timestamp;sn;text
2017-01-22 18:07:02;BarackObama;I read letters like these every single day. It was one of the best parts of the job – hearing from you. https://t.co/so1luBcszV
2017-01-20 21:17:01;BarackObama;RT @ObamaFoundation: Add your voice: https://t.co/mA9MSHmi7o https://t.co/Uf7oEvkZF3
2017-01-20 21:05:04;BarackObama;In the meantime, I want to hear what you're thinking about the road ahead. So share your ideas with me here: https://t.co/GYkEOK8EuT
2017-01-20 21:04:08;BarackObama;Hi everybody! Back to the original handle. Is this thing still on? Michelle and I are off on a quick vacation, then we’ll get back to work.
2017-01-10 23:44:14;BarackObama;Tonight, President Obama reflects on eight years of progress. Watch the #FarewellAddress at 9 pm ET: https://t.co/ZnwTsg155B #ObamaFarewell
2016-11-05 16:31:13;BarackObama;"RT @OFA: ""Thanks to the Affordable Care Act, your coverage is better today than it was before.""

Watch the weekly address: https://t.co/Pfk…"
2016-11-05 15:38:53;BarackObama;In the weekly address, President Obama discusses what #Obamacare has done to improve health care. https://t.co/VdQlyrSZhx
2016-11-04 22:16:14;BarackObama;Let's keep working to keep our economy on a better, stronger course. https://t.co/bV2BVjyj7a
2016-11-04 18:25:16;BarackObama;The landmark #ParisAgreement enters into force today—we must keep up the momentum to #ActOnClimate. https://t.co/Cyw5Udaoro
2016-11-04 16:12:12;BarackObama;The economy added 161,000 jobs in October, and wages are up 2.8 percent over the past year. https://t.co/pJxjgLnjCt #JobsReport
2016-11-03 21:02:36;BarackObama;There are a lot of plans out there. Check your options and lock in the one that's best for you: https://t.co/buFY9ozDz4 #GetCovered
2016-11-03 19:08:49;BarackObama;The positive impact of #Obamacare is undeniable, but there's one big factor holding many states back: https://t.co/7XebIdRX34
2016-11-03 17:22:00;BarackObama;RT @POTUS: It happened: @Cubs win World Series. That's change even this South Sider can believe in. Want to come to the White House before…
2016-11-02 18:22:43;BarackObama;Tens of millions of Americans have benefited from #Obamacare. Make sure you're one of them. #GetCovered https://t.co/e1KoXcPtpU
2016-11-02 15:13:34;BarackObama;Thanks to #Obamacare, quality health care is available to everyone. The marketplace is now open—make sure you and y… https://t.co/89gl6pzMGD
2016-11-02 00:15:41;BarackObama;RT @lacasablanca: La típica Latina tarda 22 meses en ganar lo que un hombre blanco gana en 12 meses. Tenemos que cerrar la brecha salarial.…
2016-11-01 22:26:14;BarackObama;RT @WhiteHouse: On #LatinaEqualPay Day, we mark the work that remains to ensure that all Americans receive equal pay for equal work. https:…
2016-11-01 20:17:35;BarackObama;Community organizing never goes out of style. Shop now: https://t.co/LXEbQdKLLT https://t.co/E56ofoU36i
2016-11-01 17:55:30;BarackObama;With #Obamacare, people can focus on treatment for pre-existing conditions without the fear of coverage being cappe… https://t.co/jvdFY87XBu
2016-11-01 15:54:09;BarackObama;The Obamacare marketplace is now open. If you're uninsured, now is the time to shop for a plan and #GetCovered.… https://t.co/Spjlga4eTT
2016-10-31 22:17:32;BarackObama;RT @FLOTUS: Open enrollment starts tomorrow! Check out your options at https://t.co/dg57hwz5of and share your #GetCovered story. https://t.…
2016-10-31 22:09:10;BarackObama;Lions and Tiggers and bears! Oh my! #HappyHalloween https://t.co/iU4fjBhi0Y
2016-10-31 20:12:07;BarackObama;Usted y su familia merecen la tranquilidad de saber que están cubiertos. El mercado de seguros abre mañana. https://t.co/9iRCkLRGZD
2016-10-31 18:08:56;BarackObama;Speak up in support of quality, affordable health care for all. https://t.co/rGsSguMxvj
2016-10-31 17:00:21;BarackObama;There's nothing to be scared of when searching for health insurance. Three in four people can #GetCovered for less… https://t.co/BUmnRO9B3E
2016-10-31 15:33:29;BarackObama;Open enrollment begins tomorrow—make sure you and your loved ones #GetCovered. https://t.co/2aak7Bt0s3
2016-10-30 22:21:27;BarackObama;RT @OFA: Witch plan is best for you? Thanks to Obamacare, even pre-existing conditions can't stop you from comparing your options. #GetCove…
2016-10-28 16:50:43;BarackObama;Senate leaders' obstruction of our Supreme Court nomination process is unacceptable. Say so: https://t.co/t3pYMO8Fp0 #DoYourJob
2016-10-28 15:07:46;BarackObama;Senate leaders should put the common good above politics—the integrity of our nation's highest court depends on it.… https://t.co/iRVCEl1pzf
2016-10-27 22:17:29;BarackObama;Don't ghost on your health and well-being—your chance to #GetCovered is coming up. Open enrollment starts November… https://t.co/qwNLazuPiz
2016-10-27 21:31:51;BarackObama;Climate change is happening now. Denial is dangerous. https://t.co/0Nlf8Fst4u
2016-10-27 20:24:15;BarackObama;If you're willing to work hard and play by the rules, you should be able to get ahead. https://t.co/394hdJttgO
2016-10-27 18:55:15;BarackObama;President Obama lays out just a few of the ways in which #Obamacare has helped millions of Americans. https://t.co/qeqHRLz0ID
2016-10-27 17:04:36;BarackObama;New report: Renewable energy installations are beating fossil fuel installations for the first time. https://t.co/MMhIdu4jzt #ActOnClimate
2016-10-27 15:27:13;BarackObama;Obamacare has helped millions of Americans gain the peace of mind that comes with coverage. Show your support: https://t.co/NfrG7DHL5C
2016-10-26 19:32:32;BarackObama;This is what happens when we focus on building an economy that works for everyone, not just those at the top. https://t.co/op3Z74rPeI
2016-10-26 17:33:39;BarackObama;"No one's too wrapped up in pre-existing conditions to #GetCovered. 
Thanks to Obamacare, you can find a plan that m… https://t.co/C7H9TZdxeU"
2016-10-26 16:26:29;BarackObama;Help protect the progress we've made in helping millions of Americans get covered. Add your name now: https://t.co/HQSZKPl1eH
2016-10-26 15:01:14;BarackObama;DYK: Most people can find a plan for less than $75 per month. Open enrollment starts on November 1. #GetCovered https://t.co/9RGG5Pr4mb
2016-10-25 19:55:05;BarackObama;Women, the sick, survivors—they all deserve fair treatment in our health care system. #Obamacare https://t.co/G948HN7pzV
2016-10-25 18:01:23;BarackObama;Don't get tripped up by misinformation. Join the @OFA Truth Team today: https://t.co/wJZj1QCxXm https://t.co/vwwDgFHq6A
2016-10-25 16:24:31;BarackObama;RT @SecBurwell: Most people shopping on @HealthCareGov will again find plans with premiums of less than $75/month, thanks to financial assi…
2016-10-25 15:25:18;BarackObama;Be proud of the progress we've made together—wear the mark of this movement. https://t.co/fYf2O9WAwG https://t.co/1Z4yJmYh4E
2016-10-24 21:32:47;BarackObama;Strong policies that help working families get ahead are good for our economy. https://t.co/QRRhibjZCl
2016-10-24 20:11:34;BarackObama;The four-week average of jobless claims fell to the lowest level since 1973—a sign of a healthy labor market. https://t.co/Lv7DnRM2DY
2016-10-24 18:52:18;BarackObama;Since 2010, America's uninsured rate has been cut in half. Help build on that progress—join Team #Obamacare today: https://t.co/MhIICuE17A
2016-10-24 17:06:57;BarackObama;"RT @OFA: It's working.
It's saving lives.
And we're not going back.
Retweet to show your support. https://t.co/YOBeMMSYP8"
2016-10-24 15:21:13;BarackObama;Health care is a right, not a privilege—and #Obamacare works to protect that right for millions of Americans. https://t.co/B7fO8rhggW
2016-10-21 20:47:03;BarackObama;Don't get tripped up by misinformation. Join the @OFA Truth Team today: https://t.co/09BpA6F9Ne https://t.co/Nxgp87o4iq
2016-10-21 16:40:47;BarackObama;Being able to stay on a parent's plan enables millions of young adults to make choices about their future with the… https://t.co/1lSzxCHZVf
2016-10-21 14:55:59;BarackObama;"""Because of Obamacare, another 20 million Americans now know the financial security of health insurance."" https://t.co/eNd6J8bMxm"
2016-10-20 20:42:08;BarackObama;Stand up for the law that's helped 20 million more Americans gain health coverage. Join Team @Obamacare today: https://t.co/XiNXrgnPoF
2016-10-20 18:47:02;BarackObama;There's still more work to do, but let's celebrate how far we've come. https://t.co/kUVWn68kJw
2016-10-20 17:52:58;BarackObama;LIVE: President Obama is in Miami talking about the progress made possible by the Affordable Care Act. https://t.co/7FsQXut07O
2016-10-20 17:29:10;BarackObama;RT @WhiteHouse: Each day, @POTUS reads 10 letters from Americans. Today, we're sharing some of the letters written about #ACA: https://t.co…
2016-10-20 16:54:36;BarackObama;Tune in at 1:55 p.m. ET to watch President Obama speak about the successes of the Affordable Care Act. https://t.co/7FsQXut07O
2016-10-20 15:35:45;BarackObama;There's a lot of misinformation floating around. Make sure you've got the facts—join the @OFA Truth Team:… https://t.co/SpfRFK5LWq
2016-10-19 20:10:29;BarackObama;From coast to coast, editorial boards are denouncing Senate obstructionism. Take a look: https://t.co/vqDr2bBiVr #DoYourJob
2016-10-19 18:07:12;BarackObama;Our Supreme Court has been short a justice for far too long. #DoYourJob, Senate leaders. https://t.co/yJlejtHjr0
2016-10-19 15:56:12;BarackObama;RT @SecBurwell: Today, 20M more Americans have coverage thanks to the #ACA. Our uninsured rate is the lowest in our nation’s history. Lowes…
2016-10-19 15:09:17;BarackObama;The need for a ninth justice is undeniably clear. #DoYourJob https://t.co/L1EBgNbh3Q
2016-10-18 20:00:51;BarackObama;We can't afford to let this be the new normal. https://t.co/nJzyfz2Zlw #ActOnClimate
2016-10-18 18:25:18;BarackObama;Denying climate change is dangerous. Join @OFA supporters in standing up for bold action now: https://t.co/JZnvlb080l #ActOnClimate
2016-10-18 17:10:19;BarackObama;Climate change is real, but so is the progress we're making to #ActOnClimate. Let's keep it up. https://t.co/GOFKXQblGJ
2016-10-18 15:45:12;BarackObama;This is just the latest step forward in the push to #ActOnClimate. https://t.co/UDInkidKkP
2016-10-17 22:14:11;BarackObama;Read why @FLOTUS is fighting to ensure that girls everywhere have access to quality education. https://t.co/xleq3HHSZt #LetGirlsLearn
2016-10-17 21:07:55;BarackObama;"Wildfires in the next few decades could be ""unrecognizable"" to previous generations—because of climate change: https://t.co/vM3xM6mCf3"
2016-10-17 18:46:37;BarackObama;Senate leaders are blocking the Supreme Court nomination for their own political gain—don't be silent: https://t.co/OMdTVim0TC #DoYourJob
2016-10-17 16:32:32;BarackObama;"RT @WhiteHouse: ""Nobody should be priced out of a higher education."" —@POTUS on the progress we've made: https://t.co/4YohVv7Qea https://t.…"
2016-10-17 15:33:28;BarackObama;RT @WHLive: Watch as @POTUS speaks on the progress made to ensure every student has the opportunity to realize their potential: https://t.c…
2016-10-17 15:30:23;BarackObama;Senate leaders have recognized Judge Garland's impeccable credentials in the past. He deserves a fair hearing and a… https://t.co/w9bPtpSmm7
2016-10-14 21:17:59;BarackObama;We need a fully functional Supreme Court. Editorial boards across the country agree: https://t.co/BkLrNaTtzN #DoYourJob
2016-10-14 19:20:14;BarackObama;The American Bar Association gave Judge Garland its highest rating. Senate leaders: #DoYourJob and fill the #SCOTUS… https://t.co/iTVTqGIUvV
2016-10-14 17:31:21;BarackObama;Denying climate change is dangerous. Join @OFA supporters in standing up for bold action now: https://t.co/7MDQGYgX2u #ActOnClimate
2016-10-14 16:18:33;BarackObama;Cynics, take note: When we #ActOnClimate, we build a stronger future. https://t.co/wHHMdo2ro6
2016-10-13 21:30:34;BarackObama;"""That’s how we will overcome the challenges we face: by unleashing the power of all of us for all of us."" Read more: https://t.co/VxpwLIR4uF"
2016-10-13 20:29:34;BarackObama;Check out the most recent editorial boards calling on Senate leaders to vote on Judge Garland: https://t.co/hzuhZYevfo #DoYourJob
2016-10-13 18:29:08;BarackObama;Senate leaders have undercut the functionality of the Supreme Court, and that's unacceptable. #DoYourJob https://t.co/5HFXhgTMoP
2016-10-13 16:53:40;BarackObama;Senate leaders' political games are handicapping the Supreme Court—and judgeships across the country. https://t.co/PhKOBKXLmS #DoYourJob
2016-10-13 15:24:26;BarackObama;RT @WIRED: After eight years in office, @POTUS remains optimistic about the world's future. His essay as WIRED’s guest editor: https://t.co…
2016-10-12 21:02:21;BarackObama;LIVE: President Obama is speaking at a reception celebrating #HispanicHeritageMonth. https://t.co/FK0ytbKw1q
2016-10-12 20:54:38;BarackObama;RT @WhiteHouse: In honor of #HispanicHeritageMonth, we celebrate the progress that Hispanic Americans have made under @POTUS: https://t.co/…
2016-10-12 19:43:55;BarackObama;Support the bold steps we're taking against climate change. Say you're ready to #ActOnClimate: https://t.co/EtwjaKgYFW
2016-10-12 17:57:21;BarackObama;Last week, more than 190 countries reached a landmark deal to reduce carbon pollution from aviation. https://t.co/LRYkXVw3rO #ActOnClimate
2016-10-12 16:35:41;BarackObama;Let's leave our children and grandchildren a planet that's healthier than the one we have today. #ActOnClimate https://t.co/mP29bpRdU9
2016-10-12 15:25:03;BarackObama;Climate change's effects are devastating. Denying the science behind it does nothing to help. https://t.co/Rww40wwgD9 #ActOnClimate
2016-10-11 23:59:09;BarackObama;"""On behalf of Michelle and our family, G’mar Chatimah Tovah."" —President Obama #YomKippur"
2016-10-11 21:18:09;BarackObama;"""LGBT individuals deserve to know their country stands beside them."" —President Obama #NationalComingOutDay https://t.co/op7nBzbaod"
2016-10-11 20:02:19;BarackObama;The Supreme Court must remain above politics. Judge Garland needs a hearing and a vote. #DoYourJob https://t.co/eVSPSIFNpB
2016-10-11 18:38:46;BarackObama;Don't stand idly by while Senate leaders continue to block Judge Garland from a fair hearing and vote: https://t.co/TSavHP3mHg #DoYourJob
2016-10-11 17:26:32;BarackObama;Judge Garland is just as qualified now as he was in 1997, Senate leaders. It's time to #DoYourJob. https://t.co/j1lEkdMYV6
2016-10-11 15:31:34;BarackObama;Dispel misinformation with facts from the @OFA Truth Team. https://t.co/zjexLUJXAC
2016-10-07 22:03:05;BarackObama;The uninsured rate is the lowest it's been in decades, thanks to #Obamacare. Spread the word.… https://t.co/ZkN8HVbn3E
2016-10-07 20:38:47;BarackObama;Deadline tonight—help rein in payday lenders that succeed by targeting vulnerable Americans: https://t.co/7OlpH6OFek #StopTheDebtTrap
2016-10-07 19:54:20;BarackObama;The Obama administration and @CFPB are working to protect consumers and #StopTheDebtTrap. https://t.co/UMO01OUkdh
2016-10-07 18:02:16;BarackObama;Our economy is on a better, stronger course. https://t.co/yzB6x7CExJ
2016-10-07 16:16:59;BarackObama;The economic progress we've made is undeniable—let's keep it up. https://t.co/gAlfaC1hkI
2016-10-07 15:14:16;BarackObama;Check out President Obama's essay in @TheEconomist on the unique challenges the American economy faces. https://t.co/jKJNCrQALL
2016-10-07 13:59:22;BarackObama;The economy added 156,000 jobs in September—extending the longest streak of total job growth on record.
2016-10-06 18:35:27;BarackObama;ICYMI: Read about the historic #ParisAgreement and what it means for the fight to #ActOnClimate. https://t.co/eMefgFZk53
2016-10-06 17:22:46;BarackObama;RT @WhiteHouse: This is #SXSL: The White House festival of ideas, art, and action. Take a peek inside: https://t.co/BbvvMEaQTF https://t.co…
2016-10-06 15:48:57;BarackObama;The cost of clean energy technology dropped significantly over the last eight years. Get the chart: https://t.co/fuGQMXeRYb #ActOnClimate
2016-10-05 21:30:38;BarackObama;This historic step in the fight to #ActOnClimate came faster than anyone predicted. https://t.co/W2rtcNXkI7
2016-10-05 20:44:42;BarackObama;"""Today is a historic day in the fight to protect our planet for future generations."" —President Obama #ActOnClimate https://t.co/x3dJSCYUcj"
2016-10-05 19:30:42;BarackObama;LIVE: President Obama is delivering a statement on the Paris Climate Agreement. https://t.co/mNpQ6QyA91
2016-10-05 15:50:42;BarackObama;Read from @NYTopinion about why filling the Supreme Court vacancy is crucial for our democracy: https://t.co/zuSWzxSaqW #DoYourJob
2016-10-04 20:30:46;BarackObama;Enough is enough. Say it's time for Senate leaders to get to work: https://t.co/2M789YIcBk #DoYourJob
2016-10-04 18:28:15;BarackObama;"""Everybody cares about their kids, their grandkids, and the kind of world we pass on to them."" —President Obama https://t.co/cfxpSBNWIU"
2016-10-04 16:53:50;BarackObama;Take what matters with you. https://t.co/E0hXWSu1q3 https://t.co/KJJdkE8DML
2016-10-04 15:08:13;BarackObama;We've come a long way, but the fight for fairness and an economy that works for everyone continues. https://t.co/WWRhZHwYWE
2016-10-03 19:57:20;BarackObama;RT @NatGeoChannel: Tonight @POTUS will be joined by @LeoDiCaprio for a conversation on combating climate change: https://t.co/yCN9K74Jnj #S…
2016-10-03 18:24:20;BarackObama;Side-by-side for 24 years. Here's to many more. #HappyAnniversary https://t.co/nh8Xfc7IWU
2016-10-03 16:55:19;BarackObama;RT @WhiteHouse: Today, @POTUS is bringing something new to the South Lawn. Find out why: https://t.co/JvtZFKpQKZ
2016-10-03 15:30:43;BarackObama;Facts matter. Stay informed with the @OFA Truth Team: https://t.co/O8PhOX5jJ3
2016-10-01 16:06:00;BarackObama;"RT @OFA: ""Since I took office, another ten million private-sector workers have gained paid sick leave."" —President Obama https://t.co/Ud3vq…"
2016-10-01 14:46:41;BarackObama;In the weekly address, President Obama discusses why access to paid leave is so important. https://t.co/q9kDEqYs5u #LeadOnLeave
2016-09-30 21:32:41;BarackObama;Parents shouldn't have to choose between a paycheck and taking care of a sick child at home. #LeadOnLeave https://t.co/FF4hTkgOZy
2016-09-30 20:11:02;BarackObama;After thirty years in Congress, Senator, this should not be your proudest accomplishment. https://t.co/FwGAJsBCoo… https://t.co/86F1fhUWsp
2016-09-30 17:47:42;BarackObama;We need a fully functioning Supreme Court. Speak up if you agree it's time for a hearing and a vote: https://t.co/d6nmum1Ut7 #DoYourJob
2016-09-30 15:57:24;BarackObama;There has never been a more qualified nominee, Senate leaders. He deserves a fair hearing and a vote. #DoYourJob https://t.co/qtzcY3iwyl
2016-09-29 21:55:49;BarackObama;It's the Senate's job to fairly consider Supreme Court nominees. Their refusal to do so is unacceptable: https://t.co/s8FdCa0tq6 #DoYourJob
2016-09-29 19:41:04;BarackObama;"""Everybody gets sick."" Check out what President Obama is doing to extend access to paid sick leave: https://t.co/gOAc2HAkQg #LeadOnLeave"
2016-09-29 17:59:08;BarackObama;RT @ErnestMoniz: THIS is what a #CleanEnergy revolution looks like. New report out today → https://t.co/o13p5fPNDg #ActOnClimate https://t.…
2016-09-29 16:33:03;BarackObama;Never underestimate the strength and resilience of the American economy. https://t.co/OFTN2FlRtq
2016-09-29 15:12:58;BarackObama;RT @Slate: President Obama answers Slate’s questions about his administration’s new rule extending paid sick leave: https://t.co/8AdEx431QN…
2016-09-28 17:49:45;BarackObama;The @OFA Truth Team makes it easy to stay informed. Join today: https://t.co/Q0axQYyJY1
2016-09-28 15:16:14;BarackObama;This is no accident—we're making a comeback because together, we've fought hard to support American families. https://t.co/LTk7SiTexP
2016-09-27 21:04:01;BarackObama;We're better off than we were eight years ago. https://t.co/OwrTM3V78t
2016-09-27 19:42:15;BarackObama;Household incomes are up, and the poverty rate is down across all demographics. https://t.co/cEIdPJuuvR
2016-09-27 16:57:08;BarackObama;As long as Senate leaders keep refusing to do their jobs, @OFA supporters will continue speaking out against their… https://t.co/DkmDKpMhOw
2016-09-27 15:28:39;BarackObama;Senate leaders have blocked Judge Garland's hearing for over six months now. Keep pushing: https://t.co/AGrUjJTnST #DoYourJob
2016-09-26 20:58:33;BarackObama;Important, tough conversations require solid facts. Get them from the @OFA Truth Team: https://t.co/5YH9zVeayn https://t.co/dD1EPgaA9W
2016-09-26 18:59:05;BarackObama;These are high praises from the American Bar Association—and yet, Senate leaders refuse to even consider Judge Garl… https://t.co/ryPFLZDAhY
2016-09-26 17:27:01;BarackObama;Senate leaders' unprecedented obstruction of the Supreme Court nomination must end. Your voice matters: https://t.co/yhy8al1FK7 #DoYourJob
2016-09-26 15:55:33;BarackObama;The American people are waiting for Senate leaders to do their jobs. https://t.co/LNqAQpxMle
2016-09-23 21:12:45;BarackObama;Senate leaders have blocked Judge Garland's hearing for over six months now. Keep pushing: https://t.co/peV6aCYswa #DoYourJob
2016-09-23 20:05:48;BarackObama;Senate leaders need to work for the good of the American people, not seek out political points. https://t.co/Tdx3xk6gYi
2016-09-23 19:03:51;BarackObama;Watch President Obama and @CEAChair Jason Furman discuss the positive gains the American economy has made. https://t.co/J28Crn3WAP
2016-09-23 18:02:58;BarackObama;Here are 16 broken records we shouldn't be proud of. https://t.co/x98dGgEloW
2016-09-23 16:57:07;BarackObama;Stay informed. Stay engaged. Speak up. Join the @OFA Truth Team: https://t.co/GVTL4HrTXw
2016-09-23 15:57:29;BarackObama;"Another record broken: 16 months in a row of undeniable, record-breaking heat.
https://t.co/qMAH7nFf5I #ActOnClimate"
2016-09-22 22:18:43;BarackObama;Happy #FirstDayofFall. https://t.co/ix02MNuOud
2016-09-22 21:21:51;BarackObama;We can't sit idly by. Climate change is likely to threaten our national security—we must act now.… https://t.co/6QQmpf27W0
2016-09-22 19:00:00;BarackObama;Judge Garland is highly qualified for the bench—even some Senate leaders who are now blocking his hearing have agre… https://t.co/D5ScOCikVl
2016-09-22 17:34:00;BarackObama;Senate leaders' blind obstruction of Judge Garland's nomination sets a dangerous precedent. We can't stand idly by. https://t.co/k76I6DCDRI
2016-09-22 15:58:39;BarackObama;Enough of the shameless partisanship, Senators. #DoYourJob and fill the Supreme Court vacancy. https://t.co/vIQY0bivo4
2016-09-21 19:58:02;BarackObama;Help keep the pressure on Senate leaders to give Judge Garland a fair hearing before their next recess. https://t.co/lkLz4yidaw #DoYourJob
2016-09-21 17:53:17;BarackObama;The American Bar Association gave Judge Garland its highest possible rating. He deserves a hearing and a vote.… https://t.co/FUVmGKdZgB
2016-09-21 16:34:02;BarackObama;"""Their right to inherit a healthy planet is a sacred responsibility."" —President Obama #ActOnClimate https://t.co/MYumi6xiIW"
2016-09-21 14:57:56;BarackObama;Communities are already experiencing the effects of climate change—we can't afford not to act. Take a look:… https://t.co/sEjVzKqhsw
2016-09-20 19:31:05;BarackObama;As the #UNGA meets, take a look at the progress we've made thanks to American leadership in the world. https://t.co/b4T0zGccLH
2016-09-20 14:30:13;BarackObama;LIVE: President Obama is speaking at the 71st Session of the United Nations General Assembly. https://t.co/J8cm9QquER #UNGA
2016-09-19 15:24:34;BarackObama;LIVE: President Obama is delivering a statement in New York. https://t.co/MJUr8C84Wd
2016-09-16 22:24:34;BarackObama;President Obama commemorates #HispanicHeritageMonth in an address to @CHCI. https://t.co/oTVX7zOyFD
2016-09-16 21:23:23;BarackObama;Senate leaders are putting politics above their basic responsibility to hold a hearing for Judge Garland. #DoYourJob https://t.co/N7vH2ncwmb
2016-09-16 19:55:06;BarackObama;Six months is long enough, senators. It's time to #DoYourJob and give Judge Garland a hearing. https://t.co/A2Yedmhuw6
2016-09-16 18:55:16;BarackObama;RT @OFA: Friendly reminder for Senate leaders on #ConstitutionDay2016: https://t.co/my5zUWxb6j
2016-09-16 17:24:19;BarackObama;The Supreme Court should remain above partisan politics, Senator. https://t.co/DlWud7Rh3K #DoYourJob https://t.co/Wjd96qn9Hf
2016-09-16 15:54:16;BarackObama;Progress starts with a conversation. Make sure you have the facts to get yours started: https://t.co/MxWdiJxz4o https://t.co/Q3iP0Jwg1t
2016-09-15 21:24:16;BarackObama;When we protect our lands and waters, it helps us protect our climate for future generations. #ActOnClimate https://t.co/8tygZI0TDR
2016-09-15 18:51:11;BarackObama;"""There is no 'election year' exception in Article II."" Sen. Leahy calls on senators to give Judge Garland a hearing: https://t.co/VjxClMdqUg"
2016-09-15 16:39:51;BarackObama;President Obama just made history by protecting nearly 5,000 square miles off the New England coast. https://t.co/i8MAFYU60k #OurOcean
2016-09-15 15:15:48;BarackObama;LIVE: President Obama is speaking at the 2016 Our Ocean Conference. https://t.co/ALK46jhUpw #OurOcean
2016-09-15 14:25:46;BarackObama;"RT @WhiteHouse: BREAKING: @POTUS will designate the first-ever marine monument in the Atlantic Ocean:
https://t.co/t33G5z2QpK https://t.co/…"
2016-09-14 20:45:42;BarackObama;We need nine justices for a fully functioning Supreme Court—and editorial boards across the country agree. https://t.co/WD42qmgXpO
