timestamp;sn;text
2016-03-30 22:24:38;BarackObama;Enjoy the tunes of James Taylor in Chicago this summer—enter before tomorrow's deadline: https://t.co/Uid4X7idZA https://t.co/hhhBdEhfzq
2016-03-30 21:23:53;BarackObama;Time's almost up. Pitch in before the deadline: https://t.co/T5y1mvq8Zu https://t.co/lKZxwjirge
2016-03-30 19:13:57;BarackObama;Tell Senate leaders to do their jobs and give Judge Garland a fair hearing: https://t.co/WBgbg7zLPR #DoYourJob https://t.co/uequq6N7pl
2016-03-30 17:12:56;BarackObama;Make a play before the big fundraising deadline tomorrow—pitch in now: https://t.co/1AnNryV2ls https://t.co/fDbZmlBGGz
2016-03-30 15:10:16;BarackObama;"A free flight to Chicago.
A free hotel room.
Tickets to see the legendary James Taylor.
Enter now: https://t.co/2frBiqy0q5"
2016-03-29 22:03:32;BarackObama;Start your engines—the big fundraising deadline is coming up. Chip in: https://t.co/bWWIWl8vWU https://t.co/v7tSjLAct9
2016-03-29 20:05:47;BarackObama;Ever met a music legend? Here's your chance—meet James Taylor in Chicago this summer: https://t.co/6QAeg2ZqxX https://t.co/Q0EyXlAXA4
2016-03-29 18:27:26;BarackObama;Judge Merrick Garland deserves fair consideration from the Senate: https://t.co/kaCTVBclmh #DoYourJob https://t.co/IljdAUY3qB
2016-03-29 16:54:53;BarackObama;Read President Obama's op-ed on why Judge Merrick Garland deserves a Senate hearing: https://t.co/1ZPiOzQszv #DoYourJob
2016-03-29 15:08:35;BarackObama;"RT @VP: We all have to do our job -- including the U.S. Senate.
https://t.co/P2sRPodYoZ"
2016-03-28 21:40:39;BarackObama;Judge Garland deserves a fair hearing. https://t.co/SZPqoMUI5t
2016-03-28 17:03:59;BarackObama;Add your name for a chance to see James Taylor perform live in Chicago this summer: https://t.co/3Iz7oEkTzq https://t.co/EhvQXqDcmI
2016-03-28 14:39:19;BarackObama;LIVE: President Obama and @FLOTUS are participating in the annual White House #EasterEggRoll. https://t.co/VM9ImySkCQ
2016-03-28 14:18:16;BarackObama;RT @WhiteHouse: Watch how one of our oldest traditions, the White House #EasterEggRoll, has evolved over the past 138 years. https://t.co/2…
2016-03-27 17:43:07;BarackObama;"""We wish all who celebrate a blessed and joyful Easter."" —President Obama https://t.co/sSls4YLCYe"
2016-03-25 21:40:06;BarackObama;"""Michelle and I join our fellow Christians in observing Good Friday and celebrating Easter this weekend."" —President Obama #GoodFriday"
2016-03-25 20:38:46;BarackObama;Follow @WeNeedNine for updates on the fight to fill the Supreme Court vacancy. #FF
2016-03-25 19:46:50;BarackObama;RT @OFA: When the @VP was Chairman of the Senate Judiciary Committee, every single #SCOTUS nominee got a hearing and a vote. https://t.co/J…
2016-03-25 18:46:45;BarackObama;Tell Senate leaders to do their jobs and give Judge Garland a fair hearing: https://t.co/U8LouSCMJl #DoYourJob https://t.co/3hWl3k4gla
2016-03-25 16:59:33;BarackObama;Judge Garland is a highly qualified nominee to fill the #SCOTUS vacancy. Senators, it's time to #DoYourJob. https://t.co/6V9uT2j7GK
2016-03-25 15:16:23;BarackObama;"""I believe Judge Garland is exactly the kind of judge we need on the Supreme Court."" —President Obama https://t.co/uGHiUD1LU9 #DoYourJob"
2016-03-24 21:51:47;BarackObama;Judge Garland deserves fair consideration from the Senate. #DoYourJob https://t.co/gKTzocthGh
2016-03-24 19:58:01;BarackObama;Join @OFA in calling on Senate leaders to give Judge Garland a fair hearing and a timely vote: https://t.co/eafdeTvt3s #DoYourJob
2016-03-24 18:21:43;BarackObama;The support for a fair hearing for Judge Garland is growing. #DoYourJob https://t.co/qFYf3senWM
2016-03-24 16:33:00;BarackObama;LIVE: @VP Biden is urging the Senate to give Judge Merrick Garland a fair hearing and timely up-or-down vote. https://t.co/2vG15zNgNn
2016-03-24 15:44:41;BarackObama;Tune in at 12:30 p.m. ET to see @VP Biden speak about why fair consideration for Judge Garland is so important: https://t.co/e07gl2q8jv
2016-03-23 22:42:15;BarackObama;It's a paws-itively beautiful day. #NationalPuppyDay https://t.co/dRY9SdgpHe
2016-03-23 21:54:55;BarackObama;Obamacare: Giving young adults (and their parents) peace of mind since 2010. https://t.co/StT3XzFVGB
2016-03-23 20:48:00;BarackObama;Obamacare is here to stay. https://t.co/sgHCIYtn5w
2016-03-23 19:42:35;BarackObama;RT @SecBurwell: Because of the #ACA, insurance is better for everyone, no matter where it’s purchased. https://t.co/v56xrDhCvH #ACAannivers…
2016-03-23 19:02:16;BarackObama;RT @CEAChair: CBO estimates imply that the #ACA will cut the deficit by over $3 trillion in the next two decades. https://t.co/HlDACtxmSs
2016-03-23 17:47:32;BarackObama;"20 million Americans covered: ✔
9 in 10 Americans now have health insurance: ✔
Lowest uninsured rate on record: ✔ https://t.co/xTyZt3aa82"
2016-03-23 16:19:56;BarackObama;On the sixth anniversary of #Obamacare, stand with @OFA and say you'll keep fighting for affordable health care: https://t.co/O2KiiRPjB1
2016-03-22 14:50:20;BarackObama;"RT @WhiteHouse: ""The thoughts and prayers of the American people are with the people of Belgium"" —@POTUS on the attacks in #Brussels https:…"
2016-03-21 21:37:25;BarackObama;Want to meet James Taylor in Chicago? Enter today for your chance: https://t.co/gf36KXxU4Q https://t.co/Aql1tqH2Ba
2016-03-21 17:48:11;BarackObama;Judge Merrick Garland deserves fair consideration from the Senate. #DoYourJob https://t.co/9LteYSfKpo
2016-03-21 14:01:01;BarackObama;Tell Senate leaders: Your constituents expect you to #DoYourJob. https://t.co/xJFlsGS3Ry https://t.co/qdeP1x3QTC
2016-03-19 19:45:08;BarackObama;"""Give Judge Garland the respect he has earned. Give him a hearing. Give him an up-or-down vote."" —President Obama https://t.co/R2qBVx7O6s"
2016-03-19 17:13:57;BarackObama;In the weekly address, President Obama urges the Senate to give Judge Garland a fair hearing and timely vote: https://t.co/1EuiCg8e8E
2016-03-18 21:05:01;BarackObama;Read from @business editorial board on why Judge Merrick Garland deserves a fair hearing: https://t.co/yzIDDgOfEs
2016-03-18 19:40:16;BarackObama;Check out how @OFA supporters are calling for a fair #SCOTUS hearing and timely up-or-down vote: https://t.co/JFf3hAf189
2016-03-18 17:03:47;BarackObama;Retweet if you believe Judge Merrick Garland deserves fair consideration. #DoYourJobFriday https://t.co/NYvoxcFO8H
2016-03-18 15:52:40;BarackObama;Make your voice heard on a fair #SCOTUS nomination process for Judge Merrick Garland: https://t.co/9kCCJ2ebUp
2016-03-17 22:05:16;BarackObama;Happy #StPatricksDay. https://t.co/VuguIeyUO1
2016-03-17 21:24:13;BarackObama;Yesterday President Obama revealed his March Madness bracket. Check it out: https://t.co/AzKCRr5DQg #Baracketology
2016-03-17 19:19:46;BarackObama;President Obama took his constitutional duty seriously and nominated a well qualified #SCOTUSnominee. https://t.co/zTOKXgLnj8
2016-03-17 17:24:25;BarackObama;Judge Garland is a qualified #SCOTUSnominee with past bipartisan approval—show your support: https://t.co/rh4XUpRSws https://t.co/MHhTEoewLn
2016-03-17 16:33:45;BarackObama;"RT @WhiteHouse: ""He is the right man for the job. He deserves to be confirmed."" —@POTUS on his #SCOTUSnominee Merrick Garland https://t.co/…"
2016-03-16 20:58:14;BarackObama;Judge Merrick Garland deserves a fair hearing and a timely vote. #SCOTUSnominee https://t.co/raFkOw5N3C
2016-03-16 15:04:56;BarackObama;HAPPENING NOW: President Obama is announcing his nominee to fill the #SCOTUS vacancy. https://t.co/ZDrkhxZpTB
2016-03-16 13:41:54;BarackObama;Tune in at 11 a.m. ET to watch President Obama announce his #SCOTUSnominee: https://t.co/IXUu3eUHdv
2016-03-15 19:55:30;BarackObama;Senate leaders shouldn't hold up the Supreme Court nomination process—sign the petition: https://t.co/HPbnxeAKmT
2016-03-15 18:31:15;BarackObama;These editorials explain why the Senate must do its job and hold fair #SCOTUS nomination hearings: https://t.co/0Erxa1SnlA #DoYourJob
2016-03-15 16:42:42;BarackObama;This February was so hot that it shattered global records. Check it out: https://t.co/7tkAzF6CT8 #ActOnClimate
2016-03-15 15:30:18;BarackObama;There's a lot of misinformation out there—help spread the facts with the @OFA Truth Team: https://t.co/srdrvXgfKA https://t.co/MrkBKYeCnm
2016-03-14 21:54:14;BarackObama;Happy #PiDay. https://t.co/gDZPJwKFk7
2016-03-14 20:23:04;BarackObama;By a margin of nearly 2-to-1, Americans believe the Senate should hold hearings on a #SCOTUS nominee: https://t.co/zssLeUT1O3
2016-03-14 16:52:36;BarackObama;Refusing to even meet with a #SCOTUS nominee has no basis in the Constitution. #DoYourJob https://t.co/5xqIrZVLqj
2016-03-14 15:37:36;BarackObama;If you think the Senate should give President Obama's #SCOTUS nominee a fair hearing, add your name: https://t.co/tFFrncdg1W #DoYourJob
2016-03-11 21:59:35;BarackObama;"RT @WhiteHouse: ""We avoided a Great Depression. 
Thanks, Obama.""
—@POTUS #SXSW2016 https://t.co/BBcKZOD8cW"
2016-03-11 21:03:21;BarackObama;LIVE: President Obama is participating in a #SXSW2016 panel on civic engagement and technology. https://t.co/BBoIZW0LWP
2016-03-11 18:09:50;BarackObama;The Senate should fairly consider a #SCOTUS nominee—sign the petition if you agree: https://t.co/clUtC1qTb8 https://t.co/UmjWwD7sQw
2016-03-11 16:03:46;BarackObama;Not caught up on the Supreme Court vacancy? Read what editorial boards around the country are saying: https://t.co/ALJKaArA7i #DoYourJob
2016-03-10 23:06:42;BarackObama;The United States and Canada are joining together to reduce methane pollution. Read more: https://t.co/RfWitsRxpB #ActOnClimate
2016-03-10 21:29:37;BarackObama;"RT @FactsOnClimate: ""Canada is joining us in our aggressive goal to bring down methane emissions in the oil and gas sector"" —@POTUS https:/…"
2016-03-10 20:04:53;BarackObama;Refusing to hold a hearing on a presidential nominee is unprecedented. Tell Senate leaders: #DoYourJob https://t.co/jmqg76dutN
2016-03-10 18:46:17;BarackObama;"RT @WhiteHouse: ""I'm going to do my job and then my expectation is going to be will the Senate do its job"" —@POTUS #SCOTUS https://t.co/sNB…"
2016-03-10 16:31:49;BarackObama;Senators on the Judiciary Committee have demanded a vote on judicial nominees 90 times. Here's a list: https://t.co/hjOn65IgI4 #DoYourJob
2016-03-09 21:35:04;BarackObama;"""Under my chairmanship, every Supreme Court nominee was given a hearing and a vote in the Judiciary Committee."" —@VP https://t.co/DKjBws90CZ"
2016-03-09 19:49:33;BarackObama;RT @WhiteHouse: Vermont just took the #LeadOnLeave so families won't have to choose between their job and the family they love. https://t.c…
2016-03-09 18:13:25;BarackObama;Add your name if you think the Senate should do its job: https://t.co/cRmr4M8lSl #DoYourJob https://t.co/DNxgqTSRTN
2016-03-09 16:42:36;BarackObama;"""Senate needs to think and vote."" See what editorials boards are saying about the Supreme Court nomination: https://t.co/ENU64s5Cud"
2016-03-08 23:01:53;BarackObama;RT @FLOTUS: #OneDayIWill see a world where every child can go to school and fulfill their boundless potential. #IWD2016 https://t.co/FonwXC…
2016-03-08 21:50:50;BarackObama;The President is going to nominate a qualified Supreme Court Justice—tell Senate leaders to do their jobs: https://t.co/uks53rbxHX
2016-03-08 20:20:10;BarackObama;From @VP Biden: Why the Senate shouldn't hold back the #SCOTUS nomination process. https://t.co/A61OoqQszS
2016-03-08 18:23:14;BarackObama;We've come a long way on women's equality, but there's still so much work to be done. #InternationalWomensDay https://t.co/bqi94Ao2iV
2016-03-08 16:35:48;BarackObama;"""U.S. solar seems poised for not just a record year but perhaps a blowout year."" Get the numbers: https://t.co/MfDphKshcl #ActOnClimate"
2016-03-07 23:09:42;BarackObama;"""If Selma taught us anything, it’s that our work is never done."" —President Obama #Selma51 https://t.co/MoaVS02Crw"
2016-03-07 20:49:06;BarackObama;Refusing to hold hearings for a president's #SCOTUS nominee has never happened before. https://t.co/G7knZPAy7x
2016-03-07 18:47:12;BarackObama;There is no excuse to delay the #SCOTUS nomination—add your name to @OFA's petition if you agree: https://t.co/WMFAOI6czO
2016-03-07 16:24:07;BarackObama;Most Americans agree that the Senate should do its job and give the #SCOTUS nominee a fair hearing: https://t.co/8pA0rFXwrm #DoYourJob
2016-03-06 21:16:43;BarackObama;"RT @WhiteHouse: ""We remain grateful for Nancy Reagan's life"" —@POTUS and @FLOTUS: https://t.co/nJZIHumlsS https://t.co/KftNACmkAh"
2016-03-04 23:15:43;BarackObama;A well-qualified #SCOTUS nominee deserves a fair hearing and a timely up-or-down vote. https://t.co/rBZe7gz2vD #DoYourJob
2016-03-04 22:05:47;BarackObama;Take a look at what editorial boards across the country think of the Senate refusing to do its job: https://t.co/6n3JNK6WoZ #DoYourJob
2016-03-04 20:50:03;BarackObama;It's the Senate's duty to fairly consider the President's #SCOTUS nominee—and there's plenty of time to do so. https://t.co/X8kMjL1pdc
2016-03-04 19:02:15;BarackObama;February's 242,000 new jobs mean the American economy has been creating jobs for six straight years. https://t.co/xCkKrs9gJp
2016-03-04 17:18:11;BarackObama;The American economy continues its comeback. https://t.co/5RZ5lB6AUV
2016-03-04 15:40:25;BarackObama;The economy added 242,000 jobs in February—a record-breaking six straight years of private-sector job growth.
2016-03-03 22:45:16;BarackObama;The majority of Americans agree that President Obama should nominate someone to fill the #SCOTUS vacancy: https://t.co/RGQEw9WAc2
2016-03-03 20:49:46;BarackObama;RT @WhiteHouse: BREAKING: 20 million more Americans now know the security of health insurance thanks to the Affordable Care Act. https://t.…
2016-03-03 19:53:46;BarackObama;LIVE: President Obama is celebrating Milwaukee's victory in the Healthy Communities Challenge. https://t.co/aB2PNdzoXT
2016-03-03 18:18:36;BarackObama;Sign the petition—join the thousands of voices speaking up for a fair Supreme Court nomination process: https://t.co/BAOLv8FMEA #DoYourJob
2016-03-03 17:20:30;BarackObama;Tune in at 12:50 p.m. ET to see President Obama congratulate Milwaukee on winning the Healthy Communities Challenge. https://t.co/JAbnRHsWSi
2016-03-03 16:19:38;BarackObama;This is what a consensus looks like. #DoYourJob https://t.co/t7ZGvXIpIk
2016-03-02 22:38:59;BarackObama;"RT @WhiteHouse: Good news: Oregon just raised its minimum wage. 

RT if you agree it's time to #RaiseTheWage for all Americans. https://t.c…"
2016-03-02 21:07:10;BarackObama;Deliberately creating partisan gridlock is not the way our democracy should work. #DoYourJob https://t.co/ubjy1N9NlS
2016-03-02 18:49:47;BarackObama;The obstruction of our Supreme Court is completely unprecedented. Sign the petition telling the Senate: #DoYourJob. https://t.co/STmBjGzaA0
2016-03-02 16:32:38;BarackObama;Refusing to consider a #SCOTUS nominee before one is even announced is irresponsible. #DoYourJob https://t.co/NiZtwUHmE5
2016-03-01 23:25:50;BarackObama;RT @WhiteHouse: Here's what @POTUS is doing to help women achieve their dreams: https://t.co/3g3TWF3qrq #WomensHistoryMonth https://t.co/rc…
2016-03-01 22:22:22;BarackObama;Leaving a seat open on the Supreme Court for more than a year is irresponsible—sign the petition: https://t.co/qWvL5ANmqP #DoYourJob
2016-03-01 20:50:17;BarackObama;We're seeing the fastest rise in sea-levels in nearly 3,000 years: https://t.co/MwO2QKE4GW #ActOnClimate
2016-03-01 18:37:51;BarackObama;Get the facts on everything from a fair #SCOTUS nomination process to climate change: https://t.co/jCZzreLARW https://t.co/qnB5GLM8eC
2016-03-01 17:02:47;BarackObama;Today's the 55th birthday of the @PeaceCorps. Thanks to all who have served across the globe. #PeaceCorpsWeek2016
2016-02-29 23:05:20;BarackObama;It's the Senate's duty to give the President's nominee a fair hearing and a timely vote. #DoYourJob https://t.co/yquRBNfS9k
2016-02-29 20:53:18;BarackObama;"""One-third of all U.S. presidents appointed a Supreme Court justice in an election year."" https://t.co/PY8dR1owzf (h/t @washingtonpost)"
2016-02-29 19:05:55;BarackObama;Sign @OFA's petition to let the Senate know you demand a fair Supreme Court nomination process: https://t.co/SeDGtpwnU5
2016-02-29 16:17:30;BarackObama;LIVE: President Obama is presenting the Medal of Honor to Senior Chief Special Warfare Operator Edward Byers. https://t.co/NGInOc0ccN
2016-02-29 15:59:52;BarackObama;"RT @WhiteHouse: Climate change ""is the most urgent threat facing our entire species.""

RT if you agree with @LeoDiCaprio. #Oscars https://t…"
2016-02-29 04:31:38;BarackObama;"RT @VPLive: ""They. Did. Nothing. Wrong."" -@VP at #Oscars #ItsOnUs"
2016-02-26 23:08:52;BarackObama;Thanks to the #RecoveryAct, clean energy investments have created hundreds of thousands of jobs. https://t.co/U82fX6P2nB
2016-02-26 22:00:48;BarackObama;Our economy has come a long way, but there's more work to do—say you support common-sense economic policies: https://t.co/UzcGjwykjs
2016-02-26 20:55:05;BarackObama;Seven years ago, our economy was shedding nearly 800,000 jobs a day. We've come a long way. https://t.co/ueSHbf52YE
2016-02-26 19:25:16;BarackObama;Our economy has added 14 million jobs over the longest streak of private-sector job growth on record. https://t.co/FwScd1Soxi
2016-02-26 18:46:41;BarackObama;LIVE: President Obama is highlighting the progress of the American economy. https://t.co/7noFkjk0F8
2016-02-26 18:39:56;BarackObama;"RT @ENERGY: It's been 7 years since @POTUS signed the #RecoveryAct. See how it shaped our #CleanEnergy future. #ActOnClimate
https://t.co/R…"
2016-02-26 17:56:13;BarackObama;Tune in at 1:55 p.m. ET to see President Obama speak about the economic progress we've made since the #RecoveryAct. https://t.co/Ve3DprDXKH
2016-02-26 16:47:42;BarackObama;Tell the Senate: Stop playing games with our Supreme Court. https://t.co/2vkSnL2KWC #DoYourJob
2016-02-26 01:02:26;BarackObama;The Senate should fulfill its constitutional duty and fairly consider the President's nominee. #DoYourJob https://t.co/AXpbOQ1bxD
2016-02-25 21:55:09;BarackObama;Add your name if you agree: Failing to fill the Supreme Court vacancy for over a year is unacceptable. https://t.co/uDxtenkam5 #DoYourJob
2016-02-25 19:20:05;BarackObama;Retweet if you agree that we can't afford to play political games over the Supreme Court vacancy. #DoYourJob https://t.co/NE380YtV41
2016-02-25 16:42:22;BarackObama;The solar industry hit record growth last year, surpassing natural gas installations for the first time: https://t.co/9M4rqbVGCC
2016-02-24 22:56:36;BarackObama;"RT @WhiteHouse: .@POTUS nominates the first woman and first African-American to be Librarian of Congress: https://t.co/5zQhYVj74j
https://t…"
2016-02-24 19:14:28;BarackObama;This kind of obstruction is unprecedented. Tell Senate leaders: #DoYourJob https://t.co/IZgCuoWE4O
2016-02-24 17:50:18;BarackObama;Sign @OFA's petition to let the Senate know you demand a fair Supreme Court nomination process: https://t.co/PlX9s74RIs
2016-02-24 14:46:40;BarackObama;President Obama on his constitutional responsibility and the qualities he's looking for in his #SCOTUS nominee: https://t.co/CFDl6l1hhC
2016-02-23 22:59:30;BarackObama;Refusing to even consider the President's Supreme Court nominee is unprecedented. Tell the Senate: #DoYourJob. https://t.co/kSrKv5e3Ae
2016-02-23 18:33:05;BarackObama;With more than 300 days left in President Obama's term, the Senate has no excuse to delay. #DoYourJob https://t.co/ultmGstueA
2016-02-23 17:19:26;BarackObama;Be part of the team debunking myths with facts—join the @OFA Truth Team: https://t.co/6z9PgSYuSk https://t.co/51zJn9N8qa
2016-02-23 15:31:44;BarackObama;LIVE: President Obama is delivering a statement from the Roosevelt Room. https://t.co/8yT6ov8klS
2016-02-22 22:58:51;BarackObama;A fair judicial nomination process is important for a functioning democracy—read more: https://t.co/C7DSRLXgTV
2016-02-22 19:57:43;BarackObama;Speak up for a fair nomination process and a timely vote by the Senate—sign @OFA's petition: https://t.co/HlQMqNYhVr #DoYourJob
2016-02-22 18:32:41;BarackObama;The Senate should not play political games with our Supreme Court. https://t.co/RoNN4vaw0a
2016-02-22 17:10:27;BarackObama;"""The Senate also has a constitutional duty: to consider presidential nominees expeditiously."" https://t.co/mnL8KCDwe5 (h/t @latimes)"
2016-02-21 18:50:55;BarackObama;Add your name to let the Senate know: The Supreme Court is too important to be held hostage by partisan politics. https://t.co/jPIEbRS7ig
2016-02-21 00:34:44;BarackObama;"RT @davidplouffe: My daughter getting ""egged"" on. She does things at her own pace. #ObamaAndKids https://t.co/BQj2jXrztj"
2016-02-20 20:38:18;BarackObama;RT @TIME: Here's why everyone is sharing pictures of #ObamaAndKids https://t.co/LdXz49BBg7
2016-02-19 20:01:10;BarackObama;Gain the skills you need to turn a desire for change into impact—apply to be an @OFA fellow today: https://t.co/q4t5Da7uyW
2016-02-19 17:13:06;BarackObama;The impact of climate change in one GIF: https://t.co/tsQOp3cIVn #ActOnClimate
2016-02-18 20:17:27;BarackObama;The longest streak of private-sector job growth, 4.9% unemployment rate—middle-class economics is working. https://t.co/jWIZ0IZwL1
2016-02-18 18:30:33;BarackObama;It's official: January 2016 was the most abnormally warm month on record. https://t.co/nAGoY6DXuB #ActOnClimate
2016-02-18 17:13:31;BarackObama;"RT @WhiteHouse: ""For the third time as President, I get to say: Give it up for the Stanley Cup champs – my hometown Chicago Blackhawks!"" —@…"
2016-02-17 22:23:02;BarackObama;Read what @VP Biden has to say about our economic comeback, thanks in part to the Recovery Act: https://t.co/mKwr9m3608
2016-02-17 20:01:46;BarackObama;In the past seven years, our economy has made real progress. https://t.co/D1XXOQVPCT
2016-02-17 17:51:34;BarackObama;RT @WhiteHouse: Watch @POTUS explain why there's more than enough time for the Senate to consider a #SCOTUS nominee he presents. https://t.…
2016-02-16 02:29:30;BarackObama;RT @WhiteHouse: Shoutout to @KendrickLamar and all the artists at the #Grammys working to build a brighter future. #MyBrothersKeeper https:…
2016-02-14 21:59:44;BarackObama;This #Valentines Day, speak up for equality: https://t.co/WAuwEmxUhm #LoveIsLove
2016-02-14 19:49:16;BarackObama;No matter who you are or whom you love, celebrate #Valentines Day with pride. #LoveIsLove https://t.co/btFuHnIEfV
2016-02-13 21:27:11;BarackObama;Stand against discrimination—join the fight for equality. https://t.co/ZUDqZ6fbQM #LoveIsLove
2016-02-13 15:32:09;BarackObama;Retweet if you believe #LoveIsLove. https://t.co/ssMsbWMcXE
2016-02-12 22:56:54;BarackObama;Watch President Obama thank @TheEllenShow for all she's done for the LGBT community: https://t.co/Und55Vdlxy #LoveIsLove
2016-02-12 21:02:33;BarackObama;Read President Obama's thoughts on climate change, technology, and #WomenInSTEM: https://t.co/VRyX8cxFEk https://t.co/IrcnE2T88M
2016-02-12 19:20:19;BarackObama;Thanks to President Obama, future generations will still be able to explore—from sea to shining sea. #FindYourPark https://t.co/Zt1U8dF3vW
2016-02-12 17:17:28;BarackObama;President Obama has protected more land and water than any of his predecessors—and he's not done yet: https://t.co/KEZZOHgyij #FindYourPark
2016-02-12 15:35:37;BarackObama;RT @WhiteHouse: Big news: @POTUS just protected 1.8 million acres of public lands in CA → https://t.co/jnLF7pHein #FindYourPark https://t.c…
2016-02-12 00:50:20;BarackObama;"RT @TheEllenShow: .@BarackObama was here in 2007, and tomorrow he’s barack. I mean back. #TBT @POTUS
https://t.co/LKU0eS0GXF"
2016-02-11 21:42:15;BarackObama;Marriage equality may be the law of the land, but there's more work to do to end discrimination. Join the fight: https://t.co/DlDQ35K8o6
2016-02-11 20:06:54;BarackObama;Show what you believe—get the #LoveIsLove tee. https://t.co/4uqGPAt4TZ https://t.co/FxaPN3Z36l
2016-02-11 18:25:16;BarackObama;Celebrate this Valentine's Day with pride, and no matter who you love, commit to ending discrimination. #LoveIsLove https://t.co/mn6BZWEe1y
2016-02-11 17:09:23;BarackObama;"""The fact is we’ve gotten a heck of a lot done these past seven years, despite the gridlock."" —President Obama https://t.co/hrw7PNSEX1"
2016-02-10 20:57:19;BarackObama;LIVE: President Obama is speaking in Springfield, Illinois. https://t.co/FZPraej5FL
2016-02-10 19:31:35;BarackObama;Tune in at 4:25 p.m. ET to watch President Obama speak to supporters in Springfield, Illinois: https://t.co/mE04l0NorZ
2016-02-10 17:42:06;BarackObama;Join the @OFA Truth Team and spread the facts on issues that matter: https://t.co/4EOm2PAXq0 https://t.co/19qvZpVawl
2016-02-09 22:32:19;BarackObama;Say cheese. #NationalPizzaDay https://t.co/cqNblFDAta
2016-02-09 21:11:49;BarackObama;RT @WhiteHouse: .@POTUS's final budget continues the fight to #ActOnClimate for future generations: https://t.co/KfMWpJVsTW https://t.co/If…
2016-02-09 19:13:20;BarackObama;An increase in solar jobs is good for our economy and our environment. #ActOnClimate https://t.co/g22J3tMhVp
2016-02-09 16:38:01;BarackObama;Good news: 2015 was another great year for clean energy growth. https://t.co/IoCSX8ybwm #ActOnClimate
2016-02-08 22:00:15;BarackObama;"RT @CBSThisMorning: WATCH: @POTUS and @FLOTUS play @GayleKing's game ""I love it when..."" during LIVE interview ahead of #SB50 on @CBS!
http…"
2016-02-08 20:12:05;BarackObama;Criminal justice reform is overdue. Speak up for fairness—add your name: https://t.co/A1b1B574uJ #FixTheSystem
