timestamp;sn;text
2016-07-25 18:02:26;BarackObama;Add your name if you believe Senate leaders need to put aside partisan politics and fill the Supreme Court vacancy. https://t.co/tnioCrRvkC
2016-07-25 17:02:06;BarackObama;Restoring the Supreme Court to full strength must remain above Senate leaders' petty politics. #DoYourJob https://t.co/H5EWm5gQug
2016-07-25 15:55:36;BarackObama;The federal minimum wage hasn't been raised since 2009. $7.25 isn't enough to make ends meet—we need to #RaiseTheWage.
2016-07-23 17:54:03;BarackObama;"""Our economy is stronger today than it was before the crisis."" —President Obama https://t.co/u441ol4m3B"
2016-07-23 16:08:53;BarackObama;In the weekly address, @SenWarren joins President Obama to discuss economic progress and Wall Street reform. https://t.co/u441ol4m3B
2016-07-22 16:41:42;BarackObama;Add your name if you believe Senate leaders need to put aside partisan politics and fill the Supreme Court vacancy: https://t.co/aYkFs9IzS7
2016-07-22 15:23:27;BarackObama;A reminder for Senate leaders: Judge Garland has had strong bipartisan support in the past. #DoYourJob https://t.co/dFjboU0TYX
2016-07-21 20:50:14;BarackObama;Ida is one of the millions of people getting new opportunities to go solar and save money. Find out more: https://t.co/GTDwZu2lNT
2016-07-21 19:13:30;BarackObama;Our economy is making real progress. https://t.co/xBgqyYEoG0
2016-07-21 17:55:47;BarackObama;By almost every economic measure, our economy is better off than it was eight years ago. https://t.co/iWSkzgSIkG
2016-07-21 15:59:21;BarackObama;America’s businesses have created more than 14 million new private-sector jobs over 76 straight months. https://t.co/e4a5X2bv0j
2016-07-20 19:34:23;BarackObama;For three years in a row, heat records have been broken across the globe. We have to #ActOnClimate now. https://t.co/Ps1Dk0Asqx
2016-07-20 17:33:46;BarackObama;RT @WhiteHouse: FACT: Since @POTUS took office more than 50,000 workers have been trained to enter the solar industry #ActOnClimate https:/…
2016-07-20 15:38:12;BarackObama;Make your voice heard: The Senate must fill the vacancy on the Supreme Court. https://t.co/GguLMpuUkq #DoYourJob
2016-07-19 16:10:17;BarackObama;Today marks 125 days since Judge Garland's nomination—the longest time in history from nomination to confirmation. https://t.co/9qff6NdrmR
2016-07-18 20:43:18;BarackObama;Editorial boards across the country are calling on Senate leaders to fill the Supreme Court vacancy. Read more: https://t.co/IArYejb7bN
2016-07-18 18:45:15;BarackObama;The majority of Americans believe Judge Garland should get a fair hearing—add your name if you agree. https://t.co/mkmVF9JsZW #DoYourJob
2016-07-18 16:42:29;BarackObama;Read President Obama's op-ed in the @WSJ on the need for Senate leaders to fill the #SCOTUS vacancy: https://t.co/CdCsAdSJlB #DoYourJob
2016-07-17 21:03:38;BarackObama;Happening now: President Obama is delivering a statement on the shooting in Baton Rouge. https://t.co/51KA2cvfHk
2016-07-15 18:58:35;BarackObama;Happening now: President Obama is delivering remarks at the Diplomatic Corps Reception. https://t.co/0UeX55Gijc
2016-07-14 21:28:10;BarackObama;Tonight: President Obama joins a town hall discussion on communities and policing. Watch at 8 p.m. ET on @ABC: https://t.co/TeFybh04PX
2016-07-14 18:33:42;BarackObama;Stay in touch with the latest news—join the @OFA Truth Team: https://t.co/7KhfzVgngW https://t.co/4JlimjSOUx
2016-07-14 16:27:04;BarackObama;Check out @VP Biden on the Supreme Court vacancy and Senate Republicans’ continued obstruction. https://t.co/HY8W77Ky1J #DoYourJob
2016-07-13 16:17:21;BarackObama;Watch President Obama deliver remarks at the #DallasMemorial service yesterday. https://t.co/BHIQTdnIDr
2016-07-12 18:47:15;BarackObama;President Obama is delivering remarks at an interfaith memorial service for the fallen police officers in Dallas. https://t.co/10WxYmaIke
2016-07-12 16:59:15;BarackObama;At 1:40 p.m. ET, President Obama will be speaking at a memorial service for the fallen police officers in Dallas. https://t.co/mSqpIVvZzZ
2016-07-08 14:53:02;BarackObama;"RT @WhiteHouse: ""We stand united with the people and the police department in Dallas."" —@POTUS on last night's attack in #Dallas: https://t…"
2016-07-07 22:17:10;BarackObama;RT @WhiteHouse: At 6:35pm ET, @POTUS will speak on the reports of police shootings in Louisiana and Minnesota. Tune in: https://t.co/h292HS…
2016-07-04 16:01:21;BarackObama;Happy Fourth of July. https://t.co/AQHiti7Yye
2016-07-03 19:19:13;BarackObama;"""Just imagine the peace and justice that would be possible in our world if we all lived a little more like Elie Wiesel."" —President Obama"
2016-07-02 15:05:52;BarackObama;Watch President Obama share a #FourthOfJuly message in the weekly address. https://t.co/7S5VzgA4OM
2016-07-01 21:54:03;BarackObama;Millions of Americans believe the Senate should hold a fair hearing for Judge Garland. Are you one of them? https://t.co/y5zGBXLvZZ
2016-07-01 20:54:04;BarackObama;Nationwide, editorial boards agree that Senate leaders should get to work and hold a fair hearing for Judge Garland. https://t.co/y7tYvcyILv
2016-07-01 19:17:36;BarackObama;Chicago raising its minimum wage is another reminder: Congress needs to keep up and #RaiseTheWage for hard-working Americans nationwide.
2016-07-01 19:12:15;BarackObama;Congrats to Chicago and all those who fought to #RaiseTheWage. Boosting paychecks for hard-working Americans is the right thing to do.
2016-07-01 17:18:21;BarackObama;Don't let the facts get drowned out. Join the OFA Truth Team today: https://t.co/RgBRNLYdYl https://t.co/SN8HUXw2H4
2016-07-01 15:55:52;BarackObama;Since #Obamacare passed, health care spending has been slowing—and the uninsured rate is down to an all-time low. https://t.co/DV3FT10f7M
2016-07-01 02:35:15;BarackObama;Quick—you're running out of time to chip in before the fundraising deadline. https://t.co/1c3ejYu2WB https://t.co/JM9WbRIBFZ
2016-07-01 00:05:54;BarackObama;We can do more than thoughts, prayers, and moments of silence. Add your voice to call on Congress to #DisarmHate. https://t.co/6CiFxUwwD7
2016-06-30 21:54:47;BarackObama;Stretch it out and get ready—the fundraising deadline is tonight. https://t.co/Ke22u7JHCa https://t.co/rwNuTtdgKA
2016-06-30 19:29:00;BarackObama;An overwhelming majority of Americans agree—Congress needs to act. #DisarmHate https://t.co/JuVv8MrEaO
2016-06-30 17:49:56;BarackObama;Reach out and help build this movement—pitch in: https://t.co/71qtnqx0Xj https://t.co/k6jketWz1r
2016-06-30 15:34:34;BarackObama;After Monday's #SCOTUS ruling, more unconstitutional restrictions on women's reproductive rights are falling. https://t.co/q6D3sbHEpq
2016-06-29 22:30:35;BarackObama;Add your name if you agree: Climate change is real and it's going to take global action to tackle it. https://t.co/HC4QGNDFWC #ActOnClimate
2016-06-29 21:17:14;BarackObama;A new historic goal in the fight to #ActOnClimate. https://t.co/sAu2fHdxAb
2016-06-28 18:36:10;BarackObama;Speak up and demand that Congress act on gun violence prevention: https://t.co/pA6IzzIE5A #DisarmHate
2016-06-28 17:36:14;BarackObama;Enough has been enough for a long time. Congress needs to vote on sensible gun legislation now. #DisarmHate https://t.co/twRQQnTBvK
2016-06-28 16:35:12;BarackObama;Congratulations to D.C., and thanks to Mayor Bowser and the D.C. Council for fighting to #RaiseTheWage. https://t.co/7cXBVUFCmn
2016-06-28 15:35:34;BarackObama;"""She outworked her rivals ... and became a role model to millions of Americans—including our two daughters."" —President Obama on Pat Summitt"
2016-06-27 21:04:29;BarackObama;You don't need super powers to help push progress forward. Chip in today: https://t.co/yCxp5APr5E https://t.co/iHbjSMt3Ug
2016-06-27 20:38:08;BarackObama;"RT @SecretaryJewell: Today we celebrate Stonewall National Monument &amp; all those who made the 1st LGBT monument possible.SJ #FindYourPark ht…"
2016-06-27 19:34:59;BarackObama;Today's #SCOTUS ruling reaffirms that every woman has a right to make her own reproductive choices. https://t.co/uvgc9MgX3e
2016-06-27 18:15:06;BarackObama;Say you'll keep fighting to protect a woman's right to make her own reproductive choices. https://t.co/pkbjaxm9wO
2016-06-27 16:58:46;BarackObama;The Supreme Court just struck down Texas' overly restrictive abortion laws—a win for women's reproductive rights. https://t.co/DMDwVnq6Vt
2016-06-27 15:23:48;BarackObama;"RT @PPact: This is a win for Texans &amp; women across the country who need access to abortion. https://t.co/UEatutANNk #MyDecision https://t.c…"
2016-06-27 00:33:41;BarackObama;Love only wins when people like you stand up and fight for it. Are you in? https://t.co/bHtizDnaTY #LoveIsLove
2016-06-26 23:25:59;BarackObama;We must keep working toward an America free from discrimination against LGBT individuals. #LoveIsLove https://t.co/YxdiL21fIl
2016-06-26 22:13:07;BarackObama;President Obama designates the first national monument honoring the LGBT rights movement. https://t.co/vpPSEnyXV6 #LoveIsLove
2016-06-26 21:07:02;BarackObama;Wear your love with pride. https://t.co/6863wUsjbn #LoveIsLove https://t.co/efRPdSb0dk
2016-06-26 19:41:57;BarackObama;"""We can’t rest. We’ve got to keep pushing for equality and acceptance and tolerance."" —President Obama https://t.co/qJOqlrn0HP"
2016-06-26 17:49:51;BarackObama;Marriage equality is one year old. But we still have a long way to go for full equality. #LoveIsLove https://t.co/nwM1XFHKzG
2016-06-26 14:00:02;BarackObama;Stand in solidarity with LGBT Americans—add your name. https://t.co/1gGugHitl1 #LoveIsLove
2016-06-25 21:20:57;BarackObama;We've made enormous progress toward full equality for LGBT Americans. Let's keep it going. #LoveIsLove https://t.co/x4mTOKQSiP
2016-06-25 19:14:16;BarackObama;In the weekly address, President Obama discusses the Stonewall Inn's significance and the ongoing push for progress: https://t.co/FVKkSnnuCt
2016-06-24 23:15:28;BarackObama;Take a look: @VP Biden discusses what 4-4 decisions—like yesterday's on immigration—mean for our country. https://t.co/y6FXMAEzzd
2016-06-24 21:12:33;BarackObama;From gun violence prevention to LGBT rights, this grassroots movement is fighting for progress. Show your support: https://t.co/wc9gPY0h3G
2016-06-24 19:57:52;BarackObama;"""Stonewall will be our first national monument to tell the story of the struggle for LGBT rights."" —President Obama https://t.co/PhswSyKsub"
2016-06-24 18:35:29;BarackObama;"A few words used by leading legal minds to describe Judge Garland:
Phenomenal
Exceptionally bright
Fair-minded https://t.co/BqmzlabZlZ"
2016-06-24 16:52:02;BarackObama;Think the Senate should give Judge Garland a fair hearing? Add your voice: https://t.co/iFQlY95TGt #DoYourJob
2016-06-24 15:33:01;BarackObama;Because Senate leaders refuse to do their jobs, the Supreme Court cannot properly do its job. #DoYourJob https://t.co/DvqUdLN2pA
2016-06-23 22:22:25;BarackObama;Speak up and demand that Congress act on gun violence prevention: https://t.co/Mo8ulIwRZg #DisarmHate
2016-06-23 21:02:36;BarackObama;Congress: Listen to the millions of voices demanding a vote on efforts to reduce gun violence. #DisarmHate https://t.co/X2uYxbJSs0
2016-06-23 18:39:42;BarackObama;Our immigration system is broken, and we need Congress for a long-term solution—speak up for #ImmigrationAction: https://t.co/apx4e9xPmN
2016-06-23 17:34:39;BarackObama;"RT @WhiteHouse: Watch → @POTUS on why today's #SCOTUS decision sets us back even further
on immigration reform: https://t.co/kdrhQQbPiS"
2016-06-23 15:53:15;BarackObama;LIVE: President Obama is speaking about today's Supreme Court immigration ruling. https://t.co/65QpzfLGS3 #ImmigrationAction
2016-06-23 01:30:23;BarackObama;We need more than moments of silence. We need action. And that's what's going on in the House now: https://t.co/L9m0dSfipA #NoBillNoBreak
2016-06-22 22:33:06;BarackObama;RT @VP: Always the keeper of the nation's conscience at times of challenge and controversy. Thank you, John Lewis. https://t.co/D9CW2A3a2B
2016-06-22 18:39:17;BarackObama;"RT @repjohnlewis: My colleagues &amp; I have had enough. We are sitting-in on the House Floor until we get a vote to address gun violence. http…"
2016-06-22 17:31:07;BarackObama;The kind of obstruction we're seeing from Senate leaders is unprecedented. #DoYourJob https://t.co/W4TbswBwvS
2016-06-22 15:16:17;BarackObama;If you're one of the millions of Americans who believes Judge Garland should get a fair hearing, add your voice: https://t.co/51SBeDdTKl
2016-06-21 22:02:41;BarackObama;Judge Merrick Garland just received the American Bar Association's highest rating: https://t.co/9ew2WSpFqd
2016-06-21 20:52:38;BarackObama;Say you support decisive action to tackle climate change. https://t.co/S9gkxn0wpv #ActOnClimate
2016-06-21 19:47:25;BarackObama;Clean energy is here to stay. https://t.co/meQoPVWXtg
2016-06-21 17:45:49;BarackObama;"""There's something sacred about this place."" —President Obama on Yosemite National Park https://t.co/BOsfJ0C9W7"
2016-06-21 15:46:50;BarackObama;RT @POTUS: Gun violence requires more than moments of silence. It requires action. In failing that test, the Senate failed the American peo…
2016-06-20 19:29:42;BarackObama;Staying informed is too important leave to chance. Join the @OFA Truth Team today: https://t.co/ltq6xPBNfI https://t.co/6FQZXGLTHA
2016-06-20 17:09:07;BarackObama;Join @vj44 on a conference call to discuss efforts we can take to help reduce gun violence. https://t.co/AzL9CkYA7z
2016-06-20 16:09:09;BarackObama;Take a look at President Obama's interview with @NatGeo on national parks, climate change and more. https://t.co/xtbFt2XMHI
2016-06-19 17:59:32;BarackObama;"""To me, fatherhood means being there."" —President Obama https://t.co/rL6RROGvQg"
2016-06-19 16:49:17;BarackObama;Happy Father's Day to all the dads out there. https://t.co/okqSRnQk6n
2016-06-18 23:28:31;BarackObama;In the weekly address, the President talks about setting examples for children in light of tragedies like Orlando. https://t.co/B1k1FHYR76
2016-06-18 19:28:58;BarackObama;"RT @WhiteHouse: ""These parks belong to all of us. This planet belongs to all of us. It’s the only one we’ve got"" —@POTUS in Yosemite https:…"
2016-06-18 15:31:18;BarackObama;President Obama has taken unprecedented steps to protect our land and water for future generations. https://t.co/D5PNr4itC5
2016-06-17 21:07:37;BarackObama;This week, people all over the world came together to stand with the LGBT community—take a look: https://t.co/YyZsmZOpUZ
2016-06-17 18:23:03;BarackObama;RT @VP: Taking steps to reduce gun violence worth doing if it could save one life. But it could save far more. Finish this. https://t.co/P7…
2016-06-17 01:41:07;BarackObama;"RT @WhiteHouse: Today @POTUS &amp; @VP visited Orlando. Watch the President give remarks after meeting with the families of the victims: https:…"
2016-06-13 16:52:45;BarackObama;#OrlandoUnited https://t.co/ixCxMZzGH2
2016-06-12 18:36:50;BarackObama;"RT @WhiteHouse: ""In the face of hate and violence, we will love one another. We will not give into fear."" —@POTUS https://t.co/i7fOS38GzH"
2016-06-12 17:17:19;BarackObama;RT @WhiteHouse: At 1:30pm ET, @POTUS will deliver a statement on the tragic shooting in #Orlando. Watch live: https://t.co/k6QWAbrHAh
2016-06-10 20:56:53;BarackObama;"""Minds open. Hearts change. America shifts."" —President Obama #Pride2016 
https://t.co/JJSBJW5UEb"
2016-06-10 19:53:24;BarackObama;Today, #LoveIsLove in all 50 states. But millions of Americans are still fighting to end discrimination—join them: https://t.co/07hwYLJOy8
2016-06-10 17:47:53;BarackObama;This is how you Slow Jam the News: https://t.co/bToPKW4UCM #POTUSonFallon
2016-06-10 16:25:15;BarackObama;RT @FallonTonight: .@POTUS and @jimmyfallon Slow Jam the News https://t.co/51BDe8zaca #POTUSonFallon #FallonTonight https://t.co/S64AtoY0tJ
2016-06-10 00:43:05;BarackObama;Watch President Obama Slow Jam the News on @FallonTonight at 11:35 p.m. ET. #POTUSonFallon https://t.co/RuwpGwbTSA
2016-06-08 21:31:03;BarackObama;Be proud of how far we've come—and continue to push for progress. #LoveIsLove https://t.co/ApzHdiiO14
2016-06-07 21:57:06;BarackObama;Senate leaders' refusal to give Judge Garland a fair hearing is pure politics. #DoYourJob https://t.co/8rzLIBigzM
2016-06-07 20:52:52;BarackObama;Your support for a fair hearing and timely up-or-down vote to fill the vacancy on the Supreme Court matters: https://t.co/qfpOoUefet
2016-06-07 18:33:03;BarackObama;"Senate leaders' politicization of the Supreme Court is ""unconscionable."" https://t.co/f92L5TbGSR #DoYourJob"
2016-06-07 16:58:40;BarackObama;Love looks good on you. Wear it with pride: https://t.co/LlWSvS4uBE #LoveIsLove https://t.co/g5WjqYQvHq
2016-06-07 15:24:30;BarackObama;This month and every month. #LoveIsLove https://t.co/L3kRhhRxA4
2016-06-06 21:46:16;BarackObama;"Unemployment rate ⬇
Federal deficit ⬇
Uninsured rate ⬇ https://t.co/SGZTb0ZBf3"
2016-06-06 19:09:53;BarackObama;Watch as President Obama tackles four common myths about our economy. https://t.co/9DdBoFj9y2
2016-06-06 17:00:27;BarackObama;Former Energy Secretary @GovRichardson: Why the #TPP will make a difference in fighting climate change. https://t.co/AuWKEGJIGW
2016-06-06 15:32:03;BarackObama;"RT @FLOTUS: Together, we are stronger. Together we can change tomorrow. Stand with us: https://t.co/kMuWTuXTdb #StateOfWomen
https://t.co/m…"
2016-06-04 15:41:59;BarackObama;"""We pray that the greatest fighter of them all finally rests in peace."" —President Obama #RIPMuhammadAli"
2016-06-03 20:45:16;BarackObama;The Supreme Court shouldn't be part of partisan political games. Add your name if you agree: https://t.co/j8T9Vqlffe
2016-06-03 19:38:47;BarackObama;It's time for Senate leaders to end the obstruction of our Supreme Court. #DoYourJob https://t.co/oKSLU2ADQi
2016-06-03 17:35:34;BarackObama;Make sure you have all the facts—sign up to be part of the @OFA Truth Team. https://t.co/WozNFfFzW2 https://t.co/FrHVjmzd62
2016-06-03 15:57:34;BarackObama;This is the largest annual global increase in renewable power capacity—ever: https://t.co/9Eha0d5gbb #ActOnClimate
2016-06-02 23:30:24;BarackObama;Watch: This is why people across the country have decided to #WearOrange today. https://t.co/IUguOJg2Zk
2016-06-02 22:31:43;BarackObama;Gun violence takes too many lives in our country. Congress must do something about it—add your name if you agree: https://t.co/H8Yh77Somm
2016-06-02 21:24:29;BarackObama;This National Gun Violence Awareness Day, keep the pressure on Congress to act. #WearOrange https://t.co/VplJtSGMaU
2016-06-02 20:09:40;BarackObama;"The noise around gun violence is loud.
But we can be louder.
#WearOrange https://t.co/lYA8JEFhvg"
2016-06-02 18:08:12;BarackObama;Join the thousands of people calling on Congress to do something about gun violence—add your name: https://t.co/M0QQvNiYdj #WearOrange
2016-06-02 16:53:25;BarackObama;Gun violence takes far too many lives in America. Congress needs to act. #WearOrange https://t.co/TYqb1fklcu
2016-06-02 15:34:25;BarackObama;"RT @POTUS: We cannot accept our level of gun violence as the new normal. We must take action to prevent this from happening again &amp; again.…"
2016-06-01 23:47:34;BarackObama;LAST CHANCE: Keep calm and enter before the midnight deadline. https://t.co/GRHmsl26Hd https://t.co/RJxiN938k8
2016-06-01 23:05:58;BarackObama;"RT @Everytown: June 2 is almost here!

How are you going to #WearOrange tomorrow? https://t.co/1y3ILsqdcu"
2016-06-01 22:04:31;BarackObama;Speak out against gun violence—#WearOrange tomorrow. https://t.co/IUguOJg2Zk
2016-06-01 21:08:12;BarackObama;Don't miss your chance to meet President Obama this summer. Enter before tonight's deadline: https://t.co/GLFCABWEuq
2016-06-01 20:20:36;BarackObama;"RT @WhiteHouse: “Our deficits haven’t grown these past seven and a half years; we’ve cut them by almost 75%.” —@POTUS https://t.co/k24EI0FG…"
2016-06-01 19:53:06;BarackObama;This is progress—but there's still more work to do to make sure our economy works for everybody. https://t.co/Gm8wvx0Gan
2016-06-01 19:31:15;BarackObama;LIVE: President Obama is speaking in Elkhart, Indiana, highlighting America's economic progress. https://t.co/x8XPvevF8e
2016-06-01 18:33:43;BarackObama;Tune in at 3:25 p.m. ET to watch President Obama speak in Elkhart, Indiana—seven years after his first visit. https://t.co/ams2ipvolb
2016-06-01 16:37:00;BarackObama;"""Make the choice to do some good in the world."" Watch Judge Garland speak to high school seniors at his alma mater: https://t.co/lkiWqSFra7"
2016-06-01 15:19:16;BarackObama;You don't want to miss out on this opportunity—enter now before tonight's deadline. https://t.co/ZgquwBCiow https://t.co/VpuEcqR86Z
2016-05-31 22:23:52;BarackObama;Suit up—enter for a chance to meet President Obama before the deadline. https://t.co/5WQWYBGrAJ https://t.co/I79QxFVYGF
2016-05-31 20:12:18;BarackObama;The Supreme Court shouldn't be part of partisan political games. Add your name if you agree: https://t.co/uqAYi3uxrI
2016-05-31 16:51:40;BarackObama;Because some Senate leaders won't do their jobs, the Supreme Court can't fully do its job. #DoYourJob https://t.co/gxXi7wCfg0
2016-05-31 15:21:39;BarackObama;Share a laugh with President Obama—enter now for your chance. https://t.co/pZ4bvOtFVx https://t.co/JkBo1fVrJ0
2016-05-30 18:21:05;BarackObama;"""Today, and every day, let us remember the servicemen and women we have lost."" —President Obama https://t.co/x1lQbyFr2M"
2016-05-30 14:36:19;BarackObama;"""This Memorial weekend, I hope you’ll join me in acts of remembrance."" —President Obama https://t.co/UxDZMDjMdu"
2016-05-29 16:47:23;BarackObama;RT @SCOTUSnom: It's graduation day at Niles West High School! Watch Judge Garland speak live at 1pm ET: https://t.co/ta4ag8A0Ci https://t.c…
2016-05-27 21:26:49;BarackObama;A new survey shows that the overwhelming majority of #Obamacare customers are satisfied with their plans: https://t.co/75eFrBUV0e
2016-05-27 18:28:53;BarackObama;Join the @OFA Truth Team and help set the record straight on issues you care about: https://t.co/FgwDveu3Ef https://t.co/aCEFVLB0ko
2016-05-27 15:53:24;BarackObama;Enter now for the chance to get some pointers from the Commander-in-Chief. https://t.co/lGn4BecCBl https://t.co/XODRtQS0UI
2016-05-26 20:14:33;BarackObama;Stand up for a fair hearing and timely up-or-down vote for Judge Merrick Garland: https://t.co/DpeBdTFt8j
2016-05-26 18:37:37;BarackObama;"Judge Garland:

Independent mind ✓
Highly qualified ✓
Has had bipartisan support ✓

Senate leaders: #DoYourJob https://t.co/r2egTausVA"
2016-05-26 15:50:52;BarackObama;Tell your friends you fist bumped President Obama—enter now for your chance. https://t.co/s86eJjBJ0U https://t.co/zJEelmeIe6
2016-05-25 22:25:29;BarackObama;Senate leaders' obstruction of our Supreme Court is completely unprecedented. #DoYourJob https://t.co/PvubG4dFnd
2016-05-25 19:14:34;BarackObama;Senate leaders need to stop obstructing our Supreme Court—add your name if you agree: https://t.co/sFaoUFD3eP #DoYourJob
2016-05-25 18:07:30;BarackObama;Judge Garland was confirmed with bipartisan support in the past. He deserves a fair hearing. #DoYourJob https://t.co/TTcIByTScg
2016-05-25 16:06:55;BarackObama;Get some face time with President Obama. Enter now for your chance to meet him: https://t.co/rLstH6U5tU https://t.co/wqfAHCk5tN
2016-05-24 21:47:38;BarackObama;If you think Senate leaders should do their jobs and fill the #SCOTUS vacancy, add your name now: https://t.co/nNHxp6SyII
2016-05-24 20:20:44;BarackObama;Don't pass this up—enter now: https://t.co/aIOZd4OfIH https://t.co/OgOyee6i4i
2016-05-24 18:29:32;BarackObama;"""People want Senate to act on Supreme Court vacancy."" See what editorial boards are saying: https://t.co/qzMRbnjD0N #DoYourJob"
2016-05-24 17:08:59;BarackObama;Ever wished you could meet President Obama? Here's your chance. https://t.co/XCeXSFtCYg https://t.co/AeFMTtBdf9
2016-05-24 15:58:14;BarackObama;Judge Garland has one of the most impressive resumes of any Supreme Court nominee in recent history. https://t.co/r2egTausVA
2016-05-23 20:08:18;BarackObama;You don't want to miss out on this chance. Enter today: https://t.co/rED8cKIqv4 https://t.co/PJoHc0lIGF
2016-05-23 17:17:49;BarackObama;Editorial boards to senators: #DoYourJob and fill the Supreme Court vacancy. https://t.co/rJi8Fy57Ii
2016-05-23 15:47:13;BarackObama;President Obama did his job, now it's time for the Senate to fulfill its duties—say you agree: https://t.co/JIdKOhTXci #DoYourJob
2016-05-22 22:18:37;BarackObama;On average, it's taken 67 days to confirm Supreme Court nominees since 1975. #DoYourJob https://t.co/ZqE3OngoFy
2016-05-21 23:40:38;BarackObama;"""This week my administration took a step to help more workers get the overtime pay they’ve earned."" —President Obama https://t.co/w7ytjIKedL"
2016-05-21 15:08:29;BarackObama;In the weekly address, President Obama discusses expanding #overtime for millions of American workers: https://t.co/w7ytjIKedL
2016-05-20 21:35:45;BarackObama;This summer, you and a friend could meet President Obama. Here's how: https://t.co/OZslVlHMI1
2016-05-20 20:51:34;BarackObama;Check out editorials from across the country calling on senators to fill the Supreme Court vacancy: https://t.co/4AGEWeXSIM #DoYourJob
2016-05-20 17:06:58;BarackObama;Editorial boards across the country are telling Senate leaders: #DoYourJob. https://t.co/WUkeoDslbp
