timestamp;sn;text
2016-05-20 15:46:02;BarackObama;Despite Judge Garland's qualifications, some Senate leaders still refuse to give him a hearing—speak out: https://t.co/gls53URSMx
2016-05-19 21:11:05;BarackObama;The uninsured rate just hit 9.1 percent—the lowest ever recorded. https://t.co/Ew8ARCuDL2
2016-05-19 19:37:34;BarackObama;Don't miss this: https://t.co/NqqvCBukwi https://t.co/0Ud7rIqPa0
2016-05-19 17:21:02;BarackObama;Thanks to the new #overtime rule, millions of hard-working Americans will have more economic security. https://t.co/JHQRJEcsv9
2016-05-19 16:02:46;BarackObama;Stand up for middle-class workers—add your name to support the Obama administration's new #overtime rule: https://t.co/SCLjZFP6aX
2016-05-18 22:03:43;BarackObama;Marriage equality? Affordable health care? Or economic progress? Tell him in person: https://t.co/5SqHi0htRp https://t.co/F83AdfUC8H
2016-05-18 21:18:38;BarackObama;RT @WhiteHouse: Today we're updating and strengthening #overtime pay rules to make sure millions more Americans are paid fairly. https://t.…
2016-05-18 20:22:52;BarackObama;Add your name if you support the Obama administration's new #overtime rule that expands protections for millions: https://t.co/9I8WHPmHlT
2016-05-18 18:53:14;BarackObama;LIVE: @VP Biden is speaking about the economy at @jenisicecreams headquarters in Ohio. https://t.co/JwIfgPAXfJ
2016-05-18 18:01:01;BarackObama;This is a big day for millions of middle-class workers. https://t.co/CCzAOOjxda
2016-05-18 15:35:55;BarackObama;LIVE: Senate Judiciary Democrats are holding a forum on Judge Merrick Garland. https://t.co/tT8pTk5Y54
2016-05-18 00:35:21;BarackObama;RT @WhiteHouse: BREAKING: @POTUS is taking an important step on #overtime to ensure your work is rewarded → https://t.co/R78XeeSNq9 https:/…
2016-05-17 21:58:52;BarackObama;Here's your chance: Tell President Obama what you're most thankful for—in person. https://t.co/EoeZNhKrdS https://t.co/lxFIDqbclW
2016-05-17 19:04:28;BarackObama;Judge Garland's former clerks have a lot to say about his record, work-life balance, and more—take a look: https://t.co/eHIgwaid6N
2016-05-17 17:15:15;BarackObama;Senate leaders are continuing to obstruct a fair hearing for Judge Garland—help put the pressure on: https://t.co/oCAPRllPZX #DoYourJob
2016-05-17 15:11:18;BarackObama;It's time for Senate leaders to put politics aside and fill the Supreme Court vacancy. #DoYourJob https://t.co/UAhLXYqgTN
2016-05-16 21:48:44;BarackObama;April was the seventh consecutive month of record-high temperatures. We need to #ActOnClimate. https://t.co/C4ca2VOA0a
2016-05-16 20:53:23;BarackObama;Think Senate leaders should do their jobs and give Judge Garland a fair hearing? Add your name: https://t.co/lDJoAIBe13 #DoYourJob
2016-05-16 18:58:11;BarackObama;LIVE: President Obama is speaking with @BuzzFeed about his #SCOTUS nominee, Judge Merrick Garland. https://t.co/suytYAcF63
2016-05-16 17:38:10;BarackObama;RT @BuzzFeed: Tune in this afternoon as @chrisgeidner interviews President Obama live from the White House on FB Live and YouTube! https://…
2016-05-16 16:06:47;BarackObama;We need to lead this fight. #ActOnClimate https://t.co/ArdxyYdCiN
2016-05-13 22:01:09;BarackObama;Change happens because people like you fight to make it happen. https://t.co/Y70kJkcrYH
2016-05-13 21:01:46;BarackObama;Show your support for continued efforts to tackle climate change: https://t.co/q28Wp3Akb6 #ActOnClimate
2016-05-13 19:53:15;BarackObama;Read more about the historic new standards in place to reduce methane pollution: https://t.co/8lq704upzr
2016-05-13 18:33:29;BarackObama;Senate leaders should listen to the American people. #DoYourJob https://t.co/vArMxcZh5W
2016-05-13 17:27:43;BarackObama;Say you support a fair #SCOTUS nomination process—speak up now: https://t.co/L6HonojsCg
2016-05-13 15:31:25;BarackObama;Find out what Judge Merrick Garland's former clerks have to say about his record as a public servant: https://t.co/wT6t9YmV0S
2016-05-12 21:28:58;BarackObama;Editorial boards are speaking up on the #SCOTUS vacancy. Here's what they're saying: https://t.co/HfS2ldyCCh #DoYourJob
2016-05-12 19:16:26;BarackObama;Add your name if you support big steps forward in the fight to tackle climate change: https://t.co/pP1RZtBKnT #ActOnClimate
2016-05-12 17:37:57;BarackObama;The Obama administration just finalized standards to cut methane pollution and improve public health. #ActOnClimate https://t.co/nR2x8UqDM8
2016-05-12 15:33:01;BarackObama;We can't afford to have a key part of our democracy understaffed. We need nine justices. #DoYourJob https://t.co/UYkYFLoNr7
2016-05-11 22:35:32;BarackObama;The Senate should give President Obama's Supreme Court nominee a fair hearing and an up-or-down vote. #DoYourJob https://t.co/eMAirFy0KU
2016-05-11 19:26:43;BarackObama;Add your voice to the push for a fair Supreme Court nomination process: https://t.co/R3ZglOxc2k #DoYourJob https://t.co/0IEpNmu3X0
2016-05-11 16:17:20;BarackObama;Here's where editorial boards across the country stand when it comes to the #SCOTUS vacancy: https://t.co/0LqnmDbFBa #DoYourJob
2016-05-10 20:59:33;BarackObama;Senate leaders: #DoYourJob and give Judge Garland the fair hearing he deserves. https://t.co/sg3Zx4vzIM
2016-05-10 20:07:56;BarackObama;RT @SCOTUSnom: Like the #SCOTUS nominees before him, Judge Garland filled out a questionnaire for Senators: https://t.co/01zuyMOQT4 https:/…
2016-05-10 18:55:32;BarackObama;Join the hundreds of thousands of people calling on Senate leaders to give Judge Garland a fair hearing: https://t.co/5nEoT9T8KV
2016-05-10 16:16:51;BarackObama;Judge Garland has impeccable credentials—he deserves a fair hearing from the Senate. #DoYourJob https://t.co/vqtTB1J4hL
2016-05-09 19:39:57;BarackObama;Add your name if you agree: We need a full Supreme Court bench for a functioning democracy. https://t.co/CApiDJ5Wgh #DoYourJob
2016-05-09 17:24:54;BarackObama;Partisan obstructionism shouldn't hold back our Supreme Court. #DoYourJob https://t.co/Q7rRKyWlZc
2016-05-09 15:13:47;BarackObama;President Obama has a message for @OFA supporters on the work ahead: https://t.co/2lW82lhIk3
2016-05-08 17:26:02;BarackObama;"""This Mother’s Day, say thank you. Say, 'I love you.'"" —President Obama https://t.co/LE1oaV5dr4"
2016-05-06 21:05:19;BarackObama;Add your name if you think Senate leaders need to stop obstructing our Supreme Court: https://t.co/7vSk8oDw6i #DoYourJob
2016-05-06 18:48:07;BarackObama;RT @WhiteHouse: “The economy has been growing, unemployment has been falling, and wages have been rising” —@POTUS https://t.co/hlZI0T2HE2
2016-05-06 16:45:28;BarackObama;74 consecutive months—more than six years—of private-sector job growth. Let's keep up the progress. https://t.co/igXXN83jCy
2016-05-06 16:16:51;BarackObama;LIVE: President Obama is speaking about the economy and new steps to strengthen financial transparency. https://t.co/Qem7LCIZVz
2016-05-06 13:39:15;BarackObama;The economy added 160,000 jobs in April—a record-breaking 74 months of private-sector job growth.
2016-05-05 21:12:07;BarackObama;President Obama just granted clemency to 58 men and women who've earned a second chance: https://t.co/TRIAGYd9Pk #FixTheSystem
2016-05-05 19:13:04;BarackObama;Say that Senate leaders should stop hiding behind excuses and give Judge Garland a fair hearing: https://t.co/mhCz1oKSyn #DoYourJob
2016-05-05 17:12:36;BarackObama;Check out President Obama's latest message to @OFA supporters and volunteers: https://t.co/DpKpYudQFa
2016-05-05 16:13:39;BarackObama;"RT @WhiteHouse: ""A young girl shouldn't have to go to Washington to be heard."" —@POTUS on 8-year-old Mari: https://t.co/fKPGpHwvCa https://…"
2016-05-04 22:12:41;BarackObama;President Obama: When American workers and businesses compete on a level playing field, no one can beat us. https://t.co/RBHapsYhqp
2016-05-04 20:11:05;BarackObama;LIVE: President Obama is speaking at Northwestern High School in Flint, Michigan. https://t.co/hg4ZAhZZId
2016-05-04 18:00:15;BarackObama;Retweet if you agree. #DoYourJob https://t.co/WjTM07LRL4
2016-05-04 15:51:01;BarackObama;Make your voice heard on a fair #SCOTUS nomination process—add your name today: https://t.co/kHWdaefQAP #DoYourJob
2016-05-03 20:33:43;BarackObama;LIVE: President Obama honors the 2016 National Teacher of the Year. https://t.co/mWxAZq5RKm
2016-05-03 17:44:41;BarackObama;Good climate change policy and good economic policy can go hand in hand. #ActOnClimate https://t.co/MEDMB870SP
2016-05-03 16:40:39;BarackObama;American workers deserve a trade agreement that works for them. Check out President Obama's op-ed on #TPP: https://t.co/exMvIGmk2H
2016-05-03 14:00:16;BarackObama;The United States just hit one million solar installations—enough to power 5.5 million homes. #MillionSolarStrong
2016-05-02 21:31:18;BarackObama;Say you're one of the majority of Americans who want Senate leaders to give Judge Garland a fair hearing. https://t.co/Vq2kN3WWlq #DoYourJob
2016-05-02 20:08:48;BarackObama;Building a clean energy economy is a great way to #ActOnClimate for people across the country. https://t.co/xfdVKh3Zhy
2016-05-02 18:46:37;BarackObama;Read what editorial boards across the country have to say about the #SCOTUS vacancy: https://t.co/xFqioAHA3l
2016-05-02 15:59:17;BarackObama;It's unacceptable for obstructionists in the Senate to play political games with the Supreme Court. Say you agree: https://t.co/ORb8MTAeAt
2016-05-01 22:26:34;BarackObama;"""And with that, I just have two more words to say—Obama out."" —President Obama at the #WHCD

Don't miss this: https://t.co/T4YNBb30zJ"
2016-05-01 20:15:17;BarackObama;"Watch ""Couch Commander"" President Obama at last night's #WHCD: https://t.co/MF3iohymbP"
2016-05-01 02:05:12;BarackObama;LIVE: President Obama is speaking at the #WHCD. https://t.co/U8C7OEGjEC
2016-04-30 22:28:06;BarackObama;"Tune in at 8:00 p.m. ET to watch ""Comedian-in-Chief"" President Obama at the #WHCD: https://t.co/JePbRDQkgG"
2016-04-30 21:18:06;BarackObama;"""Poll after poll shows a majority of Americans think Senate Republicans should do their job."" —President Obama https://t.co/L7wi8kiFj4"
2016-04-30 15:36:39;BarackObama;In the weekly address, President Obama has a simple message for Senate Republicans: #DoYourJob. https://t.co/Vj0BuPXlKM
2016-04-29 21:06:33;BarackObama;Senate leaders need to do their jobs and fill the #SCOTUS vacancy. #DoYourJob https://t.co/ZGcyGEv2CS
2016-04-29 15:10:47;BarackObama;Clean air makes for healthier and safer communities. #ActOnClimate https://t.co/uuPdv41v0u
2016-04-28 21:18:23;BarackObama;Hundreds of thousands of Americans are calling on Senate leaders to fill the #SCOTUS vacancy—join them: https://t.co/9LwydN9bmk
2016-04-28 20:21:27;BarackObama;It's been more than 40 days since Judge Garland was nominated. Senate leaders: #DoYourJob. https://t.co/RUBRebSJhZ
2016-04-28 18:08:22;BarackObama;Don't let climate change deniers jeopardize the progress we've made toward a safer, healthier future. Call them out: https://t.co/GV1Stqvdoq
2016-04-28 15:30:07;BarackObama;Fighting climate change will save Americans money at the gas pump. #ActOnClimate https://t.co/ePl93jLYTU
2016-04-27 22:20:17;BarackObama;Add your name if you support global efforts to tackle climate change: https://t.co/IQJzH7sb2C
2016-04-27 21:15:58;BarackObama;Watch Professor Obama take obstructionists in the Senate back to school with #SCOTUS 101. #DoYourJob https://t.co/GaN9kDsQIp
2016-04-27 20:09:45;BarackObama;For the health of our children and grandchildren, we have to #ActOnClimate. https://t.co/pJz7ODyr3p
2016-04-27 18:40:21;BarackObama;The Senate should uphold its constitutional duty and give Judge Garland a fair hearing. Add your name if you agree: https://t.co/JmvJa0rHns
2016-04-27 16:44:15;BarackObama;Watch: Professor Obama has a #SCOTUS lesson for obstructionists in the Senate. #DoYourJob https://t.co/CtFP33X8Lv
2016-04-26 20:58:35;BarackObama;"""Not to let the Constitution function is totally irresponsible and it's never happened like this before."" —@VP https://t.co/y6FXMAEzzd"
2016-04-26 20:02:05;BarackObama;Don't let climate change deniers derail progress—show your support for bold action on climate change: https://t.co/ZeUmitNSUb #ActOnClimate
2016-04-26 18:15:38;BarackObama;The fight to tackle climate change took a big step on Friday with hundreds of countries signing the #ParisAgreement. https://t.co/gk7BWRRBqA
2016-04-26 16:29:47;BarackObama;ICYMI: The U.S. and more than 170 other nations just signed the #ParisAgreement—the first ever global climate deal. https://t.co/Jlg4q4piDu
2016-04-25 21:43:29;BarackObama;We all play a part in helping to stop gun violence. Do your part—#WearOrange on June 2. https://t.co/IUguOJg2Zk
2016-04-25 19:22:00;BarackObama;We're already seeing the effects of climate change. Denial is unacceptable. #ActOnClimate https://t.co/k3sphu7KgC
2016-04-25 17:28:38;BarackObama;Show your support for bold moves to combat climate change—add your name: https://t.co/Wof6TIp08t #ActOnClimate
2016-04-25 15:24:10;BarackObama;Carbon pollution is the biggest contributor to climate change—and President Obama is taking it head on. https://t.co/lZlIAyD9UV
2016-04-23 19:36:21;BarackObama;"""We have criminal justice policies, including unfair sentencing laws, that need to be reformed."" —President Obama https://t.co/ovSB7lu9Kl"
2016-04-23 18:07:24;BarackObama;In the weekly address, President Obama talks about his efforts to improve our criminal justice system. https://t.co/7jF32GGJ3c #FixTheSystem
2016-04-23 15:55:57;BarackObama;"""From our family to yours, chag sameach."" —President Obama #Passover"
2016-04-22 22:35:55;BarackObama;Happy #EarthDay. https://t.co/grX8lqPkKI
2016-04-22 22:22:38;BarackObama;RT @VancityReynolds: Huge day for our Great Green Spinning Chunk of Awesome. Thank you world leaders for taking #ClimateAction. https://t.c…
2016-04-22 21:53:41;BarackObama;We can tackle climate change—but it's going to take all of us working together. #ActOnClimate https://t.co/LEvJFzebLA
2016-04-22 21:18:42;BarackObama;"RT @Interior: Healthy parks = Healthy planet 🌎
#EarthDay #ActOnClimate https://t.co/dw4xmiaDZY"
2016-04-22 19:34:37;BarackObama;Bold action on climate change matters. #ActOnClimate https://t.co/fzKtmRyFCQ
2016-04-22 18:08:46;BarackObama;Say you'll stand up for bold action to fight climate change: https://t.co/fU0rSHhQT1 #ActOnClimate
2016-04-22 17:19:25;BarackObama;RT @WhiteHouse: “Today, on #EarthDay, our governments, along with about 170 others, are in New York to sign that agreement.” —@POTUS https:…
2016-04-22 16:08:57;BarackObama;The Paris Agreement is a big deal. #ActOnClimate https://t.co/j75MzQKH0V
2016-04-22 15:47:02;BarackObama;RT @OFA: President Obama is protecting our lands and waters for future generations. #NationalParkWeek https://t.co/4361K1TEeg
2016-04-21 20:07:29;BarackObama;"""'A strong spirit transcends rules,' Prince once said—and nobody's spirit was stronger, bolder, or more creative."" —President Obama"
2016-04-21 16:21:33;BarackObama;President Obama is investing in a more sustainable future. #ActOnClimate https://t.co/MbDFRg0QcP
2016-04-20 21:23:12;BarackObama;RT @WhiteHouse: .@VP breaks down why it's time for the Senate Republicans to give the President's @SCOTUSnom a hearing. #DoYourJob  https:/…
2016-04-20 19:37:33;BarackObama;We can't let climate change deniers derail progress—say you stand for bold action: https://t.co/965Ps8qIfC #ActOnClimate
2016-04-20 17:26:36;BarackObama;Continuing to invest in clean energy like solar power is critical in the fight to #ActOnClimate. https://t.co/wvIKlRDDOD
2016-04-20 16:00:40;BarackObama;Last year, wind energy generated enough electricity to power 17.5 million homes: https://t.co/RBMQxG7Pes #ActOnClimate
2016-04-19 22:08:34;BarackObama;Add your name to support bold action to combat climate change: https://t.co/b1d4PFfxyY #ActOnClimate
2016-04-19 19:26:03;BarackObama;Climate change is real—and it's devastating communities across the country. We have #ActOnClimate now. https://t.co/RD8EC74QXZ
2016-04-19 17:52:06;BarackObama;The wind energy industry keeps growing—here's the latest on its record-setting year: https://t.co/hf4vFdL0ze #ActOnClimate
2016-04-19 15:43:12;BarackObama;Stand up today for a fair Supreme Court nomination process: https://t.co/ZNdQVurk9h #DoYourJob
2016-04-18 22:23:14;BarackObama;Happy National Park Week. Go #FindYourPark today. https://t.co/B00kPjS35Q https://t.co/uTNnDkSw6O
2016-04-18 20:56:54;BarackObama;President Obama's #ImmigrationAction could have a big economic impact. https://t.co/ss6UaGH8C3
2016-04-18 19:55:31;BarackObama;Last month continued the streak of record-breaking global temperatures. https://t.co/HQk5xSCCkV #ActOnClimate
2016-04-18 17:56:48;BarackObama;This is unprecedented. #DoYourJob https://t.co/bAo3uLvDtT
2016-04-18 15:44:28;BarackObama;Show your support for a fair hearing and timely up-or-down vote for Judge Merrick Garland: https://t.co/o4vCIrG0HX #DoYourJob
2016-04-15 20:57:23;BarackObama;Editorial boards are making their voices heard on the #SCOTUS nomination process. See what they're saying: https://t.co/1teSLORDsG
2016-04-15 15:55:09;BarackObama;Add your name if you think the Senate should give Judge Garland fair consideration: https://t.co/mlzf0SeE8t https://t.co/JjJMIwiEbF
2016-04-14 21:53:45;BarackObama;See what editorial boards are saying about Senate leaders' refusal to give Judge Garland a fair hearing: https://t.co/FETn702lVz
2016-04-14 17:32:40;BarackObama;This kind of Senate obstructionism is completely unprecedented. #DoYourJob https://t.co/gPazJAImPi
2016-04-14 16:14:58;BarackObama;Climate change means wildfires are now a continual threat in some parts of the country: https://t.co/uR7S3onk4T #ActOnClimate
2016-04-13 20:53:59;BarackObama;RT @WhiteHouse: .@POTUS highlights a few of the young innovators at the #WHScienceFair: https://t.co/zebPBWO67z https://t.co/lA6FZFUYsk
2016-04-13 19:05:30;BarackObama;LIVE: President Obama is delivering remarks at the #WHScienceFair. https://t.co/b01pncM9iY
2016-04-13 17:45:13;BarackObama;Tune in at 2:50 p.m. ET to watch President Obama speak at the #WHScienceFair: https://t.co/HRBcwVcXv4
2016-04-13 17:19:57;BarackObama;Judge Garland is highly qualified for the Supreme Court—he deserves a hearing. https://t.co/P4g3JSQYem #DoYourJob https://t.co/6D9Adjikoz
2016-04-13 15:46:29;BarackObama;Read why having nine Supreme Court justices is critical for our judicial system: https://t.co/2M6XYgYlK3 #DoYourJob
2016-04-12 22:13:10;BarackObama;It's time. #EqualPayDay https://t.co/VpcBDOHABW
2016-04-12 21:13:04;BarackObama;"""Improving gender equality would add at least $2.1 trillion to U.S. gross domestic product by 2025."" https://t.co/YHZW8QPEpR #EqualPayDay"
2016-04-12 19:25:35;BarackObama;Retweet if you agree. #EqualPayDay https://t.co/tOZuPJJsX5
2016-04-12 17:37:31;BarackObama;Stand up for equal pay—add your name now: https://t.co/X3NldyL4LJ #EqualPayDay
2016-04-12 16:23:10;BarackObama;"""I'm here to say we will close the wage gap."" —President Obama #EqualPayDay https://t.co/NqmuWFRJHO"
2016-04-12 15:36:17;BarackObama;LIVE: President Obama is speaking about women's equality on #EqualPayDay. https://t.co/aulLEiX9Je
2016-04-12 15:06:47;BarackObama;Tune in at 11:25 a.m. ET to watch as President Obama designates a new national monument honoring women's equality: https://t.co/dP0wa1U6bc
2016-04-12 14:24:40;BarackObama;RT @WhiteHouse: On #EqualPayDay, @POTUS will designate a new national monument honoring women’s equality: https://t.co/smysRM3uDq https://t…
2016-04-11 21:50:28;BarackObama;Side by side. #NationalPetDay https://t.co/nvursfUJqE
2016-04-11 21:06:57;BarackObama;"RT @SCOTUSnom: ICYMI: @POTUS discusses what his hope is in the Senate regarding his nominee, Judge Garland. 

(Hint: #DoYourJob) https://t.…"
2016-04-11 19:29:51;BarackObama;We cannot let political gridlock and dysfunction spread to our Supreme Court. https://t.co/ieJPV45nK5
2016-04-11 17:11:20;BarackObama;It's time for the United States to #LeadOnLeave—show your support if you agree: https://t.co/XtTmJH00Y9
2016-04-11 15:34:06;BarackObama;Retweet if you believe it's time for the United States to #LeadOnLeave. https://t.co/8jsAkBBqzx
2016-04-08 21:23:02;BarackObama;Speak up for a fair hearing for Judge Merrick Garland: https://t.co/Tf8yVdukBx #DoYourJob
2016-04-08 18:52:17;BarackObama;This is unprecedented. #DoYourJob https://t.co/kMdn564dCW
2016-04-08 17:04:33;BarackObama;Add a comment if you agree: American workers shouldn't have to choose between their health and a paycheck. https://t.co/AbSVkV1sEr
2016-04-08 15:45:49;BarackObama;Working families in America should have the basic security of paid sick leave. #LeadOnLeave https://t.co/0jxbEnUUJg
2016-04-07 22:06:06;BarackObama;If you think Judge Merrick Garland deserves a fair hearing and an up-or-down vote, add your name: https://t.co/EDECatQHmj #DoYourJob
2016-04-07 20:33:37;BarackObama;"RT @SCOTUSnom: ""Why is it so hard for this guy to get a hearing and a vote?"" —@POTUS on GOP obstruction of #SCOTUS nom. #DoYourJob https://…"
2016-04-07 19:47:52;BarackObama;LIVE: The President is at @UChicagoLaw discussing why Judge Garland deserves a fair hearing and an up-or-down vote. https://t.co/OKb612WkWb
2016-04-07 19:02:19;BarackObama;Tune in at 3:30 p.m. ET to watch President Obama speak about the #SCOTUS nomination process at @UChicagoLaw: https://t.co/hMSxVb9hpA
2016-04-07 18:12:47;BarackObama;Read what a former @UChicagoLaw student learned from Professor Obama: https://t.co/fubKEiPum1 https://t.co/9DrfKTYIAS
2016-04-07 17:03:37;BarackObama;Show your support for the proposal to expand paid sick leave—add a comment today: https://t.co/3zFKbN3E0v #LeadOnLeave
2016-04-07 15:34:53;BarackObama;The U.S. is the only advanced nation that doesn't guarantee paid sick leave—it's time to change that. #LeadOnLeave https://t.co/LoUwswnXLg
2016-04-06 22:17:05;BarackObama;The Senate has more than enough time to give Judge Garland a fair up-or-down vote. #DoYourJob https://t.co/ybHNMwMWLm
2016-04-06 20:20:33;BarackObama;RT @SmlBizMajority: Obama’s National Monuments Have Been An Economic Boon For Local Economies https://t.co/VDPBXBSMJR via @climateprogress
2016-04-06 18:27:30;BarackObama;Add your voice to the thousands calling on Senate leaders to give Judge Merrick Garland a fair hearing: https://t.co/RPAVha9eW9 #DoYourJob
2016-04-06 16:57:43;BarackObama;RT @FactsOnClimate: It's #PublicHealthWeek. Stay informed about how climate change could impact your health → https://t.co/sFXGtphj42 https…
2016-04-06 15:55:12;BarackObama;If we don't #ActOnClimate now, the sea level could rise by more than six feet by the end of the century: https://t.co/xDvYsS3aYA
2016-04-05 22:13:43;BarackObama;Clean energy currently employs 2.5 million people in the United States. Check it out: https://t.co/ToV5ZYc5kI #ActOnClimate
2016-04-05 20:09:03;BarackObama;Ten million workers in California and New York now have better economic security: https://t.co/ivMeLnflQI #RaiseTheWage
2016-04-05 18:17:13;BarackObama;"RT @WhiteHouse: ""We should keep building an economy where everybody has a fair shot, and everybody plays by the same rules."" —@POTUS https:…"
2016-04-05 16:16:01;BarackObama;LIVE: President Obama is delivering a statement on the economy. https://t.co/7u5ZLGAoK4
2016-04-05 15:34:51;BarackObama;Tune in at 12:15 p.m. ET to watch President Obama deliver a statement about the economy: https://t.co/yOJQ9yCJJ9
2016-04-04 21:23:01;BarackObama;"""Supreme Court struggles with just eight justices."" https://t.co/ql8DEPqrIg #DoYourJob"
2016-04-04 19:36:54;BarackObama;An overwhelming majority of Americans want a fair #SCOTUS nomination process—add your name if you're one of them: https://t.co/rC9AMKaQVm
2016-04-04 17:38:45;BarackObama;Judge Merrick Garland received bipartisan support in the past. Today should be no different. #DoYourJob https://t.co/4S4E2x8RZk
2016-04-04 16:06:39;BarackObama;Stay informed and get the facts with the @OFA Truth Team: https://t.co/3GuF7OCxdC https://t.co/ypohneIQcS
2016-04-01 19:16:42;BarackObama;Our economy is making real progress, but we have to keep fighting to make sure that it works for everybody. https://t.co/i10j4c9dTo
2016-04-01 17:54:23;BarackObama;"""Another encouraging jobs report,"" as the longest streak of private-sector job growth on record continues. https://t.co/SfwVx1mkwu"
2016-04-01 16:12:40;BarackObama;The United States of America has the strongest, most durable economy in the world—and it's getting better. https://t.co/mCyYWccvf5
2016-04-01 14:30:02;BarackObama;The economy added 215,000 jobs in March—a record-breaking 73 months of private-sector job growth.
2016-03-31 22:41:16;BarackObama;This is it—your last chance to win a free trip to Chicago to meet James Taylor: https://t.co/ryoo6ZGLdo https://t.co/y8BYvl0HIb
2016-03-31 21:22:35;BarackObama;DEADLINE: Chip in to support this grassroots movement before midnight tonight. https://t.co/1jc6aDshbl https://t.co/DJDHZQMMWn
2016-03-31 20:12:54;BarackObama;You've got a friend that wants to meet James Taylor? Enter today and you could both be heading to Chicago: https://t.co/pXfBEQYcES
2016-03-31 18:57:24;BarackObama;"Marriage equality. 
Obamacare. 
A global climate agreement. 
Push for more progress: https://t.co/aT3bWC5EjY https://t.co/OFqJ3OUjoM"
2016-03-31 16:56:50;BarackObama;Get weekly updates on everything from the #SCOTUS nomination process to climate change: https://t.co/mqDVfWXVbZ https://t.co/Ms5hVDn8se
2016-03-31 15:14:59;BarackObama;Calling all supporters—the fundraising deadline is here. Do your part to chip in: https://t.co/mRBj02GezI https://t.co/md6ajk1oki
