timestamp;sn;text
2017-01-30 07:48:18;barb_kinney;One more from San Francisco International Airport #sfoairport today. #afghan #refugeeswelcome… https://t.co/U8nlv9kF5p
2017-01-30 07:43:01;barb_kinney;At #sfoairport today for the #refugeeswelcome and #antitrump  and #immigration protest event. https://t.co/Yj5mvJE4IQ
2017-01-29 06:35:18;barb_kinney;"RT @HillaryClinton: I stand with the people gathered across the country tonight defending our values &amp; our Constitution. This is not who we…"
2017-01-27 07:54:09;barb_kinney;"RT @EmCollective: Myth: ""In #SanctuaryCities, #immigrants take jobs from U.S. citizens."" Read the report, get the facts https://t.co/OAkCmE…"
2017-01-26 17:38:58;barb_kinney;RT @laurenepowell: This action against immigration and refugees will go down in history as a source of national shame. Speak up, speak out.…
2017-01-23 06:58:59;barb_kinney;My first photo published at my new job with @EmCollective. From the #womensmarch2017 in San Francisco https://t.co/22KVnPRZuW
2017-01-22 08:24:30;barb_kinney;End of the Women's March in San Francisco. #lovetrumpshate #womensmarch #womensmarch2017… https://t.co/nq6GiZiYVN
2017-01-22 08:15:07;barb_kinney;The Women's March in San Francisco. Love Trumps Hate. #womensmarch2017  #womensmarch… https://t.co/pbOoaXUkOh
2017-01-20 07:00:54;barb_kinney;#imstillwithher https://t.co/USRp8Yzo4s
2017-01-19 18:08:16;barb_kinney;Ah, Phillippe @PhilippeReines, if only I could have photographed you as the Donald! https://t.co/o4Q4a2K0Xj
2017-01-19 17:58:26;barb_kinney;RT @EmCollective: 1M+ more students—mostly students of color—earned high school diplomas over the course of @barackobama’s presidency https…
2017-01-17 17:36:10;barb_kinney;RT @EmCollective: Bryan Stevenson of @EJI_org: The civil rights movement was not a “three-day carnival” #MLKDay https://t.co/y0EhbiFuWI
2017-01-15 19:26:43;barb_kinney;On the eve of MLK day, I am reminded of how fortunate I was to be in the same room with civil… https://t.co/sktmh79qui
2017-01-01 20:10:22;barb_kinney;RT @seattletimes: Fireworks lit up the sky above Seattle Center as thousands celebrated the start of the new year. See more photos at https…
2017-01-01 20:07:53;barb_kinney;RT @EmmyA2: I spent every waking minute of 2016 trying to shatter the glass ceiling and stop Trump, with the very best people. It was a goo…
2016-12-28 22:21:55;barb_kinney;"RT @HillaryClinton: The holidays are a time to be thankful for our blessings. Let's rejoice in this season &amp; look forward with renewed hope…"
2016-12-23 04:30:14;barb_kinney;"From a December 8, 2015 rally in New Hampshire.
#girlpower #imwithher https://t.co/M5loAarTxX"
2016-12-18 20:29:29;barb_kinney;"My photo is the #1 photo! Ah, the selfie 
https://t.co/8shvdOUkOY"
2016-12-14 03:26:03;barb_kinney;With longtime friend and incredible photo editor and leader in the photojournalism world, Brad… https://t.co/LYZXqv0N3h
2016-12-12 01:26:44;barb_kinney;The traveling crew back together in NYC. wutthezuck @barb_kinney https://t.co/4n1wqAQ68s
2016-12-09 01:15:22;barb_kinney;#imstillwithher #imwithher #girlpower https://t.co/ayi736XYXs
2016-12-05 18:39:21;barb_kinney;Oops, Photo #51 is mine. https://t.co/dI9nsEzb0k
2016-12-05 18:03:52;barb_kinney;Hillary waving to crowd after an event in Coconut Creek, FL on October 25th. #imwithher… https://t.co/N0x2oOHo6m
2016-12-05 16:52:28;barb_kinney;"Honored to have a photo chosen by TIME - the selfie photo! Photo #50 here:
TIME selects the 100 best images 2016  https://t.co/kKGwPNdmDa"
2016-12-05 01:26:05;barb_kinney;Afternoon walk in Central Park today. #centralpark #nyc #sunday #relaxed https://t.co/Ok2fF3Dkgf
2016-11-30 02:23:53;barb_kinney;"I am still with her.
#imwithher #imstillwithher #hillaryclinton #strongertogether https://t.co/jvCdjQZWKw"
2016-11-27 22:19:04;barb_kinney;Remedy for being in a sad mood? Puppies in a window in the West Village. #puppies #toocute https://t.co/gbYr0z6bfa
2016-11-22 20:40:51;barb_kinney;Hillary waving to the overflow crowd at an LGBT event in Orlando.  #strongertogether #herstory… https://t.co/7A3CHZyaeq
2016-11-20 05:26:27;barb_kinney;I rarely post pictures of myself, but someone sent me this from a rally a few weeks ago. I… https://t.co/MSFpDIecTv
2016-11-13 01:39:24;barb_kinney;At last night's staff party......Adam Schultz @schultzinit , WJC, me and Hillary hillaryclinton… https://t.co/nSlpkkqZ2n
2016-11-09 02:29:28;barb_kinney;Stronger Together. Let's do this! #strongertogether #madamepresident #imwithher hillaryclinton https://t.co/dxPVm3Xl6C
2016-11-08 21:42:45;barb_kinney;It's going to be a great night. #madamepresident #strongertogether #imwithher #wegotthis #herstory https://t.co/EkPlW2ANcM
2016-11-08 20:02:43;barb_kinney;The Clintons after casting their ballots for the next President of the United States, this… https://t.co/TyuLLHGrI4
2016-11-08 19:33:16;barb_kinney;Amazing midnight rally in Raleigh, NC last night. #strongertogether #imwithher #hrc2016 #vote… https://t.co/Jjn5OwCqTz
2016-11-08 04:56:55;barb_kinney;Photo by @barb_kinney !!! https://t.co/6k2slOXOoD
2016-11-07 14:23:02;barb_kinney;Rainy rally in Miami yesterday but Hillary had a great time! #imwithher #strongertogether #miami… https://t.co/j3lWcAu2m3
2016-11-05 17:58:48;barb_kinney;Hillary at Heinz Field, the stadium of the Pittsburgh Steelers, before her speech in the Great… https://t.co/sUPgoc6GUX
2016-11-05 06:30:15;barb_kinney;Jay Z, Beyoncé and Hillary in one room. Tonight was pretty great. hillaryclinton beyonce… https://t.co/TlJ4BdWsF6
2016-11-02 23:39:40;barb_kinney;Selfie with Gabby Giffords and husband Mark Kelly in Cincinnati on Monday. hillaryclinton… https://t.co/BKuont871l
2016-10-31 17:42:24;barb_kinney;Hillary is announce and heads toward the stage at a rally in Cedar Rapids, Iowa. #iwillvote… https://t.co/ultk3vdjOI
2016-10-31 04:46:37;barb_kinney;Backstage at the Jennifer Lopez Gets Loud for Hillary concert in Miami are JLO, Hillary and Marc… https://t.co/6baZTmG3qS
2016-10-30 15:37:36;barb_kinney;Anytime you need a pick me up - go to Barbara Kinney's Instagram feed - Democratic Underground https://t.co/aUaqDeYwrM via @demunderground
2016-10-30 04:40:46;barb_kinney;Backstage before event yesterday in Winston-Salem, NC with @flotus and hillaryclinton… https://t.co/UBFCYp0XUX
2016-10-28 21:07:25;barb_kinney;Photo by @barb_kinney . What a great event yesterday with @FLOTUS and @HillaryClinton https://t.co/aZHUJphTur
2016-10-28 04:16:58;barb_kinney;@NickMerrill https://t.co/Ge1gGeL18P
2016-10-28 04:14:11;barb_kinney;Hillary spokesperson Nick Merrill walks off the campaign plane after a long day in North… https://t.co/d3MjuL1UpK
2016-10-27 03:32:24;barb_kinney;Leaving the stage after a rally in Tampa, Florida today. hillaryclinton @barb_kinney… https://t.co/WUoyeeNKCZ
2016-10-26 20:23:40;barb_kinney;Happy Birthday hillaryclinton !!! #iwillvote #imwithher #hrc2016 #strongertogether #happybirthday https://t.co/p4dFVSILSU
2016-10-25 14:25:32;barb_kinney;RT @just_jenna: With just #14days to go, the earliest days of this campaign (in IA and NH here) seem like 100 years ago. (📷 @Barb_Kinney) h…
2016-10-25 03:52:21;barb_kinney;Lots of plane rides these next two weeks.....#campaignplane #hrc2016 #imwithher… https://t.co/2ccZrmy6FS
2016-10-24 16:39:33;barb_kinney;15 days! #iwillvote #imwithher #strongertogether #hrc2016 hillaryclinton @barb_kinney https://t.co/AQWSwQz6VT
2016-10-23 21:26:04;barb_kinney;Here's to Stronger Together with hillaryclinton and @timkaine in Philadephia. #strongertogether… https://t.co/Jb92v1NYiu
2016-10-23 00:38:14;barb_kinney;Hillary arriving at the Westchester airport on a foggy evening after campaigning in Ohio… https://t.co/ZnyLi8kTbn
2016-10-21 07:44:01;barb_kinney;HRC hillaryclinton talking to the press last night on the flight home from Las Vegas after the… https://t.co/FWPY3Tpdcn
2016-10-16 03:29:12;barb_kinney;Actress Tracee Ellis Ross @traceeellisross snaps a selfie with hillaryclinton at an event this… https://t.co/q6hc9ANJtC
2016-10-14 00:49:28;barb_kinney;Former Secretary of the Interior Ken Salazar must have said something pretty funny to HRC… https://t.co/eOdFU2evqC
2016-10-11 22:31:06;barb_kinney;18,500 supporters for @HillaryClinton in Columbus, Ohio last night. #imwither #StrongerTogether photo by… https://t.co/mEm7Eoe1hL
2016-10-11 02:46:13;barb_kinney;After the debate, on the plane home. Yep, she did it again. #imwithher #strongertogether… https://t.co/GW4dmCJEDN
2016-10-10 16:25:21;barb_kinney;RT @PaulBegala: BREAKING: @CNN poll shows @HillaryClinton won debate by overwhelming margin: 57 - 34. Congratulations to Hillary and her te…
2016-10-09 15:11:23;barb_kinney;My photo on the cover of Hola! Magazine. Thanks to Chandler West and Paola Ramos for making it… https://t.co/CQ2Hyt0Dq7
2016-10-09 03:07:39;barb_kinney;Wow! #imwithher https://t.co/KevGBhyYtz
2016-10-09 01:15:04;barb_kinney;I love NYC on a Saturday night. Clowns (who insist they are not part of the crazy, scary clown… https://t.co/0PQ6k2CgeO
2016-10-08 19:03:43;barb_kinney;Hear about my career and why @HillaryClinton means so much to me on @TheRivetersPod https://t.co/XqB0KDZPV0
2016-10-05 22:50:41;barb_kinney;hillaryclinton at the Zembo Shrine in Harrisburg, PA on Tuesday. #hrc2016 #strongertogether… https://t.co/GZEMwdEV80
2016-10-05 00:49:51;barb_kinney;"This photo I shot yesterday in Toldeo, Ohio just makes me chuckle.
#hrc2016 #strongertogether… https://t.co/JD6IV5vdpb"
2016-10-03 23:12:44;barb_kinney;Love this @GregHale1 , you are a pretty damn fine photographer! https://t.co/yZuZXOAzWE
2016-10-02 20:57:46;barb_kinney;Ruline - 103 years old and just cast her vote for the first woman President. Good things are worth waiting for. Pho… https://t.co/ehyd03wprT
2016-10-02 20:52:33;barb_kinney;RT @HillaryClinton: “She’s just out there every day doing God’s work in her own way. You know? Making her parents proud.” —Betsy, Hillary's…
2016-10-02 17:28:17;barb_kinney;Well, if she gets the feline vote, it will be a purrfect election. Photographed in Fort Pierce,… https://t.co/GFxQ2nIfwR
2016-09-30 21:29:00;barb_kinney;Hillary boarding her campaign plane last night in Chicago. #lovetrumpshate #clintonkaine2016… https://t.co/79mLYS8Sb1
2016-09-29 17:21:39;barb_kinney;Before an event in Portsmouth, NH yesterday. Bernie and Hillary, definitely #strongertogether… https://t.co/rtpAkJ8AQ4
2016-09-27 16:42:28;barb_kinney;Great night last!  #shewon #imwithher #clintonkaine2016 #strongertogether hillaryclinton https://t.co/T2tRF3ZHdz
2016-09-26 05:57:37;barb_kinney;"Apparently my photo of the massive selfie has ""gone viral"" as someone emailed me tonight. Wow....... https://t.co/u2tKEJr0du"
2016-09-26 05:56:27;barb_kinney;RT @victomato: Photo credit goes to @barb_kinney! 📸 https://t.co/Arse4mKSwh
2016-09-24 19:07:36;barb_kinney;"RT @HillaryClinton: ""I really regret doing this."" —Hillary on Between Two Ferns https://t.co/OmDyINNCrW"
2016-09-24 19:07:13;barb_kinney;https://t.co/0R8Q0IEnjt
2016-09-22 22:32:47;barb_kinney;Hillary departing her campaign plane yesterday in Orlando. #imwithher #strongertogether #hrc2016… https://t.co/apn4DU0lLF
2016-09-22 03:00:42;barb_kinney;A mother and son in the over-flow crowd at Hillary's Inclusive Economy speech in Orlando today.… https://t.co/cyDVhA8rjW
2016-09-20 04:19:25;barb_kinney;"Today at a hillaryclinton rally in Philadelphia. Love Trumps Hate.
#hrc2016 #lovetrumpshate… https://t.co/93YVx3yLva"
2016-09-19 22:37:29;barb_kinney;RT @HillaryClinton: Our next president needs to have the right temperament to meet the challenges we face. https://t.co/XMDZPtLNMB
2016-09-15 23:49:17;barb_kinney;While Hillary took a couple days to rest from pneumonia, I took off to Los Angeles with… https://t.co/tHNLBizPy4
2016-09-15 02:48:12;barb_kinney;RT @PaulBegala: He backs down when confronted by a strong woman.   https://t.co/d869i7Q7ld
2016-09-15 02:46:17;barb_kinney;RT @paoramos: Take a second to watch https://t.co/9KDvpliKSV
2016-09-13 23:38:30;barb_kinney;My favorite sign from a recent Hillary rally......enough said. #hrc #hrc2016 #strongertogether… https://t.co/Oz9VIsqxsE
2016-09-11 14:20:50;barb_kinney;At Ground Zero for the 15th anniversary of 9/11. #nyc #worldtradecenter #september112001… https://t.co/oJTHJoEmKf
2016-09-10 16:35:57;barb_kinney;RT @HillaryClinton: When Hillary talks about needing more love and kindness in our lives, this is what she means. https://t.co/F9jMEDy00A
2016-09-10 16:29:48;barb_kinney;RT @Lavernecox: Get out and vote this election.  Get informed about the issues and vote for our values our… https://t.co/Tzsqf5fHab
2016-09-09 21:58:52;barb_kinney;On the campaign plane last night, policy advisor Maya Harris shared photos of her new grandchild… https://t.co/yuaMhsTodB
2016-09-08 15:00:24;barb_kinney;Hillary waiting to be announced onstage last night at the NBC Forum on the Intrepid in NYC.… https://t.co/dUdKkNLkvV
2016-09-07 03:42:47;barb_kinney;RT @jmpalmieri: @barb_kinney most revealing photo of the day....I am on to you @NickMerrill. https://t.co/xC9CxuWMxy
2016-09-07 01:47:24;barb_kinney;Hillary and the still photographers covering her campaign (and one video guy who snuck in the… https://t.co/GLFD3jC9V4
2016-09-05 12:46:23;barb_kinney;And we embark on a new chapter in the campaign today. #hrc2016 #strongertogether #imwithher… https://t.co/UfpO1jwbxS
2016-09-05 00:28:06;barb_kinney;Hillary meeting with Mother Teresa in 1995 at the opening of The Mother Teresa Home for Infant… https://t.co/z498gRoOx4
2016-09-01 14:00:59;barb_kinney;Hillary standing backstage before speaking at the American Legion's 98th Annual Convention… https://t.co/vG8XgrM4uT
2016-08-26 15:09:08;barb_kinney;"In Reno yesterday, as Hillary walked into a room of volunteers, I heard a woman scream ""oh my,… https://t.co/Uo722PREcI"
2016-08-22 03:12:40;barb_kinney;At an event today in Provincetown, MA, I am walking ahead of Sec. Clinton on way to the stage… https://t.co/kGvTlUy82H
2016-08-16 22:46:00;barb_kinney;Hillary greets Vice President Joe Biden and Air Force Two yesterday in Scranton, PA.… https://t.co/xHvQskK6ct
2016-08-14 18:33:42;barb_kinney;Babies and ice cream - doesn't get much better than this! On the campaign trail with veep… https://t.co/3x0ltxVzrA
2016-08-14 06:16:47;barb_kinney;Ice cream and babies! With @timkaine this week on the campaign trail. Photo by @barb_kinney  https://t.co/1LVsIdBxoi
2016-08-14 00:14:07;barb_kinney;Traveling with @timkaine this week and getting great photos! @HillaryClinton #StrongerTogether #ClintonKaine  https://t.co/1LVsIdBxoi
2016-08-13 04:14:40;barb_kinney;Vice Presidential candidate Sen. Tim Kaine shares a laugh with Rev. Jesse Jackson backstage at… https://t.co/c7MBQ3r7kN
2016-08-11 19:44:11;barb_kinney;Traveling with our veep candidate @timkaine this week. A classic campaign moment as he stands on… https://t.co/VO4pXLNzwe
2016-08-06 23:43:24;barb_kinney;RT @barb_kinney: This is what I saw while photographing @HillaryClinton, @POTUS and more at the #DemConvention. https://t.co/jY0RO1XNJX
2016-08-06 22:10:23;barb_kinney;This is what I saw while photographing @HillaryClinton, @POTUS and more at the #DemConvention. https://t.co/jY0RO1XNJX
2016-08-05 05:47:31;barb_kinney;My fav pic from the DNC convention. No idea what was so funny but such a sweet moment. Photo by @barb_kinney  https://t.co/ojX5CW4SGA
2016-08-04 02:17:48;barb_kinney;Thank you for the shout out @GavinNewsom  https://t.co/7Hc3Q63CgA
2016-08-03 02:47:09;barb_kinney;Best cab ride ever!!! @HillaryClinton   #Hillary2016 #ImWithHer  https://t.co/X5hwdy6FVp
2016-08-01 04:08:29;barb_kinney;An epic week for hillaryclinton - sharing a moment with her husband before an event in… https://t.co/NsghyGAGKU
2016-07-30 18:41:47;barb_kinney;And I am following behind the bus! https://t.co/4sU8gemSwH
2016-07-30 15:45:34;barb_kinney;"Another favorite from this week. Doesn't get too much more Presidential!
#hillaryclinton… https://t.co/c01MHWf4GG"
2016-07-29 23:45:47;barb_kinney;So much to celebrate last night after hillaryclinton accepted the Democratic nomination for… https://t.co/nFbL1BfJKL
2016-07-29 00:02:23;barb_kinney;Presidential giggles with hillaryclinton and @barackobama #imwithher #hillary2016… https://t.co/fURQGN1wKP
2016-07-28 23:12:55;barb_kinney;@ABCLiz @instagram  thanks Liz!
2016-07-28 23:09:19;barb_kinney;Uh wow. I guess this is the big time now. Overwhelmed. Photo by @barb_kinney  https://t.co/Y09cPbOZdj
2016-07-28 04:51:52;barb_kinney;@barb_kinney photo. What an amazing night. https://t.co/dxratM7hex
2016-07-25 20:14:34;barb_kinney;RT @HillaryClinton: .@TimKaine is everything Donald Trump and Mike Pence are not: progressive and qualified to lead on day one. https://t.c…
2016-07-25 20:14:13;barb_kinney;"RT @HillaryClinton: ""He is a progressive who likes to get things done. That’s just my kind of guy."" –Hillary on @TimKaine https://t.co/vHso…"
2016-07-24 17:49:18;barb_kinney;Yesterday in Miami before the big rally, Hillary meets with veep pick, Sen. Tim Kaine, and wife… https://t.co/gJYdu5vLQq
2016-07-23 14:37:49;barb_kinney;RT @HillaryClinton: I'm thrilled to announce my running mate, @TimKaine, a man who's devoted his life to fighting for others. -H https://t.…
2016-07-22 12:36:58;barb_kinney;RT @HillaryClinton: History is watching. https://t.co/pdphHQmYCM
2016-07-22 12:34:15;barb_kinney;RT @Gators4Hillary: The decision is almost here! Want to know Hillary's VP choice first? Text VP to 47246 now! #ImWithHer (@barb_kinney) ht…
2016-07-21 03:43:38;barb_kinney;Hillary Clinton backstage before giving remarks at the ATF convention in Minneapolis on Monday.… https://t.co/rBeM7YiaVs
2016-07-06 04:31:54;barb_kinney;Air Force One arriving in Charlotte, NC today with Pres. Obama and Sec. Hillary Clinton.… https://t.co/C9fNQsBvGA
2016-07-06 00:23:40;barb_kinney;So nice to see Air Force One again!  https://t.co/VJwLYnZU0u
2016-07-04 01:00:52;barb_kinney;Happy Birthday USA! A bald eagle takes flight along the Skagit River in Washington State in… https://t.co/7oE0CfUbq9
2016-06-28 16:32:42;barb_kinney;RT @dawnstaley: A sad day in my life and the entire WBB community-Pat Summit thank you for sharing your passion and love for the game with…
2016-06-28 16:32:09;barb_kinney;RT @MassAGO: So sad to hear of #PatSummitt's passing. You don't become the winningest coach in history without the heart and spirit she pos…
2016-06-26 18:59:37;barb_kinney;Pride in NYC. Photo by @barb_kinney So happy I was there! #NYCPride #Hillary2016 #ImWithHer  https://t.co/yKrF4uDN4T
2016-06-26 00:18:36;barb_kinney;Quiet afternoon walk in Central Park today. #nyc #centralpark #newyork #newyorkcity #skyline… https://t.co/p3PbckIyRz
2016-06-25 20:14:06;barb_kinney;Happy Pride weekend! #pride #imwithher #hillary2016 #lovetrumpshate #hrc hillaryclinton #rainbow https://t.co/TjZgvaddh5
2016-06-20 06:38:41;barb_kinney;RT @billclinton: Aidan has made two dads very happy this Father's Day. Hillary and I are thrilled for Marc and Chelsea! https://t.co/vPuwDA…
2016-06-18 20:07:48;barb_kinney;I've witnessed a lot of special moments as @HillaryClinton's photographer, but June 7 was something special. https://t.co/ErQG2P6zid
2016-06-17 02:21:28;barb_kinney;usadeafsoccerwnt's photo https://t.co/tAhGRWBdXy
2016-06-15 15:02:42;barb_kinney;RT @HillaryClinton: We just won Washington, D.C.! Grateful to everyone who voted. https://t.co/ImPsK42yGd
2016-06-14 19:16:13;barb_kinney;Button up! #imwithher #hillary2016 #hillary2016 hillaryclinton #campaignbuttons https://t.co/rCRm8sYOlR
2016-06-13 21:02:31;barb_kinney;Spotted backstage at a hillaryclinton event last week. #hrc #hillary2016 #lovetrumpshate… https://t.co/92W82vq37J
2016-06-13 14:11:49;barb_kinney;@JudyKi128 haven't edited those yet. Just at May 21. Back logged.
2016-06-10 04:38:56;barb_kinney;"RT @JonDavidson_: Today, @HillaryClinton racked up some major endorsements:
✅ Barack Obama
✅ Michelle Obama
✅ Joe Biden
✅ Elizabeth Warren…"
2016-06-09 19:44:07;barb_kinney;Thanks for the endorsement President Obama! Unity! My photo from 2008 when HRC endorsed you in… https://t.co/CrH1WN3nD5
2016-06-09 12:20:05;barb_kinney;"Images from me and HFA photogs, @schultzinit Mike Davidson Samuel Fisch from the historic night w/ @HillaryClinton 
https://t.co/QttDvjbimI"
2016-06-08 19:58:37;barb_kinney;I showed my necklace to @HillaryClinton last night and she gave me a big hug. #imwithher #HistoryMade  https://t.co/mRbN6HJrHl
2016-06-03 21:57:11;barb_kinney;hillaryclinton working the ropeline yesterday in Newark, NJ. #imwithher #hillary2016… https://t.co/0WVobB25Zk
2016-06-02 23:42:00;barb_kinney;RT @NickMerrill: As seen on the wall of the San Diego campaign office. #SmartWomanWarrior https://t.co/7GPJpIWNxY
2016-06-01 05:59:01;barb_kinney;A banner reflects the silhouette of the crowd at a hillaryclinton rally last week in San Jose,… https://t.co/xdAqHWLx0u
2016-05-25 23:56:10;barb_kinney;"RT @HillaryClinton: LGBT kids are perfect the way they are. They deserve love—not harmful ""conversion therapy."" Thanks @GovPeterShumlin. ht…"
2016-05-25 19:17:45;barb_kinney;Photo by @barb_kinney of @HillaryClinton @katemckinnon and @TheEllenShow  https://t.co/smBPsJh209
2016-05-25 17:00:36;barb_kinney;My photo yesterday back stage at the @TheEllenShow with a couple of @Ghostbusters  https://t.co/OkukxKbBlJ
2016-05-22 15:15:03;barb_kinney;RT @HillaryClinton: Do all the good you can, for all the people you can, for as long as you can. https://t.co/Ei8yn8ikUg
2016-05-20 21:27:24;barb_kinney;At a rally in Kentucky - nothing more needs to be said. #hrc #imwithher #hillary2016… https://t.co/U9UcDZOJ2P
2016-05-19 05:16:59;barb_kinney;hillaryclinton in Louisville, KY this past Sunday. Bring it home Kentucky! We want a win today!… https://t.co/BJGlBRLx3o
2016-05-18 00:25:21;barb_kinney;Saw this backstage yesterday in Kentucky while @HillaryClinton was signing books for the crowd. To-do list done. https://t.co/ByTsQhasnd
2016-05-16 19:11:38;barb_kinney;hillaryclinton's photo https://t.co/Bk0GOkpiVQ
2016-05-15 05:19:08;barb_kinney;Going to start posting some of my favorite images that I have taken in the last year while on… https://t.co/M5XWn7Q97B
2016-05-06 03:05:40;barb_kinney;RT @ChloeGMoretz: Two of my favorites!! Love my new @HillaryClinton #MadeForHistory @dvf tee. Let's win this! #ImWithHer https://t.co/MSZnR…
2016-04-27 14:49:39;barb_kinney;Steel podium the workers at Munster Steel  made for @HillaryClinton in Hammond, IN. I am so proud to be a Hoosier! https://t.co/tzIITEA8m4
2016-04-21 02:16:12;barb_kinney;Photo by @barb_kinney  https://t.co/4RIWUeiRfZ
2016-04-19 20:33:41;barb_kinney;RT @victomato: Spotted in Brooklyn! 📷 by @barb_kinney #ImWithHer @HillaryForNY https://t.co/mUKIK1ndM5
2016-04-19 19:14:39;barb_kinney;@HillaryClinton votes this morning on #NYPrimary day while a fan takes a #selfie. #ImWithHer https://t.co/n9jazJj2y2
2016-04-04 05:12:04;barb_kinney;Visited three churches in Brooklyn today with @HillaryClinton . Inspiring and spiritual! Photos here https://t.co/ITsYt20YuU
2016-04-01 23:32:07;barb_kinney;A few of my favorite photos from a very busy month on the campaign trail with @HillaryClinton #ImWithHer    https://t.co/re1jvpoNze
2016-03-17 05:36:38;barb_kinney;@HillaryClinton high fives campaign manager Robby Mook before taking the stage last night. #ImWithHer https://t.co/GRxUzm0s0Y
2016-03-16 15:16:58;barb_kinney;"RT @HillaryClinton: You’re welcome at (the real) HQ any time, @BroadCity.
https://t.co/BQIFqxoTQV"
2016-03-16 15:13:36;barb_kinney;@HillaryClinton enters the room at night's election rally in Florida. Photo by @barb_kinney #ImWithHer  https://t.co/IbjQCAVJYV
2016-03-15 05:14:24;barb_kinney;"Busy day with #HillaryClinton on the campaign - Chicago. #ImWithHer #MothersInTheMovement 
https://t.co/aevGKGK0jI https://t.co/5x7K4qhOlT"
2016-03-13 04:20:38;barb_kinney;Knocking back beers with @HillaryClinton tonight in Youngstown, Ohio. Photo by @barb_kinney  https://t.co/ltfTXdhgaT
2016-03-06 23:29:35;barb_kinney;RT @billclinton: I met two great Alaskan Malamutes in Michigan today while campaigning for @HillaryClinton. They barked #ImWoofHer. https:/…
2016-03-02 06:15:33;barb_kinney;"Super Tuesday @HillaryClinton #ImWithHer 
https://t.co/yunhZw4oa9"
2016-03-01 23:10:37;barb_kinney;RT @EmmyA2: Incredible moment in Alabama captured by @barb_kinney. https://t.co/WGUijYxIet
2016-03-01 23:10:19;barb_kinney;I don't take no for answer! #ImWithHer  https://t.co/GtzDqxqfow
2016-03-01 05:22:09;barb_kinney;Boston, today with @HillaryClinton https://t.co/RBkV68iuuw
2016-02-29 14:05:26;barb_kinney;Showing a little love for @HillaryClinton in Sumter, SC https://t.co/r9iMN7gDrC
2016-02-29 00:19:23;barb_kinney;Spent some time with another President today - @tonygoldwyn  https://t.co/qJIfDJ6yJF
2016-02-28 05:19:14;barb_kinney;@HillaryClinton in Birmingham, Alabama today before her victory party in South Carolina! https://t.co/AAqxTLv6qv
2016-02-27 21:55:53;barb_kinney;Happy Birthday @ChelseaClinton (and photo by @barb_kinney ) https://t.co/vLGR3OdcNI
2016-02-27 21:53:32;barb_kinney;Thank you @lcollinsp - great time with @HillaryClinton in Hotlanta! https://t.co/RgtfEEL4QR
2016-02-27 21:52:27;barb_kinney;Thank you @EmmyA2, love our @HillaryClinton supporters. https://t.co/x1bgLmlBS0
2016-02-21 22:48:34;barb_kinney;Thanks for the shout out @lcollinsp - one of my favorite photos from yesterday. #HRC #ImWithHer #HillaryClinton  https://t.co/MM7GObizR8
2016-02-21 22:46:39;barb_kinney;"#ImWithHer in Nevada yesterday. Go @HillaryClinton. See my photos on Flickr here:
https://t.co/hfH1mBV8bv"
