timestamp;sn;text
2017-01-29 02:24:07;BretEastonEllis;Asghar Farhadi's THE SALESMAN is the best movie nominated for an Oscar this year, foreign or otherwise. Hope he can… https://t.co/VEJRfOAYYs
2017-01-26 01:01:26;BretEastonEllis;Watch all 8 episodes of THE DELETED Season One at https://t.co/fJkv5KOLCu https://t.co/ySkxgiWuQm
2017-01-23 08:01:09;BretEastonEllis;https://t.co/tBhwMQMySa
2017-01-16 19:02:12;BretEastonEllis;HOMESICK FOR ANOTHER WORLD by Ottessa Moshfegh is the best new short story collection I've read in a very, very lon… https://t.co/nA5wlDsSOs
2017-01-12 18:30:55;BretEastonEllis;All eight episodes of THE DELETED Season One are now available at: https://t.co/fJkv5KOLCu https://t.co/LR7OtuCBej
2017-01-04 20:39:22;BretEastonEllis;The 10 Best Movies I saw that were released theatrically in 2016 in the U.S. Four are docs, five are foreign. It wa… https://t.co/cB0gv6UsLh
2017-01-03 20:32:07;BretEastonEllis;"On Sale: Signed by BEE: Mural Poster (54"" x 40"") of Christian Bale as Patrick Bateman from American Psycho. Go to:… https://t.co/0x0URmpiK4"
2016-12-28 19:33:11;BretEastonEllis;"""You can watch things on your iPhone and people do that all the time — something like 80 percent of our audience... https://t.co/zO76D57czh"
2016-12-28 17:48:59;BretEastonEllis;RT @ScottPorch: .@BretEastonEllis Gets Extremely Candid About His New @Fullscreen Series @TheDeletedShow https://t.co/2wNrBPtB0n via @decid…
2016-12-23 23:58:03;BretEastonEllis;I now tweet infrequently, and I rarely use Twitter in the way that it’s supposed to be used... https://t.co/2RDwwhhzwC
2016-12-19 18:51:48;BretEastonEllis;THE BEE PODCAST: Laura Jane Grace, bully benefits, narcissism, Replacements, Kardashians, trans, making $ in music:… https://t.co/gmd8yGMY3K
2016-12-12 18:01:53;BretEastonEllis;Watch all eight episodes of THE DELETED Season 1. Start your free trial at https://t.co/fJkv5KOLCu and sign up usin… https://t.co/q7suM94dOz
2016-12-12 17:59:49;BretEastonEllis;Watch all eight episodes of THE DELETED Season 1. Start your free trial at https://t.co/fJkv5KOLCu. Sign up... https://t.co/LYIlc7RjhJ
2016-12-06 23:56:08;BretEastonEllis;THE B.E.E. PODCAST with Variety film critic Owen Gleiberman: explaining the Batman/Ben Affleck controversy that I... https://t.co/k4syadPaGV
2016-12-06 17:44:27;BretEastonEllis;THE B.E.E. PODCAST: Affleck/Batman controversy, the limits of fanboy culture, Carrie, identity politics, Raiders:… https://t.co/qhpo1syFx0
2016-12-05 18:31:34;BretEastonEllis;A digital series I wrote and directed THE DELETED is now available with a new episode dropped daily all this week... https://t.co/AZgWqiAosC
2016-12-05 18:24:57;BretEastonEllis;RT @Fullscreen: You haven’t started @TheDeletedShow yet? Don’t give us that look. Go watch Episode 2 featuring @willpeltz now. https://t.co…
2016-12-04 02:08:50;BretEastonEllis;THE DELETED begins airing December 4th. New episodes all week with the finale on December 11th. Created by Bret Eas… https://t.co/7XL2vUsY7c
2016-12-03 23:50:34;BretEastonEllis;The Deleted, written and directed by Bret Easton Ellis, premieres tomorrow on Fullscreen. Get a free trial below... https://t.co/oJ8CEOdsfv
2016-11-22 19:23:23;BretEastonEllis;THE B.E.E. PODCAST: Anne Heche and homophobia in Hollywood, the relationship with Ellen DeGeneres damaging her... https://t.co/1kXbKBiFBM
2016-11-21 18:17:57;BretEastonEllis;B.E.E. PODCAST: Moonlight, Heche on Hollywood homophobia, racism/sexism of Ghostbusters, the neo-Victorian feminist… https://t.co/gu2fqZjj4d
2016-11-18 01:06:53;BretEastonEllis;Verhoeven's ELLE is the best new narrative movie I've seen in 2016 so far. Totally hypnotic, violent, funny. Defini… https://t.co/3sjfpc2ZVk
2016-11-17 20:26:41;BretEastonEllis;BEE's American Psycho rocked America. Here's his verdict on the movie, directed by Mary Harron. https://t.co/Q7vtmNvkAu
2016-11-15 22:32:51;BretEastonEllis;You can now purchase books signed by Bret Easton Ellis on Amazon. Check it out below: https://t.co/I9K2uWV0Au
2016-11-15 18:27:18;BretEastonEllis;"""It’s savage, it’s brutal, and it’s a masterpiece"". BEE's thoughts on David Fincher's Fight Club from a '99 issue... https://t.co/MsOetTE15Z"
2016-11-08 22:49:35;BretEastonEllis;In 1999, Gear Magazine approached Bret to write about something he thought was evil. Here's the result: https://t.co/ZBapNzaWos
2016-11-04 23:04:23;BretEastonEllis;https://t.co/4mHqtwTZzw https://t.co/J6Pc4LxHKy
2016-11-03 22:44:28;BretEastonEllis;"In the January 2011 issue of Playboy, B.E.E. writes, ""If you somehow missed The Hills or avoided it because of... https://t.co/HonuFS54BZ"
2016-10-31 19:29:36;BretEastonEllis;B.E.E. PODCAST: Mark Duplass, Art vs Artist, Netflix as savior, Nate Parker's acquittal, JT LeRoy hoax, brotherhood… https://t.co/DUqozMgniq
2016-10-25 16:45:40;BretEastonEllis;Two gay-themed movies opened last weekend. Which one did I prefer? (It wasn't the one directed by a straight guy.)… https://t.co/c8YMDgpAt9
2016-10-17 19:02:14;BretEastonEllis;THE B.E.E. PODCAST: Schrader, American Gigolo, Scorsese friendship, cocaine, Gere vs Travolta, LA, Kael in Hollywoo… https://t.co/i5G9OLDjRX
2016-09-27 17:45:53;BretEastonEllis;THE B.E.E. PODCAST: Victims. The cosplaying of the culture. Stranger Things. The Night Of. Larry Clark and Bully.… https://t.co/olr6xkdPQI
2016-09-26 18:53:25;BretEastonEllis;Kristina Schake is too creepy and unnerving to be allowed on TV and Corey Lewandowski is a total DILF. My thoughts… https://t.co/B7tEuJtqnT
2016-09-19 02:40:22;BretEastonEllis;Let audiences applaud during the IN MEMORIAM segment. This should be a joyous tribute and not so grim. No more goddamn covers of Hallelujah!
2016-09-14 17:30:43;BretEastonEllis;THE B.E.E. PODCAST: Moby, 90s Manhattan, John Cheever journals, Streep, VMA takedown, Eagles https://t.co/wKeIAIZVhA https://t.co/XiRnwWH9Q8
2016-09-09 18:41:48;BretEastonEllis;The most fascinating 2016 movie opens today: AUTHOR: THE J.T. LEROY STORY, a withering commentary on victim culture. https://t.co/w3jXWcIQBs
2016-08-29 02:50:23;BretEastonEllis;It happened: HBO's brilliant THE NIGHT OF effectively eradicates the notion of the 2-hour American theatrical movie. https://t.co/CmFDxWa9Su
2016-08-18 18:45:58;BretEastonEllis;THE B.E.E. PODCAST: Peter Bogdanovich, The Last Picture Show, 70s Hollywood, movie violence https://t.co/wKeIAIZVhA https://t.co/Fs6ZVOAJjw
2016-08-12 07:02:07;BretEastonEllis;https://t.co/Bs8zeMD1YU
2016-08-12 06:47:22;BretEastonEllis;https://t.co/J8g0vQYB8i
2016-08-03 16:56:06;BretEastonEllis;"Excellent novels for summer: CAROUSEL COURT (McGinniss Jr); BRIGHT, PRECIOUS DAYS (McInerney); SWEETBITTER (Danier). https://t.co/N05EGy9Cgp"
2016-07-28 17:41:45;BretEastonEllis;THE B.E.E. PODCAST: Alex GIbney, biopics vs docs, Obama vs whistleblowers, ideology vs art: https://t.co/wKeIAIZVhA https://t.co/Qqx6TLwuiz
2016-07-12 22:50:54;BretEastonEllis;THE B.E.E. PODCAST: Karyn Kusama, Brian De Palma, objectifying Sky Ferreira, Beatty's beauty https://t.co/wKeIAIIkq2 https://t.co/NKmSM4bt79
2016-06-29 02:02:37;BretEastonEllis;B.E.E. PODCAST: Illeana Douglas, Easy Rider, Scorsese relationship, women directors, DeNiro. https://t.co/wKeIAIZVhA https://t.co/q9qWgnTtR7
2016-06-23 18:57:24;BretEastonEllis;The most entertaining theatrical experience so far in 2016 is the Brian De Palma doc DE PALMA. See it in a theater. https://t.co/mAoWl3rEB3
2016-06-14 21:25:57;BretEastonEllis;THE B.E.E. PODCAST: Duncan Sheik, 1987 NYC, the American Psycho musical, Hamilton, Radiohead https://t.co/wKeIAIZVhA https://t.co/53rxnasAcE
2016-06-06 23:01:38;BretEastonEllis;THE B.E.E. PODCAST: People v OJ Simpson, Batman v Superman, Black Phillip, producer Bob Yari https://t.co/wKeIAIZVhA https://t.co/0GhGd4ctnN
2016-05-31 06:17:16;BretEastonEllis;I binge-watched THE NIGHT MANAGER today and could only think that the theatrical experience of the movie is so OVER. https://t.co/f7bdpbHdRh
2016-05-23 18:20:37;BretEastonEllis;THE B.E.E. PODCAST: aesthetics vs ideology, The Revenant, OscarsSoWhite BS, John Carpenter https://t.co/wKeIAIZVhA https://t.co/YIsRR01nR4
2016-05-13 22:55:01;BretEastonEllis;Adam Thompson, the producer of The BEE Podcast, posted this. I'm not so sure... https://t.co/7o4BgHcOqa
2016-05-03 07:27:41;BretEastonEllis;"Best 2016 films so far: TALE OF TALES Garrone; GREEN ROOM Saulnier; THE INVITATION Kusama; BATMAN V SUPERMAN Snyder. https://t.co/kCT4w3j5Yh"
2016-04-28 01:39:20;BretEastonEllis;Smart piece/review on AMERICAN PSYCHO: THE MUSICAL in The Los Angeles Times... https://t.co/wOyTLdWA6t
2016-04-12 15:45:04;BretEastonEllis;Karyn Kusama's THE INVITATION is a scary slow-burning L.A.-set thriller and the most effective movie of 2016 so far. https://t.co/hluIv9ue1L
2016-04-04 03:42:26;BretEastonEllis;Season #5 is the best year of GIRLS so far: great episode after great episode. Beautifully written, shot, directed. https://t.co/fErKQgOHS4
2016-03-03 18:41:07;BretEastonEllis;RT @Adweek: Ad of the Day: @BretEastonEllis directed a delightfully debauched film for the Paris Opera. https://t.co/YmVoe62CiT https://t.c…
2016-02-25 20:18:48;BretEastonEllis;"RT @ArthenaArt: Opening tonight at @Gagosian #BeverlyHills: #AlexIsrael &amp; #BretEastonEllis https://t.co/y5PPvutfE5"
2016-02-25 01:26:21;BretEastonEllis;RT @GagosianLA: Check out the #AlexIsrael #BretEastonEllis billboard on Sunset/San Vicente?! And come see the show Feb 25, 6–8pm https://t.…
2016-02-23 04:24:30;BretEastonEllis;Indie Arthouse Horror is becoming my least favorite new genre: It Follows, Goodnight Mommy, The Babadook, The Witch. https://t.co/KDvGa5w8po
2016-02-22 07:12:01;BretEastonEllis;https://t.co/W5hKsdA34x
2016-02-21 07:00:02;BretEastonEllis;Just back from a dinner in West Hollywood: shocked the majority of the table was voting for Trump but they would never admit it publicly.
2016-02-17 19:28:31;BretEastonEllis;Alex Israel/Bret Easton Ellis. Gagosian Gallery. Beverly Hills. February 25th. https://t.co/US2MNloWIE
2016-02-17 18:29:32;BretEastonEllis;The great Ben Walker as PB... https://t.co/xdrrpOjCQY
2016-01-26 20:17:48;BretEastonEllis;RT @APtheMusical: In two weeks, we go to work. #AmericanPsychoBway https://t.co/GZHgRgoSbq
2016-01-21 05:40:50;BretEastonEllis;THE EAGLES: The HOTEL CALIFORNIA album was as big an influence as Joan Didion or Raymond Chandler. RIP Glenn Frey. https://t.co/iqwoLo5LeX
2016-01-19 00:16:44;BretEastonEllis;"Actors nominate actors. THE ""ACADEMY"" DOES NOT NOMINATE ACTORS. Actors nominate actors. Remember this #OscarsSoWhite https://t.co/dTPKr5kt8V"
2016-01-10 20:06:37;BretEastonEllis;Best Direction of a movie released theatrically 2015: EDEN, the French house-music epic directed by MIA HANSEN-LOVE. https://t.co/Wzf9xqgmpa
2016-01-03 23:45:15;BretEastonEllis;VILMOS ZSIGMOND (1930-2016). One of the greatest cinematographers in movie history and defined the look of 70s film. https://t.co/AViS27vRLE
