timestamp;sn;text
2017-02-01 02:20:31;SenWarren;Based on the long and well-established record of Judge Neil Gorsuch, I will oppose his nomination. https://t.co/iYbOWwwGoS
2017-01-31 22:51:54;SenWarren;Heading to the Senate floor now to discuss why I will be voting NO on Rex Tillerson for Secretary of State. Watch: https://t.co/SRRHUnhCre
2017-01-31 17:58:56;SenWarren;"It’s time for the Senate to stand up for the Constitution &amp; exert moral leadership. I urge my colleagues: Vote NO on Jeff Sessions for AG."
2017-01-31 17:57:46;SenWarren;Jeff Sessions is so dangerous that a Republican-controlled Senate rejected his nomination to a federal judgeship 30 years ago.
2017-01-31 17:56:52;SenWarren;"Trump expects us to replace the AG w/ Jeff Sessions, whose career is defined by hostility to civil rights, immigrants &amp; the rule of law."
2017-01-31 17:54:04;SenWarren;Let me repeat: the @POTUS fired the nation’s top law enforcement officer for refusing to defend an illegal, unconstitutional, immoral order.
2017-01-31 17:53:16;SenWarren;"Last night, the acting AG refused to defend @realDonaldTrump’s unlawful &amp; unconstitutional Muslim ban, so Trump fired her."
2017-01-31 00:58:28;SenWarren;Watch live now as I speak out from the Senate floor about @realDonaldTrump's Muslim ban: https://t.co/KYG7aJim5s #NoBanNoWall
2017-01-31 00:57:37;SenWarren;I’ll also be sharing the views of nonpartisan experts who are alarmed that this policy will harm our national security. #NoBanNoWall
2017-01-31 00:56:47;SenWarren;I’ll be sharing stories from people in MA terrified about what @realDonaldTrump’s executive action means for their loved ones. #NoBanNoWall
2017-01-31 00:56:08;SenWarren;"Tonight @SenateDems will hold the floor as we speak out against @realDonaldTrump’s illegal &amp; unconstitutional Muslim ban. #NoBanNoWall"
2017-01-31 00:31:25;SenWarren;"What a view tonight in front of the Supreme Court as Congressional Dems &amp; hundreds of people gathered to say… https://t.co/l1hSzxS4Kw"
2017-01-30 18:29:42;SenWarren;I urge my colleagues: vote NO on Steve Mnuchin. Don’t put the fates of the families you represent in the hands of a lying Wall St insider.
2017-01-30 18:28:28;SenWarren;Steve Mnuchin won't give us an honest answer about his foreclosure record. He's not going to give us one when we give him our economy.
2017-01-30 18:27:00;SenWarren;If Steve Mnuchin were the Captain of the Titanic, he’d deny ever hitting the iceberg.
2017-01-30 18:26:03;SenWarren;"You have to wonder, @SenateDems &amp; @SenateGOP: What else is Steve Mnuchin willing to lie about if we hand him the keys to @USTreasury?"
2017-01-30 18:24:46;SenWarren;Mnuchin lied about his bank’s illegal tactics in response to @SenBobCasey's q's. There’s no other way to say it. https://t.co/lUsVQChRMd
2017-01-30 18:23:23;SenWarren;.@SenateDems brought victims of Mnuchin’s bank to DC when @GOPSenFinance refused to hear their stories. https://t.co/RMCZNyqxsC
2017-01-30 18:21:48;SenWarren;"Steve Mnuchin ran a bank that aggressively &amp; sometimes illegally foreclosed on more than 60k families. That’s not up for debate. It’s fact."
2017-01-30 15:46:58;SenWarren;"RT @BU_Tweets: In @BostonGlobe, BU's President Brown takes a stand against Trump's travel ban &amp; discusses its impact on #HigherEd: https://…"
2017-01-30 01:19:15;SenWarren;"I told 20k+ ppl in MA: We'll fight in courts, Congress &amp; across America to stop Trump’s #MuslimBan. #NoBanNoWall https://t.co/NSKCnw13Sv"
2017-01-29 19:02:18;SenWarren;"Proud to stand shoulder-to-shoulder with Mayor @marty_walsh, @SenMarkey, @CAIRMass &amp; 20k+ people in Boston today to… https://t.co/8YzgLJE2au"
2017-01-29 03:35:55;SenWarren;RT @ACLU_Mass: We encourage anyone being detained at Logan under #MuslimBan, as well as their families/friends, to contact us at 617-482-31…
2017-01-29 02:03:42;SenWarren;We will not allow a Muslim ban in the United States of America. Here's what I said at Logan Airport tonight.… https://t.co/6XVanUUI0w
2017-01-29 01:33:16;SenWarren;Tonight we fight for American values at airports all across this country. I'm at Logan Airport now to say: #nomuslimban #NoBanNoWall
2017-01-28 00:09:22;SenWarren;"I urge @realDonaldTrump: embrace policies that reflect America’s core values &amp; protect our ntl security. Rescind this executive order now."
2017-01-28 00:08:17;SenWarren;"On #HolocaustRemembranceDay, we remember what can happen when hatred &amp; fear turns neighbor against neighbor. When we abandon those in need."
2017-01-28 00:05:28;SenWarren;Turning our back on refugees because of their religion creates recruiting fodder for ISIS and other terrorist groups.
2017-01-28 00:04:12;SenWarren;"The Syrian refugees admitted to the US last yr are kids, doctors, teachers, engineers, &amp; college students who sought safety from terrorists."
2017-01-28 00:02:59;SenWarren;"We are a country of immigrants &amp; refugees, of people fleeing religious persecution &amp; seeking freedom, a country made strong by diversity."
2017-01-28 00:01:50;SenWarren;".@realDonaldTrump's order restricting immigrants from Muslim countries &amp; freezing admission of refugees is a betrayal of American values."
2017-01-28 00:00:50;SenWarren;Let’s be clear: A Muslim ban by any other name is still a Muslim ban.
2017-01-27 23:59:52;SenWarren;"Today, @realDonaldTrump closed the door on that little girl – &amp; so many others who are running for their lives."
2017-01-27 23:58:53;SenWarren;"I thought about what horrors must have possessed her parents to hand a wad of cash &amp; their little girl over to human smugglers."
2017-01-27 23:57:59;SenWarren;And I met a 7-yr-old girl – younger than my own granddaughters – who had been sent out on that perilous journey alo… https://t.co/bg0F2Ytfr1
2017-01-27 23:56:15;SenWarren;I saw the plastic pool floaties parents put on small children, hoping that would be enough to save them if the raft… https://t.co/j90JTG1nU0
2017-01-27 23:55:11;SenWarren;"I saw the shoddy, paper-thin rubber rafts that people cram onto with a hope &amp; a prayer that they’ll make it across the choppy, rocky sea."
2017-01-27 23:54:26;SenWarren;15 months ago, I traveled to the Greek island of Lesvos – the 1st stop for many Syrian refugees as they flee the te… https://t.co/4VY1gXnWgo
2017-01-27 19:01:25;SenWarren;It’s hard to imagine a less qualified or more dangerous @USedgov nominee. The Senate should reject Betsy DeVos. https://t.co/KKWRr7HR1H
2017-01-27 19:00:20;SenWarren;"I’ve heard from thousands of teachers, parents, &amp; ed leaders in MA with deep concerns about Betsy DeVos. I hear &amp; share their concerns."
2017-01-27 18:59:08;SenWarren;"And Betsy DeVos is unwilling to commit to be a cop on the beat with for-profit colleges that break the law &amp; cheat students."
2017-01-27 18:58:03;SenWarren;Betsy DeVos repeatedly demonstrated contempt for public ed. She plans to maintain financial ties that could create conflicts of interest.
2017-01-27 18:56:37;SenWarren;I will vote against Betsy DeVos’s nomination for @USedgov because it’s not in the best interests of America’s young people.
2017-01-26 01:07:08;SenWarren;".@realDonaldTrump’s actions today show an ugly indifference to immigrants &amp; a profound misunderstanding of the real dangers we face."
2017-01-26 01:05:47;SenWarren;".@realDonaldTrump’s actions will divert local police dept resources away from protecting &amp; building trust in our communities."
2017-01-26 01:05:06;SenWarren;".@realDonaldTrump’s actions will waste taxpayer dollars on irresponsible &amp; misguided pet political projects."
2017-01-26 01:04:22;SenWarren;".@realDonaldTrump’s actions will hurt working parents &amp; children who have risked their lives to flee war, violence &amp; poverty."
2017-01-26 01:03:23;SenWarren;"None of @realDonaldTrump’s actions today will make us safer. They’ll tear apart the fabric that makes us strong &amp; united."
2017-01-26 01:02:46;SenWarren;Why not just declare January 25th as the Trump Administration's First Anti-Immigrant Day?
2017-01-25 22:37:58;SenWarren;I’ve heard from many people about my vote for Dr. Ben Carson – so I’ve explained it the best I can: https://t.co/rOhCeZ4xdp
2017-01-24 21:04:13;SenWarren;"If @RepMickMulvaney thinks the @CFPB is a ""sad, sick joke,"" maybe he should spend more time talking to his constituents"
2017-01-24 21:02:06;SenWarren;"Those are just some of the dozens of constituents – including servicemembers &amp; seniors – who have gotten money back or other help from @CFPB"
2017-01-24 20:59:41;SenWarren;Maybe @RepMickMulvaney should take a look at some of the complaints his constituents have filed with the @CFPB: https://t.co/E3gdLLbdMO
2017-01-24 20:57:23;SenWarren;Budget Director nominee @RepMickMulvaney said today he believes the @CFPB is a “sad, sick joke” and that he finds the agency “offensive”
2017-01-23 23:00:43;SenWarren;I’m glad the @CFPB is cleaning up student loan servicing and holding @Navient accountable. That’s why we need a strong consumer agency.
2017-01-23 22:59:47;SenWarren;There’s a reason why @Navient usually scores dead last in every @usedgov borrower satisfaction survey.
2017-01-23 22:59:19;SenWarren;Every time I tweet or post about @Navient, students and families share stories about how they were harmed by this student loan giant.
2017-01-23 22:58:23;SenWarren;We all know @Navient has been caught red-handed cheating students and servicemembers before. https://t.co/BbkUbp8Olv
2017-01-23 22:57:21;SenWarren;Now the CEO of @Navient is whining to @washingtonpost about getting caught by the @CFPB. Give me a break. https://t.co/LGUIniffPj
2017-01-23 22:55:38;SenWarren;"Last week, @CFPB, @ILAttyGeneral, &amp; @AGOWA all sued @Navient (fmr Sallie Mae) for cheating students. https://t.co/yM5LRlMQU0"
2017-01-23 21:14:40;SenWarren;"Perhaps @POTUS @realDonaldTrump &amp; the @GOP didn’t get the message Saturday: We’re not taking women’s rights back – not now, &amp; not ever."
2017-01-23 21:13:55;SenWarren;I’ve been a cosponsor of a bill to repeal the global gag rule. I’ll be 1st in line to cosponsor again when @SenatorShaheen reintroduces it.
2017-01-23 21:12:50;SenWarren;.@POTUS Trump is reinstating the “global gag rule” to stop funding for overseas health centers that may provide abortion. This is insanity.
2017-01-23 21:11:27;SenWarren;"Attacking @PPFA &amp; US women’s reproductive rights isn’t enough for @realDonaldTrump &amp; the @GOP. Today they made their fight global."
2017-01-20 23:27:23;SenWarren;We must measure @POTUS @realDonaldTrump by actions, not only words. And today he made it harder for families to achieve the American Dream.
2017-01-20 23:26:15;SenWarren;That’s 40,000 families who just lost their chance to buy a home thanks to brand-new @POTUS @realDonaldTrump.
2017-01-20 23:25:30;SenWarren;.@POTUS suspended a planned cut in FHA mortgage insurance premiums, which @nardotrealtor says will cost 40k families a shot at a new home.
2017-01-20 23:24:21;SenWarren;Just minutes after taking the oath of office, @POTUS Trump made it harder for working families to get a mortgage. https://t.co/13ytYnmGpt
2017-01-19 23:42:11;SenWarren;Thank you for your terrific service, @JohnKerry. You’ve made MA proud, and we’re looking forward to having you back in the Commonwealth.
2017-01-19 18:03:54;SenWarren;Today at 1 ET, @SenateDems are hosting a forum with ppl who’d be hurt by Price’s health care policies. Watch live: https://t.co/Q6m4FyZNmi
2017-01-19 18:03:12;SenWarren;"And yesterday at his @HHSgov hearing, Tom Price wouldn’t commit to protecting Medicare &amp; Medicaid from massive cuts. https://t.co/1NJ6dYCJK8"
2017-01-19 18:01:59;SenWarren;Rep Tom Price - @realDonaldTrump’s pick to run @HHSgov - is the lead architect of legislation to repeal the Affordable Care Act.
2017-01-19 16:50:26;SenWarren;When Mnuchin makes mistakes on complicated paperwork, he asks for forgiveness. When his customers made mistakes, he took their homes.
2017-01-19 16:49:55;SenWarren;Heather McCreary lost her home when Mnuchin’s bank said she sent the wrong check with her complicated paperwork. https://t.co/k9OjA82Yfw
2017-01-19 16:49:16;SenWarren;"Steve Mnuchin told @SenStabenow &amp; @SenatorMenendez he didn’t disclose $100M because “the amount of paperwork” was tough. Boo hoo."
2017-01-19 16:23:47;SenWarren;"The people who broke our economy &amp; ruined people’s lives need to be held accountable. Not given the keys to break our economy again."
2017-01-19 16:23:06;SenWarren;"No, @SenOrrinHatch, @POTUS didn’t force Mnuchin &amp; OneWest to lie to homeowners about modifications &amp; steal homes while making millions."
2017-01-19 15:56:32;SenWarren;.@SenPatRoberts says @RonWyden should take a valium? Maybe more Senators should be outraged by Wall St bankers that steal people's homes.
2017-01-19 15:55:04;SenWarren;".@SenOrrinHatch said Mnuchin's bank's disgraceful actions are ""essentially unrelated"" to his qualifications. Tell that to his victims."
2017-01-19 15:26:33;SenWarren;.@SenateDems held a forum to hear Mnuchin’s victims. While watching the @USTreasury hearing, remember Colleen. https://t.co/kc8ap1VIjV
2017-01-19 15:25:25;SenWarren;.@GOPSenFinance didn’t want to hear Colleen – an 84-yr-old who might lose her home because of a reverse mortgage scam from Mnuchin’s bank.
2017-01-19 15:24:26;SenWarren;"Steve Mnuchin ran a bank that lied &amp; cheated people out of their homes. @GOPSenFinance didn’t want to hear those stories today."
2017-01-19 01:06:21;SenWarren;".@realDonaldTrump should stand with working Americans &amp; uphold @POTUS’s protections. Read my new @CNN op-ed. https://t.co/gNozaRHTU1"
2017-01-19 01:04:40;SenWarren;"New protections making sure Americans are paid overtime &amp; aren’t exposed to deadly chemicals could turn to dust with @realDonaldTrump."
2017-01-19 01:03:15;SenWarren;"Paid sick days, a higher min wage, &amp; discrimination-free hiring for federal contractors could go out the window with @realDonaldTrump."
2017-01-19 01:02:26;SenWarren;"If @realDonaldTrump follows through on promises to “eliminate” or “repeal” @POTUS’s exec orders, workers could lose wages &amp; benefits Monday."
2017-01-19 00:19:50;SenWarren;Thank you, @SenRonJohnson. Dais or not, I hope more will watch the heartbreaking stories of Mnuchin’s victims. https://t.co/RMCZNyqxsC
2017-01-18 23:57:00;SenWarren;If Rep Tom Price won’t commit to protecting 1 in 3 Americans’ health care, he’s not the right person to run @HHSgov.
2017-01-18 23:55:16;SenWarren;I asked @HHSgov nominee Price: Will you follow @realDonaldTrump’s promise for no Medicare/Medicaid cuts? (Nope.) https://t.co/7pC2c4YzSl
2017-01-18 23:53:56;SenWarren;".@HHSgov nominee Tom Price proposed a whopping $449 billion in Medicare cuts &amp; $1 trillion in Medicaid cuts as chair of @housebudgetGOP."
2017-01-18 23:52:17;SenWarren;".@realDonaldTrump promised over &amp; over that he wouldn’t cut Medicare &amp; Medicaid, but his @HHSgov nominee won't make the same promise."
2017-01-18 19:21:26;SenWarren;OneWest Bank victims deserve to have their voices heard, so we invited them to share their stories. Tune in now: https://t.co/RMCZNyqxsC
2017-01-18 19:06:19;SenWarren;It will take a lot more than petty rearranging of furniture to stop @SenateDems from fighting for working families, @SenateGOP. Try again.
2017-01-18 19:05:03;SenWarren;But @SenRonJohnson ordered dais chairs removed from his empty room so Senators talking to victims couldn't sit in t… https://t.co/MbslF6F5Wb
2017-01-18 19:03:47;SenWarren;3 hours before the Mnuchin victims’ forum was scheduled to start, @SenRonJohnson finally agreed that we could use his empty hearing room.
2017-01-18 19:02:37;SenWarren;"Mnuchin's allies in Congress will do ANYTHING to protect @realDonaldTrump’s @USTreasury nominee &amp; please their Wall Street friends."
2017-01-18 19:01:10;SenWarren;So today at 2:15PM ET, we are holding a forum with OneWest Bank foreclosure victims. https://t.co/RMCZNyqxsC
2017-01-18 18:59:54;SenWarren;25 Senators asked @SenOrrinHatch to hear from OneWest Bank foreclosure victims at Steve Mnuchin’s @USTreasury hearing. He refused.
2017-01-18 15:05:09;SenWarren;Tune in now to watch @HELPCmteDems’s confirmation hearing with Tom Price for @HHSgov secretary: https://t.co/Xto9jqdsBS
2017-01-18 15:01:06;SenWarren;I explained my concerns about Tom Price’s @HHSgov nomination in a 20-page letter yesterday. https://t.co/edaNYEBoWO
2017-01-18 14:59:53;SenWarren;"Tom Price has also championed proposals to privatize Medicare &amp; radically restructure Medicaid – weakening our nation’s health care."
2017-01-18 14:59:04;SenWarren;Tom Price championed ACA repeal. He’s opposed improvements to women’s care. He’s cosponsored leg to discriminate against LGBT ppl.
2017-01-18 14:58:05;SenWarren;"The job of @HHSgov sec is to “enhance &amp; protect the health…of all Americans.” I’m not convinced Tom Price is willing or able to do that."
2017-01-18 02:03:04;SenWarren;"If #BetsyDeVos won't use @usedgov’s many tools &amp; resources to save students from fraud, she shouldn't be the Secretary of Education."
2017-01-18 02:02:09;SenWarren;"Tonight I asked #BetsyDeVos a set of q's about her education experience &amp; commitment to protect students. Watch: https://t.co/0euCIOKwAn"
2017-01-18 02:00:53;SenWarren;In fact, #BetsyDeVos has no experience with student loans, Pell Grants, or public education at all.
2017-01-18 01:59:32;SenWarren;As @usedgov secretary, #BetsyDeVos would be in charge of running a $1 trillion student loan bank. She has no experience doing that.
2017-01-18 01:04:03;SenWarren;I have 3 more rounds of q's that I would like to ask @usedgov nominee Betsy DeVos, @SenAlexander. I’m waiting. #1moreround #DeVosHearing
2017-01-17 23:50:04;SenWarren;RT @PattyMurray: RT if you think Senators shouldn't be cut off after just 5 minutes of questions: https://t.co/oGBRmoVTZ4 #DeVos https://t.…
2017-01-17 22:02:23;SenWarren;Tune in live now to watch @HELPCmteDems’s confirmation hearing with Betsy DeVos for @usedgov secretary:  https://t.co/66BzPi6Ovd
2017-01-17 22:01:02;SenWarren;I raised my many concerns about @usedgov nominee Betsy DeVos in a 16-page letter to her last week. https://t.co/WAE1JCODir
2017-01-17 22:00:27;SenWarren;.@usedgov secretaries have served as teachers, school system leaders, governors – and Betsy DeVos has held no such position.
2017-01-17 21:59:47;SenWarren;There is no precedent for a @usedgov secretary with the lack of experience in public education that Betsy DeVos has.
2017-01-16 01:40:03;SenWarren;Read my new @bostonglobe op-ed about what's at stake for MA if the @GOP repeal ACA. #OurFirstStand #saveheathcare https://t.co/Igl70KV2nh
2017-01-16 01:38:24;SenWarren;There's no magic wand MA can wave to go back to the way things were before the Affordable Care Act. #OurFirstStand #savehealthcare
2017-01-16 01:37:09;SenWarren;"MA has worked for years for quality, affordable healthcare - &amp; we went all in to expand access with ACA. #OurFirstStand #savehealthcare"
2017-01-13 17:00:15;SenWarren;".@SenateDems &amp; I have asked @SenOrrinHatch to include outside witnesses for Mnuchin’s @USTreasury hearing.… https://t.co/LvZ41iPYAU"
2017-01-13 16:57:24;SenWarren;If being “the Foreclosure King” qualifies Mnuchin for @USTreasury, we should hear from ppl with first-hand experience with his businesses.
2017-01-13 16:55:53;SenWarren;".@realDonaldTrump's @USTreasury pick Steve Mnuchin ran a bank infamous for aggressively &amp; sometimes illegally foreclosing on people’s homes."
2017-01-12 20:13:08;SenWarren;Rex Tillerson may try to dodge accountability in the US Senate – but @ExxonMobil certainly won’t dodge accountability from @MassAGO Healey.
2017-01-12 20:11:28;SenWarren;And the same day Tillerson dodged climate change q’s, @ExxonMobil must turn over climate change docs to @MassAGO. https://t.co/6YUW6BdR4S
2017-01-12 20:10:13;SenWarren;.@ExxonMobil CEO Tillerson had a bad day yesterday. Wouldn’t call out his pal Putin. Claimed Exxon didn’t lobby against sanctions (it did).
2017-01-12 19:14:13;SenWarren;The solution is clear: @realDonaldTrump must divest fully – putting his assets in a true blind trust. If he won't, Congress must require it.
2017-01-12 19:12:50;SenWarren;".@HUDgov grants &amp; loans must be about helping the American people ONLY – not @realDonaldTrump's personal fortune."
2017-01-12 19:11:41;SenWarren;Dr Carson danced around my q, because here’s the truth: He can’t promise it, b/c @realDonaldTrump won't eliminate his financial conflicts.
2017-01-12 19:10:36;SenWarren;I asked Ben Carson a simple q: Can you assure us no @HUDgov money will help @realDonaldTrump’s business empire? https://t.co/Q3Dh4lPVL0
2017-01-12 00:35:21;SenWarren;And if @realDonaldTrump won’t follow the Constitution, Congress must fight back every step of the way.… https://t.co/n2GOtj0HbO
2017-01-12 00:33:29;SenWarren;"If @realDonaldTrump truly wants to make America great &amp; put America first, he’ll divest his assets by placing them in a true blind trust."
2017-01-12 00:31:40;SenWarren;The @OfficeGovEthics says he “[doesn’t] think divestiture is too high a price to pay to be @POTUS.” I don’t either. https://t.co/3i4PgapSOs
2017-01-12 00:29:49;SenWarren;The idea that @realDonaldTrump will still own massive business interests as @POTUS isn’t only unethical – it puts us all at risk.
2017-01-12 00:27:46;SenWarren;.@realDonaldTrump’s business plans for the Trump empire are a joke. Only nobody is laughing.
2017-01-10 20:31:07;SenWarren;"In case you missed it, our @CarlsJr &amp; @Hardees workers forum is happening now. Watch live here: https://t.co/34uygiTf4e"
2017-01-10 19:59:16;SenWarren;"In just a few min, we’ll talk with @CarlsJr &amp; @Hardees workers about how Puzder’s companies treat workers. Watch: https://t.co/GTfV3Diadr"
2017-01-10 19:58:04;SenWarren;In fact, @USDOL Secretary nominee Andrew Puzder seems to have little respect for American workers at all.
2017-01-10 19:56:35;SenWarren;.@realDonaldTrump’s pick to protect America’s workers is a fast food CEO whose burger chains have had numerous labor law violations.
2017-01-10 15:53:27;SenWarren;"My colleagues &amp; I will host a forum today at 3pm to hear from @CarlsJr &amp; @Hardees employees. I hope you’ll tune in. https://t.co/GTfV3Diadr"
2017-01-10 15:52:30;SenWarren;.@SenAlexander refused our request to hear from Andrew Puzder’s employees at his confirmation hearing. https://t.co/tkxIcHZlCJ
2017-01-10 15:51:17;SenWarren;"22 of my colleagues &amp; I urged @SenAlexander to hold a hearing with Puzder’s employees &amp; other outside witnesses. https://t.co/TvdrZiwq9K"
2017-01-10 15:50:19;SenWarren;"It’s essential for the HELP Committee to hear from Puzder’s employees to evaluate his qualifications &amp; suitability for @USDOL Secretary."
2017-01-10 15:49:01;SenWarren;"If confirmed as @USDOL Secretary, Andrew Puzder would oversee enforcement of many labor laws that @CarlsJr &amp; @Hardees reportedly violated."
2017-01-10 15:48:06;SenWarren;"Andrew Puzder’s fast food chains have had numerous violations of wage protection laws &amp; several class action lawsuits by employees."
2017-01-10 02:55:43;SenWarren;If the @SenateGOP want to destroy health care in America, I will fight them every step of the way.
2017-01-10 02:54:40;SenWarren;"Tonight I went to the Senate floor to tell the @SenateGOP: Repeal &amp; run of the ACA is for cowards. https://t.co/OrEYGlv7ES"
2017-01-10 02:53:18;SenWarren;"The @SenateGOP want to tear apart the ACA – rip health insurance out of the hands of millions of people who need it – &amp; repeal &amp; run."
2017-01-10 02:52:07;SenWarren;The @SenateGOP have spent 8 years complaining about health care reform. But after 8 years of complaining, they still don’t have a plan.
2017-01-10 00:52:23;SenWarren;About to speak on the Senate floor about why we can't allow the @SenateGOP to repeal the ACA. Watch live: https://t.co/16OFY08f3t
2017-01-09 20:15:50;SenWarren;RT @SenSchumer: Our requests are eminently reasonable, shared by leaders of both parties. I'll return this letter to @SenateMajLdr with the…
2017-01-09 20:15:40;SenWarren;RT @SenSchumer: In 2009, Min Ldr McConnell gave Maj Ldr Reid his pre-recs for @POTUS nominees. They're almost exactly like @SenateDems requ…
2017-01-09 18:46:04;SenWarren;A blind trust has been the standard for previous presidents. We still expect @realDonaldTrump to do the same.
2017-01-09 18:44:16;SenWarren;"Today @RepKClark, our Democratic colleagues &amp; I introduced the bill to implement the Emoluments Clause: https://t.co/wEG1wdljgO"
2017-01-09 18:42:24;SenWarren;The only way for @realDonaldTrump to truly eliminate conflicts is to divest his financial interests by placing them in a blind trust.
2017-01-09 18:41:04;SenWarren;"Americans STILL deserve to know that the President is doing what’s best for the country – not what’s best for himself &amp; his businesses."
2017-01-09 18:39:58;SenWarren;It’s been 25 days since @realDonaldTrump promised to outline his plans for the Trump empire. We’re still waiting.
2017-01-07 21:29:12;SenWarren;Cabinet officials must put our country's interests before their own. No conf hearings should be held until we’re certain that’s the case.
2017-01-07 21:27:47;SenWarren;This is ridiculous. @realDonaldTrump’s noms can’t drag their feet on ethics paperwork while their Senate friends try to run out the clock.
