timestamp;sn;text
2016-10-14 17:12:05;SenWarren;The SEC has a simple purpose: to protect investors by ensuring they have the information they need to make decisions
2016-10-14 17:10:17;SenWarren;Today I asked @POTUS to immediately designate a new Chair of the SEC to replace Mary Jo White: https://t.co/Jin8kvpbZ5
2016-10-13 16:49:48;SenWarren;"I am heartsick for the 2 brave @bostonpolice officers shot in Boston, their families &amp; the entire BPD. Our gratitude &amp; prayers are with you."
2016-10-12 23:13:18;SenWarren;"A bank CEO should not be able to oversee a massive fraud &amp; simply walk away to enjoy his millions in retirement."
2016-10-12 23:12:10;SenWarren;"A bank teller would face criminal charges &amp; a prison sentence for stealing a handful of 20s from the cash drawer."
2016-10-12 23:10:59;SenWarren;If @WellsFargo’s John Stumpf is leaving with all of his ill-gotten millions, that's still not real accountability.
2016-10-12 23:08:54;SenWarren;"As I said: @WellsFargo CEO Stumpf should resign, return every nickel he made during the scam, &amp; face DOJ/SEC investigation. He’s 1 for 3."
2016-10-10 21:32:12;SenWarren;"I'm proud of MA's cranberry heritage &amp; I'm fighting for our cranberry growers. https://t.co/If2gw8iN7V"
2016-10-10 21:30:06;SenWarren;I've been looking forward to visiting our MA cranberry bogs all year! https://t.co/PrLdF8T3fh
2016-10-10 21:28:55;SenWarren;Today we put on our cranberry waders at Mann Farms of the @OceanSprayInc co-op in Buzzards Bay. https://t.co/OWwRjbosYg
2016-10-05 22:44:44;SenWarren;The @CFPB just announced new rules to protect consumers from fraud and hidden fees with prepaid cards. Take a look: https://t.co/Hki6npOBlT
2016-09-30 19:00:08;SenWarren;Watch @RepGutierrez tell this Board to open its doors to actual Puerto Ricans, not just Wall Street. https://t.co/VvYErL4IAX
2016-09-30 18:58:54;SenWarren;If this unelected Board wants Puerto Rico to believe it takes their crisis seriously, they can start by leaving NY. Start by showing up.
2016-09-30 18:57:33;SenWarren;I guess holding the mtg in Puerto Rico would've been inconvenient. 20,000+ Zika cases. Recent blackouts left 1M w/o power. 340k w/o water.
2016-09-30 18:56:29;SenWarren;Will this Board speak for the ppl of Puerto Rico or the bankers? Today it met for the first time - not in PR, but NYC. That's a bad start.
2016-09-30 18:55:30;SenWarren;"Congress passed a bill in June to ""help"" Puerto Rico - handing authority over PR to an unelected Board, but providing no actual resources."
2016-09-29 20:41:09;SenWarren;"Today I joined @SenSherrodBrown, @SenSanders &amp; 9 other @SenateDems to say no to trade deals with #ISDS. https://t.co/aATYWclM2T #TPP"
2016-09-29 19:40:22;SenWarren;It’s time for @usedgov's student loan bank to prove they care more about Corinthian’s victims than their own bottom line.
2016-09-29 19:38:57;SenWarren;Today I wrote to @usedgov demanding their student loan bank halt collection of Corinthian students’ debt: https://t.co/qk6LpjPfeP
2016-09-29 19:37:59;SenWarren;"That means Corinthian’s victims eligible for loan forgiveness are instead having tax refunds, EITC &amp; Social Security garnished. It’s absurd."
2016-09-29 19:36:57;SenWarren;We uncovered data that instead of simply discharging the loans of Corinthian’s victims, @usedgov pushed 80k of them to debt collectors.
2016-09-29 19:35:59;SenWarren;Corinthian Colleges went belly up amid findings that it defrauded students. Under fed law, those students are eligible for loan discharge.
2016-09-29 16:37:19;SenWarren;"That’s the @GOP agenda in a nutshell: Pay Congress to do nothing, &amp; block back-breaking Americans from getting paid for a hard day’s work."
2016-09-29 16:36:21;SenWarren;Last night @HouseGOP voted to delay our new overtime rule by 6 months. Kill a simple rule that hard-working people deserve to get paid.
2016-09-29 16:35:18;SenWarren;.@SpeakerRyan’s Congress is on track to work the fewest days in decades. But what did they do last night before leaving town until November?
2016-09-28 20:02:36;SenWarren;"RT @VotingInMass: The voter registration deadline is 3 weeks away. Make sure your voter information is up to date:
https://t.co/g1xroLhd7B…"
2016-09-28 19:27:55;SenWarren;Deepest sympathies for the family of Shimon Peres on the passing of a dedicated public servant with an enduring commitment to peace.
2016-09-28 14:11:53;SenWarren;"As I said last week: Mr. Stumpf should resign, return every nickel he made while this scam was ongoing, &amp; face SEC &amp; DOJ investigations."
2016-09-28 14:10:33;SenWarren;".@WellsFargo CEO Stumpf will be just fine: he keeps his job &amp; most of the money he made while massive fraud went on under his nose."
2016-09-28 14:09:18;SenWarren;.@WellsFargo employees who tried to sound the alarm about the creation of fake accounts were fired. Their lives turned upside down.
2016-09-28 14:08:10;SenWarren;.@WellsFargo employees who failed to meet management's outrageous sales goals were fired.
2016-09-28 14:06:59;SenWarren;This is a small step in the right direction, but nowhere near real accountability. https://t.co/7Aj4fxXp9x
2016-09-27 23:02:28;SenWarren;"Watch my speech calling on @SenateGOP to end their outrageous demands &amp; to stop threatening a gov shutdown. https://t.co/FeX2lsYmvG"
2016-09-27 23:01:01;SenWarren;And any politician who won't stand with Flint, MI - whose kids are choking on poisoned water - lacks the moral courage to serve in Congress.
2016-09-27 22:59:29;SenWarren;If @SenateGOP seriously think they can hold the gov hostage to protect political corruption w/o anyone noticing, they'd better think again.
2016-09-27 18:32:00;SenWarren;"Every agency w/ jurisdiction should follow @USDOL's lead &amp; determine whether @WellsFargo &amp; its senior execs should be prosecuted/sanctioned."
2016-09-27 18:30:51;SenWarren;"I'm glad @USDOL announced today that it will conduct a prompt &amp; thorough ""top-to-bottom review"" of @WellsFargo. https://t.co/IJN1XVDmF6"
2016-09-27 18:29:40;SenWarren;Last week we asked @USDOL to investigate whether @WellsFargo violated the Fair Labor Standards Act. https://t.co/uLSbc4A4mX
2016-09-27 16:40:34;SenWarren;We will not sit by while our planet is destroyed so that the super rich can make an extra buck.
2016-09-27 16:39:04;SenWarren;My @SenateDems colleagues issued a report showing how the fossil fuel industry funds Clean Power Plan opponents. https://t.co/b50fN7afnM
2016-09-27 16:37:37;SenWarren;The fossil fuel industry made billions at the expense of our environment. Now they want to kill the country’s plan to reduce air toxins.
2016-09-27 16:33:38;SenWarren;Want to see 1 more example of the @GOP putting billionaires first? Just look at their opposition to the Clean Power Plan.
2016-09-26 16:52:06;SenWarren;".@WellsFargo’s Stumpf will be accountable only if he resigns, returns every nickel he got during the scam, &amp; faces DOJ &amp; SEC investigation."
2016-09-26 16:51:04;SenWarren;"If John Stumpf can oversee a massive fraud &amp; walk away w/ $100M+, why should we expect any CEO to follow the law? https://t.co/wixnesLKGh"
2016-09-23 15:10:44;SenWarren;"Yesterday I led a letter to @USDOL to investigate if @WellsFargo misclassified workers &amp; failed to pay overtime: https://t.co/JdsIupLhmQ"
2016-09-23 15:09:44;SenWarren;The @CFPB’s investigation of @WellsFargo uncovered staggering workplace conditions imposed on employees to meet sales quotas.
2016-09-23 15:08:51;SenWarren;".@WellsFargo CEO John Stumpf blamed his bank’s massive fraud on 5300 low-level bank tellers, branch managers &amp; customer service reps."
2016-09-22 22:22:51;SenWarren;"Congress must do more to reform higher ed accreditation, so I introduced a bill w/ @SenatorDurbin &amp; @SenBrianSchatz: https://t.co/33bV95cRNF"
2016-09-22 22:21:17;SenWarren;".@usedgov did the right thing today to protect students &amp; taxpayers by stripping ACICS of its college accreditation power."
2016-09-22 22:20:08;SenWarren;"Corinthian &amp; ITT Tech committed fraud to drown students in debt with useless degrees, but ACICS accredited both when they filed bankruptcy."
2016-09-22 22:19:02;SenWarren;College accreditation is supposed to make sure kids get a good education while colleges take taxpayer money. But the system is broken.
2016-09-21 15:51:23;SenWarren;".@SenateGOP has billions of reasons to defend this rotten system - but we're sick of it &amp; ready to fight. https://t.co/acTsbKkKU4"
2016-09-21 15:49:43;SenWarren;If @SenateMajLdr thinks he can hold the whole government hostage to shield donors buying off politicians, think again.
2016-09-21 15:48:32;SenWarren;"We know why - billions in secret dark money is flowing into our political system, to prop up @realDonaldTrump &amp; his GOP allies in Congress."
2016-09-21 15:47:31;SenWarren;But here we go again - Republicans are threatening to shut down the gov in days unless we ban disclosure of corporate political spending.
2016-09-21 15:46:46;SenWarren;Shutting down the government isn't very popular with the American people. You'd think the Republicans would've learned that by now.
2016-09-21 00:37:16;SenWarren;If you missed my questions for @WellsFargo CEO John Stumpf on his gutless leadership earlier today, take a look. https://t.co/5brb1ARRqC
2016-09-21 00:27:19;SenWarren;Tonight I'll be talking to Rachel @Maddow about today's @SenateBanking hearing with @WellsFargo CEO John Stumpf. Tune in at 9PM ET!
2016-09-20 19:05:02;SenWarren;"Watch my questioning of @WellsFargo CEO John Stumpf &amp; his gutless leadership at today’s @SenateBanking hearing: https://t.co/5brb1AAgz4"
2016-09-20 19:03:38;SenWarren;".@WellsFargo CEO John Stumpf should resign, give back the money he took while the scam was going on, &amp; be criminally investigated."
2016-09-20 19:02:32;SenWarren;"A bank cashier who steals $20 would be facing theft charges, but Wall St execs never hold themselves accountable. Not in 2008 &amp; not now."
2016-09-20 19:01:27;SenWarren;We know @WellsFargo’s Board knew of exec Carrie Tolstedt’s misconduct, but she’ll still retire with a huge payout: https://t.co/leTA3jL4we
2016-09-20 18:59:35;SenWarren;We know @WellsFargo is proud of cross-selling - getting customers to open more accounts. See the earnings calls: https://t.co/gPflL7JtkL
2016-09-20 18:58:30;SenWarren;.@WellsFargo’s definition of “accountable” is to push blame on low-level employees who don’t have money or PR firms to defend themselves.
2016-09-20 18:56:10;SenWarren;The @CFPB caught @WellsFargo in a massive, years-long scam. CEO John Stumpf hasn’t resigned. He hasn’t fired 1 senior executive.
2016-09-20 14:00:15;SenWarren;Today at 10am @SenateBanking will question @WellsFargo CEO John Stumpf about its years-long scam. Watch: https://t.co/EG5ZjTAP7j
2016-09-15 22:00:54;SenWarren;I agree with @SenMarkey – it's time to #UnlockTheBox. https://t.co/RxvFH4nyB6
2016-09-15 21:12:59;SenWarren;Watch my speech on our bill to make sure every Presidential candidate releases their taxes – even @realDonaldTrump. https://t.co/hCCRK0ZUtk
2016-09-15 21:10:01;SenWarren;.@realDonaldTrump won't release his taxes voluntarily. Let's pass the Presidential Tax Transparency Act and make sure he comes clean.
2016-09-15 21:09:01;SenWarren;We don't know what @realDonaldTrump is hiding in his taxes. What new tax scams he's running. Which foreign dictators have him on the take.
2016-09-15 21:07:16;SenWarren;Every major party Presidential candidate should release their tax returns. And they all do – except @realDonaldTrump. He's just too chicken.
2016-09-15 18:07:52;SenWarren;"Thanks, FCIC Chair @PhilAngelides. I agree: This wasn't ""immaculate corruption"" - DOJ's failure defies common sense. https://t.co/W9MOrTjfWw"
2016-09-15 14:39:12;SenWarren;The @FBI released @HillaryClinton’s info citing “intense public interest.” It should do the same for its Wall Street FCIC investigations.
2016-09-15 14:37:01;SenWarren;I’ve also asked the @FBI to release its investigation materials related to FCIC referrals. https://t.co/iicSLZ2Wwf https://t.co/rvt4JF8frd
2016-09-15 14:35:41;SenWarren;I've asked @TheJusticeDept to investigate its inability to prosecute the FCIC's referrals. https://t.co/iicSLZ2Wwf https://t.co/oVNl7ghEx3
2016-09-15 14:32:54;SenWarren;Not one of the people or corporations referred to @TheJusticeDept by the FCIC has been criminally prosecuted. That’s an abysmal failure.
2016-09-15 14:31:55;SenWarren;"The FCIC investigated the causes of the 2008 crisis. Recently-released docs show they referred 9 people &amp; 14 corps to @TheJusticeDept."
2016-09-15 14:31:00;SenWarren;"8 years ago today, Lehman Bros filed for bankruptcy. The big banks recklessly gambled with our economy &amp; millions of people suffered for it."
2016-09-14 20:47:49;SenWarren;Rep @LamarSmithTX21’s big oil buddies don’t want state AGs to do their jobs, but the AGs aren’t going to cower to big oil or the GOP.
2016-09-14 20:46:37;SenWarren;You don’t need a hearing to know basic facts, @LamarSmithTX21: the US Constitution gives states power to enforce state laws.
2016-09-14 20:45:36;SenWarren;Sci Chairman @LamarSmithTX21 held a hearing today on his unprecedented step of subpoenaing state AGs for investigating @exxonmobil.
2016-09-14 15:20:11;SenWarren;The American people pay us to get things done, @SenateGOP. With this schedule, I’d want my money back. #DoYourJob https://t.co/XiZoYvht6O
2016-09-14 15:18:50;SenWarren;You’d think the @SenateGOP would be ready to work, right? Nope. They’re getting ready for ANOTHER break. #DoYourJob https://t.co/ak3ozOC0qz
2016-09-14 15:17:42;SenWarren;The @SenateGOP took a 7-wk summer break. No work on Zika, SCOTUS, or anything to help working families. #DoYourJob https://t.co/S4mUMfoRlF
2016-09-13 19:36:04;SenWarren;Congrats to MA principal of the year Justin Cameron of Hartnett Middle School in Blackstone! #POY16 https://t.co/yNccoOIFIH
2016-09-12 17:36:22;SenWarren;I sat down with @Buzzfeed to discuss ISDS – a rigged court system baked into our trade deals, including the #TPP: https://t.co/lsf0yIsqJW
2016-09-08 20:57:19;SenWarren;"Read my letter to Aetna requesting answers about its Humana merger &amp; #Obamacare-related decisions. https://t.co/p4cvzbiB1A"
2016-09-08 20:56:17;SenWarren;"Aetna’s decision to use the health of millions of Americans as a bargaining chip for its Humana merger is inexplicable &amp; irresponsible."
2016-09-08 14:44:19;SenWarren;Read my @nytimes op-ed about how Congress should fix our broken corporate tax code: https://t.co/SsUA4SfYOz
2016-09-08 14:43:11;SenWarren;"When tax dodgers move back to the US, they should pay their fair share – just as working families &amp; small businesses have been all along."
2016-09-08 14:41:53;SenWarren;Now that other leading countries are starting to get tough on tax enforcement, corporate tax dodgers want to move money back to the US.
2016-09-08 14:40:33;SenWarren;Corporate tax dodgers have taken full advantage of the benefits of being a US company while searching for every way to avoid paying taxes.
2016-09-08 14:01:59;SenWarren;"We need MORE transparency &amp; accountability in shadow banking, not less. @HouseDemocrats: stand up to Wall St lobbyists &amp; oppose HR 5424."
2016-09-08 14:00:47;SenWarren;"One @HouseGOP bill being pushed this week, HR 5424, would let private equity &amp; hedge funds disclose even LESS info to federal regulators."
2016-09-08 13:59:38;SenWarren;1st order of business for @HouseGOP after a 7-wk recess? Not Zika. Not LA flooding. Just a pile of bills to weaken the rules on Wall Street.
2016-09-07 20:53:22;SenWarren;All we’re asking is for the @SenateGOP to stop playing politics with judicial nominees and #DoYourJob. This is disgraceful.
2016-09-07 20:52:18;SenWarren;Today I called on the @SenateGOP to consider 10 nominees already passed through Judiciary. They said no. https://t.co/6u3LeFmH4y #DoYourJob
2016-09-07 20:51:02;SenWarren;The @SenateGOP have made it very clear: They want @realDonaldTrump to appoint judges who will bend the law for their interests. #DoYourJob
2016-09-07 20:49:51;SenWarren;"Today there are more than twice as many judicial vacancies &amp; emergencies as there were at this point in the Bush Admin. #DoYourJob"
2016-09-07 20:48:37;SenWarren;"The @SenateGOP are setting new records for obstruction with judicial nominations – leaving courts overburdened &amp; understaffed. #DoYourJob"
2016-09-07 19:01:49;SenWarren;"Heading to the Senate floor now to tell the @SenateGOP: #DoYourJob &amp; give judicial nominees a vote. Watch: https://t.co/h7zRAFfpKr"
2016-09-07 15:25:35;SenWarren;"RT @MassAGO: Former ITT Tech students in Massachusetts:
✖️ CANCEL any payments 
💾 Save all paperwork.
📞 Call us at 1-888-830-6277 https://t…"
2016-09-07 15:23:06;SenWarren;RT @JohnKingatED: #ITTTech students: applying for loan discharge is FREE. Don’t be fooled by scammers offering help for $. Visit https://t.…
2016-09-07 14:23:37;SenWarren;Now it’s time to focus on helping @ITTTech students – the real victims – get their loans cancelled or finish programs at schools that care.
2016-09-07 14:22:45;SenWarren;.@usedgov took the right step a few weeks ago when they banned @ITTTech from enrolling new students with federal student loan money.
2016-09-07 14:21:41;SenWarren;"The only people responsible for @ITTTech’s collapse are their execs who sucked students in with thousands in debt &amp; useless degrees."
2016-09-06 23:35:16;SenWarren;#Zika funding isn’t a place for your selfish, partisan games, @SenateGOP. People’s lives are at risk. Bring a clean bill to a vote NOW.
2016-09-06 23:34:19;SenWarren;"After a 7-wk @GOP recess, the @SenateGOP's 1st priority is the same old #Zika bill that hurts women, vets, Obamacare, @PPFA &amp; clean water."
2016-08-30 17:21:10;SenWarren;"19 of my @SenateDems colleagues &amp; I sent a letter to Mylan for answers about the EpiPen price hike: https://t.co/Q3q1yTinBN"
2016-08-30 17:20:21;SenWarren;Mylan’s promise of a new generic EpiPen for half the price only further calls into question the excessive price of branded EpiPens.
2016-08-30 17:19:14;SenWarren;"Mylan’s expanded patient assistance programs are an industry game to keep EpiPen costs high for insurance companies, the gov &amp; employers."
2016-08-30 17:18:23;SenWarren;I have serious concerns about pharmaceutical giant Mylan’s significant price hikes for the life-saving EpiPen Auto-Injector.
2016-08-25 21:57:09;SenWarren;".@ITTTech's free ride is finally over &amp; the message is clear: We won't stand by &amp; allow these shady schools to cheat students &amp; taxpayers."
2016-08-25 21:56:12;SenWarren;Today, @usedgov has finally said enough is enough, banning @ITTTech from enrolling any new students with federal dollars this fall.
2016-08-25 21:55:30;SenWarren;"The SEC, @CFPB, &amp; @MassAGO are all suing @ITTTech for fraud &amp; they failed, again, to meet the low standards of their accrediting agency."
2016-08-25 21:54:12;SenWarren;".@ITTTech – a massive, for-profit college – is currently under investigation by 20 state &amp; federal agencies for cheating students."
2016-08-19 19:14:18;SenWarren;"Great news: @TheJusticeDept will end its use of ineffective &amp; dangerous private prisons - 1 step to fix our broken criminal justice system."
2016-08-17 21:18:41;SenWarren;.@HUDgov guidance will send a clear message that housing-related ordinances must protect vulnerable individuals – not leave them homeless.
2016-08-17 21:16:59;SenWarren;I joined 28 @SenateDems urging @HUDgov to explain how nuisance ordinances may violate fed law. https://t.co/aIWPyQFR83
2016-08-17 21:15:44;SenWarren;"Domestic violence survivors, crime victims, &amp; others should never have to pick between calling 911 &amp; keeping a roof over their heads."
2016-08-12 15:04:17;SenWarren;.@usedgov didn’t fall for the scheme. To other shady #4profit schools, @JohnKingatED's right: Don’t waste your time. https://t.co/sPqrPE3HDJ
2016-08-12 15:03:32;SenWarren;"A Utah-based #4profit college tried to convert to a bogus nonprofit school to skirt @usedgov for-profit rules &amp; oversight. Lame trick."
2016-08-12 14:29:13;SenWarren;RT @SenateFinance: It's simple. If @SenateMajLdr is serious about protecting our democracy from foreign influence, he will bring up the bil…
2016-08-12 14:29:08;SenWarren;RT @SenateFinance: The Presidential Tax Transparency Act would make releasing tax returns a requirement so pres. nominees cannot hide forei…
2016-08-12 14:29:05;SenWarren;"RT @SenateFinance: Tax returns show if a nominee has foreign investments &amp; in what countries. Releasing your tax returns should not be opti…"
2016-08-11 20:20:02;SenWarren;The entire MA Congressional delegation supports @MassAGO’s enforcement of our state laws banning assault weapons. https://t.co/4ndp6414An
2016-08-11 19:18:43;SenWarren;"I'll keep pushing our federal agencies to reschedule marijuana as part of crafting a rational research &amp; public health strategy."
2016-08-11 19:17:10;SenWarren;"Bad news: @DEAHQ refused to reschedule marijuana. This has wide implications for med research, law enforcement &amp; business."
2016-08-11 19:16:28;SenWarren;Good news: @DEAHQ is eliminating outdated barriers to marijuana research. Common sense given growing pool of med marijuana patients.
2016-08-10 16:16:15;SenWarren;"Read my op-ed w/ @SenWhitehouse on @GOP’s unprecedented attack on free speech &amp; states’ rights for big oil donors: https://t.co/gIRepwVimr"
2016-08-10 16:15:18;SenWarren;When oil-backed @GOP abuse power to stifle state climate change investigations, they don’t advance the 1st Amendment – they trample on it.
2016-08-09 17:56:18;SenWarren;Who does the @USChamber work for? Big corps who stash profits overseas, leaving small biz to pay taxes instead. https://t.co/Tm46RYAIhC
2016-08-09 16:52:06;SenWarren;"More from @nytimes &amp; @TheEye_NECIR on think tank conflicts. Some can be an expert on anything for the right price. https://t.co/3t55RAI7r6"
2016-08-07 16:55:36;SenWarren;"Read this @nytimes story on how corporations fund ""independent"" think tank research to push their interests: https://t.co/jcAcgljYz0"
2016-08-07 16:54:33;SenWarren;Big corporations must disclose lobbying expenditures, but not contributions to think tanks to fund industry-friendly studies. That’s wrong.
2016-08-05 16:27:26;SenWarren;Want to protect open debate, Mr Koch? Disclose the spending you do to bury your opponents in an avalanche of lies: https://t.co/lF703sf4Hw
2016-08-05 16:26:34;SenWarren;Charles Koch, who secretly spends millions to shred candidates and orgs he opposes, is worried that open debate is under attack. Really?!
2016-08-04 22:15:22;SenWarren;".@HouseGOP time &amp; again puts Big Oil interests over every other issue. Proud to stand w/ @MassAGO. Let her investigate &amp; see the facts."
2016-08-04 22:14:51;SenWarren;Every MA delegation member signed a letter to @LamarSmithTX21 w/ concerns about this disgraceful pander to Big Oil. https://t.co/fUl9DZ1liu
2016-08-04 22:07:45;SenWarren;"GOP says @MassAGO’s investigation is a war on 1st Amendment rights. But companies don’t have a right to defraud their investors &amp; consumers."
2016-08-04 22:06:42;SenWarren;We haven't found another example – not one – of a House committee subpoenaing a STATE AG's investigation of potential STATE law violations.
2016-08-04 22:05:48;SenWarren;The @HouseGOP claims to be for states’ rights, but they don’t seem to know the Constitution gives STATES power to enforce STATE law.
2016-08-04 22:04:45;SenWarren;"Sci Chairman @LamarSmithTX21 issued subpoenas to @MassAGO Healey &amp; @AGSchneiderman— a prime example of @HouseGOP abuse of power."
2016-08-04 22:03:48;SenWarren;The GOP-led @HouseScience Committee is helping @exxonmobil deny the reality of climate change.
2016-08-04 15:46:12;SenWarren;Today in the @NEJM I write about the need for transparency in our clinical trial system to improve people's health: https://t.co/l6hBWp53Hk
2016-07-21 17:23:10;SenWarren;Yesterday @MassAGO took an important step to stop the spread of lethal assault-style weapons. Read more here: https://t.co/ElPNcmPTf5
2016-07-20 15:58:34;SenWarren;"Let me offer you a word of advice, @LamarSmithTX21 &amp; your @exxonmobil buddies: you picked a fight with the wrong state &amp; the wrong AG."
2016-07-20 15:57:19;SenWarren;This is an outrageous abuse of Congressional subpoena power to threaten a state AG and help a campaign contributor.
2016-07-20 15:56:08;SenWarren;For the @GOP, states’ rights only apply for restricting voting rights or regulating women’s bodies. Not investigating climate change fraud.
2016-07-20 15:54:16;SenWarren;".@LamarSmithTX21 says he “takes very seriously his obligation to uphold &amp; defend the Constitution” — but apparently not the 10th Amendment."
2016-07-20 15:51:48;SenWarren;Yup, that’s right: House Republicans are interfering with a state AG’s ongoing investigation of a company violating state law.
2016-07-20 15:50:42;SenWarren;"Now @exxonmobil got the Chair of the @HouseScience Committee — a TX Republican who has taken $675k from oil &amp; gas — to subpoena @MassAGO."
2016-07-20 15:49:43;SenWarren;"First @exxonmobil tried to stop @MassAGO by suing Healey in a TX court &amp; attacking her integrity because she’s doing her job."
2016-07-20 15:48:59;SenWarren;.@MassAGO Maura Healey is investigating whether @exxonmobil broke state laws by knowingly misleading people about climate change.
2016-07-20 15:48:23;SenWarren;Want to see how giant corporations rig the system? Look at what @exxonmobil is doing to intimidate @MassAGO to stop fraud investigation.
