timestamp;sn;text
2017-01-07 21:26:04;SenWarren;.@OfficeGovEthics wrote back with “great concern” about the @SenateGOP’s confirmation hearings. https://t.co/YIC6e5TBSs
2017-01-07 21:24:17;SenWarren;"Confirmation hearings start Tuesday, so @SenSchumer &amp; I asked @OfficeGovEthics how the ethics reviews are going. https://t.co/z04Vyhxx5b"
2017-01-07 21:22:19;SenWarren;Confirmation hearings historically aren’t conducted until the @OfficeGovEthics certifies that each nominee has no unresolved conflicts.
2017-01-07 21:21:09;SenWarren;The @SenateGOP are bypassing important steps to make sure these billionaire cabinet nominees are free of dangerous conflicts of interest.
2017-01-07 21:19:48;SenWarren;".@SenateMajLdr &amp; the @SenateGOP are desperately trying to rush Senate confirmation hearings for @realDonaldTrump’s cabinet nominees."
2017-01-05 22:43:00;SenWarren;I’m cosponsoring @CoryBooker’s bill so the fed gov can't engage in surveillance or harassment of immigrant groups. https://t.co/BPOzNTpyJm
2017-01-05 22:41:48;SenWarren;Targeting people based on their religion flies squarely in the face of who we are as Americans – and it makes our country less safe.
2017-01-03 22:50:58;SenWarren;"Welcome @SenDuckworth &amp; @SenCortezMasto to the US Senate! https://t.co/cwWVPOWP0K"
2017-01-03 03:06:02;SenWarren;Tell us, @GOP: Who, exactly, thinks that the problem with Washington is that we have too many rules requiring the gov to act ethically?
2017-01-03 03:04:42;SenWarren;And now the @HouseGOP is gutting its ethics office in the middle of the night – hours before the new Congress is sworn in.
2017-01-03 03:03:30;SenWarren;"Trump’s cabinet of billionaires &amp; CEOs have ignored gov ethics rules &amp; dragged their feet on FBI background checks &amp; financial disclosures."
2017-01-03 03:02:23;SenWarren;.@realDonaldTrump still hasn’t announced plans for his business empire while falsely claiming the President can’t have conflicts.
2017-01-02 20:00:47;SenWarren;Read my @TalkPoverty piece on why everyone who supports a strong @CFPB must continue fighting to protect it. https://t.co/NI7PRn97r6
2016-12-30 16:57:28;SenWarren;"We’ve received heartbreaking stories of ppl hurt by OneWest Bank &amp; Steve Mnuchin. There’s still time to share yours… https://t.co/FQl5k83TO7"
2016-12-23 20:09:36;SenWarren;If the outgoing Obama Admin won’t find a solution for SS recipients taxed on their forgiven student loans, the incoming Trump Admin should.
2016-12-23 20:08:29;SenWarren;It’s baffling that @USTreasury won’t act to protect hundreds of thousands of people. https://t.co/XmNC1DEyOR
2016-12-23 20:07:28;SenWarren;"This is nuts. @USTreasury has helped real estate developers &amp; trust fund owners with taxes on forgiven debts – but not SS recipients?!"
2016-12-23 20:06:19;SenWarren;.@usedgov plans to forgive student loans for people with severe disabilities – but @USTreasury wants to stick them with a giant tax bill.
2016-12-23 20:04:57;SenWarren;387k Social Security recipients are struggling to pay student loans but have been diagnosed with a disability so severe they can’t work.
2016-12-23 16:56:05;SenWarren;Every nominee must follow the law before they are confirmed – even rich ones who think the rules don't apply. https://t.co/DwCczwAcu9
2016-12-23 16:53:11;SenWarren;If President-elect @realDonaldTrump's cabinet nominees ignore the ethics rules, it's a recipe for corruption. https://t.co/eMPhPZRm4k
2016-12-23 16:52:04;SenWarren;"Rs &amp; Ds always require cabinet nominees to complete FBI background checks &amp; ethics agreements to resolve financial conflicts."
2016-12-23 16:50:59;SenWarren;Federal agency appointees can face jail time if they make official government decisions that affect their own financial interests.
2016-12-23 16:49:56;SenWarren;Cabinet officials must put the interests of the nation ahead of their own bank accounts. It's not just good government – it's the law.
2016-12-23 02:53:25;SenWarren;"Thanks @POTUS &amp; @DHSgov for reaffirming US values by ending the xenophobic NSEERS program. We're better than that. https://t.co/u0BuYPe9IZ"
2016-12-21 16:07:50;SenWarren;Happy #NaismithDay, and thank you Springfield, MA for giving us the game of basketball! #125HoopYears https://t.co/yfkL6Itw1k
2016-12-16 18:21:52;SenWarren;Were you or someone you know hurt by Steve Mnuchin, OneWest Bank or Financial Freedom? Tell the @SenateDems: https://t.co/KBXukZcO1k
2016-12-16 18:19:55;SenWarren;.@realDonaldTrump wants to hand Steve Mnuchin the keys to @USTreasury – where he can make big banks even richer at the expense of families.
2016-12-16 18:18:01;SenWarren;"Steve Mnuchin &amp; OneWest also ran Financial Freedom, which serviced 17% of reverse-mortgages but were responsible for 39% of foreclosures."
2016-12-16 18:12:02;SenWarren;"Steve Mnuchin &amp; OneWest Bank swooped in after the 2008 crash &amp; aggressively – &amp; sometimes illegally – foreclosed on people’s homes."
2016-12-15 17:30:25;SenWarren;Placing assets in a true blind trust has been the standard for previous presidents. Our bill makes clear we expect Trump to do the same.
2016-12-15 17:28:55;SenWarren;".@SenatorCardin, @ChrisCoons, @SenatorDurbin, @SenJeffMerkley &amp; I will introduce a bill in January to implement the Emoluments Clause."
2016-12-15 17:27:15;SenWarren;"The only way for @realDonaldTrump to eliminate conflicts-of-interest is to divest his financial interests &amp; place them in a blind trust."
2016-12-15 17:26:09;SenWarren;Americans deserve to know that the President is doing what’s best for the country – not using his office to do what’s best for himself.
2016-12-14 22:50:35;SenWarren;"I look forward to working closely with the bases, companies &amp; research labs across MA as a member of the Armed Services Committee."
2016-12-14 22:49:07;SenWarren;"Massachusetts leads the US in innovative defense work &amp; scientific research. Our expertise is critical to keeping our country safe."
2016-12-14 22:47:43;SenWarren;As we’ve seen with the recent Russian cyberattacks, the nature of our national security threats is changing, and we need to change too.
2016-12-14 22:46:32;SenWarren;"Congress must provide effective support &amp; oversight of the Armed Forces, monitor ntl security threats &amp; ensure responsible use of force."
2016-12-14 22:45:25;SenWarren;"All 3 of my brothers served in the military. I understand the sacrifice servicemembers make, &amp; @DeptofDefense’s work to keep us safe."
2016-12-14 22:44:14;SenWarren;I’m pleased to announce that I’ll be serving on the Senate Committee on Armed Services in the next Congress.
2016-12-13 20:57:51;SenWarren;RT @SenatorCarper: I urge President-elect Trump to take the advice of the Office of Government Ethics and divest his business holdings http…
2016-12-13 00:17:28;SenWarren;.@exxonmobil can’t bully @MassAGO Healey in a TX courtroom or anywhere else. We stand with Maura Healey. https://t.co/6VbwBrHb0p
2016-12-13 00:04:02;SenWarren;I’m glad the Obama Admin has fought hard to clean up the for-profit college industry. Will the next Admin fight for students or the crooks?
2016-12-13 00:01:54;SenWarren;.@usedgov also deserves credit for new steps to prevent lousy for-profit colleges rubber-stamped by ACICS from cheating more students.
2016-12-13 00:00:54;SenWarren;"I’m glad @JohnKingatED held firm &amp; finally pulled the plug on for-profit college accreditor ACICS. https://t.co/WO44Sq9ydA"
2016-12-09 23:02:08;SenWarren;Congress should pass the bipartisan legislation ready to go TODAY to make good on its 70-yr promise to our miners. https://t.co/5HBswCUge6
2016-12-09 23:01:36;SenWarren;90k miners will also soon lose their pensions. It’s $7k/yr on avg – not much –but the promise of SS + those pensions are all many have got.
2016-12-09 23:01:05;SenWarren;"If Congress goes home &amp; doesn’t act, 16k miners will lose their insurance by the end of the month. 2.5k more by March. 4k more by July."
2016-12-09 23:00:01;SenWarren;"70 years ago, the gov made a promise to union coal miners: health insurance &amp; pensions for putting their lives at risk to power our country."
2016-12-09 21:57:27;SenWarren;"Heading to the Senate floor to support @Sen_JoeManchin, @SenCapito, &amp; their fight for America's coal miners. Watch: https://t.co/wM38koMW5q"
2016-12-09 16:29:18;SenWarren;.@US_FDA’s actions will implement 1 part of my bill with @ChuckGrassley to help adults get access to hearing aids. https://t.co/8HDo378LcE
2016-12-09 16:28:00;SenWarren;Glad to see @US_FDA recognize that over-the-counter hearing aids can improve access to millions of Americans. https://t.co/BHbrgXKIkx
2016-12-09 15:50:54;SenWarren;RT @VertexPharma: Thanks @OrrinHatch @SenatorBurr @SenWarren @SenBennetCO for your commitment to patients with #rarediseases #CuresNow #tar…
2016-12-09 00:11:56;SenWarren;Appointing Andrew Puzder to run the agency responsible for protecting workers is a slap in the face for every hard-working American family.
2016-12-09 00:10:01;SenWarren;"Andrew Puzder plotted to replace his workers with machines because they are ""always polite"" &amp; ""never take a vacation."""
2016-12-09 00:08:35;SenWarren;"Andrew Puzder looks down on working people. At @Hardees &amp; @CarlsJr, he got rich squeezing front-line workers on wages, overtime &amp; benefits."
2016-12-08 15:32:57;SenWarren;"Many in our communities rely on free broadcast TV. I share @SenMarkey’s concerns about NBC signal loss in MA &amp; call… https://t.co/jYYxZmJGLD"
2016-12-08 02:44:21;SenWarren;"I’ll keep fighting to implement the good policies in #CuresAct, repeal the giveaways, &amp; hold Congress accountable for NIH &amp; opioid funding."
2016-12-08 02:42:29;SenWarren;But I believe the final 21st Century #CuresAct still failed to live up to the standards we should expect from our Congress.
2016-12-08 02:40:55;SenWarren;"We also got a ridiculous provision removed from the #CuresAct that would let drug companies hide kickbacks to doctors &amp; hospitals."
2016-12-08 02:39:36;SenWarren;By fighting back, we changed a #CuresAct provision that would let @realDonaldTrump decide opioid spending. Now MA should get its fair share.
2016-12-08 02:38:20;SenWarren;Republicans also broke their promise in the #CuresAct to meaningfully boost guaranteed funding for NIH and the opioid crisis.
2016-12-08 02:37:15;SenWarren;Republicans concluded that bipartisan medical innovation in the #CuresAct would require a raft of giveaways to giant drug companies.
2016-12-08 02:35:42;SenWarren;I’m glad that many good provisions in the #CuresAct will become law, but I’m disappointed by the price we paid for the GOP to pass the bill.
2016-12-08 02:34:28;SenWarren;The #CuresAct includes my bipartisan provision reducing the admin burden at NIH to ensure more efficient spending of fed research money.
2016-12-08 02:33:25;SenWarren;"The #CuresAct includes my bipartisan provision ensuring the meaningful inclusion of women &amp; minorities in clinical trials."
2016-12-08 02:32:09;SenWarren;The #CuresAct includes my bipartisan provision supporting the development of genetically-targeted therapies for people with rare diseases.
2016-12-08 02:31:22;SenWarren;The #CuresAct includes my bipartisan provision to strengthen Senator Kennedy’s work to protect the genetic privacy of patients.
2016-12-08 02:30:23;SenWarren;"The 21st Century #CuresAct includes a number of bipartisan provisions that I’ve spent months &amp; years working with others to write &amp; pass."
2016-12-07 23:32:24;SenWarren;"So will you keep your promise to protect Medicare &amp; Medicaid, @realDonaldTrump? My colleagues &amp; I want to know: https://t.co/PtyEAZL1HP"
2016-12-07 23:31:28;SenWarren;"But the election is over, @realDonaldTrump, &amp; now you’re shifting to support changes that would gut Medicare &amp; Medicaid."
2016-12-07 23:30:17;SenWarren;"During your presidential campaign, @realDonaldTrump, you promised you were the only Republican who would protect Medicare &amp; Medicaid."
2016-12-07 21:24:58;SenWarren;I know I speak for millions when I say: Thank you for your tireless fight, @VP Biden. We wish you the very best.… https://t.co/MCOHOk2sHC
2016-12-07 19:52:10;SenWarren;"I introduced the Jessica Kensky &amp; Patrick Downes Act to let terrorism victims access military healthcare facilities. https://t.co/nMq3tfdIm6"
2016-12-07 19:50:52;SenWarren;"We need to allow military doctors to share their expertise &amp; provide terrorism victims with streamlined access to our military healthcare."
2016-12-07 19:49:55;SenWarren;"I visited Jess &amp; Patrick at Walter Reed &amp; saw the state-of-the-art facilities &amp; world-class physicians who helped them recover more fully."
2016-12-07 19:48:56;SenWarren;"Jessica Kensky &amp; Patrick Downes survived the Boston Marathon bombing. @DeptofDefense gave them special designation for care at Walter Reed."
2016-12-07 17:27:27;SenWarren;"We know the big bank onslaught to roll back critical financial rules &amp; pad bankers’ pockets is coming. It’s up to all of us to fight back."
2016-12-07 17:26:25;SenWarren;"Big banks like @WellsFargo have no shame. No matter how much they hurt investors &amp; customers, they're prowling to gut Dodd-Frank."
2016-12-07 17:25:25;SenWarren;Fresh off of defrauding customers, @WellsFargo’s new CEO wants Congress to weaken the financial rules. https://t.co/wIZeJFUCie
2016-11-30 20:25:09;SenWarren;"Trump, Mnuchin &amp; @HouseGOP may be willing to gamble w/ our economy, but @HouseDemocrats should side with ppl who want tougher Wall St rules."
2016-11-30 20:23:52;SenWarren;Steve Mnuchin would get to decide how to regulate 30 of our biggest banks – including the bank where he currently serves as board member.
2016-11-30 20:22:47;SenWarren;"HR 6392 would take power away from independent regulators &amp; give it to @realDonaldTrump’s choice for Treasury Secretary, Steve Mnuchin."
2016-11-30 20:21:26;SenWarren;The banks cut loose by HR 6392 are the same size as the banks that helped bring down the economy in 2008. What could possibly go wrong?!
2016-11-30 20:20:21;SenWarren;.@HouseGOP aren’t waiting for @realDonaldTrump to roll back Wall St reform. HR 6392 guts Dodd-Frank rules for 30 of the biggest banks.
2016-11-30 19:33:40;SenWarren;I still oppose the 21st Century Cures Act. The American people deserve a better deal. https://t.co/YAxDpglGGm
2016-11-30 19:32:46;SenWarren;"21st Century Cures still doesn’t do nearly enough to help generate real cures for Alzheimer’s, diabetes, cancer, &amp; other deadly diseases."
2016-11-30 19:31:32;SenWarren;21st Century Cures no longer lets drug companies hide kickbacks to doctors, but it still lets drug companies get away with fraud.
2016-11-30 19:30:22;SenWarren;"Since the public got wind of the Big Pharma giveaways &amp; Congress started feeling the heat, 21st Century Cures has changed a little."
2016-11-30 16:58:23;SenWarren;"Heading to the Senate floor w/ @SenJeffMerkley &amp; @SenatorDurbin to discuss why I still oppose the Cures Act. Watch: https://t.co/yqWgK1qEGx"
2016-11-29 21:47:00;SenWarren;"RT @SenWhitehouse: My 150th climate speech is live on @CSPAN 2 at ~4:45pm. We've got to #ActOnClimate now &amp; #draintheswamp of special inter…"
2016-11-29 20:01:39;SenWarren;"I’m proud to #Fightfor15 alongside workers in Massachusetts &amp; nationwide. #povertydoesntfly https://t.co/zPWmk3aTF3"
2016-11-29 19:59:45;SenWarren;"Building economic security starts by raising the min wage to $15/hr &amp; making sure every worker has the right to join a union. #fightfor15"
2016-11-29 19:58:42;SenWarren;No one who works full time should live in poverty. Not fast food workers, Uber drivers, or hardworking folks at @BostonLogan. #Fightfor15
2016-11-29 01:02:01;SenWarren;"I told my Dem colleagues: We weren’t sent to Congress to roll over to drug companies. Show some spine &amp; fight back. https://t.co/QvSJiGmUaF"
2016-11-29 01:00:47;SenWarren;"I know the difference between compromise &amp; extortion – and I cannot vote for the 21st Century Cures Act as it currently stands."
2016-11-29 00:59:29;SenWarren;"Every good proposal in the Cures Act will die unless Democrats help drug companies commit fraud, give out kickbacks, &amp; put patients at risk."
2016-11-29 00:58:12;SenWarren;Congress has been working on medical innovation legislation for yrs. But in the final days of 2016, Big Pharma hijacked 21st Century Cures.
2016-11-28 21:50:00;SenWarren;Big Pharma has hijacked the 21st Century Cures Act. About to speak on the Sen floor about my concerns with the bill. https://t.co/aaP67lX8jh
2016-11-28 19:27:05;SenWarren;"Congress should pass the bipartisan Retirement Savings Lost &amp; Found Act – a commonsense bill to help Americans retire with dignity."
2016-11-28 19:25:47;SenWarren;".@SteveDaines &amp; I introduced a bill to help workers locate old 401(k)s online. Read more about it in @WSJ: https://t.co/wPD51v3RJL"
2016-11-28 19:24:53;SenWarren;"When workers leave jobs, retirement accounts get left behind. Up to 30% of retirement plans &amp; hundreds of millions $$$ are lost/neglected."
2016-11-23 17:50:33;SenWarren;".@realDonaldTrump’s transition “disarray” &amp; serious conflicts of interest raise questions that taxpayers deserve to have answered."
2016-11-23 17:49:26;SenWarren;".@RepCummings &amp; I asked @USGAO to review @realDonaldTrump’s taxpayer-funded transition today.… https://t.co/OuUOzbtY6j"
2016-11-23 17:48:20;SenWarren;"The President of the US should work for you – &amp; not exploit the most powerful office in the world &amp; your tax dollars to make a quick buck."
2016-11-22 22:23:21;SenWarren;.@USTreasury shouldn’t drag its feet to say that 387k people's cancelled student loans aren’t taxable. https://t.co/5YuiU61846
2016-11-21 15:49:43;SenWarren;RT @presmccartney: Steve Bannon has made some uninformed comments about the Seven Sisters. Today, we have our own message for him. https://…
2016-11-18 23:38:03;SenWarren;We should all be very worried if a @realDonaldTrump Education Dept will stand up for students being ripped off at shady for-profit colleges.
2016-11-18 23:36:18;SenWarren;It is totally unprecedented for a President-elect of the United States to have to settle fraud lawsuits before taking office.
2016-11-18 23:35:12;SenWarren;".@realDonaldTrump just paid $25 million for breaking the law &amp; ripping off students. https://t.co/G73gPNd7lS"
2016-11-18 23:34:11;SenWarren;.@realDonaldTrump swindled thousands of students at his sham “Trump University.” That’s not up for debate anymore – that’s a fact.
2016-11-18 19:56:14;SenWarren;"Today, a new GOP Senate must decide whether self-interest &amp; political cowardice will prevent them from once again doing what is right."
2016-11-18 19:53:25;SenWarren;"30 yrs ago, a GOP Senate rejected @SenatorSessions’ judicial nomination, affirming no compromise with racism; no negotiation with hate."
2016-11-18 19:52:12;SenWarren;If @realDonaldTrump refuses to reverse on @SenatorSessions, it falls on the Senate to exercise fundamental moral leadership for our nation.
2016-11-18 19:51:19;SenWarren;Instead of embracing the bigotry of his rallies, I urge @realDonaldTrump to reverse his decision to nominate @SenatorSessions for AG.
2016-11-18 15:16:17;SenWarren;Gov @MittRomney: when you're meeting with @realDonaldTrump, maybe you could bring your binders full of women with y… https://t.co/UYD32JzZR4
2016-11-17 22:46:41;SenWarren;Today I spoke about @realDonaldTrump’s decision to hand over the government to the worst special interests. Watch: https://t.co/mx9z44CZ13
2016-11-17 22:45:31;SenWarren;.@realDonaldTrump isn’t “draining the swamp.” He’s inviting the biggest, ugliest swamp monsters in the front door.
2016-11-17 19:36:53;SenWarren;About to speak on the Senate floor about @RealDonaldTrump’s broken promise to #draintheswamp. Watch live: https://t.co/9cyvsLgdnt
2016-11-17 19:22:25;SenWarren;"Registering &amp; tracking Americans based on race or religion is idiotic. Disgusting. Unconstitutional. And it’s a recruiting bonanza for ISIS."
2016-11-17 18:16:13;SenWarren;If @realDonaldTrump thinks we’re going to just roll over while his Wall St buddies crash our economy again, they're in for a rude awakening.
2016-11-17 18:14:39;SenWarren;"Why is Wall St celebrating @realDonaldTrump? Because his administration ""looks like an investment banker’s dream.” https://t.co/ugnYkjTOd7"
2016-11-16 23:34:03;SenWarren;"I ask the financial industry: Bigotry is bad for our country &amp; business. What message do you send customers &amp; employees if you stay silent?"
2016-11-16 23:32:55;SenWarren;".@SenSherrodBrown, @MaxineWaters, @keithellison &amp; I sent a letter to banking leaders, urging them to condemn Bannon. https://t.co/eCiitHjOmP"
2016-11-16 23:31:37;SenWarren;.@realDonaldTrump appointed a bigot as his WH Chief Strategist. This is a moral test for all of us – including the business community.
2016-11-16 15:51:00;SenWarren;"Brought a longtime friend &amp; my new colleague by the office today – our new Senator-Elect from CA, @KamalaHarris! https://t.co/6PbkLwlRQV"
2016-11-15 21:48:37;SenWarren;"#draintheswamp on your team, @realDonaldTrump. The American people demanded changes, &amp; we’re watching you every step of the way."
2016-11-15 21:47:24;SenWarren;And I sent a letter to @realDonaldTrump raising my concerns about the insiders running his transition team: https://t.co/f9cRhIci8l
2016-11-15 21:46:08;SenWarren;Today I told a room full of CEOs at the #WSJCEOCouncil: Nobody wants them to keep running the gov for themselves. https://t.co/PhyLkxE4dn
2016-11-15 21:44:51;SenWarren;"Keeping these lobbyists &amp; insiders on your team sends a clear message, @realDonaldTrump: your campaign was a giant con."
2016-11-15 21:43:28;SenWarren;"You already broke your promise, @realDonaldTrump. You stacked your transition team with Wall Street elites, insiders &amp; lobbyists."
2016-11-15 21:42:12;SenWarren;".@realDonaldTrump, you promised the American people you’d #draintheswamp of lobbyists &amp; insiders rigging the system for the rich &amp; powerful."
2016-11-15 00:03:52;SenWarren;The President of the United States should condemn bigots, @realDonaldTrump. Not give them a West Wing office to decide our country's future.
2016-11-15 00:02:48;SenWarren;"Steve Bannon promoted white nationalism, @realDonaldTrump. He's been praised by KKK supporters &amp; denounced by @splcenter &amp; @ADL_National ."
2016-11-15 00:01:42;SenWarren;"Tell us, @realDonaldTrump: You said you'd be a ""President for all."" Then why are you embracing the ugliness &amp; divisiveness of your campaign?"
2016-11-14 18:10:33;SenWarren;Let me be clear: It's foolish for any Dem to think that weakening support for the @CFPB is good for the country or good for us as a party.
2016-11-14 18:09:05;SenWarren;"Anyone in Congress – GOP or Dem – who votes to weaken the @CFPB will declare loud &amp; clear they represent giant banks, not working families."
2016-11-14 18:07:39;SenWarren;"The @CFPB has returned over $11 BILLION to consumers who have been cheated by big banks &amp; financial institutions."
2016-11-14 18:06:28;SenWarren;"If I were Wall Street &amp; the GOP, I’d be scared too: The @CFPB goes after big banks like @WellsFargo when they break the law."
2016-11-14 18:05:16;SenWarren;"The real reason Wall St &amp; their @GOP allies are going after the @CFPB is because it’s working too darn well for consumers &amp; must be stopped."
2016-11-14 18:04:17;SenWarren;You’re going to hear a lot of reasons why we must make these changes to the @CFPB. Not one of them is going to be true.
2016-11-14 18:03:28;SenWarren;"It’s only been a few days since the election &amp; Wall St banks &amp; their @GOP friends are already licking their chops to undercut the @CFPB."
2016-10-21 18:28:23;SenWarren;And @FCC should ban unreasonable pay-for-privacy schemes that coerce consumers to give up #privacy for discounts. https://t.co/CG8MNN9LcJ
2016-10-21 18:26:19;SenWarren;"The @FCC can do something about #broadband #privacy – &amp; they should @TomWheelerFCC @JRosenworcel @MClyburnFCC @AjitPaiFCC @mikeofcc"
2016-10-21 18:25:28;SenWarren;"Right now we have no #broadband #privacy rules to protect consumers – no rules on how companies can collect, use, share, &amp; sell our data."
2016-10-20 18:27:01;SenWarren;Great to see the @nytimes agrees it’s time to pass my Accreditation Reform and Enhanced Accountability Act: https://t.co/tqk48zWDlu
2016-10-20 14:53:25;SenWarren;Glad to write the intro for @acslaw’s new Big Ideas report on top policy recs for the next administration: https://t.co/0oOlgE16oz
2016-10-18 21:29:14;SenWarren;Congress should pass the #SAVEBenefits Act in Nov to give a much-needed boost to millions of Americans on Soc Security who have earned it.
2016-10-18 21:28:04;SenWarren;".@RepDuckworth &amp; I introduced the #SAVEBenefits Act to give 70M Americans a one-time 3.9% Social Security payment. There's still time."
2016-10-18 21:27:02;SenWarren;Today the @SocialSecurity Admin announced a 0.3% COLA for 2017. For many Americans struggling to make ends meet, that offers little relief.
2016-10-14 17:16:14;SenWarren;The SEC needs new leadership to return to its mission to protect investors. @POTUS should use his authority to designate a new chair today
2016-10-14 17:14:42;SenWarren;SEC Chair White has refused to advance a rule to require public corporations to disclose political spending despite broad bipartisan support
2016-10-14 17:13:25;SenWarren;But under Chair White the SEC routinely ignores needs of investors to cater to interests of big businesses, dragging its feet on key rules
