timestamp;sn;text
2016-11-07 01:45:39;ezraklein;"""When did Barack Obama — the president of the United States — become the United States’ foremost thrower of shade?"" https://t.co/7h815BFbJb"
2016-11-07 01:40:16;ezraklein;RT @ddale8: The impact of those long, long lines to vote: https://t.co/Y48cm31c1h https://t.co/DNBl4oG7bu
2016-11-07 00:25:19;ezraklein;This is not an impossible problem for Facebook to solve, or at least address: https://t.co/D7NrtO2TgF
2016-11-07 00:23:36;ezraklein;RT @stevesi: This is a new form of spam that Facebook needs to combat. Lots of ways to work on this. Needs to happen. https://t.co/EvOltaR3…
2016-11-07 00:19:41;ezraklein;If polls stayed open so a long line of white voters could vote, the Trump campaign would not have this reaction: https://t.co/tNy0zQF5FE
2016-11-06 22:11:46;ezraklein;Come for the mean tweets, stay for the clear discussion of trend line adjustments: https://t.co/7TVO6InrAw
2016-11-06 22:08:14;ezraklein;This photo tho https://t.co/WrH1VnZSsX
2016-11-06 22:04:01;ezraklein;RT @DKThomp: Quantifying the Comey Shock https://t.co/OMJvgzUPMJ https://t.co/J5m909DEld
2016-11-06 21:05:04;ezraklein;"Agree with this. Simply making voters think the words ""FBI"" or ""emails"" is bad for Clinton right now. https://t.co/kzbNi4pyPD"
2016-11-06 21:04:20;ezraklein;RT @voxdotcom: The real Clinton email scandal is that a bullshit story has dominated the campaign https://t.co/9UW6jVQI3L
2016-11-06 20:57:30;ezraklein;RT @drvox: As you read about all these long lines and voter hassles, remember: there's a better way. Voting by mail works. https://t.co/R6G…
2016-11-06 20:54:41;ezraklein;RT @voxdotcom: FBI director: New emails don’t change our conclusion that Clinton shouldn’t be charged https://t.co/IPgRJQlohl
2016-11-06 20:54:35;ezraklein;If it's true that our state security services are this out-of-control, that's actually a crisis https://t.co/XwAkSq5oX9
2016-11-06 20:29:24;ezraklein;RT @voxdotcom: Time zones were a good idea when they were invented in the 19th century. But today they cause more trouble than they're wort…
2016-11-06 20:21:21;ezraklein;Another reminder that the real scandal is how a BS story dominated this entire campaign: https://t.co/nmFrAhnZSo https://t.co/M6Mej440pn
2016-11-06 20:14:59;ezraklein;"RT @samsteinhp: As we marvel at on-message Trump, note he’s:
- made up impending indictment
- suggested ED rigging
- lied abt Obama yelling…"
2016-11-06 20:12:25;ezraklein;This is appalling. No one in America should ever have to wait this long to vote. https://t.co/zaX006SZaL
2016-11-06 20:06:22;ezraklein;In Florida, more people have voted early than voted in all of Pennsylvania in the 2012 election: https://t.co/TguHXEmJnU
2016-11-06 18:24:29;ezraklein;The Republican civil war starts the day after the election: https://t.co/X1phi35KPo
2016-11-06 18:05:15;ezraklein;Thanks! https://t.co/utLbn3GbVV
2016-11-06 17:53:38;ezraklein;"""Mr. Trump still privately muses about all of the ways he will punish his enemies after Election Day"" https://t.co/y1GbF0cy5a"
2016-11-06 15:43:33;ezraklein;This kicker deserves an award: https://t.co/JR0txInoJA
2016-11-06 14:21:30;ezraklein;"Had a great pre-election podcast convo with @davidfrum. You don't want to miss this one: https://t.co/oLDUldADPg

https://t.co/S1VT8W4y7p"
2016-11-06 14:10:14;ezraklein;"RT @amirtibon: A politician who blatantly lies by describing a peaceful protest as an ""assasination attempt"" will do the same to his oppone…"
2016-11-05 22:39:55;ezraklein;"RT @voxdotcom: We're looking for writers to help us expand our foreign coverage.

Apply here:

https://t.co/d81QoTCuvY
https://t.co/Lu6Fios…"
2016-11-05 21:05:46;ezraklein;Sad reality: we will never really know whose election forecast was right because they are all probabilistic
2016-11-05 20:49:09;ezraklein;Now is a good time to read our dive into how the 538 model works, which includes a bonus dive into the HuffPo model: https://t.co/hlG8osFy8O
2016-11-05 20:18:35;ezraklein;"RT @steveschale: One more thing:  Remember how I told you Wednesday was record day for AfAm turnout in FL...until Thursday?

Well, Friday b…"
2016-11-05 20:18:32;ezraklein;"RT @steveschale: Overall EV diversity in Florida through Friday:
White: 67.5%
Black: 12.4%
Hispanic: 14.6%

Definitely trending more divers…"
2016-11-05 16:26:12;ezraklein;"""the final day of early voting Friday was, Ralston writes, 'cataclysmic' for Republicans"" https://t.co/thLyAseX0v"
2016-11-05 14:57:21;ezraklein;The anti-Clinton insurgency at the FBI, explained: https://t.co/RVTQaF9ISN
2016-11-04 23:19:04;ezraklein;@mollyesque even more whoa if untrue tho
2016-11-04 22:56:05;ezraklein;I thought this too, but 2012-like look of early voting is making me doubt Clinton’s GOTV advantage will be so huge https://t.co/ccBcALItem
2016-11-04 19:55:01;ezraklein;"""The defining characteristic of our moment is that parties are weak while partisanship is strong"" https://t.co/20UoK5Ps6M"
2016-11-04 19:16:05;ezraklein;RT @voxdotcom: Radio host Charlie Sykes reflects on what Donald Trump has done to the Republican party and his decision to go off the air.…
2016-11-04 18:49:54;ezraklein;Counties monitored by the Voting Rights Act have closed down at least 868 polling places since the SCOTUS decision: https://t.co/tElCw4WBYt
2016-11-04 15:39:52;ezraklein;So does Trump remove Christie from running his transition team now?
2016-11-04 15:37:17;ezraklein;Tim Kaine’s law school roommate takes to Facebook to corroborate the rumors that Tim Kaine is really nice: https://t.co/crZQMh2o0f
2016-11-04 15:08:01;ezraklein;This app lets third-party voters in swing states trade their votes with Clinton supporters in safe states: https://t.co/HclZRk5ARU
2016-11-04 14:58:49;ezraklein;Are we witnessing the end of the Fox News era? https://t.co/XawULf3lL6
2016-11-04 14:50:46;ezraklein;Given the geography of Clinton's coalition, a popular vote win but electoral college loss is genuinrely possible: https://t.co/6kU2xf4OAP
2016-11-04 13:56:08;ezraklein;Great, poli-sci driven explanation of how swing voters went extinct, and how it’s changing politics: https://t.co/ogfOsgc2wE
2016-11-04 13:41:39;ezraklein;"RT @sarahkliff: 🚨LAST PRE-ELECTION WEEDS🚨
https://t.co/IYQYReRrns"
2016-11-04 13:38:19;ezraklein;The real Clinton email scandal is that a bullshit story has dominated the campaign:  https://t.co/nmFrAhFAJW
2016-11-04 12:53:43;ezraklein;The single best thing I've read putting Trumpism in context:  https://t.co/YlgFXaplha
2016-11-03 21:47:23;ezraklein;Ben Bernanke reviews the new Greenspan biography: https://t.co/4bRrRJRU82
2016-11-03 21:26:23;ezraklein;"""The defining characteristic of our moment is that parties are weak while partisanship is strong"" https://t.co/20UoK5Ps6M"
2016-11-03 21:08:43;ezraklein;I understand response rate bias is real, but I don't  understand *why* supporters refuse to answer polls when their candidate is doing badly
2016-11-03 19:56:58;ezraklein;Why I can't stop reading Twitter/eating Halloween candy, explained: https://t.co/GEIh2W3i7u
2016-11-03 19:43:03;ezraklein;I get asked about this story often, so here's why Vox, like other media outlets, is skeptical of it: https://t.co/i0JPlqEIge
2016-11-03 18:34:38;ezraklein;RT @thegarance: Spencer @attackerman reports FBI agents are actively trying to influence the campaign https://t.co/WAzOmAOvmY https://t.co/…
2016-11-03 18:32:37;ezraklein;This, from @dylanmatt, is a great insight: Hillary Clinton's agenda is a minimal viable product for social democracy https://t.co/IDd5wZYe49
2016-11-03 17:46:01;ezraklein;RT @voxdotcom: A British court just prevented the prime minister from Brexiting. Here’s what that means. https://t.co/kwMNDLfju5
2016-11-03 17:31:57;ezraklein;RT @DKThomp: 3. A lot of national media co's--both digital native and legacy--will be fine, even RICH. It's local news that ppl should worr…
2016-11-03 17:27:20;ezraklein;The workers who have the most at stake in this election aren’t white men: https://t.co/XrOW4azZny
2016-11-03 17:22:47;ezraklein;Hillary Clinton's reputation for incremental policymaking has been vastly overstated: https://t.co/IDd5wZYe49 https://t.co/LsJ33uswRK
2016-11-03 16:56:30;ezraklein;If you communicate with other human beings, or are following this election, you shoud listen to Deborah Tannen: https://t.co/tWQ8q3WgPJ
2016-11-03 16:23:17;ezraklein;The logic behind the 538 model's relatively pro-Trump results, explained: https://t.co/hlG8osX9xo
2016-11-03 12:32:32;ezraklein;RT @hyperplanes: Romans mostly measured time in terms of AM vs PM. You scheduled something for the morning or the afternoon, but not more s…
2016-11-02 21:41:56;ezraklein;Study after study has found that voter ID laws have little to no effect on voter turnout: https://t.co/WHL4CpeH3Z
2016-11-02 21:30:57;ezraklein;The reason it's so hard to rig an American election is it's really thousands of separate elections: https://t.co/xmO199unWn
2016-11-02 21:22:54;ezraklein;.@CHSommer's view on how Trump's brand of masculinity contrasts with Obama's brand of masculinity is interesting: https://t.co/gWQVKknkgc
2016-11-02 20:46:06;ezraklein;An American Muslim comedian on being typecast as a terrorist — and then being mistaken for one: https://t.co/vAd4yFMdyj
2016-11-02 20:42:23;ezraklein;The scariest thing about the newspaper cuts and advertising numbers is imagining what happens in the next recession: https://t.co/cXJVSnTKIe
2016-11-02 20:19:43;ezraklein;"RT @DKThomp: When Facebook went public, it didn't run mobile ads and said this was FB's 3rd biggest risk factor.

Now mobile is 84% of FB a…"
2016-11-02 18:59:06;ezraklein;This isn't just true for emails -- it's what happens after almost all gaffes that seem gamechanging: https://t.co/0G31mNtNr8
2016-11-02 18:28:14;ezraklein;I did not see that Old School reference coming, @jonathanchait: https://t.co/fa8I97LcAK
2016-11-02 18:22:41;ezraklein;Liberals like panicking over individual polls, but the big picture is Clinton's swing-state firewall is holding: https://t.co/Z09fpqTgiE
2016-11-02 18:02:17;ezraklein;We are drowning in information about Hillary Clinton, so why do we feel we know so little about her? https://t.co/2PbB2AbiOg
2016-11-02 17:40:44;ezraklein;Good reality check on the very bad reporting about those male birth control studies: https://t.co/YFsOMWVAFz
2016-11-02 17:32:03;ezraklein;Watch @yochidreazen explain Donald Trump's foreign policy, which is more coherent than people give credit for: https://t.co/fSGJVGg2cv
2016-11-02 17:18:20;ezraklein;"RT @voxdotcom: ""Amoral masculinity"": a theory for understanding Trump from a feminist contrarian https://t.co/tNg29rNuiO"
2016-11-02 16:55:29;ezraklein;Read this instead of obsessing about polls: https://t.co/V9hIZ9rlT1
2016-11-02 16:46:58;ezraklein;Jon Stewart recalls the time Trump tried “to let people know I’m a Jew”: https://t.co/XcoNjlFod2
2016-11-02 15:52:01;ezraklein;RT @voxdotcom: Just imagine what the FBI saga would look like under a vengeful President Trump https://t.co/rStlWN0ypm
2016-11-02 14:30:10;ezraklein;Republicans and Russian hackers have made Hillary Clinton the most transparent candidate in history https://t.co/F3Spbm8z2z
2016-11-02 14:09:43;ezraklein;RT @sarahkliff: Trump left something out of his Obamacare speech — the 21 million his plan leaves uninsured.  https://t.co/T0gsO9gtus https…
2016-11-02 13:10:20;ezraklein;This has been the signal failure of the press in this election: https://t.co/KorsNsqxNY
2016-11-01 20:33:43;ezraklein;I'm old enough to remember when liberals were worried Clinton was too far ahead in the polls so Democrats would get complacent and stay home
2016-11-01 17:14:39;ezraklein;It would be so great to have a real conversation about how to improve our elections: https://t.co/A78pZGDx2b
2016-11-01 17:13:12;ezraklein;RT @newtgingrich: Happy Halloween! Hope it's spooktacular! 👻🎃 https://t.co/9Mh641FPBZ https://t.co/UJdXN5UbYd
2016-11-01 16:53:42;ezraklein;RT @voxdotcom: Forget conspiracy theories. This is why Trump’s Russian connection is actually a problem. https://t.co/du6XvK2zWc
2016-11-01 14:57:47;ezraklein;The 7 voter turnout questions that could decide the 2016 election: https://t.co/3iUpuUFsEo
2016-11-01 14:45:12;ezraklein;RT @voxdotcom: Social decay: what the conversation about Trump and the white working class misses https://t.co/aOD0lBzG71
2016-11-01 14:03:43;ezraklein;This is a great piece making the battle lines and flashpoints in the coming GOP civil war much more concrete: https://t.co/X1phi35KPo
2016-11-01 13:58:19;ezraklein;RT @bradplumer: In Iraq, the environment itself has once again become a weapon of war: https://t.co/rw5wcUf3EY
2016-11-01 13:55:15;ezraklein;If Trump needed a way to communicate with Russia, they could've found an easier, less conspicuous, method than this: https://t.co/SeTZfh0d8q
2016-11-01 13:53:59;ezraklein;The new https://t.co/7EmRgjPNfB sure looks amazing
2016-11-01 13:44:48;ezraklein;Not fun to talk about, but researchers find resentment towards women is a strong predictor of Trump support: https://t.co/u10Uk1VA2J
2016-10-31 22:05:05;ezraklein;This is a way in which Thiel's support for Trump is powered by more common Silicon Valley confusion about politics:… https://t.co/pPwXUhD7uZ
2016-10-31 21:51:01;ezraklein;Seems like  Clinton camp believes escalating on Comey/FBI bias motivates their base. Wonder what their polling on this is showing...
2016-10-31 19:42:13;ezraklein;Peter Thiel's case for Trump doesn't take Trump literally or seriously. It's a Straussian read of his campaign: https://t.co/btv8sjNDfB
2016-10-31 16:42:41;ezraklein;What if Clinton has been getting away with it for all these years because she hasn’t done anything wrong? https://t.co/LhoUa4kNmv
2016-10-31 15:29:35;ezraklein;@zackbeauchamp You have clearly never spoken to @dylanmatt about the tax implications of marriage
2016-10-31 15:07:11;ezraklein;Florida looks very, very close: https://t.co/kKMdr14aKv
2016-10-31 15:02:48;ezraklein;"In this campaign, some bigotries have proven more ""deplorable"" than others: https://t.co/jLJsKagyU4"
2016-10-31 13:53:08;ezraklein;In private, Donald Trump admits “if we don’t” win, “that’s okay, too”:  https://t.co/byF5klxWrS
2016-10-31 13:08:15;ezraklein;Banks wish they were tech companies: https://t.co/3h7WltvMJC
2016-10-31 12:15:13;ezraklein;RT @BenjySarlin: I talked to two of the most famous   Bush officials on both sides of the waterboarding debate. They agree on Trump. https:…
2016-10-29 03:43:27;ezraklein;RT @voxdotcom: Moonlight is one of the year’s best films. @tvoti explains why: https://t.co/O9obJT7MTa
2016-10-29 03:39:08;ezraklein;This story makes me sad on a lot of levels: https://t.co/WBGK7MgsRx
2016-10-28 23:13:10;ezraklein;RT @JamesFallows: Kicking off a new Time Capsule Series (HRC Capsule #1) https://t.co/EpzitoZpRl by me
2016-10-28 23:02:10;ezraklein;RT @djrothkopf: Unprecedented degree to which info tech, privacy, security and cyber are central to this campaign is very telling, should b…
2016-10-28 22:03:03;ezraklein;Interesting thread here https://t.co/y0QPZHqdPV
2016-10-28 22:02:04;ezraklein;"RT @jeneps: ""This election is ten days away,"" Clinton says before correcting herself. ""Eleven. But we're more than halfway through today."""
2016-10-28 21:50:56;ezraklein;Meanwhile, there's new tape of Trump sexually humiliating a women on stage because he felt slighted by her: https://t.co/5ZLmX7xoGM
2016-10-28 21:32:28;ezraklein;The unsatisfying truth about the Clinton-FBI news: we don’t know anything yet, and shouldn’t pretend otherwise https://t.co/pnlQs6CgHB
2016-10-28 20:56:03;ezraklein;RT @sarahkliff: A great @alv9n news cartoon that explains how Clinton's email scandal got started. https://t.co/MUieeU8Qhn via @voxdotcom
2016-10-28 20:12:46;ezraklein;To understand the FBI-Clinton letter, you need to pull apart her different email scandals: https://t.co/bOjs18lmj3
2016-10-28 20:05:07;ezraklein;"Sometimes the correct, though unsatisfying, take is ""more info is needed"""
2016-10-28 19:44:35;ezraklein;"RT @zackbeauchamp: On the season finale of ""American Politics,"" all the plot lines finally come together https://t.co/XLxqqYv5li"
2016-10-28 12:31:07;ezraklein;How social media creates angry, poorly informed partisans:  https://t.co/9lQNOAcy8R
2016-10-28 12:19:06;ezraklein;WikiLeaks emails reveal the Clinton campaign receives some truly terrible advice: https://t.co/wi00TCwctR
2016-10-26 21:26:30;ezraklein;I want to joke about this, but I’m finding wild-eyed anti-semitism not very funny these days: https://t.co/gnPyyfeDv9
2016-10-26 21:23:41;ezraklein;Fresh, new, Obamacare-focused Weeds! https://t.co/oyONMDaV29
2016-10-26 18:40:05;ezraklein;"Francis Fukuyama: America is in ""one of the most severe political crises I have experienced"" https://t.co/RSAaGk1m3U"
2016-10-26 18:24:15;ezraklein;"""Remember: When it comes to the internet, always question your sources!"" https://t.co/gCjKmSQHt3"
2016-10-26 17:48:49;ezraklein;This is the piece you need to read on Obamacare today: https://t.co/WAos6CHEpE
2016-10-26 15:47:32;ezraklein;This notion of a secret, un-polled Brexit surge is a myth: https://t.co/LAN8ALSnuJ
2016-10-26 15:43:58;ezraklein;RT @elisefoley: Again, the hotel opening/commercial the Trump campaign claims is not a campaign event is listed on his campaign site https:…
2016-10-26 15:39:35;ezraklein;"RT @germanrlopez: In the 1980s, he warned that ""this is your brain on drugs."" In 2016, he voted to legalize marijuana: https://t.co/zNf69Oh…"
2016-10-26 15:13:42;ezraklein;RT @jbarro: Republicans' impossible GOTV challenge, explained in two tweets: https://t.co/fcJYLv3YKz
2016-10-26 15:12:59;ezraklein;The Trump and Clinton campaigns finally had a substantive climate debate:  https://t.co/pw7xF99F32
2016-10-26 13:56:26;ezraklein;"RT @voxdotcom: Newt Gingrich melts down on Fox over Trump spiral, calls Megyn Kelly ""fascinated with sex"" https://t.co/FYhn5E7PwQ"
2016-10-26 13:19:44;ezraklein;An expert explains what is broken with Obamacare — and how to fix it: https://t.co/e1sOo7k4JP
2016-10-26 12:18:50;ezraklein;@RameshPonnuru What I'm driving at is are there GOP votes for a bill that adds catastrophic plans and loosens essential benefits in Ocare?
2016-10-26 12:12:59;ezraklein;@RameshPonnuru But it's not just a frame. There's a big diff. between modifying Obamacare in the ways you suggest and wholly alt. plans
2016-10-26 12:05:57;ezraklein;Nearly 1,000 https://t.co/iZA2Pl8S0O counties will have just one insurer next year: https://t.co/b33ahlfAAk
2016-10-26 11:36:10;ezraklein;@RameshPonnuru In some ways, the closest thing I've seen is the copper plan proposal by Warner, Kaine et al https://t.co/oRCzyjRQ04
2016-10-26 11:34:56;ezraklein;@RameshPonnuru I'm not being snarky. This is a fair critique of how to amend the law. What I don't know is whether it's being made that way.
2016-10-26 11:34:03;ezraklein;@RameshPonnuru But — and correct me if I'm wrong — are they proposing more catastrophic, less regulation as amendment to Obamacare?
2016-10-26 02:28:44;ezraklein;Have any congressional Republicans actually proposed amending Obamacare along the lines @rameshponnuru proposes?  https://t.co/eR1LjGBfoF
2016-10-26 02:19:30;ezraklein;RT @voxdotcom: Over the past 10 years, more people have immigrated from the US to Mexico than vice versa https://t.co/z4eMd5zvaJ
2016-10-25 21:49:13;ezraklein;RT @voxdotcom: What each state’s marijuana legalization initiative would do: https://t.co/1gKPCujcfK https://t.co/GjQwWtJ4Rf
2016-10-25 21:43:08;ezraklein;RT @MacleansMag: For the first time ever recorded in Canada, women aged 40 and older have surpassed teenagers in giving birth: https://t.co…
2016-10-25 21:42:42;ezraklein;RT @Sammy_Roth: It's been a good month for #climate policy. @bradplumer on why we should stop waiting for the one big breakthrough: https:/…
2016-10-25 21:31:55;ezraklein;Nooooooooo https://t.co/Z56un2c2bS
2016-10-25 21:21:09;ezraklein;RT @sarahkliff: One huge reason Obamacare is struggling: enrollment is currently half of what it was supposed to be. https://t.co/hOaePFL4p…
2016-10-25 18:58:39;ezraklein;RT @kdrum: We Live in a Gentlemen's C- Universe https://t.co/vNqh8oYNPZ
2016-10-25 18:55:53;ezraklein;RT @voxdotcom: How Obamacare has fallen short, in one chart https://t.co/PEWfdRNHHN https://t.co/VNZ4dXwPnw
2016-10-25 17:32:36;ezraklein;This, from Tim Kaine, is important, particularly in an election where masculinity has been modeled so badly: https://t.co/izgMRVN4ux
2016-10-25 17:27:59;ezraklein;"New podcast! @JosephEStiglitz on broken markets, bad trade deals, and basic incomes: https://t.co/Ws0LxT6r0i

https://t.co/bxVVZkdfRI"
2016-10-25 17:13:57;ezraklein;This is perhaps the most revealing of all the Trump quotes we've heard this election: https://t.co/JLobhUdVRV
2016-10-25 17:10:46;ezraklein;Is there a name for the tendency where getting attacked for soft support for one side sends you hard to that side? https://t.co/HhsQsV1etp
2016-10-25 15:48:31;ezraklein;It’s not hard to make Obamacare work better, but you would need a governing majority that wanted it work better: https://t.co/MB0c5XgY8R
2016-10-25 15:39:34;ezraklein;Simple explanation is Conway and Trump are managing post-election brands at this point, and their incentives diverge https://t.co/HfrzwDIRWO
2016-10-25 15:35:17;ezraklein;On Tim Kaine’s feminism: https://t.co/izgMRVN4ux
2016-10-25 15:06:59;ezraklein;RT @t_golshan: Wait... so Al Gore worked? https://t.co/6JktiBRK0T
2016-10-25 14:13:06;ezraklein;“The mandate penalties are not working”: an expert explains what is broken with Obamacare https://t.co/VruP6oqIG4
2016-10-25 13:50:04;ezraklein;This Pepe the Frog vs. Dilbert comic explains 2016's online culture wars: https://t.co/BEj7ZENN8F
2016-10-25 13:34:00;ezraklein;RT @voxdotcom: Trump's supporters are more liberal than he is — with one big exception https://t.co/eSXMlsOhVg https://t.co/hLSQOAmdmJ
2016-10-25 12:48:05;ezraklein;Resolved: when the election is over, I'm going to spend a lot of time thinking about this:  https://t.co/GFeimeD2vz
2016-10-25 12:40:40;ezraklein;"Not taken with Biden's ""I wish I could take Trump behind the gym and fight him"" comments. If Trump said that, liberals would freak out."
2016-10-25 12:08:42;ezraklein;"RT @voxdotcom: Why the strongest case for AT&amp;T's merger with Time Warner is also the case against it https://t.co/gGmYV5JlDg"
2016-10-25 11:55:59;ezraklein;RT @voxdotcom: Obamacare's double-digit rate hike, explained in 400 words https://t.co/UNtwUXMkKS
2016-10-25 11:33:12;ezraklein;RT @RyanLizza: Under-appreciated fact of this election is that Trump is on track to do worse with white voters than Romney did.
2016-10-25 02:29:49;ezraklein;RT @CitizenCohn: So how would Hillary Clinton govern? @ezraklein invited me on his @voxdotcom podcast to discuss https://t.co/tva8dLFucZ
2016-10-24 22:53:51;ezraklein;Ugh. https://t.co/RYMfkWMiJB
2016-10-24 21:51:52;ezraklein;The Clinton campaign should read this Dave Roberts piece on carbon taxes: https://t.co/icWNOHmXod
2016-10-24 21:49:54;ezraklein;Obamacare's double-digit rate hike, explained: https://t.co/6Po0Tu0ybn
2016-10-24 20:36:57;ezraklein;If you want to intervene in Syria, you need to explain, in detail, why your plan won't make things even worse: https://t.co/LK60c5Ri63
2016-10-24 20:23:31;ezraklein;@jonlovett :( I was actually looking forward to this
2016-10-24 19:54:06;ezraklein;"RT @aedwardslevy: ""Remain"" margin over ""Leave"": +0.3
Clinton margin over Trump: +7.3 https://t.co/TW4iXaQlUD"
2016-10-24 19:47:36;ezraklein;Imagine how Trump would react if his rallies got normal levels of coverage, which is to say, basically none https://t.co/PjLGnQ88Af
2016-10-24 19:34:49;ezraklein;So much of the punditry you hear about this election is wrong. These charts prove it: https://t.co/8TLQZflKBs
2016-10-24 19:21:54;ezraklein;“The hottest hole in the world”: Iceland’s bold new idea for renewable energy https://t.co/7hDr7oklxk
2016-10-24 18:28:48;ezraklein;This is less sexy than election coverage, but more important than any election story you'll read today: https://t.co/uiVixx6sf2
2016-10-24 18:26:28;ezraklein;RT @DemFromCT: here's your latest installment of humorless liberals taking the fun out of the election by overthinking it https://t.co/iMgI…
2016-10-24 18:17:01;ezraklein;Like with so many Clinton scandals, there’s much less to this Morocco scandal once you look into it: https://t.co/J3QSOsprkY
2016-10-24 15:58:13;ezraklein;RT @voxdotcom: Consent, explained for Donald Trump https://t.co/JvfisNiTAY
2016-10-24 15:30:31;ezraklein;The symbiotic relationship between @mitchellvii and the liberals who love him, explained: https://t.co/gJHNbQBD0Y
2016-10-24 13:00:06;ezraklein;Transition questions I'm curious about: does Stiglitz return as CEA chair? He and Clinton have gotten closer... https://t.co/oVexDGe1N0
2016-10-24 12:40:01;ezraklein;21 maps and charts that should change how you think about the election: https://t.co/8TLQZflKBs
2016-10-24 11:05:57;ezraklein;The Fantastic Ursula K. Le Guin https://t.co/EukoqBt602
2016-10-24 00:33:51;ezraklein;RT @voxdotcom: Only 0.000004375 percent of national votes were fraudulent from 2000 to 2014. https://t.co/eviR84PLcE
2016-10-23 21:46:11;ezraklein;The Dangers of Hillary Clinton:  https://t.co/t9jZoqkzpQ
2016-10-23 19:59:16;ezraklein;"RT @sahilkapur: CBS poll: If Florida Republicans could re-do the primary today they'd still take Trump over Rubio, 35% to 25%.

https://t.c…"
2016-10-23 16:19:00;ezraklein;"The AT&amp;T-Time Warner merger doesn't make obvious business sense, but it'd be fun for AT&amp;T execs: https://t.co/0xc6o9fn1V"
