timestamp;sn;text
2016-05-20 14:19:47;RepKClark;Mtg w/amazing #Winthrop Recovery Coaches, @Winthroppolice: supporting families, adrsing #opioid crisis, saving lives https://t.co/oWt89JzGmb
2016-05-20 13:56:05;RepKClark;RT @NancyPelosi: Americans won't forget @HouseGOP is so committed to discriminating against LGBT people, they broke regular order to suppor…
2016-05-19 16:30:34;RepKClark;Members of both parties were working 2 protect #LGBT rights til GOP leaders used dirty tricks 2 get their way.#Shame https://t.co/tRT2hTK6rV
2016-05-19 15:34:32;RepKClark;When kids are hungry they can't learn. It's outrageous that GOP is making it *harder* to feed hungry children. https://t.co/AOkBUgleJ2
2016-05-18 21:05:43;RepKClark;"So proud of #girlscout Richa &amp; the Western HS choir for taking their fight for education funding to the Capitol! https://t.co/GmjWUitO02"
2016-05-18 20:54:19;RepKClark;RT @edworkforcedems: Under #HR5003 up to 431 vulnerable students in @RepKClark's district could lose access to free school meals #GOPHunger…
2016-05-18 20:15:25;RepKClark;"Thank you @RealRobinWright for taking a stand, speaking out &amp; demanding #equalpay. https://t.co/qamYA6JDaM"
2016-05-18 19:53:03;RepKClark;Women bear the brunt of #Zika's devastation. It's unacceptable that GOP is pushing for only 1/3 of response $ needed https://t.co/ROKIRZipPl
2016-05-18 16:51:39;RepKClark;"From 1 #girlscout to another -- we're proud of you, Richa! And we're rooting for you! 
https://t.co/ixSY53b9x9 https://t.co/z0I1iey4fd"
2016-05-18 14:50:36;RepKClark;"It's simple: Millions work xtra hours to provide for their families &amp; shld get paid 4 their hard work. #Overtimerule https://t.co/wSmrP8QNha"
2016-05-17 21:18:22;RepKClark;Stigma should never get in the way of care. Why I'm fighting to bring #postpartum depression out of the shadows. https://t.co/3LokdtyYmu
2016-05-17 19:18:56;RepKClark;As a member of the #Equality Caucus, Im proud 2 keep fighting 'til we have full #LGBT equality #WeAreWithYou #IDAHOT https://t.co/0ISR12i41h
2016-05-17 15:43:42;RepKClark;RT @JackSmithIV: Following the @BrookingsInst sextortion report, @BarbaraBoxer and @RepKClark issue separate calls to action  https://t.co/…
2016-05-17 14:32:30;RepKClark;Join us @TuftsUniversity for our #DistrictPolicyPanel on #ClimateChange, 6/2, 6pm at the Interfaith Ctr in #Medford: https://t.co/nKTCNr0SD7
2016-05-17 12:53:33;RepKClark;RT @RepRobinKelly: GOP wants Americans to make do with less than 1/3 of what top health officials say we need to address #Zika. #DoYourJob…
2016-05-16 19:18:43;RepKClark;"Without #equalpay for equal work, moms have less $ for food, school &amp; planning for the future. #momsequalpay FACTS: https://t.co/glbkgQ5KSn"
2016-05-16 18:39:15;RepKClark;RT @RepKathleenRice: There are more than 100 pregnant women w confirmed cases of #Zika in US, but @HouseGOP has yet to take action. RT if y…
2016-05-15 19:46:39;RepKClark;Honored to attend the Christa McAuliffe Branch Library Dedication in #Framingham-Team Clark https://t.co/4bPM1Scr5q
2016-05-15 15:25:37;RepKClark;"Thank you @RosLehtinen for sharing your family's story, love of your son, &amp; example of compassion #everyonewelcome https://t.co/4VuoRS92uV"
2016-05-13 16:02:36;RepKClark;We're demanding that radical #antichoice Republicans end their abusive overreach. READ: https://t.co/fdlBdPTtMD https://t.co/6PsVxzFTD2
2016-05-12 21:00:01;RepKClark;"Congrats to the #MA Senate for fighting for #equality &amp; standing on the right side of history! #TransBillMA https://t.co/mbzu7S8zeb"
2016-05-12 19:01:18;RepKClark;"Thankful for the #MA delegation's leadership in listening to families at home &amp; making the #opioid crisis a priority https://t.co/KR1L811y7T"
2016-05-11 23:06:24;RepKClark;#Breaking: Clark passes #opioid crisis bills with unanimous support of House READ: https://t.co/WQOwuBBhL5
2016-05-11 21:19:09;RepKClark;Update: I plan to make sure we’re doing more to address #sextortion READ:https://t.co/Dmj38K8HKX
2016-05-11 18:23:42;RepKClark;"PACKED house for the #Cambridge &amp; @MIT Annual #Senior Luncheon!-Team Clark #LoveIsAgeless https://t.co/RpSwfFGBeV"
2016-05-11 00:56:37;RepKClark;#Update: Clark leads House discussion ahead of #opioid-related votes, highlights local stories https://t.co/CuXrSKOsgZ
2016-05-10 23:48:21;RepKClark;HAPPENING NOW: Clark on House floor to bring colleagues together in advance of votes on bills to adrs #opioid crisis https://t.co/TMrPBSxHoK
2016-05-10 19:58:45;RepKClark;Proud to attend #HiddenInPlainSight kickoff in #Natick, helping parents spot signs of youth substance use-Team Clark https://t.co/3p1ahAo1Gb
2016-05-09 23:05:06;RepKClark;"#GLX is an opportunity to invest in our economic &amp; environmental future. I encourage our leaders to stay the course: https://t.co/sJPyrZ78xQ"
2016-05-09 14:33:43;RepKClark;"RT @RepCummings: 2 yrs &amp; nearly $7 million in taxpayer funds wasted on @HouseGOP's Select Committee to Attack Clinton. Enough is enough. #P…"
2016-05-08 10:00:36;RepKClark;"Happy #MothersDay! #Moms should know they're being heard &amp; their hard work matters. More: https://t.co/tfEc94VGS6 https://t.co/U1mWThzrPy"
2016-05-06 16:32:42;RepKClark;"The #opioid crisis is an urgent calling for us to put aside our differences &amp; save lives. https://t.co/YAIL8UhlK8 https://t.co/VNUNRqwiAh"
2016-05-05 21:18:50;RepKClark;#PaidLeave means moms can care for a new baby or a sick child without fear of losing the income she needs for groceries. #whatmomsneed
2016-05-05 21:04:58;RepKClark;"#HolocaustRemembranceDay reminds us never to be silent in the face of hate &amp; injustice. We honor the stories of survivors and those we lost."
2016-05-05 16:12:44;RepKClark;"#swatting is a threat to public safety &amp; expensive. Great example of a community working together to fight back: https://t.co/lD4jWnj30g"
2016-05-05 14:44:41;RepKClark;"""#MA's talent in education, tech &amp; research has put us on the map as an economic engine to America."" https://t.co/OhuHAjKowv #innovation"
2016-05-05 13:28:20;RepKClark;"RT @RepJoeCourtney: .@HouseDemocrats have called on @SpeakerRyan to address the growing opioid &amp; heroin epidemic. Our letter: https://t.co/…"
2016-05-04 20:31:09;RepKClark;Huge thanks to our #firefighters for their daily bravery and work to keep our families safe! #InternationalFireFightersDay
2016-05-04 20:17:41;RepKClark;"We're at @CambridgeCollg celebrating innovation, entrepreneurship &amp; #NationalSmallBusinessWeek w/ @CWEtalk, @SBAgov. https://t.co/V0S5gs91En"
2016-05-04 15:31:08;RepKClark;"TY @projinclude. Ensuring #diversity in #tech goes a long way toward safe, inclusive spaces &amp; combating #onlineabuse https://t.co/tOccEtGWB8"
2016-05-03 22:36:02;RepKClark;"On #TeacherAppreciationDay &amp; throughout the year, we're grateful to the tireless #educators who prepare our #students for future success!"
2016-05-03 21:14:12;RepKClark;"Discrimination against #LGBT students by colleges is shocking, disheartening &amp; must be disclosed. Read abt our bill:https://t.co/1hukQ9XAgR"
2016-05-03 18:22:19;RepKClark;Hosted #InnovationAgenda mt w/@RepJoeKennedy @MAHIGHTECH 2 discuss emrging #innovation w/MA business, #STEM, Ed ldrs https://t.co/YjTdOzqHnf
2016-05-02 15:59:39;RepKClark;"Breaking: We intro'd bill ensuring #HigherEd discrimination against #LGBT students be disclosed; Supported by @HRC https://t.co/SAs4aRHF1Y"
2016-04-30 15:45:01;RepKClark;"Our team is taking action &amp; volunteering at the Mystic River Cleanup! #CommunityEarthDay #EarthDay2016 -Team Clark https://t.co/DgILTfur4r"
2016-04-29 18:30:19;RepKClark;"Honored to attnd @homebaseprogram ICP launch event! TY for your dedication to #veterans &amp; their families!-Team Clark https://t.co/FIlfxeKovI"
2016-04-29 15:04:59;RepKClark;Beautiful morning in #Natick, kicking off the 2016 #WalkForMAChildren! TY @JeffsPlace for sponsoring.-Team Clark https://t.co/rI1MhxBTsc
2016-04-28 20:48:40;RepKClark;Update: Our bills to reduce fatal #opioid overdoses just received unanimous support in House committees. Learn more: https://t.co/4QhjUZ55RS
2016-04-28 20:38:55;RepKClark;.@EarlyEd4All  - thank YOU for all you do for our youngest learners! #investinkids #investinus #earlyed  https://t.co/8XcwYRV2PD
2016-04-28 19:20:53;RepKClark;"#Breaking: Just introduced a bill to help doctors &amp; patients navigate #opioid treatment &amp; substance use disorders: https://t.co/PWsWo7AwGd"
2016-04-27 23:59:47;RepKClark;"""The atrocities of the #ArmenianGenocide 101 years ago must never be forgotten or denied."" https://t.co/9YzF34EN52"
2016-04-27 16:44:21;RepKClark;“We’re talking about somebody not losing a day’s wages when their kid is sick..” Why #paidleave for all matters: https://t.co/D5uEEWgygo
2016-04-27 13:58:42;RepKClark;RT @RepJoeKennedy: .@HouseDemocrats have a clear message for Republicans who've failed to pass a #budget or address urgent health crises: T…
2016-04-26 18:21:56;RepKClark;"Women often face the most extreme #onlineabuse, harassment, &amp; stalking just for showing up to work. https://t.co/pdEwOyZ0uP #MoreThanMean"
2016-04-26 12:56:38;RepKClark;"Women are abused online every day for simply doing their job, &amp; this abuse has devastating real world consequences. https://t.co/l6ra01T3Ji"
2016-04-25 19:38:54;RepKClark;This Saturday, Apr 30, is National #RXTakeBack Day. Spread the word on where to participate: https://t.co/hUObe91who https://t.co/4LcvDFrR2i
2016-04-25 18:53:55;RepKClark;"Great to be in #Weston &amp; to hear from Pres. Hays @RegisCollege_MA, celebrating new Science Lab! -Team Clark #STEM https://t.co/a6bttLiY5O"
2016-04-25 14:20:20;RepKClark;RT @NitaLowey: .@HouseGOP's refusal to protect American communities from the threat of the #Zika virus is breathtakingly irresponsible. Con…
2016-04-24 12:02:00;RepKClark;The lessons of the #ArmenianGenocide must never be denied and must never be forgotten.  Read: https://t.co/tEA5lpUfmh #ArmenianGenocide101
2016-04-23 11:15:14;RepKClark;Congratulations to you and your beautiful family! https://t.co/nJbQCHgCqk
2016-04-22 20:32:33;RepKClark;Wishing you good times, health, and happiness this #Passover season. Happy Passover! https://t.co/75JZ5HNZig
2016-04-22 19:14:52;RepKClark;Great read in @masslivenews about our fight to end the scourge of our nation's #opioid epidemic: https://t.co/lik8f4iEqj #mapoli
2016-04-22 13:06:26;RepKClark;Happy #EarthDay2016! Team Clark will join the Mystic River #EarthDay Cleanup, 4/30. Find vol. opportunities near you:https://t.co/YHKUR2IqTT
2016-04-21 20:57:20;RepKClark;"""Even if you think it’s small, it might turn into something huge.” Way to go, Sofia! #girlpower https://t.co/QpgLlsfmpl"
2016-04-21 17:07:30;RepKClark;Our bipartisan task force on the #opioid crisis is pushing Congress to pass these bills: https://t.co/5A2e68mD88 https://t.co/95HSZHTzV3
2016-04-21 16:11:43;RepKClark;The CIA’s decision to ensure full death benefits to the Doherty family is the right thing to do.. READ MORE: https://t.co/BiIfUpF4Rg
2016-04-20 18:38:39;RepKClark;Wonderful to see an American hero receive the recognition and honor she deserves. #HarrietTubman. https://t.co/u2i97lyF7H
2016-04-20 18:20:51;RepKClark;".@Elmo &amp; @MeCookieMonster agree: every child deserves high quality #earlyed. #InvestInKids https://t.co/kKaQqZwk82 https://t.co/er19aACz3K"
2016-04-20 13:42:24;RepKClark;"Unaffordable #childcare forces working parents to forfeit critical opportunities at work &amp; school. https://t.co/e0okKPO23L"
2016-04-19 13:06:58;RepKClark;I sat down w/ @thinkprogress to discuss how #diversity in #tech must be part of the solution to address #onlineabuse https://t.co/9n607535NW
2016-04-19 12:04:53;RepKClark;REMINDER: MA-5 High School Students: Submit your #CongressionalArtCompetition entries to our office by Tuesday, 4/26 https://t.co/A29rTX18Ye
2016-04-19 01:03:12;RepKClark;"Former ambassador &amp; @TuftsUniversity Tisch College Dean Alan Solomont accepts the Tzedek v'Shalom award #JStreetGala https://t.co/VvC0NHLE4B"
2016-04-18 15:11:35;RepKClark;"Happy #PatriotsDay &amp; good luck to all the incredible athletes at the 120th #BostonMarathon! We're cheering for you!
https://t.co/6zONsAmNix"
2016-04-18 12:38:57;RepKClark;RT @RepGutierrez: Today, @HouseDemocrats stand united in #FightForFamilies for #immigration actions that benefit our communities and all Am…
2016-04-16 11:20:52;RepKClark;"These hoaxes are dangerous for residents &amp; first responders. It's why I'm fighting to make swatting a federal crime. https://t.co/HHP4D6IHAu"
2016-04-15 19:27:16;RepKClark;Again: women's presence doesn't cause rape. Rapists do. Stop telling women to change their behavior. https://t.co/kZsBQdk7zQ
2016-04-15 16:58:55;RepKClark;"""when you’re the mom standing at the door ..looking at a full police response"" My push to criminalize #swatting: https://t.co/A0kETBC8V4"
2016-04-15 14:06:56;RepKClark;"#OneBostonDay reminds us that unexpected acts of heroism &amp; generosity can change lives &amp; bring communities together. https://t.co/K5T9bYrNDi"
2016-04-14 22:17:08;RepKClark;We launched Congress' 1st-ever #PreKCaucus because we want to ensure all of our youngest learners have a fair shot. https://t.co/zNYPMQvbKr
2016-04-14 19:14:51;RepKClark;"We know, &amp; we believe, &amp; we’re going to work to ensure that everyone is welcome in Massachusetts #EveryoneWelcome https://t.co/OtgyS4JQDE"
2016-04-14 15:19:17;RepKClark;"Today I’m teaming up w/ @JoaquinCastrotx, @TomColeOK04, &amp; @RepRichardHanna to start Congress' 1st-ever #PreKCaucus. #InvestInkids #earlyed"
2016-04-13 18:01:46;RepKClark;Or, instead of blaming women, you could focus on teaching members of your club to NOT sexually assault people. https://t.co/5FjZUdqIC9
2016-04-13 17:38:48;RepKClark;The community of women working to end #OnlineAbuse is extraordinary. I am inspired every day by their commitment: https://t.co/6Dp6f3fPjM
2016-04-13 16:24:13;RepKClark;"#onlineabuse has ""a significant economic impact."" Why I'm fighting to ensure the #internet is safe &amp; open to all: https://t.co/nnuTZmzcve"
2016-04-13 13:42:01;RepKClark;Team Clark is proud to join @MaldenOvercomes to help #StopTheStigma associated with addiction! #MaldenStopTheStigma https://t.co/MTeACITJyf
2016-04-12 21:07:47;RepKClark;"Congrats @perkinsvision in #Watertown: Winner of #GoogleImpactChallenge Disabilities &amp; recipient of $750,000 grant! https://t.co/nDrX640V4E"
2016-04-12 18:01:12;RepKClark;"Wage #discrimination costs #women &amp; their families hundreds of thousands over a lifetime. The facts: https://t.co/LqgMapmTP2 #EqualPayDay"
2016-04-12 17:47:21;RepKClark;RT @MassTreasury: Treasurer Goldberg unveils the Treasury's brand-new website https://t.co/gAm6OfTFYt, dedicated to closing the wage gap in…
2016-04-12 16:36:25;RepKClark;"""It’s more expensive to educate a 4 y/o in #preschool than an 18 y/o in college."" Why I'm fighting to #InvestInKids: https://t.co/VcPwsXMKcG"
2016-04-12 15:54:52;RepKClark;The very 1st bill I cosponsored was the #PaycheckFairnessAct. #Equalpay #Equalpayday Here's why:   https://t.co/tKSQuYZhPe
2016-04-12 12:58:12;RepKClark;#EqualPayDay reminds us that when women are not paid what they're worth, our whole economy suffers. #equalpay https://t.co/p7QBovfFWq
2016-04-12 12:39:04;RepKClark;RT @DorisMatsui: This #EqualPayDay, @HouseDemocrats renew commitment to helping #WomenSucceed. Let's pass the Paycheck Fairness Act! https:…
2016-04-11 18:34:29;RepKClark;Having been a target of #swatting, I tell @csmonitor why it's more important than ever to fight #onlineabuse. https://t.co/lhJBlbNwys
2016-04-11 17:05:03;RepKClark;"Glad to join students at @Harvard to discuss #onlineabuse &amp; keeping the #internet open &amp; safe for all. #mapoli https://t.co/r0e6FCmVlX"
2016-04-11 14:53:08;RepKClark;"Read about my day w/ #Malden students who got to be ""Senators-for-a-day"" at @emkinstitute #mapoli https://t.co/gu3mI3JnhT"
2016-04-11 14:36:49;RepKClark;"It's #NationalPetDay! PAWS Act empowers survivors of #domesticviolence &amp; keeps #pets safe. https://t.co/o0qdFwqQRM https://t.co/sYN7XCF362"
2016-04-08 16:58:36;RepKClark;"TY @emkinstitute, #Malden HS, @MTEC02148 &amp; students for your civic #leadership &amp; passion to help our communities. https://t.co/QeRhMU5gIJ"
2016-04-08 13:34:44;RepKClark;"TY #Massachusetts Reading Assoc. for Reading Advocate Award &amp; for incredible work you do #ManyVoicesofLiteracy https://t.co/YozPecMDML"
2016-04-07 12:44:09;RepKClark;Congrats @UWofTC Award Recipients, including Wade from our team for #LIVEUNITED award! -Team Clark #therippleeffect https://t.co/kVilPC1jk1
2016-04-06 17:49:12;RepKClark;TY @AARP Massachusetts for meeting today to discuss The RAISE Family Caregivers Act, supporting family caregivers! https://t.co/fZkgs5iGkM
2016-04-06 16:40:31;RepKClark;"Great mtg w/ @citizensclimate, discussing strategies to combat #climatechange nationally &amp; reduce emissions https://t.co/rOZJrgejny"
2016-04-06 15:25:40;RepKClark;"At @Harvard w/ @repjohnlewis &amp; Pres. Faust to recognize truths of our past &amp; contributions of enslaved individuals. https://t.co/AzsuiG94OW"
2016-04-06 15:03:36;RepKClark;"Interested in learning more about federal #grant opportunities? Read &amp; sign up for our Grants E-Newsletter!https://t.co/x6hscNvP5V"
2016-04-06 14:08:28;RepKClark;It's #SexualAbuse Awareness Month. We intro'd the PAWS Act to empower survivors of #abuse. https://t.co/7t4YmC5v5F https://t.co/SF3I8oKvep
2016-04-06 12:17:07;RepKClark;"This is a huge economic issue affecting women &amp; families across the country. It's time to ensure #equalpay. https://t.co/nNHI8MYYkA"
2016-04-05 23:23:41;RepKClark;Keep up the good work, Hilde. With your hard work and passion, there's nothing you can't do. #girlpower https://t.co/l692VIftpk
2016-04-05 14:15:22;RepKClark;RT @repmarkpocan: .@SpeakerRyan has recessed House w/out #budget vote or action on 3 major public health crises. Time to #DoYourJob! https:…
2016-04-04 23:42:59;RepKClark;This is a big deal: there's #nosuchthing as a child prostitute. Congratulations @rights4girls! https://t.co/B9WtByfgH1
2016-04-04 16:58:22;RepKClark;Good news from #SCOTUS. We should be working to *stengthen* #votingrights, not working to erode them.  https://t.co/J2V9ckkzoc
2016-04-04 16:40:11;RepKClark;"""We need to start thinking about every transportation project as a bridge to opportunity""TY @SecretaryFoxx-TeamClark https://t.co/Fy4XDcMNuv"
2016-04-01 16:50:47;RepKClark;#MA cont. to be nat'l leader in #innovation! Will host $317 mil. Advanced Functional Fabrics of America, led by @MIT https://t.co/hiSiuIKqtn
2016-04-01 15:32:24;RepKClark;Great news: With the federal ruling in MS, same-sex couples can now #adopt in all 50 states! #LoveWinsAgain #LGBT https://t.co/bVm8WLKtlK
2016-04-01 14:29:23;RepKClark;"#Equalwork deserves #equalpay; period. TY #USWNT for fighting to end #WageDiscrimination. https://t.co/ePfjBj9Rhs https://t.co/PrLzCrOmIY"
2016-03-31 19:36:51;RepKClark;Remembering #CesarChavez for bringing people together to demand a fair shot for every worker and every family. https://t.co/EWa44dBION
2016-03-31 18:12:07;RepKClark;I intro'd our #postpartum bill b/c #moms shld know it's ok to ask for help. A mom speaks up: https://t.co/sSQ7ShWM3G https://t.co/a5xAqRp50z
2016-03-31 14:59:55;RepKClark;Thank you @HousingFamilies for your inspiring work to end family homelessness. Proud to partner with you!-Team Clark https://t.co/Wax96fBUB5
2016-03-30 23:50:48;RepKClark;"Proud 2 join @MaldenRedevelop &amp; recognize the fantastic work of #Malden CDBG &amp; HOME fed. grant recipients-Team Clark https://t.co/kb7XdxKYlV"
2016-03-30 20:16:53;RepKClark;Not considered official in 1969, she was the 1st woman to win the Boston Marathon. Can you name her? #WomensHistory https://t.co/J0cd3zCGPS
2016-03-30 14:08:57;RepKClark;"Agree w/ @BostonGlobe. Our #transgender friends &amp; neighbors deserve the same legal protections as everyone else. https://t.co/UuluvOLxdm"
2016-03-30 00:11:48;RepKClark;"Congrats to the #WomenMakingHistoryNow nominees &amp; winners tonight @FraminghamU! -Team Clark https://t.co/jCK23x6zZd"
2016-03-29 20:09:20;RepKClark;Grateful 4 the quick response frm @genius. Looking fwd 2 a dialogue abt ensuring an internet that's safe 4 everyone  https://t.co/qxLjcUfm6A
2016-03-29 18:49:56;RepKClark;"TY to @POTUS for leadership in combating the #opioid crisis. Now Congress has to do its part &amp; ensure strong funding https://t.co/Gdm5tcNNaH"
2016-03-29 17:09:28;RepKClark;".@slate has a point  https://t.co/6FdfBgYGc3 I asked @genius to consider how they are enabling abuse &amp; harassment https://t.co/gqqJqujQB8"
2016-03-29 16:49:38;RepKClark;"Babies like Lexi are the youngest victims of the #opioid crisis &amp; why we want Congress 2 act https://t.co/izUjtXi2sv https://t.co/cQHW2ET9eS"
2016-03-29 14:28:56;RepKClark;Her successful case to win her freedom ultimately led to the abolition of slavery in #MA. Name her?#WomensHistory https://t.co/aXS4kH1zto
2016-03-29 13:25:54;RepKClark;We're leading a push for House appropriators to ensure strong resources to combat the #opioid epidemic. #mapoli https://t.co/rVsUp4znDN
2016-03-28 19:26:01;RepKClark;Thankful that my DC staff and interns are safe and accounted for.
2016-03-28 17:37:00;RepKClark;#WomensHistory trivia: In 1894, this #MA mom of 3 became the 1st woman to circle the globe on a bicycle. Who is she? https://t.co/ddpmpN0bsy
2016-03-25 18:31:13;RepKClark;REMINDER:MA-5 high school students submit your art pieces to our office for the #CongressionalArtCompetition by 4/26 https://t.co/A29rTX18Ye
2016-03-24 19:27:37;RepKClark;# of #MA infants suffering from #opioid withdrawal is surging. Congress needs to act.https://t.co/CjkciDGANf #mapoli https://t.co/Bl56qMmVh1
2016-03-24 15:33:45;RepKClark;"In @NYmag, @marytraina bravely shares her story of #cyberstalking. Why &amp; how I'm pushing to end #onlineabuse: https://t.co/SGcmyfhrSo"
2016-03-24 14:57:44;RepKClark;#WomensHistory trivia: Name this #MA native/ chemist (right) who co-invented the 1st useful anti-fungal antibiotic. https://t.co/sF71VbSOff
2016-03-24 14:19:14;RepKClark;"Our bill gets moms &amp; babies affected by the #opioid crisis the help they need to have healthy &amp; successful lives. https://t.co/92t0S1H0Rj"
2016-03-23 23:39:21;RepKClark;Thrilled to join @alzassociation in #Lexington to thank them for their work to help families living with #Alzheimers https://t.co/L7Awu1EnDk
2016-03-23 21:46:19;RepKClark;"My hope is thru these partnerships immigrant &amp; refugee communities will see my office as a resource in their journey:https://t.co/x11MgxFOog"
2016-03-23 19:04:30;RepKClark;Unaffordable #childcare holds back families working hard to get to the #middleclass. My push to help them succeed: https://t.co/ZxxPQchmd5
2016-03-23 17:35:31;RepKClark;"Women should be able to plan their families &amp; access #birthcontrol no matter where they work. #SCOTUS #ZubikvBurwell https://t.co/azafIw6IQ9"
2016-03-23 16:49:25;RepKClark;Last week we toured the #USArmy #Natick Soldier Research Center w/our #CongressionalAppChallenge winners! #STEM https://t.co/zxAoV6GDTq
2016-03-23 15:58:23;RepKClark;Why I'm working to help the 1 in 7 new moms w/ #postpartumdepression #PPD.Read/ RT my op-ed: https://t.co/36lxpwQPR0 https://t.co/kB48qUxs71
2016-03-23 14:03:05;RepKClark;#WomensHistory trivia: Name this pioneering suffragist whose granddaughter became a pioneering #MelroseMA lawmaker. https://t.co/yCgWqF38t4
2016-03-22 14:09:17;RepKClark;My heart breaks for all those affected by the acts of terror in #Brussels. We stand in solidarity with Belgium during this horrific tragedy.
2016-03-21 23:42:42;RepKClark;".@serenawilliams is the greatest of all time &amp; she responds with grace &amp; strength to comments that exhibited neither https://t.co/O4LyuGENhV"
2016-03-21 18:05:23;RepKClark;"Before TV &amp; film, this #Medford native reported for @ChannelOneNews. Can you name her? #MA5  #womenshistory #trivia https://t.co/sc3hkKuc5z"
2016-03-21 16:30:44;RepKClark;"In @TheAtlantic:how the #wagegap impacts moms &amp; women of color + why I'm fighting for increased on-campus #childcare https://t.co/aNjrKq4AxZ"
2016-03-20 20:49:02;RepKClark;So much of the progress toward normalizing relations with Cuba is due to @RepMcGovern's leadership https://t.co/AWJSCl6LCm
2016-03-19 17:29:55;RepKClark;Proud to partner w/ @ProjCitizenship to host free citizenship workshop in #Framingham! https://t.co/CEtWnkmeQb https://t.co/QVC7pTJJwK
2016-03-19 16:01:25;RepKClark;Wonderful turnout for our #CoffeewithKatherine in #Natick! Thnx for sharing your priorities for #Congress https://t.co/9dsaRFt15h
2016-03-18 19:38:15;RepKClark;@dustysandyroads you got it! Thanks!
2016-03-18 19:23:13;RepKClark;"Her '91 testimony sparked natl awareness &amp; open discussion of workplace #sexualharassment. Who is she?#womenshistory https://t.co/eX54aSN1uD"
2016-03-18 13:49:02;RepKClark;"Our bill empowers patients &amp; doctors to shrink the amount of unused/unwanted medications fueling the #opiod crisis. https://t.co/nY03NWydZh"
2016-03-18 13:03:40;RepKClark;".@POTUS: ""the #Internet is a public space where #women have every right to exist freely and safely” https://t.co/NkcVpC1b1C #onlineabuse"
2016-03-17 16:48:12;RepKClark;GOP is more than willing to see mothers torn from children to appease party radicals but refuses immigration reform. https://t.co/lepqG81gvC
2016-03-17 15:25:44;RepKClark;Happy #stpatricksday! #mapoli 🍀🍀🍀 https://t.co/vaYVQtqpra
2016-03-16 21:39:06;RepKClark;4. @POTUS: Addressing #onlineharassment shouldn't divide us, because we all should care about it
