timestamp;sn;text
2016-08-31 19:18:55;RepKClark;Great to see so many friends @CarolynDykema #Senior Picnic! #Holliston #Southborough  https://t.co/pGJZWw2c1Z https://t.co/Fn01yqdCeU
2016-08-30 13:03:07;RepKClark;Good news! Our PAWS Act to empower survivors of #domesticviolence now has 196 cosponsors. My write-up w/ @ASPCA:  https://t.co/S7rZfQxzyY
2016-08-29 20:00:55;RepKClark;"TY @WomensAction for mtg &amp; for continued efforts to empower women, girls &amp; maintain international #peace &amp; security https://t.co/oqlFfcXVB3"
2016-08-29 16:33:04;RepKClark;Congratulations to this year’s MA5 #CongressionalAward recipients! Thank you for your incredible public service https://t.co/VGoNBtt5fF
2016-08-29 13:00:10;RepKClark;"No one's participation in an online economy should be jeopordized by threats &amp; abuse. Why I'm fighting #onlineabuse: https://t.co/9VZWzv01lD"
2016-08-28 23:03:31;RepKClark;Thank you. https://t.co/xE9dJ8WFjp
2016-08-28 14:11:51;RepKClark;A beautiful tribute to a gentleman and a patriot https://t.co/w68HzSPsgd
2016-08-26 13:00:12;RepKClark;"#WomensEqualityDay calls on us to fight for #equalpay, #reprorights, equal representation; end #violenceagainstwomen - IOW: full #equality"
2016-08-25 15:00:21;RepKClark;It's @NatlParkService's 100th birthday! Let's celebrate by exploring one of our beautiful natl parks. #FindYourPark https://t.co/SxeUBbPmB9
2016-08-25 13:30:20;RepKClark;"Are you a high school student in MA's 5th district &amp; have an idea for an app? Our #CongressionalAppChallenge: https://t.co/st0CSy6rWO"
2016-08-24 16:16:56;RepKClark;My heart goes out to all the families affected by the devastating earthquake in Italy. #ItalyEarthquake
2016-08-24 16:04:49;RepKClark;How #domesticviolence and #gunviolence are related, and why I'm pushing for commonsense policies that save lives: https://t.co/9lbmA21TdI
2016-08-23 15:46:50;RepKClark;"When Black women must work 8 xtra months to earn #equalpay, that's less $ for gas, groceries &amp; planning for the future. #BlackWomensEqualPay"
2016-08-23 13:21:02;RepKClark;"""Our neighbors support and love called them to action, and love conquers hate. Love wins.” #Natick making us proud: https://t.co/eF5Yj7WmLO"
2016-08-22 14:45:24;RepKClark;Megan stepped in front of an AK-47 to save a toddler. These survivors of #gunviolence deserve a vote to #disarmhate: https://t.co/i7LZK2T9wF
2016-08-19 15:24:51;RepKClark;More than 1/3 of #domesticviolence survivors delayed leaving out of concern for their pet.Why I intro'd the PAWS Act https://t.co/MFS6khNgUj
2016-08-18 15:24:24;RepKClark;Looking for ways to help families affected by the devastating #laflood? Please RT: https://t.co/7Qsx48rudg
2016-08-18 14:51:28;RepKClark;"96yrs since #19thamendment was ratified &amp; there's still work to do. Women comprise &lt; 20% of Congress &amp; &lt; 25% locally https://t.co/8Kum2JgHBX"
2016-08-17 19:55:58;RepKClark;Investing in our future means investing in our youngest learners *and* #earlyed teachers.#InvestInKids #backtoschool https://t.co/gikjNVi0OF
2016-08-16 21:31:58;RepKClark;"Lets work together to keep the internet safe &amp; open for everyone. A list of bills I intro'd to combat #onlineabuse: https://t.co/UwYApK1Ul0"
2016-08-16 13:56:57;RepKClark;"Working parents shouldn’t have to choose between their family's health &amp; a paycheck. Why I'm fighting 4 #paidleave: https://t.co/xkEltub8zt"
2016-08-15 17:19:53;RepKClark;"Congratulations #Revere Fire Chief Bright, sworn in today! &amp; TY Chief Doherty for your incredible 40 yrs of service: https://t.co/wnAsxogv5L"
2016-08-15 15:53:35;RepKClark;"Sad &amp; happens far too often. All of us have a role in combating #onlineabuse. #love4gabbyusa https://t.co/YHoG9hzbDR"
2016-08-12 18:00:15;RepKClark;81 yrs ago #MA's Frances Perkins (pictured behind FDR) was the force behind #SocialSecurity. https://t.co/DBqfsq8N37 https://t.co/B7lNorAYzx
2016-08-12 14:08:26;RepKClark;How my bill w/@RosLehtinen to empower survivors of #domesticviolence will save lives. https://t.co/pGVXw0aF9D https://t.co/9hlVOQSWmZ
2016-08-11 23:37:31;RepKClark;Not OK. Outing gay Olympic athletes for sport is not only horrifying and irresponsible, it's dangerous.  https://t.co/inej0s0Gom
2016-08-11 14:09:06;RepKClark;Our delegation is proudly united in support of @MassAGO as she courageously works to enforce the assault weapons ban.https://t.co/Bn3FjHJ8WR
2016-08-10 17:30:42;RepKClark;"2,600+ kids die from #gunviolence each year, yet Speaker Ryan &amp; GOP refuse to allow gun safety votes. The facts: https://t.co/Tkfhq9ZzRY"
2016-08-10 16:42:28;RepKClark;"#Sextortion is a dangerous &amp; growing form of #onlineabuse. Why I intro'd the Interstate Sextortion Prevention Act: https://t.co/Edd1ALLEqc"
2016-08-09 18:44:27;RepKClark;RT @EdWorkforce: .@CongressmanGT, @RepKClark's bipartisan bill to strengthen #CTE has gained broad support: https://t.co/p0tLKMNODJ
2016-08-09 14:27:20;RepKClark;HS student in MA5? Have an idea for an app? Participate in the 2016 #CongressionalAppChallenge! Learn more: https://t.co/UZukZndlLz
2016-08-08 20:14:48;RepKClark;"Thousands of women &amp; children are targets of #sextortion. They need to know the law is on their side. About my bill: https://t.co/b6fYVF0hAW"
2016-08-08 14:01:05;RepKClark;"RT @NancyPelosi: Even FL's Republican governor is telling @HouseGOP to ""show up"" to fight #Zika. When will you #doyourjob? https://t.co/KOG…"
2016-08-06 10:00:06;RepKClark;"51 yrs ago #VRA was enacted to safeguard every American's right to vote. We must defend that right &amp; #RestoreTheVRA. https://t.co/tL9PVMNhZs"
2016-08-05 22:35:41;RepKClark;"Gd Luck #TeamUSA &amp; MA5 Olympians competing in #RIO2016 Games, Sarah Scherer of #Woburn &amp; Eli Dershwitz of #Sherborn! https://t.co/e3PgOM52MW"
2016-08-05 19:04:39;RepKClark;"Since going into effect 23 yrs ago #FMLA has been used 200 million times by families.We shld ensure #paidleave &amp; pass the #FAMILYAct #FMLA23"
2016-08-05 19:04:10;RepKClark;Beautiful day to participate in water chestnut removal project w/ @MysticMyRWA -Team Clark https://t.co/qiwk6RmucO
2016-08-05 18:04:37;RepKClark;"No parent should be forced to choose between caring for a new baby &amp; keeping their paycheck. #paidleave https://t.co/rqbKFsmLFU"
2016-08-04 19:23:05;RepKClark;Glad to team up w/ our MA delegation to stand up to the GOP's abuse. Thankful for @MassAGO's service. https://t.co/xq087jiRSn
2016-08-04 16:54:17;RepKClark;"RT @RepJaredPolis: Happy #StartupDay! Startup companies create #jobs &amp; support #innovation. RT to give them recognition they deserve! https…"
2016-08-04 16:29:24;RepKClark;Wishing @POTUS the happiest of birthdays. #HappyBirthdayMrPresident #ThanksObama https://t.co/8fXi9OLIKb
2016-08-04 16:00:20;RepKClark;"Completely unacceptable for GOP to bully state attorneys general in order to deny #climatescience &amp; help #BigOil. https://t.co/2ds97hldM5"
2016-08-04 14:24:52;RepKClark;#Breaking: Clark, Mass delegation demand end to GOP’s abusive subpoenas of state Attorneys General https://t.co/I2Fb6hOUx3
2016-08-04 14:08:56;RepKClark;Happy 25th Anniversary #LakotaBakery! Fantastic #Arlington #SmallBusiness leading on #paidfamilyleave, raising wages https://t.co/XhMjumjiDI
2016-08-03 15:17:14;RepKClark;Congress must fully fund our #Zika response. Instead, GOP prioritized attacking #womenshealth, then ended session. https://t.co/EWKwqW3xWo
2016-08-03 13:27:18;RepKClark;"RT @RepTedDeutch: .@HouseGOP priorities:
✗ Fund Zika research
✗ Prioritize Americans' health
✗ Address public health crises
✓ Take 7 week r…"
2016-08-02 16:30:02;RepKClark;For many parents, unaffordable #childcare is the biggest barrier to returning to school or work. Let's change that: https://t.co/RnjJyxwvx3
2016-08-01 19:55:58;RepKClark;"Big day! Thanks &amp; congrats to all who fought for #EqualPayMA. Now let's #closethegap &amp; get #equalpay across America! https://t.co/UfHQNxpiWt"
2016-08-01 19:37:10;RepKClark;".@CDCgov has the latest on #Zika, including info for pregnant women, travelers &amp; advice on prevention. Pls share: https://t.co/eXT4wn8fMe"
2016-08-01 19:07:52;RepKClark;Congratulations to the graduates of @Wal_Fam_School! #TogetherWeLearn #TogetherWeSucceed #Waltham -Team Clark https://t.co/g0BgYRGE80
2016-08-01 16:14:09;RepKClark;"RT @USRepKCastor: 14 suspected FL cases of mosquito-transmitted #Zika &amp; @HouseGOP is on the longest summer recess since at least 1960 https…"
2016-08-01 15:27:28;RepKClark;"RT @EdWorkforce: Here’s why @AEDSocial supports @CongressmanGT &amp; @RepKClark’s bill to strengthen #CTE https://t.co/m8haUnGM5c https://t.co/…"
2016-08-01 15:26:56;RepKClark;"Instead of spreading hate, we shld all be working to stop #gunviolence &amp; care for each other. Proud of our @MassAGO. https://t.co/GsmS6cZSH0"
2016-08-01 14:50:35;RepKClark;"Shameful &amp; wrong. Online abusers who disagreed w/ commonsense #gunsafety chose to threaten violence &amp; spread hate. https://t.co/7NnEnMPFwV"
2016-07-30 12:23:04;RepKClark;"Happy 51st birthday #Medicare &amp; #Medicaid! Let's keep fighting to ensure health care is a right for all Americans, not a privilege for some."
2016-07-29 20:10:35;RepKClark;"#Zika is a public health emergency. House GOP should stop wasting time &amp; allow us to fully fund our response. https://t.co/GgjIgDJzRW"
2016-07-29 13:28:04;RepKClark;Sickening. Imagine being forced to leave work bc someone threatens your child. #Onlineabuse isn't a virtual problem. https://t.co/p8AOE7e2oE
2016-07-28 19:47:09;RepKClark;These moms had the courage to share their stories of loss. Congress should have the courage to vote to #disarmhate. https://t.co/0AvBidcC1l
2016-07-28 19:36:48;RepKClark;"Thankful for @AmerAcadPeds's leadership in addressing the impact of #gunviolence on kids &amp; our need to #disarmhate. https://t.co/qUL23LYhih"
2016-07-28 16:27:21;RepKClark;#TBT I co-founded the Pre-K Caucus to ensure our youngest learners have a voice in Congress. #InvestInKids #EarlyEd https://t.co/bjL91VFKdF
2016-07-27 14:27:04;RepKClark;"""U.S. spent $240 million/ yr on traffic safety research..but virtually no publicly-funded research on #gunsafety."" https://t.co/6E4efaHdEb"
2016-07-26 19:34:47;RepKClark;Congrats, Director Tamilio! Honored to join you for today's ceremony! - Team Clark https://t.co/1N7Rjr2TF0
2016-07-26 19:26:07;RepKClark;Excited to join #SecDef Carter today for the official launch of @DIU_x East in #Cambridge! - Team Clark https://t.co/LRo4CbDT1X
2016-07-26 17:49:06;RepKClark;RT @EdWorkforce: .@CongressmanGT, @RepKClark's #CTE bill will help more Americans compete for high-skilled, in-demand jobs: https://t.co/c8…
2016-07-26 15:56:54;RepKClark;"TY Col. Dunklee for your service to @Hanscom_AFB &amp; congrats to Col. Hund! We look fwd to working w/you! -Team Clark https://t.co/dFmM5PBS6B"
2016-07-26 15:20:58;RepKClark;For millions of parents, unaffordable #childcare makes going back to school or work nearly impossible. A solution: https://t.co/WhpvrPpGGI
2016-07-26 13:27:22;RepKClark;"RT @RepSwalwell: In @HouseDemocrats' #StrongerAmerica, students get help with higher ed &amp; refinancing loans: https://t.co/GbrGIWomF6 https:…"
2016-07-25 18:40:13;RepKClark;I intro'd the PAWS Act to help all affected by #domesticviolence - including family pets. https://t.co/VJNKY4ULZB https://t.co/uifHP2Hfqv
2016-07-22 19:44:22;RepKClark;"TY @MassAGO for your leadership &amp; common sense measures to adrs #gunviolence, keep MA communities safe. #DisarmHate https://t.co/8ys79omoe1"
2016-07-21 18:30:31;RepKClark;Honored 2 join @Hanscom_AFB to welcome home our service members who have deployed over the past year. TY!-Team Clark https://t.co/mz7gv5fKUR
2016-07-21 01:41:00;RepKClark;"Heartbroken by the loss of my friend @RepMarkTakai, a thoughtful public servant &amp; champion for the people of Hawaii https://t.co/EYVYYdd5oc"
2016-07-20 18:07:52;RepKClark;"The #internet should be open &amp; safe for everyone. Read about our fight against #onlineabuse: https://t.co/s7zvt94Pkm"
2016-07-19 15:33:13;RepKClark;TY #Framingham Selectmen, voting unanimously to send a msg to Speaker Ryan: Allow a vote on gun violence.#DisarmHate https://t.co/Ba0Kj5KlLC
2016-07-19 11:16:59;RepKClark;".@Lesdoggg's experience is horrific but sadly familiar. Have to do more to fight threats, hate speech &amp; abuse online https://t.co/jltQS0FFBp"
2016-07-18 15:49:21;RepKClark;Proud to join @MayorArrigo at #Revere City Hall to honor #SusanBAnthony Mdle Schl #NationalHistoryDay Participants! https://t.co/MmArReAdxU
2016-07-15 19:58:24;RepKClark;"RT @CAPEarlyEd: High quality child care is a necessity for working parents  @RepKClark’s bill makes it more affordable &amp; accessible https:/…"
2016-07-15 15:39:40;RepKClark;"Felicia's son was shot &amp; killed as he protected her. They deserve a vote to #disarmhate. https://t.co/YEgmg8tMNs https://t.co/HIwRtKBuTi"
2016-07-15 14:08:09;RepKClark;My heart is heavy for the people of France after this horrific violence. We stand with you. #NiceAttack #BastilleDayTragedy
2016-07-15 14:02:36;RepKClark;RT @NancyPelosi: .@HouseGOP is gone for longest recess in at least 60 years, did no work on #gunviolence, #Zika, and more. Shameful. https:…
2016-07-15 01:24:29;RepKClark;"Henrietta Beckman &amp; Wendy Edmonds still fighting for the memory of their loved ones. So shld Congress. #DisarmHate https://t.co/OCXRVd8BeY"
2016-07-15 00:41:30;RepKClark;"""What I do know is we have to end #gunviolence so no other mother will have to go through what I did."" #DisarmHate https://t.co/meU4FUhTEZ"
2016-07-15 00:30:39;RepKClark;RT @RepMcGovern: America has lost too many lives to #GunViolence. We must act now and come together, #LightingTheWay to #DisarmHate. https:…
2016-07-15 00:30:04;RepKClark;RT @RepTerriSewell: @GOP went home. We're still here. #EnoughIsEnough #DoYourJob #DisarmHate #LightingTheWay https://t.co/8UmYYHc8Bv
2016-07-15 00:10:51;RepKClark;The brave survivors joining us tonight are #LightingTheWay in our fight to end #gunviolence. #DisarmHate https://t.co/53qaWONHnn
2016-07-14 19:58:22;RepKClark;#Breaking: Clark bill ensures affordable #childcare through tax credits  https://t.co/YHdSk0AjZG
2016-07-14 18:44:22;RepKClark;"""It's no time to be silent. Tell the stories of those lost to #gunviolence loudly.They deserve action."" #DisarmHate https://t.co/qwQ7KrhanP"
2016-07-14 16:36:03;RepKClark;Thank you @RepSpeier for your leadership to #endrevengeporn https://t.co/XvhiH2XhRy
2016-07-14 16:34:55;RepKClark;RT @CCRInitiative: .@RepKClark: It is not ok to tell women to change their behavior, restrict their relationships, or stay off the internet…
2016-07-14 16:34:47;RepKClark;RT @RepSpeier: @RepKClark simply put, nonconsensual pornography, so-called #revengeporn, RUINS victims' lives. https://t.co/l5UilsrY7l
2016-07-14 00:30:42;RepKClark;"""GOP is telling us it’s not up to a woman to consult her doctor... it's up to her boss."" https://t.co/gYfy6cYq2w #notmyconscience"
2016-07-13 21:53:45;RepKClark;"If predators come after kids they should be met by the full force of the law. @SusanWBrooks &amp; I tackling #sextortion https://t.co/eWRrcUM0bm"
2016-07-13 21:46:44;RepKClark;#Breaking: Clark bill tackles #sextortion https://t.co/eWRrcUM0bm
2016-07-13 15:48:28;RepKClark;Fantastic feature in @ELLEmagazine about our fight against #onlineabuse. https://t.co/IAkgXMd4kH
2016-07-13 00:24:43;RepKClark;Joined other Democrats to honor the lives of those lost to the #pulseshooting. We will keep fighting to #DisarmHate https://t.co/THkrT46D9R
2016-07-12 18:59:55;RepKClark;Happy 120th Birthday, #RevereBeach! https://t.co/hi6WtEUF2p
2016-07-12 13:39:15;RepKClark;Shameful. GOP can't be bothered to address #gunviolence but found time to push an anti-#LGBT bill 1 mo after Orlando.https://t.co/KbaT4DuyNc
2016-07-11 16:09:44;RepKClark;TY #Melrose for beautiful cards! We owe it to every child to cont' fight to end #gunviolence https://t.co/54DWixZjQT https://t.co/Kyz463OymX
2016-07-11 13:22:11;RepKClark;RT @RepRobinKelly: FACT: 82% of gun owners support closing the dangerous #NoFlyNoBuy loophole. https://t.co/3XQ7NKhynD #DisarmHate https://…
2016-07-08 18:56:12;RepKClark;"A victory for #MA that continues our tradition of being on the front lines in the fight for justice &amp; equality. #TransBillMA is now law!"
2016-07-08 18:51:00;RepKClark;#Breaking:Clark bills incorporated in passage of Congress’ #opioid reform package https://t.co/YHdSk0AjZG
2016-07-08 14:54:30;RepKClark;"I join the country in grief for the police officers who were assassinated &amp; those wounded while doing their jobs. https://t.co/T14L6JEFY2"
2016-07-08 06:11:22;RepKClark;Devastated by the targeting of police officers in Dallas tonight. We must stand together against this horrific violence.
2016-07-07 23:42:26;RepKClark;"When we don't speak about race &amp; racism, we become casual observers of unchecked privilege, discrimination, death https://t.co/yP9nDsuuJ2"
2016-07-07 23:42:12;RepKClark;The violent deaths of Alton Sterling and Philando Castile are assaults on our humanity. Read: https://t.co/yP9nDsM5AA
2016-07-07 19:46:52;RepKClark;UPDATE: Clark Bipartisan Bill to Strengthen Career and Technical Education Approved Unanimously by Committee https://t.co/kFR93oHnyK
2016-07-07 14:11:04;RepKClark;RT @YvetteClarke: FACT: 91 people per day die from gun violence. RT to say it's far past time we #disarmhate. https://t.co/i2FiFALmyd
2016-07-06 22:35:27;RepKClark;Listen to DeAndra whose 13 y/o son was shot at a birthday party. She and her son deserve a vote to #DisarmHate https://t.co/yx5si7bdGA
2016-07-06 21:42:47;RepKClark;"Listen to Jill: ""When I lost my son to #gunviolence, a part of me died."" She deserves a vote to #DisarmHate. https://t.co/p77YMFfVX4"
2016-07-06 21:18:39;RepKClark;In 1993 America refused to let the NRA's massive $ spending to control their Congress. My op-ed frm 2014:https://t.co/1Fg9TxHfoC #DisarmHate
2016-07-06 20:54:57;RepKClark;Barbara's 24 y/o daughter Allison was shot on live TV while doing her job. They deserve a vote to #DisarmHate https://t.co/7yGorYcrOS
2016-07-06 20:20:57;RepKClark;Antwan used his own body to shield his 2 kids from gunfire. He was shot 11 times. He deserves a vote to #DisarmHate https://t.co/VK1gqC6vUp
2016-07-06 18:45:06;RepKClark;Catherine lost her 10 y/o daughter to a domestic abuser who bought a gun online. She deserves a vote to #DisarmHate. https://t.co/HIOtUNBq4K
2016-07-06 15:12:18;RepKClark;"""We won't give up or give in. We demand a vote to #disarmhate."" Why we call @repjohnlewis the conscience of Congress https://t.co/gvP2qgVQMY"
2016-07-06 14:37:49;RepKClark;We're standing up to the NRA w/ 91 in orange who represent 91 Americans lost to #gunviolence each day. #DisarmHate https://t.co/SnISGUExT1
2016-07-05 20:23:21;RepKClark;"#Update: Make no mistake - the GOP's bill is a vote for the NRA, not the American people. Watch &amp; RT:https://t.co/sDkloenPdf #DisarmHate"
2016-07-05 20:01:20;RepKClark;I ask this Congress to muster the moral courage to pass real, meaningful, commonsense gun violence reforms that will save lives. #DisarmHate
2016-07-05 20:00:25;RepKClark;We must reject a cynical bill, bought and paid for by the gun lobby, that will do nothing to make American families safe. #DisarmHate
2016-07-05 19:58:32;RepKClark;Yet, instead of listening to the demands of the American people, @SpeakerRyan has doubled down on the gun lobby's demands. #DisarmHate
2016-07-05 19:57:55;RepKClark;The American people have stated clearly that they will no longer stand for capitulation to the @NRA #DisarmHate
2016-07-05 19:56:57;RepKClark;The vast majority of Americans support bipartisan common sense legislation that has been gathering dust on the Speaker's desk #DisarmHate
2016-07-05 19:54:04;RepKClark;and a vote for a bill that does nothing to keep Americans safe from harm. #DisarmHate
2016-07-05 19:53:39;RepKClark;"This bill is a vote for powerful special interests; a vote to honor millions of dollars of the @NRA's campaign spending; #DisarmHate"
2016-07-05 19:51:31;RepKClark;Instead, @SpeakerRyan has given American families a bait and switch. #DisarmHate
2016-07-05 19:50:54;RepKClark;and a vote to keep Americans safe from harm and terror. #DisarmHate
2016-07-05 19:50:18;RepKClark;"a vote to honor victims and survivors of senseless gun violence; a vote to honor victims and survivors of senseless gun violence #DisarmHate"
2016-07-05 19:48:43;RepKClark;When @SpeakerRyan announced a vote on gun violence, the American people hoped this would be a vote for families and children #DisarmHate
2016-07-05 19:47:20;RepKClark;The American people have been clear: they are demanding a vote to keep American families safe from gun violence. #DisarmHate
2016-07-05 12:47:15;RepKClark;"Thank you to the #Juno team @NASA for your commitment to scientific discovery &amp; making the impossible possible! https://t.co/8ffVSf9Scd"
2016-07-04 09:00:13;RepKClark;Happy #4thOfJuly! Happy Birthday, America! Read: https://t.co/0NW1tA3bz3 https://t.co/XDeHt2XcV8
2016-07-03 01:42:28;RepKClark;"""There may be times when we are powerless to prevent injustice, but there must never be a time when we fail to protest."" - Elie Wiesel"
2016-07-01 14:18:07;RepKClark;"""We know that we can balance civil liberties with commonsense measures that protect our families and our children,"" https://t.co/68tJ1A73iu"
2016-07-01 14:12:52;RepKClark;Ending the backwards ban on #transgender service members is a bold move toward #equality, but we can't stop there. https://t.co/GINPvSgGBx
2016-06-30 18:03:26;RepKClark;".@RepJoeKennedy: ""We won't stop until the American people's voices are heard."" #disarmhate #EndGunViolence https://t.co/R3QkDOQO5M"
2016-06-30 17:27:00;RepKClark;It's time for us to #moveourfeet to honor the tens of thousands lost to #gunviolence. #disarmhate https://t.co/VRmfT0ylis
2016-06-30 16:40:36;RepKClark;".@MassAGO: #MA has some of the strongest gun safety laws in the country and we know it works."" #disarmhate https://t.co/rPcGqJBLSx"
2016-06-30 16:33:00;RepKClark;From #nobillnobreak in DC to the steps of the #statehouse in #MA, our movement to #disarmhate continues to grow! https://t.co/9dS3wUQZWZ
2016-06-30 16:29:09;RepKClark;".@marty_walsh: ""House GOP leaders might not have heard #nobillnobreak, but the American people sure did."" https://t.co/ogI5k2w8kz"
2016-06-30 16:22:28;RepKClark;".@SpeakerDeLeo to Congress: ""No more moments of silence without action!"" #disarmhate https://t.co/jiaorO9MFR"
2016-06-30 16:19:11;RepKClark;#happeningnow: @senstan handing Katherine a resolution to demand that Congress act on #gunviolence #disarmhate https://t.co/IjeVZ77PUu
2016-06-30 16:07:23;RepKClark;Great crowd coming together to #disarmhate and end #gunviolence https://t.co/8rvxgdEPpX
2016-06-30 13:58:41;RepKClark;RT @RepSwalwell: .@HouseGOP, Americans are tired of the daily tragedy of gun violence. They are taking their frustration and saying: #Disar…
2016-06-29 19:34:49;RepKClark;Proud to stand with you, Mayor. Thank YOU for your leadership! https://t.co/wMiDI2l8Jj
2016-06-29 19:33:49;RepKClark;Thank you for your leadership, Mayor! https://t.co/aEBFta2rt5
2016-06-29 18:58:11;RepKClark;"Join us: Tomorrow at 12p in Boston, we're teaming up w/ national &amp; local leaders to push for action on #gunviolence. https://t.co/C1KodkvCrR"
2016-06-29 15:37:44;RepKClark;#Breaking: Teamed up w/ #MA5 mayors to urge @SpeakerRyan to allow a vote on #gunviolence. https://t.co/wNp3LJ97Oa https://t.co/HH68lyREYV
2016-06-29 10:49:19;RepKClark;Horrified by the news out of Istanbul. Please know that the people of the United States stand with you against these acts of terror.
2016-06-28 23:00:59;RepKClark;"Watch @GreaterBoston on WGHB-2 now. @RepCapuano &amp; I will discuss the #DemocraticSitIn &amp; #NoBillNoBreak w/ @jimbraude https://t.co/s8GLXjP9Hl"
2016-06-28 16:40:57;RepKClark;"She changed the game forever &amp; inspired girls to follow their dreams. Grateful for #PatSummitt's legacy. 🏀🏀🏀 https://t.co/egwkFsxSpK"
2016-06-27 22:23:23;RepKClark;Thrilled to join @Shireplc for the Celebration of their newest location in #Lexington! #STEM #Innovation https://t.co/2lD8lE4oAX
2016-06-27 19:41:56;RepKClark;This #SCOTUS ruling preserves an important tool to keep families safe from gun violence. https://t.co/ieTE0LipM9
2016-06-27 17:06:39;RepKClark;"Thank you #MA5 Mayors, Town Mangers for your leadership - working to build prosperous, healthy &amp; safe communities https://t.co/Bh04H6voFW"
2016-06-27 15:39:46;RepKClark;In #Waltham, Mtg w/ #MA5 Mayors, Town Managers on #Transportation, Economic Development, #Opioid Crisis, #GunSafety https://t.co/CHaIt4wFvD
2016-06-27 14:13:59;RepKClark;An enormous win for women's reproductive autonomy. Thanks to all who fought so hard for all of us! #StopTheSham  https://t.co/8iBmWO5B0W
2016-06-27 11:28:57;RepKClark;.@SpeakerRyan, we should be voting on gun violence prevention legislation to keep Americans safe. #NoBillNoBreak https://t.co/WZbLVwfX53
2016-06-24 19:42:28;RepKClark;https://t.co/qiIKPkJqyv
2016-06-24 18:55:44;RepKClark;From #Stonewall to #Pulse, #LGBT community has reminded us some things are worth fighting for. #WeAreWithYou #PRIDE https://t.co/bQNSk0aH0i
2016-06-24 16:35:40;RepKClark;Thousands across the country pled #NoBillNoBreak. Speaker Ryan's response? Adjourn the House. We will keep fighting. https://t.co/Rx2XMOPmJ6
2016-06-24 10:07:44;RepKClark;And thank you for making sure the American people could see it! https://t.co/JyCIIlJLA8
2016-06-23 17:09:47;RepKClark;"We will keep up the fight in our districts &amp; across the country to end gun violence. The American people demand action. #NoBillNoBreak"
