timestamp;sn;text
2017-01-31 20:03:06;RepKClark;"Thank you @MassAGO for taking steps to protect MA families from Trump's illegal &amp; unconstitutional #MuslimBan.… https://t.co/0f4YAUHPsG"
2017-01-31 19:37:59;RepKClark;I co-sponsored the EACH Woman Act b/c all women have the right to full reproductive health care regardless of their income. #BeBoldEndHyde
2017-01-31 14:46:23;RepKClark;"Teamed up w/ @RepZoeLofgren &amp; 170+ Dems to fight Trump's reckless &amp; unconstitutional ban. Statue of Liberty Values… https://t.co/jv0q5Ug38x"
2017-01-31 14:29:08;RepKClark;"""slamming the door shut on those fleeing violence and persecution..is a stark departure from core American values."" https://t.co/NsI2Ms6RFh"
2017-01-31 12:41:09;RepKClark;Thank you @SallyQYates for having the moral courage to stand up for what's right, no matter the consequences… https://t.co/4yuKYPtnQL
2017-01-30 21:00:47;RepKClark;"Will @HouseGOP find the moral courage to join us &amp; fight these unconstitutional executive orders? #muslimban https://t.co/QU5tc20DmC"
2017-01-30 20:18:05;RepKClark;Bannon's appointment to the National Security Council should concern every American. https://t.co/9ue8iRaZcR
2017-01-30 19:59:37;RepKClark;#KorematsuDay reminds us that it's never the wrong time to take a stand and fight injustice.
2017-01-30 03:09:59;RepKClark;I'm committed to using every tool available to fight this unconstitutional Muslim Ban. #NoBanNoWall https://t.co/Z34TqOl4YQ
2017-01-30 03:09:19;RepKClark;"are fearful &amp; uncertain about what will happen to their family members as a result of Trump's reckless &amp; heartless… https://t.co/aZkhEMsN5W"
2017-01-30 03:07:34;RepKClark;Still, too many of our neighbors, like the Syrian American family I met tonight from Belmont #NoBanNoWall https://t.co/58TajEP46y
2017-01-30 03:05:35;RepKClark;The immigration attorneys at Logan Airport are doing amazing work helping families reunite with their loved ones.… https://t.co/3exW25hhoG
2017-01-29 10:02:01;RepKClark;"Thank you to the attorneys in Boston &amp; around the country who've dropped everything to fight Trump's #MuslimBan https://t.co/z5XO75Rius"
2017-01-29 01:37:19;RepKClark;Congress can fix this unconscionable, unconstitutional executive order. Will @HouseGOP summon the moral courage to… https://t.co/W4rtybQnRM
2017-01-28 13:28:10;RepKClark;This is not a question of liberal vs conservative or Democrat vs Republican. This is a question of right vs wrong. https://t.co/VkANI71qjU
2017-01-27 16:45:59;RepKClark;History reminds us to be compassionate and concerned citizens of the world. #HolocaustRemembranceDay https://t.co/RExzqcTmug
2017-01-26 19:04:07;RepKClark;RT @USProgressives: We need @RepKClark 's Presidential Conflicts of Interests Act! Read @ZephyrTeachout oped about the emoluments clause ht…
2017-01-26 17:44:30;RepKClark;In his 1st interview as POTUS, Trump.. https://t.co/QJaWxjWf9A
2017-01-26 15:00:21;RepKClark;#TBT #offensiveandunconstitutional https://t.co/UfltPtyx1b
2017-01-26 14:41:22;RepKClark;"POTUS's move to muzzle @EPA should raise red flags for anyone who believes in transparent &amp; accountable government.… https://t.co/7cxlbg02JL"
2017-01-25 16:14:35;RepKClark;"Turning our back to unprecedented humanitarian crises is not an act of strength; it exposes a lack of moral leadership."
2017-01-25 16:14:09;RepKClark;POTUS's anti-immigrant plans are cruel and un-American.  https://t.co/44iGxO57gY
2017-01-25 15:49:27;RepKClark;Congress should be protecting Americans, not POTUS's conflicts of interest. https://t.co/LY79EQCIYM
2017-01-24 23:23:44;RepKClark;For the record, @BadlandsNPS was tweeting #Science, not #alternativefacts https://t.co/RuYwuHlRsF
2017-01-24 21:54:22;RepKClark;#science https://t.co/FGE4TnLW8c
2017-01-24 18:44:28;RepKClark;Shameful. Instead of helping families at home, GOP has made it a top priority to roll back progress on women's #reprorights. #ProtectOurCare
2017-01-24 18:38:12;RepKClark;"Our msg to POTUS &amp; GOP: Millions marched in solidarity to reject your divisive anti-woman promises. We won't be sil… https://t.co/Bhr2bAKa4N"
2017-01-24 15:48:00;RepKClark;Proud to be recognized by @massheadstart @NatlHeadStart. They honor us daily by fighting for our youngest learners.… https://t.co/BDJ4H3faOT
2017-01-24 14:14:14;RepKClark;RT @janschakowsky: Medicaid rationing threatens our ability to care for seniors and people with disabilities – while forcing states to pick…
2017-01-23 18:29:45;RepKClark;Reinstating the global gag rule shows his anti-woman campaign promises becoming anti-woman policy. #WomenAreWatching https://t.co/xndmQL48EE
2017-01-23 17:31:29;RepKClark;Americans should not be left in the dark about POTUS's conflicts. Another reason to pass the Presidential Conflicts… https://t.co/66RG2PThqd
2017-01-23 16:11:43;RepKClark;"More #alternativefacts: White House says ""people don't care"" about POTUS's tax returns &amp; conflicts. Here's reality:  https://t.co/dGHskfbAud"
2017-01-23 15:58:18;RepKClark;"By never releasing tax returns, POTUS keeps Americans in the dark about how much he owes &amp; to whom. Yes -- we care. https://t.co/srZkbSN2uw"
2017-01-23 03:41:44;RepKClark;AFC Champs! Congrats #PatriotsNation! https://t.co/a0ZF0DfExe
2017-01-22 15:04:29;RepKClark;On the 44th anniversary of #RoeVWade I'm one of the #7in10forRoe who believe reproductive rights are human rights #Roe44 #trustwomen
2017-01-22 12:42:33;RepKClark;Trump's priorities in his first 24 hours: https://t.co/DaNxdQIybN
2017-01-20 19:37:48;RepKClark;Just met w/ dedicated caregivers @PPAdvocacyMA. I want them to know we're fighting for them and the families they h… https://t.co/XuX4kzi5N9
2017-01-20 11:51:39;RepKClark;Thank you. https://t.co/f6zMQytfGt
2017-01-19 14:36:29;RepKClark;We asked the President-elect: Will your policies hurt or help women? The true test begins tomorrow.#womenarewatching https://t.co/nvntx1TR2W
2017-01-18 15:01:06;RepKClark;"""The core problem is that Trump won’t make the sacrifices necessary to serve as a conflict-free chief executive."" https://t.co/tNgASsjRqs"
2017-01-16 20:16:33;RepKClark;Proud to join friends and neighbors to honor the legacy and spirit of #MLK through community service projects. https://t.co/P5wPAZcpwV
2017-01-16 17:40:28;RepKClark;Wonderful #MLKDay in Cambridge. Let’s be the ones to guide the arc of the moral universe towards justice. https://t.co/3oN0CGn86Z
2017-01-16 09:59:54;RepKClark;"""The time is always right to do what is right."" -Martin Luther King, Jr. Happy #MLKDay https://t.co/GMFy5sAVV8"
2017-01-14 17:48:53;RepKClark;.@realDonaldTrump is willing to sacrifice our democracy for his personal enrichment
2017-01-14 17:47:50;RepKClark;.@repjohnlewis is an American hero who was willing to sacrifice his life for our democracy https://t.co/slK2SVB0Lz
2017-01-14 15:44:12;RepKClark;RT @NancyPelosi: Ahead of #MLKday2017, let us remember that many have tried to silence @repjohnlewis over the years. All have failed.
2017-01-13 20:05:02;RepKClark;"Every Democrat &amp; every Republican should want to promote accountability &amp; transparency within the executive branch. https://t.co/effroDI799"
2017-01-13 19:06:54;RepKClark;GOP's plans to eliminate lifesaving health insurance for 20 million Americans also kills millions of jobs, adds $9… https://t.co/17V6OcVHBV
2017-01-13 17:06:00;RepKClark;Congress should be protecting the American people from Trump's conflicts of interest, not attacking ethics watchdogs https://t.co/zQgnE72mR7
2017-01-12 14:52:30;RepKClark;"Office of Government Ethics: Trump's plan is ""meaningless."" Why we need the Presidential Conflicts of Interest Act: https://t.co/QMr2K7gwrJ"
2017-01-11 20:12:45;RepKClark;How we spend our resources is a reflection of our values. Eager to serve as a new member of the House Appropriation… https://t.co/flYx0xkYBi
2017-01-11 20:05:04;RepKClark;"""We don't want to go back. We want to go forward."" Here's why @repjohnlewis is known as the conscience of Congress. https://t.co/4zO5EP6CqB"
2017-01-11 18:45:28;RepKClark;"Presidential Conflicts of Interest Act: because both parties want to eliminate uncertainty &amp; promote transparency. https://t.co/XfFPxbaAAc"
2017-01-11 18:44:32;RepKClark;Our bill ensures that Americans' needs will never compete with or be beholden to a president’s financial interests. https://t.co/XfFPxbaAAc
2017-01-11 18:43:32;RepKClark;There is nothing partisan about the transparency and accountability that comes with being leader of the free world. https://t.co/XfFPxbaAAc
2017-01-11 18:42:32;RepKClark;Americans are left wondering if the President-elect will work for them or will work to line his own pockets. https://t.co/XfFPxbaAAc
2017-01-10 22:11:51;RepKClark;Update: Support for Presidential Conflicts of Interest Act has grown to 100 cosponsors since we intro'd it yesterday https://t.co/Q82Cao1xgv
2017-01-10 21:58:52;RepKClark;#Postpartum depression affects 1 in 7 moms. Here's why I fought to make addressing it a priority:  https://t.co/jQk3RaIQF6
2017-01-10 18:11:29;RepKClark;Why Congress should pass the Presidential Conflicts of Interest Act: https://t.co/OgQP51oFJM
2017-01-09 18:47:43;RepKClark;"Proud to partner w/ @SenWarren &amp; Democrats to introduce the Presidential Conflicts of Interest Act in the House &amp; S… https://t.co/aTqkFPehpL"
2017-01-09 16:52:52;RepKClark;Americans deserve to know that their needs will always come 1st. Read abt the Presidential Conflicts of Interest Act https://t.co/Q82Cao1xgv
2017-01-09 16:03:41;RepKClark;Update: Clark, Democrats Introduce Bill to Require President and Vice President to Fully Divest Personal Financial… https://t.co/mehefScQex
2017-01-08 01:32:06;RepKClark;"Trump &amp; team are failing to comply with ethics rules designed to protect the American public. Congress must hold hi… https://t.co/uzlaaB9SwD"
2017-01-05 23:50:16;RepKClark;My statement on the upcoming inauguration: https://t.co/dQXE0ztvTf
2017-01-05 23:30:46;RepKClark;"#Breaking: Rep. Clark appointed to House Appropriations Committee
https://t.co/U4nvH4ScF9 https://t.co/gfhSc4BefZ"
2017-01-05 20:12:52;RepKClark;"Congrats @RallyPoint in #Watertown for reaching 1mil active members! Thnx for all you do for veterans &amp; servicememb… https://t.co/KcaHxdgr6v"
2017-01-05 17:35:42;RepKClark;"1st week back in Congress and what's the GOP's priority? Turning back the clock for women &amp; families #IStandWithPP 
https://t.co/ka0qzYI4N3"
2017-01-05 16:00:56;RepKClark;"My talk w/ @RadioBoston: why it's more important than ever that we speak out &amp; keep this GOP Congress &amp; the Trump a… https://t.co/CFcxqFqZv1"
2017-01-05 15:42:10;RepKClark;RT @RepDianaDeGette: #ACA means ~85 million women now have access to preventive care like mammograms and flu shots. That's worth protecting…
2017-01-04 15:41:04;RepKClark;"GOP wants to punish those of us who speak up against gun violence. This is the #PeoplesHouse &amp; we will keep fighting https://t.co/C9KTOB0eId"
2017-01-04 15:35:55;RepKClark;"RT @RepCheri: Fact: The Republicans radical attempts to repeal #ACA &amp; destroy Medicare, Social Security &amp; Medicaid will #MakeAmericaSickAga…"
2017-01-04 15:11:21;RepKClark;".@POTUS to Congressional Dems: ""There is nothing more noble than fighting for the American people.""
We will continu… https://t.co/XmMRtGleiZ"
2017-01-03 20:18:04;RepKClark;Now more than ever, we're ready to cause some #goodtrouble in the #peopleshouse. The American people are depending… https://t.co/LGkaWO12yi
2017-01-03 17:56:35;RepKClark;Because the #PeoplesHouse should be ethical, accountable, and open to free debate, I vote for @NancyPelosi for Speaker of the House
2017-01-03 17:44:56;RepKClark;"But make no mistake: the GOP rules still seek to silence the people's representatives &amp; limit Americans' access to the #PeoplesHouse 2/2"
2017-01-03 17:44:38;RepKClark;"Egregious proposal to undermine House #ethics &amp; the #PeoplesHouse was pulled because thousands of Americans spoke up. 1/2"
2017-01-03 15:43:52;RepKClark;"No punishment or rules change will keep me from speaking out &amp; standing up to extremists who promise to take us backwards. 6/6"
2017-01-03 15:42:45;RepKClark;Democrats will defend the #PeoplesHouse. We will speak up for American families. We will not back down to bullies. 5/6
2017-01-03 15:42:17;RepKClark;"It's clear: GOP will do the bidding of special interests, ignore the will of Americans &amp; be accountable to no one. #PeoplesHouse 4/6"
2017-01-03 15:41:24;RepKClark;"By shutting down accountability in the #PeoplesHouse &amp; muzzling the people’s representatives, GOP is sending a dangerous message. 3/6"
2017-01-03 15:40:48;RepKClark;At the same time, they’re muzzling the people’s representatives with fines for speaking out like we did at the sit-in #PeoplesHouse 2/6
2017-01-03 15:40:09;RepKClark;"In the middle of the night, GOP removed all independence &amp; accountability from House #ethics #PeoplesHouse 1/6 https://t.co/wORlKD226J"
2017-01-03 14:26:08;RepKClark;"RT @NancyPelosi: Working families expect us to fight for their health &amp; economic security. In 115th Congress, @HouseDemocrats will do just…"
2017-01-02 18:21:56;RepKClark;RT @NancyPelosi: Republicans are launching their assault on ACA. And they won't stop there: they want to dismantle Social Security, Medicar…
2017-01-01 10:00:16;RepKClark;As we reflect on the end of one year and celebrate the beginning of another, I wish everyone a happy and healthy New Year!
2016-12-29 16:00:39;RepKClark;When the new Congress is sworn in, we'll be here continuing our fight to end #onlineabuse. My proposals: https://t.co/C9zXbfljRE
2016-12-28 18:24:26;RepKClark;"""Clark chastised Republicans whom she accused of focusing on punishing members over addressing gun violence."" https://t.co/AWoh96OaRL"
2016-12-28 16:01:10;RepKClark;As we approach 2017, I encourage you to sign up for our newsletter to get updates on my work in Congress. https://t.co/MqGdlk2H51
2016-12-28 02:15:41;RepKClark;There is no punishment that will deter me from standing with American families devastated by gun violence. https://t.co/D3pwyMieSN
2016-12-27 19:08:22;RepKClark;They should know this: there is no punishment that will deter me from standing with American families devastated by gun violence.
2016-12-27 19:06:57;RepKClark;Rather than take a single vote to prevent gun violence, House GOP will pass rules designed to prevent another sit-in https://t.co/jqLYfuTFMt
2016-12-27 15:59:57;RepKClark;"As we look ahead to 2017, I encourage you to empower yourself &amp; others w/ info on the legislative process. Pls share https://t.co/5cv8VOeP7r"
2016-12-26 15:59:55;RepKClark;"Working together, we've been able to lead the national conversation on issues like #gunviolence, #onlineabuse &amp; more https://t.co/cuWTl2od8y"
2016-12-25 10:00:09;RepKClark;Merry Christmas! I hope your day brings you love, laughter, and peace. https://t.co/dv659GHWT9
2016-12-24 10:00:08;RepKClark;Wishing you a wonderful Festival of Lights filled with joy and great memories. Happy Hanukkah! https://t.co/obNTL54eDk
2016-12-23 17:08:23;RepKClark;"I wish our servicemembers &amp; military families abroad &amp; at home a safe and joyous holiday season. Thank you for your service and sacrifice."
2016-12-23 16:52:18;RepKClark;Update: We have 82 co-sponsors in the House pushing for the passage of #PresidentialAccountabilityAct https://t.co/rSNQ6VBYod
2016-12-22 18:05:39;RepKClark;A look back at 2016. I look forward to continuing our fight in Congress. https://t.co/8uf7gWUDKi https://t.co/vzKcGiFSqy
2016-12-22 15:42:41;RepKClark;Americans deserve assurance that their needs will always come first. Why we need the #PresidentialAccountabilityAct https://t.co/NskVE9bqm1
2016-12-21 17:45:47;RepKClark;"“Our moms need to know they matter.. that we will fight for the health and success of their families,"" said Clark. https://t.co/bDwxIPJow9"
2016-12-21 16:35:52;RepKClark;"Thank you, @cagoldberglaw. Ending #onlineabuse requires action &amp; partnerships across tech, lawmaking &amp; online commu… https://t.co/plJUrUDOmR"
2016-12-20 14:46:09;RepKClark;"I talked to @CNN about calling out @realDonaldTrump &amp; his abusive online attacks against private citizens. https://t.co/Mduio81lBg"
2016-12-20 14:34:56;RepKClark;"""Trump isn't issuing threats himself..but he knows he has followers who will."" On @realDonaldTrump &amp; #onlineabuse: https://t.co/Mduio81lBg"
2016-12-20 01:10:44;RepKClark;We should change the ethics laws: so @realDonaldTrump can't use the presidency to line his own pockets… https://t.co/udBJ7GbIFZ
2016-12-19 20:52:04;RepKClark;"Great to join co-founders and twin sisters Angelica &amp; Diana Cardona for the grand opening of @Chocolaffee2 in Rever… https://t.co/ctxm7cu1qP"
2016-12-19 16:25:55;RepKClark;"""anything short of divestment does not mitigate concerns regarding conflicts.."" #PresidentialAccountabilityAct https://t.co/otbgWW3lIc"
2016-12-19 16:18:34;RepKClark;ICYMI: It can take a toll on victims, both emotionally and economically. Why I'm fighting #onlineabuse: https://t.co/qzKDAM7aJD
2016-12-19 00:41:36;RepKClark;Congress can. #PresidentialAccountabilityAct https://t.co/Muabp8IES9
2016-12-16 22:01:39;RepKClark;ICYMI: Here's why I'm pushing Congress to address the malicious release of private information, aka #doxxing: https://t.co/nemqox0wNo
2016-12-16 20:29:01;RepKClark;When others try to use hate to divide our community, we stand together to refuse it. TY Islamic Center of #Wayland. https://t.co/mjk1WvINMn
2016-12-16 18:07:18;RepKClark;Will the President-elect be working for American families or for personal profit? #PresidentialAccountabilityAct  https://t.co/igtgXOtWZj
2016-12-16 16:51:32;RepKClark;Wonderful to partner w/ @REACH_MA in #Waltham this morning to help transport gifts to local families! TY for all yo… https://t.co/UFBJnskMLm
2016-12-15 16:44:31;RepKClark;"Thank you @MomsDemand for your tenacity &amp; leadership. Proud to stand with you. Let's #keepgoing in 2017.… https://t.co/VwvnbVkARK"
2016-12-15 16:01:17;RepKClark;Yes, let's address the influence of fake news. First, by making sure our top officials aren't the ones spreading it… https://t.co/qPbtrfW2Jk
2016-12-15 14:36:10;RepKClark;Only silence on the day @realDonaldTrump promised to address conflicts of interest. #PresidentialAccountabilityAct https://t.co/rSNQ6VBYod
2016-12-14 17:04:57;RepKClark;"""Office of Government Ethics's view is that a President should comply with this law by divesting conflicting assets"" https://t.co/CyKgK4sPV0"
2016-12-14 16:00:25;RepKClark;My heart goes out to those we lost in #SandyHook. We should honor them with action. We won't back down from our fig… https://t.co/ICtH8usiL0
2016-12-14 15:12:57;RepKClark;"""he will not divest...nothing of consequence has changed."" Why we should pass my #PresidentialAccountabilityAct: https://t.co/rDIXy8ZVib"
2016-12-14 14:14:43;RepKClark;It's an incredible honor to bring our fight to Congress every day. https://t.co/0jzhJ3iv6Q
2016-12-13 22:33:30;RepKClark;"""Trump gave no indication he will give up his ownership stake."" Why I introduced the #PresidentialAccountabilityAct: https://t.co/Gk6B3QD46U"
2016-12-13 18:04:55;RepKClark;The intelligence community has concluded that a foreign government intended to interfere in our presidential electi… https://t.co/3tNjGZL5fo
2016-12-13 16:27:59;RepKClark;Americans want assurance that their needs will come 1st. Why support for #PresidentialAccountabilityAct is growing: https://t.co/fEwproBwmQ
2016-12-13 16:14:57;RepKClark;On the heels of Russian interference in our election, the nomination of a Big Oil Pal of Putin is breathtaking. https://t.co/rSWVlQRFk2
2016-12-12 20:45:44;RepKClark;Fantastic time at Supreme BBQ Grand Opening in #Malden. Congratulations! -Team Clark https://t.co/YCRRSBIqxd
2016-12-12 20:32:33;RepKClark;TONIGHT:Join #Immigration Know Your Rights Workshop at Roosevelt Towers #CambMa. Free legal info, childcare provided https://t.co/zAOHWf9EcW
2016-12-12 15:58:38;RepKClark;"Here's why I intro'd the #PresidentialAccountablityAct. Transparency &amp; accountability should not be partisan goals. https://t.co/tfmVyvyHnv"
2016-12-12 14:28:42;RepKClark;Read about why I introduced a bill to stop the malicious publication of personal info. #Doxxing  https://t.co/xWCvgNpcII
2016-12-10 14:04:49;RepKClark;6 worst, @realDonaldTrump's attacks on private citizens are designed to intimidate so he won't be criticized. We will not be silenced.
2016-12-10 13:34:34;RepKClark;5 @realDonaldTrump's behavior isn't just unpresidential, it's below minimum standards for a regular adult human being
2016-12-10 13:33:28;RepKClark;4/ we know it's only a matter of time, but it shouldn't take an actual violent response for @realDonaldTrump to stop these attacks
2016-12-10 13:31:52;RepKClark;3/ despite - or because of - this dangerous, unhinged response, @realDonaldTrump continues to attack private citizens
2016-12-10 13:30:36;RepKClark;2/ @realDonaldTrump knows that these attacks result in a massive response from his followers, including death threats
2016-12-10 13:28:57;RepKClark;1/ whether a college student in NH or a union leader in IN, @realDonaldTrump's attacks on private citizens must stop https://t.co/gkut0KZ5zJ
2016-12-10 12:41:21;RepKClark;The American people deserve an immediate, full, and transparent investigation.  https://t.co/j165KTwSPV https://t.co/yJ68eu0lD5
2016-12-09 20:27:30;RepKClark;Congrats to my friend and colleague @nikiinthehouse! A well deserved honor for her leadership and service. https://t.co/zxx9Z5r52u
2016-12-09 15:36:56;RepKClark;This is a victory for all families. Read about why I pushed Congress to pass my bill to helps moms affected by… https://t.co/dTDqIKreoy
2016-12-09 15:15:55;RepKClark;Great news! My bill to empower survivors of #domesticviolence now has 220 cosponsors -- enough to pass in the House… https://t.co/aEH4zZS5X6
2016-12-08 21:37:03;RepKClark;"Saddened to hear of the passing of Sen. John Glenn, an American hero, a champion for exploration, &amp; public servant. https://t.co/lzYf19zbt4"
2016-12-08 19:37:47;RepKClark;#Update: Read about the bill I intro'd to protect victims of #doxxing: https://t.co/FeryzCi51z https://t.co/i4rVr354pb
2016-12-08 15:13:35;RepKClark;A majority of Americans demand that Congress address #gunviolence, but GOP would rather listen to the gun lobby. https://t.co/FDi2l53JxJ
2016-12-08 14:51:20;RepKClark;“..moms need to know they matter ― that we will fight for the health and success of their families.”- Rep. Clark  https://t.co/TmJZwwddn8
2016-12-08 14:35:51;RepKClark;"""Cherry-picking and twisting the facts will not change the future nor the fact that the Earth is warming."" Exactly.
https://t.co/SUlkqJ9kag"
2016-12-07 22:26:43;RepKClark;#Onlineabuse can impact how we navigate an economy that is increasingly online. Why I'm pushing Congress to act: https://t.co/qzKDAM7aJD
2016-12-07 14:20:57;RepKClark;Trump should be working for American families, not personal profit. #PresidentialAccountabilityAct #HR6340 Watch: https://t.co/rSNQ6VBYod
2016-12-06 21:48:13;RepKClark;"Congrats @TuftsMensSoccer, #NCAA Division III Champs! #GoBos 
https://t.co/JvPTRQDyEE"
2016-12-06 20:13:37;RepKClark;Support for the #PresidentialAccountablityAct is growing stronger every day. Now at 70 cosponsors.… https://t.co/g6z8dfndQH
2016-12-06 16:54:38;RepKClark;".@VP is right: ""Progressive values are working class values and don't give a centimeter on them."" https://t.co/emzivQghnL"
2016-12-06 16:27:06;RepKClark;We're working with amazing leaders in our district to spread the message of inclusivity and acceptance. https://t.co/2vxN2FVS4S
2016-12-05 18:00:57;RepKClark;"61 yrs ago, brave Americans took a stand &amp; began the #MontgomeryBusBoycott. Today, we continue our fight for justic… https://t.co/ifFITUHViE"
2016-12-05 17:25:52;RepKClark;TY Plasmabots from #Lexington for sharing your impressive work to protect bees! Gd luck in FIRST LEGO League qualif… https://t.co/dov9Br998l
2016-12-05 01:46:16;RepKClark;"Grateful for the courage &amp; perseverance of @StandingRockST #WaterProtectors. Now let's make sure this decision is p… https://t.co/X6PMK6R0cQ"
2016-12-03 18:35:50;RepKClark;"TY for joining conversation on being strong allies &amp; keeping communities safe. Your commitment will help build a fu… https://t.co/F6s9NtPzJ4"
2016-12-03 15:33:05;RepKClark;HAPPENING NOW:Community conversation w/faith leaders, @CAIRMass, @MIRACoalition, @ProChoiceMass on embracing divers… https://t.co/LieswzGvVQ
2016-12-02 20:15:16;RepKClark;My message to the GOP: The House Science Committee should be promoting science, not attacking it to protect Big Oil. https://t.co/SteegIon1o
2016-12-02 18:07:58;RepKClark;"Congrats to my friend @RepRichardNeal, top Dem on Ways &amp; Means. Great news for MA &amp; all of us fighting to protect Medicare &amp; Social Security"
2016-12-02 17:14:02;RepKClark;My bill to ensure the President-elect resolves his conflicts of interests is now bipartisan w/ 60 cosponsors. https://t.co/PoyfFFq9Q8
2016-12-02 14:37:07;RepKClark;"Online predators are targeting women &amp; children. I talked to @newsweek abt why I intro'd a bill to stop #sextortion. https://t.co/Ltm9M6Jchu"
2016-12-02 14:23:44;RepKClark;When you can't win on actual science, so you turn to a platform for white supremacist, anti-Semitic, sexist trolls… https://t.co/METMNBcG9A
2016-12-01 21:29:21;RepKClark;GOP wants to spend 1.5M tax payer dollars attacking women’s healthcare, targeting private citizens #disbandthepanel https://t.co/43yMUeBp98
2016-12-01 16:39:55;RepKClark;Glad to see so many come together this morning to work on ending #onlineabuse. #FOSI2016 https://t.co/M78QP090Ws
