timestamp;sn;text
2015-12-04 17:36:38;timkaine;Also applaud the overdue reauthorization of the @EximBankUS, which benefits a vast array of Virginia companies
2015-12-04 17:35:50;timkaine;"Pleased amdts @MarkWarner and I pushed for were included in the FAST Act, like strengthening WMATA safety &amp; oversight"
2015-12-04 17:35:24;timkaine;"The FAST Act will provide something America hasn't had in years - investments in transportation &amp; the certainty of a 5-yr bill"
2015-12-03 21:47:55;timkaine;"Just voted for a measure to prevent those on terror watchlist from purchasing guns &amp; explosives. Disappointed by lack of bipartisan support"
2015-12-03 17:11:53;timkaine;Very supportive of @DeptofDefense decision to open all combat positions to women. Time for this barrier to be eliminated #WomenWhoServe
2015-12-03 16:41:11;timkaine;"Nearly 17 months into war, Congress needs to follow the lead of the UK Parliament by debating &amp; voting on an #AUMF https://t.co/g7Gsvmq5cr"
2015-12-03 16:19:44;timkaine;Are Members of Congress ready to stop being bystanders to gun violence in America? I joined @Morning_Joe to discuss https://t.co/lO6AtDqx0l
2015-12-03 12:18:35;timkaine;Joining @Morning_Joe shortly. Tune to @MSNBC
2015-12-03 12:06:48;timkaine;I'll be on with @WTOP shortly. Tune in here: https://t.co/2zVAuBYv2K
2015-12-02 23:12:07;timkaine;"Today's shooting in San Bernardino is beyond senseless. My heart goes out to victims &amp; those in law enforcement working to find the suspects"
2015-12-02 21:40:40;timkaine;"Congrats to Hamilton's Bonnie Carroll, who recently received a Presidential Medal of Freedom for her work for veterans &amp; their families"
2015-12-02 18:35:22;timkaine;Approximately 1 in 5 women has relied on a Planned Parenthood health center for care in her lifetime. #StandWithPP
2015-12-02 18:34:54;timkaine;Planned Parenthood provides many critical, preventative services. Here’s just some #StandWithPP https://t.co/TmPRd7GJ1X
2015-12-02 14:19:54;timkaine;"In true ROTC fashion, I was up early w/Cadets from @JMU to Skype on military issues, foreign policy &amp; leadership https://t.co/SFLZw8z9X0"
2015-12-02 14:03:00;timkaine;#SyrianRefugees are not the enemy of the United States, ISIL is our enemy. More from my floor speech yesterday: https://t.co/zW4DpZ5UiG
2015-12-02 00:05:55;timkaine;"Senate took impt action &amp; passed our bill to assist eugenics victims w/state compensation payments cc: @MarkWarner https://t.co/5hZiqs85Zf"
2015-12-01 23:16:34;timkaine;"Met w/@williamandmary Pres. Reveley today to discuss higher-education issues &amp; sea level rise https://t.co/SfUJkAduf6"
2015-12-01 23:10:57;timkaine;Discussed US-Japanese relations with Ambassador Sasae today https://t.co/EZz7ffD2md
2015-12-01 23:04:02;timkaine;The @PeaceCorps have made a difference in countless lives abroad. Met w/Deputy Director nominee Carlos Torres today https://t.co/JTIyEU4VI4
2015-12-01 21:41:28;timkaine;"My latest @Medium post on #climatechange &amp; why the #COP21 summit is so important for VA &amp; our future #ActOnClimate https://t.co/T2qr8fnn4i"
2015-12-01 19:08:21;timkaine;"Read my full statement on #ESSA &amp; my #CTE &amp; safe relationship provisions included in the final bill: https://t.co/ihxNCv06Sx"
2015-12-01 19:07:28;timkaine;"Pleased #ESSA conf cmte chose to recognize importance of teaching safe relationship behavior to prevent sexual assault &amp; dating violence"
2015-12-01 18:32:33;timkaine;As VA shipyards look for the next generation of skilled workers, I'll continue to advocate for CTE training programs https://t.co/Ffhz8MR3S9
2015-12-01 17:39:29;timkaine;"Rex Springston showcased the natural treasures of our Commonwealth. Will miss his work &amp; paddling/singing with him on the James cc: @RTDNEWS"
2015-12-01 17:03:43;timkaine;Proud to recognize 60 years since civil rights leader Rosa Parks fought injustice by refusing to give up her seat https://t.co/n8I2VuBC3t
2015-12-01 03:08:12;timkaine;With Gayle Smith finally confirmed to head @USAID, U.S. can better coordinate global effort to address historic #SyrianRefugee crisis
2015-11-26 14:59:37;timkaine;Wishing everyone at home and abroad a very happy Thanksgiving! https://t.co/6XcOFCmyra
2015-11-24 17:47:35;timkaine;Proud to fight for a long-overdue #AUMF vs ISIL that will show resolve amidst violence abroad cc: @PilotOpinion https://t.co/rF1L5qMpWD
2015-11-23 19:36:24;timkaine;"Stopped by the Guardian Place Retirement Community in Richmond for lunch &amp; a discussion on my work on the Aging Cmte https://t.co/sFX7QMDKNd"
2015-11-23 19:30:39;timkaine;"W/@ALZ_GRVA members earlier. Increasing research &amp; access to care resources is critical to fighting Alzheimer's https://t.co/ftXzyepsE9"
2015-11-21 16:56:29;timkaine;Frank Beamer = @VT_Football #ThanksFrank #GoHokies!
2015-11-20 22:05:33;timkaine;"Great to be in Halifax this wknd for the @HFXforum w/my Senate Foreign Relations Cmte colleagues @SenJohnBarrasso &amp; @ChrisMurphyCT #HISF2015"
2015-11-20 22:02:26;timkaine;"#DACA &amp; #DAPA keep families together &amp; strengthen our country as a whole. Proud to support &amp; defend these programs"
2015-11-20 18:59:25;timkaine;My @Quora answer to Which 2016 presidential candidate do you support? Why? https://t.co/m6eTRdE35e
2015-11-20 18:58:59;timkaine;My @Quora answer to How is your relationship with Mark Warner? https://t.co/FWC3BVuRGF
2015-11-20 18:58:26;timkaine;My @Quora answer to Who are your favorite senators? https://t.co/snZKwARDQ6
2015-11-20 18:58:02;timkaine;My @Quora answer to How was picking up the mantle from Jim Webb? https://t.co/IxNI51Rtts
2015-11-20 18:57:43;timkaine;My @Quora answer to Why did the France attack happen? https://t.co/T9hxBHUVbk
2015-11-20 18:56:38;timkaine;My @Quora answer to Do the president's military actions against ISIS represent an illegal war? https://t.co/Q2zihLdlDY
2015-11-20 18:52:35;timkaine;My @Quora answer to Why is Congress afraid to vote on the ISIL war? https://t.co/6g11D2C9HW
2015-11-20 18:51:56;timkaine;My @Quora answer to What is our current strategy for fighting ISIS? Is the strategy working? https://t.co/RcHPY7cOc0
2015-11-20 18:51:19;timkaine;My @Quora answer to What's wrong with the War Powers Act? https://t.co/UMZAfPenlr
2015-11-20 18:51:05;timkaine;My @Quora answer to How does being a Governor compare to being a Senator? https://t.co/4KPOqIoecn
2015-11-20 18:50:05;timkaine;My @Quora answer to Should the US accept Syrian refugees? https://t.co/vhMHy33rvv
2015-11-19 22:07:46;timkaine;Good luck to all VA teams in the @NCAA soccer championship! @UVAWSoccer @TribeWSoccer @VT_WSoccer @RadfordMSOC @UVAMenSoccer
2015-11-19 21:55:23;timkaine;Great to see King George High School's government class getting a first-hand look at the Capitol today! https://t.co/3EAJJqFlO5
2015-11-19 21:33:07;timkaine;Excited to be joining @Quora! I'm taking questions today: https://t.co/q8J7sEaSrX
2015-11-19 21:16:32;timkaine;"Live with @TeamCavuto on @FoxNews shortly to talk about what it will take for Congress to come together &amp; authorize the war vs ISIL"
2015-11-19 18:02:21;timkaine;I joined @ABC7GMW to explain why the #Paris attacks underscore the need for Congress to vote on war authorization: https://t.co/JaVen8MGs7
2015-11-19 17:30:00;timkaine;Agree w/@HillaryClinton's call for no-fly zone in Syria. Aids effort to address worst humanitarian crisis since WWII https://t.co/X1hvQEPdfF
2015-11-19 17:26:15;timkaine;".@HillaryClinton is right. Congress should swiftly pass an #AUMF vs ISIL to send a message to them, our troops &amp; allies that we're committed"
2015-11-19 16:41:43;timkaine;"Applaud Northern VA blanket &amp; coat drive for #SyrianRefugees, now in its 3rd year. Find out how you can help here: https://t.co/4mRUZi7ZXD"
2015-11-19 16:38:15;timkaine;Good luck to Arlington's @WilliamsburgAdm's Ms. Leni Bronstein, who's a finalist for @ACTFL's teacher of the year award! #ACTFL15
2015-11-19 16:25:00;timkaine;"Applaud Arlington's blanket &amp; coat drive for #SyrianRefugees, now in its 3rd year. Find out how you can help here: https://t.co/4mRUZi7ZXD"
2015-11-19 16:07:23;timkaine;"ICYMI: @JeffFlake &amp; I discussed our bipartisan #AUMF proposal on @Morning_Joe. Watch our interview here: https://t.co/Y3gyrXqBW9"
2015-11-19 12:37:03;timkaine;"Talking with @jfradioshow on US response to ISIL &amp; my position on #SyrianRefugees. Tune in here: https://t.co/zMkGAL9Cjc"
2015-11-19 12:13:01;timkaine;I'll be joining @ABC7GMW at 7:15AM to discuss the war against ISIL in the wake of the tragic #Paris attacks https://t.co/Hbz26lGzEQ
2015-11-19 11:47:24;timkaine;https://t.co/0iZIFeNnBH
2015-11-19 11:38:39;timkaine;RT @Morning_Joe: Coming up... @timkaine and @JeffFlake #morningjoe https://t.co/t2MsQhfJ4I
2015-11-19 11:37:50;timkaine;Early morning at the office w/ @JeffFlake to discuss our bipartisan #AUMF push on @Morning_Joe. Tune in now!
2015-11-18 20:27:08;timkaine;"Read my full statement on #SyrianRefugees here:
https://t.co/4lOU9K66Ks"
2015-11-18 18:35:25;timkaine;"Congrats to Katherine Johnson on the Presidential Medal of Freedom! A trailblazer for @NASA Langley &amp; major contributor to space exploration"
2015-11-18 17:00:52;timkaine;"We owe it to the troops &amp; American people to debate this war against ISIL cc: @JeffFlake: https://t.co/rPXDmXHKIo"
2015-11-17 23:45:18;timkaine;Teamed up w/@JeffFlake to pen this @TIME op-ed on how passing an #AUMF vs ISIL shows US resolve amidst violence: https://t.co/rPXDmXHKIo
2015-11-17 23:27:25;timkaine;"RT @TIME: Senators Kaine and Flake: ""Congress has been too silent on ISIS"" https://t.co/lBGg3XfepF"
2015-11-17 21:23:31;timkaine;"Ensuring our energy production is cleaner tomorrow than today is good for our economy &amp; planet. That's why I support the #CleanPowerPlan"
2015-11-17 21:01:20;timkaine;"Our bill reduces youth homelessness &amp; ensures we’re meeting the needs of children transitioning out of foster care"
2015-11-17 21:00:56;timkaine;"Thank you to @SenatorCollins @PattyMurray &amp; @SenBrianSchatz for supporting a bill that will help keep families together"
2015-11-17 21:00:17;timkaine;"Introduced a bill to help prevent youth homelessness &amp; keep struggling families together. Learn more: https://t.co/mdGxBtZBwW"
2015-11-17 20:09:48;timkaine;"An #AUMF vs ISIL formally declares war &amp; shows strength to both our allies and adversaries in the global fight against terrorism"
2015-11-17 19:23:58;timkaine;"Headed to the floor now to speak w/@JeffFlake to urge for bipartisan support to debate &amp; vote on an #AUMF vs ISIL: https://t.co/4koInpFeM3"
2015-11-17 17:30:29;timkaine;One of the best ways for the U.S. to demonstrate resolve in the face of the #ParisAttacks is to formally act on an #AUMF vs ISIL
2015-11-17 17:01:55;timkaine;As ISIL threat metastasizes across the globe, Congress must formally declare war with an #AUMF. Joining @mitchellreports on @MSNBC #AMR soon
2015-11-17 14:32:59;timkaine;"Joining Jimmy on @1140WRVA to discuss #SyrianRefugees &amp; my thoughts on the U.S. response to the #Paris Attacks: https://t.co/Zb9VOwWg4M"
2015-11-13 23:31:11;timkaine;Horrified by situation unfolding in Paris. My heart goes out to the people of France tonight
2015-11-13 16:29:21;timkaine;"Bill McKelway is one of the most inquisitive &amp; humane journalists ever to take up a pen. I’ll miss being surprised &amp; enlightened by his work"
2015-11-12 20:11:50;timkaine;"Investing in clean coal R&amp;D &amp; CTE programs is essential to ensuring Virginia’s coal communities have a place in a cleaner energy future"
2015-11-12 20:11:24;timkaine;Applaud @HillaryClinton's plan to revitalize America's coal communities as we move to build a clean energy economy
2015-11-12 16:50:45;timkaine;What a touching story from @PilotNews about a WWII Virginia Beach veteran reconnecting with his wartime love: https://t.co/fFMqp6iMPq
2015-11-11 19:12:34;timkaine;RT @GovernorVA: Gov announces VA first state in nation to functionally end veteran homelessness - housed 1400+ veterans in last yr. https:/…
2015-11-11 16:12:43;timkaine;"Honored to speak to veterans &amp; their families at the George Marshall International Center in Leesburg #VeteransDay https://t.co/BR8AJXS1e9"
2015-11-11 15:15:55;timkaine;"On this #VeteransDay, we pay tribute to those who have sacrificed to keep our country safe &amp; free. Thank you to all of our nation's veterans"
2015-11-10 23:18:48;timkaine;We shouldn't be in month 16 of a war without a vote of Congress. I'll share why I'm concerned with Congress' silence tonight cc: @calabresim
2015-11-10 23:18:23;timkaine;"Headed to Arlington to join a panel hosted by @UVA's Sorensen Institute. Speaking on Congress' indifference to declaring war &amp; #AUMF"
2015-11-10 19:28:24;timkaine;Great @PilotNews article on this #VeteransDay eve on a Norfolk native preserving untold stories of female veterans: https://t.co/HnX0F6uOcB
2015-11-10 16:14:17;timkaine;"Happy 240th birthday to the few and the proud, the @USMC! Thank you for serving &amp; keeping us safe #SemperFi"
2015-11-10 15:01:06;timkaine;Si queremos prevenir los peores resultados del #cambioclimatico, Debemos actuar ahora comunidades como #HRVA dependen de nuestro liderazgo
2015-11-10 15:00:41;timkaine;Hampton Roads, hogar de la base naval más grande de nuestro país, es una de las comunidades más afectadas por el #cambioclimatico #hrva
2015-11-10 14:59:48;timkaine;@JohnKerry está en Hampton Roads hoy para ver en persona como el aumento del nivel del mar y el #cambioclimatico afectan nuestra comunidad
2015-11-10 14:07:04;timkaine;If we want to prevent the worst effects of #climatechange, we must act now. Communities like Hampton Roads depend on our leadership #hrva
2015-11-10 14:06:19;timkaine;Hampton Roads, home to the world's largest Naval base, is one of the communities at greatest risk to #climatechange #hrva
2015-11-10 14:05:27;timkaine;.@JohnKerry is in Hampton Roads today getting a first-hand look at how sea level rise, caused by #climatechange, affects the community #hrva
2015-11-10 11:35:36;timkaine;I'm pushing for Congress to do its most solemn job by approving an AUMF vs ISIL. Live with the crew from @Morning_Joe soon
2015-11-10 11:09:16;timkaine;"About to join @foxandfriends to discuss my bipartisan push for a debate &amp; vote on an AUMF vs ISIL. Hope you can tune in"
2015-11-09 23:04:07;timkaine;Hey Virginians! State parks are waiving parking fees and holding special activities for #VeteransDay: https://t.co/x8wW96CRbz
2015-11-09 21:09:58;timkaine;RT @NewsInTheBurg: .@timkaine bill aims to stem heroin overdoses. In 2014, about 75 people have died from opiate overdoses locally. https:/…
2015-11-09 20:32:14;timkaine;RT @SenCapito: Joined w/ @timkaine to intro the Co-prescribing Saves Lives Act, a bipartisan bill to fight opioid overdose deaths https://t…
2015-11-09 20:24:47;timkaine;Asked Pres. Obama to prioritize a strengthened Memorandum of Understanding w/Israel during PM Netanyahu's visit: https://t.co/bneM3fJJ9K
2015-11-09 19:19:40;timkaine;"Educating students on consent, safe relationship behavior &amp; where to go for help can help prevent campus sexual assault #ItsOnUs"
2015-11-09 19:18:09;timkaine;"Standing with the @WhiteHouse &amp; @GenProgress for the #ItsOnUs week of action. Join the movement at https://t.co/dgyLlmPs0U"
2015-11-09 19:17:18;timkaine;RT @ItsOnUs: It's the #ItsOnUs Week of Action! Do you have something planned on campus? Let us know here: https://t.co/tIGvbtqLOo https://t…
2015-11-09 18:37:07;timkaine;Looking for the perfect Christmas tree? Check out where you can find locally grown Virginia trees here! https://t.co/OXWRJcWmaW
2015-11-06 21:08:16;timkaine;@mollymotoole For those who said bipartisan support wasn't possible, definitely proving them wrong
2015-11-06 20:20:11;timkaine;"Effects of #climatechange in VA are real. Sea level rise &amp; recurrent flooding is putting community of Hampton Roads at the most serious risk"
2015-11-06 20:19:38;timkaine;.@POTUS made the right call on #KeystoneXL. We must make choices that will help make America’s energy future cleaner tomorrow than today
2015-11-06 19:43:14;timkaine;Will continue to urge my Senate colleagues to take an AUMF up in the SFRC. We must define the scope of a mission that has expanded greatly
2015-11-06 19:42:21;timkaine;"Strongly support bipartisan effort of colleagues in the House calling for an AUMF against ISIL. We owe the troops a debate &amp; vote on the war"
2015-11-06 15:13:43;timkaine;RT @Sweetbriaredu: Thanks, @sethmeyers. We’re excited, too! #SethAtSweetBriar https://t.co/O9uJeSwKCP
2015-11-05 22:15:05;timkaine;RT @chucktodd: Virginia Sen. @timkaine is pushing President Obama to get new approval for military action against #ISIS. He'll join me next…
2015-11-05 22:05:06;timkaine;Joining @chucktodd on @MSNBC soon to talk about pressing need to debate an #AUMF against ISIL as US forces are deployed to #Syria #MTPDaily
2015-11-05 21:37:53;timkaine;RT @meetthepress: One hour to #MTPDaily → @JimMiklaszewski @timkaine @Kasparov63 @GovernorPataki @kathleenparker @costareports join @chuckt…
2015-11-05 20:49:47;timkaine;ICYMI: Watch my floor speech on my bill that help me fight opioid overdose deaths by increasing access to naloxone: https://t.co/yjaGDi3VYn
2015-11-05 20:47:47;timkaine;My bill would help save lives by encouraging doctors to co-prescribe naloxone alongside opioid prescriptions. More: https://t.co/vMuFau4hfM
2015-11-05 16:58:10;timkaine;Naloxone saves lives by reversing the effects of an opioid overdose https://t.co/Cw3zt3uBkh
2015-11-05 16:57:07;timkaine;The scope of the opioid abuse epidemic in Virginia and America: https://t.co/m5D99U8h3b
2015-11-05 16:18:43;timkaine;Headed to the floor to introduce the Co-prescribing Saves Lives Act, a bill that would help fight opioid overdose deaths. Tune to CSPAN2
2015-11-04 19:51:51;timkaine;RT @IECChesapeake: FACT: There are 400K+ registered apprenticeships nationwide in more than 1,000 occupations. #ApprenticeshipWorks https:/…
2015-11-04 19:12:16;timkaine;Check out some of Virginia's hidden gems via @ThrillistDC https://t.co/ZM86tHcY1r
2015-11-04 17:35:08;timkaine;ICYMI: Joined @CNNSitRoom yesterday to discuss importance of an #AUMF as war against ISIL continues to expand: https://t.co/wxyjWGaba5
2015-11-04 17:34:06;timkaine;".@MarkWarner &amp; I are urging @CFPB to look at impact of prepaid prison cards &amp; protect inmates from predatory schemes https://t.co/UlJrXLe8td"
2015-11-03 22:52:18;timkaine;"I'll be joining @CNNSitRoom today at 6:05pm ET to discuss #Syria &amp; need for a Congressional #AUMF. Tune in if you can #Sitroom"
2015-11-03 21:14:48;timkaine;Great news for @ValleyWDB. This federal funding will help grow the 21st century economy #ApprenticeshipsWork: https://t.co/CZdU7F81zp
2015-11-03 21:14:19;timkaine;"Apprenticeships can grow the economy &amp; equip workers with skillsets for in-demand jobs. I'll highlight how #ApprenticeshipsWork this week"
2015-11-03 21:13:32;timkaine;Introduced a Senate resolution recognizing National Apprenticeship Week #ApprenticeshipsWork #NAW2015 https://t.co/awqlfe05pf
2015-11-03 17:30:04;timkaine;Great story on Danville's effort to find innovative uses for iconic 'Home of Dan River Fabrics' sign #ReimagineThat: https://t.co/HpXM12oo8R
2015-11-03 16:20:13;timkaine;RT @RepDonBeyer: Thanks @POTUS ! My door is always open if your spell check ever breaks. https://t.co/mNkd3Fzxyj
2015-11-03 15:52:27;timkaine;Residentes de Virginia! Expresen su voz hoy y #GoVote. Los locales están abiertas hasta las 7pm #ElectionDay https://t.co/hHxZ1c8Tpy
2015-11-03 14:42:54;timkaine;Hey Virginians! Make your voice heard and #GoVote today. Polls are open until 7:00pm #ElectionDay https://t.co/uJPdzLxaFU
2015-11-02 23:12:44;timkaine;"From Norfolk to Richmond, message from my recent roundtables has been clear: #cjreform is needed, fiscally smart &amp; upholds American values"
2015-11-02 23:12:32;timkaine;Banning the box for federal jobs removes an unreasonable barrier for those seeking employment. Applaud @POTUS for this #cjreform step
2015-11-02 22:36:16;timkaine;Agree w/@POTUS. The U.S. must shift its focus to helping ex-offenders stay on the right track by improving reentry programs #cjreform
2015-11-02 21:18:02;timkaine;"Check out veteran-owned businesses &amp; events in Virginia during National Veterans Small Business Week! #MyVetBiz https://t.co/4I0DLaLX6E"
2015-11-02 17:52:03;timkaine;World champs! Congratulations to the @Royals on winning their first #WorldSeries since 1985! #TookTheCrown
2015-10-31 17:19:38;timkaine;George Burke was a great friend. He had a brilliant mind and was a fierce competitor. We'll deeply miss him.
2015-10-31 15:43:26;timkaine;Happy Halloween! Resemble anyone you know? #FearTheBrow https://t.co/3eO4Edl8Kl
2015-10-31 12:07:55;timkaine;Tune in to @NPRWeekend now for my discussion w/ @nprscottsimon on the announced deployment of US forces to #Syria https://t.co/qhF6JVVerM
2015-10-30 21:07:01;timkaine;"Look fwd to joining @nprscottsimon tomorrow at 8:10AM to discuss deployment of US forces to #Syria &amp; why Congress needs to vote on this war"
2015-10-30 20:10:36;timkaine;"Happy we came together to pass a bipartisan budget deal that will increase economic certainty &amp; break cycle of crisis-to-crisis budgeting"
2015-10-30 17:29:41;timkaine;Read my statement on the deployment of U.S. special operations forces to Syria: https://t.co/wCoFVx3tUz
2015-10-29 21:29:40;timkaine;Enjoyed speaking with Wes Bush from @northropgrumman today. Congrats to this VA Company on continuing its legacy in bomber production
2015-10-29 20:14:41;timkaine;Me reuní con el Emb. Pinzón para hablar sobre las recientes negociaciones entre el gobierno Colombiano y las FARC https://t.co/R4R2sWhoH8
2015-10-29 17:02:15;timkaine;Congress can honor the legacy of the Pregnancy Discrimination Act, passed 37 yrs ago this Saturday by passing PWFA! #PregnantAtWork
2015-10-29 17:01:53;timkaine;I stand with women who are #PregnantAtWork and need accommodation to continue working. Let's pass PWFA
2015-10-29 16:37:11;timkaine;Congrats to @SpeakerRyan. Enjoyed working w/him on Murray-Ryan deal-willingness to compromise to get nation's business done. We need that
2015-10-29 14:25:39;timkaine;Two down and two more wins to go to #TakeTheCrown! Let's go @Royals! #WorldSeries
2015-10-29 02:32:49;timkaine;"Pleased House passed a bipartisan 2 year budget. Now it's time for the Senate to do the same &amp; give VA businesses the certainty they deserve"
2015-10-28 21:20:53;timkaine;Headed to Crystal City now - excited to see what's in store! #1776inVA  https://t.co/wtzmbVDPSJ
2015-10-28 17:21:10;timkaine;"Vote for Sean to be ""Hero of the Year by visiting here: https://t.co/VZT9xcp3iR"
2015-10-28 17:20:48;timkaine;Congrats to Sean Gobin, of Charlottesville, who was named a Top 10 #CNNHero! Learn how he's helping our veterans: https://t.co/wM8zsDHOjb
2015-10-28 16:30:57;timkaine;What a wild Game 1 in the #WorldSeries last night! Glad my @Royals came away with the victory for the home crowd #TakeTheCrown
2015-10-28 14:31:32;timkaine;More from @CAPgunsandcrime: VA ranks 3rd among states with the highest number of guns exported out of state and used in crime #VAUnderTheGun
2015-10-28 14:30:46;timkaine;From @CAPgunsandcrime study: VA is one of 17 states where more people are killed annually by gunfire than in car accidents #VAUnderTheGun
2015-10-28 14:29:20;timkaine;Read the new @CAPgunsandcrime study #VAUnderTheGun. We must #StopGunViolence https://t.co/awNA2XCHtB
2015-10-28 14:27:40;timkaine;Epidemic of gun violence needs a comprehensive solution. These steps are critical pieces that Americans can agree on #StopGunViolence
2015-10-28 14:26:44;timkaine;"More gun violence tragedies can be avoided by closing the gun show loophole &amp; improving background checks #StopGunViolence #NoCheckNoGun"
2015-10-28 14:25:31;timkaine;The better background records check system we have, the safer people will be. I support longer waiting periods on gun sales #NoCheckNoGun
2015-10-28 14:13:15;timkaine;Announcing a bill requiring a completed background record check before any gun sale #NoCheckNoGun #StopGunViolence https://t.co/nkXqqIIOXf
2015-10-28 02:24:14;timkaine;"RT @alikrieger: Thank you for all your support! You have my vote ;) it was an honor to meet you!  https://t.co/RJ4aG7v65a"
2015-10-28 00:10:45;timkaine;Grew up outside Kansas City. So all I have to say now is...let's #TakeTheCrown @Royals! #WorldSeries
2015-10-27 23:57:13;timkaine;"Senate should reauthorize #ExIm. It helps level the playing-field for US exporters- many of which are small businesses- &amp; reduce the deficit"
2015-10-27 23:23:04;timkaine;What a career for @AbbyWambach! A record-breaking leader who will leave with this distinction: World Cup Champion #USA #USWNT
2015-10-27 23:14:19;timkaine;Senate voted overwhelmingly in support of the #CISA bill, which represents an important first step towards improving our #cybersecurity
2015-10-27 22:33:48;timkaine;RT @ThousandDays: Huge thank you to #Nutrition Champions Senator Susan Collins, @TimKaine @alikrieger @lucymsullivan https://t.co/gNJNFF295I
2015-10-27 22:10:49;timkaine;"Standing w/World Cup champ &amp; VA native @alikrieger to speak on importance of child nutrition #USWNT @ussoccer_wnt https://t.co/gWr1mTXQo7"
2015-10-27 20:25:05;timkaine;"Facebook Q&amp;A is about to start. Join the conversation here: https://t.co/3Iec4Juz7Y"
2015-10-27 20:00:20;timkaine;"I'll be on my Facebook page at 4:30pm ET hosting a Q&amp;A! Post a question here: https://t.co/3Iec4Juz7Y"
2015-10-27 19:07:05;timkaine;"Sat down to discuss #SocialSecurity &amp; #Medicare with @JoAnn_Jenkins #DisruptAging https://t.co/TDUvq4ij4N"
