timestamp;sn;text
2017-01-21 04:07:04;timkaine;Hitched! Congrats to Dea and Sharon. Was honored to officiate their wedding tonight https://t.co/8y6BzG14kE
2017-01-21 02:25:26;timkaine;President Sullivan has served UVA admirably. Wishing her the best as she finishes her hard work! https://t.co/vmZ2WqjaPg
2017-01-20 23:48:28;timkaine;"Voted in favor of Gen. Kelly. Confident he will bring a measured approach &amp; perspective to @DHSgov"
2017-01-20 17:30:52;timkaine;As I continue to advocate for the interests of Virginia in the Senate my motto remains: advance everywhere we can, defend everything we must
2017-01-20 17:30:22;timkaine;"Congrats Pres. Trump &amp; VP Pence. I wish them the best as they take on this monumental duty &amp; hope they will be successful for all Americans"
2017-01-20 17:29:33;timkaine;The peaceful transfer of power remains one of the most powerful symbols of our great democracy
2017-01-19 22:34:13;timkaine;My statement on the nominations of Nikki Haley, Tom Price and Betsy DeVos https://t.co/JFIO3tsHM2
2017-01-19 17:57:17;timkaine;Soon: Americans share why they would be hurt by Tom Price's policies, including #ACA repeal. I'll share VA stories: https://t.co/0LzQWoWQql
2017-01-19 00:23:35;timkaine;"Memorial Bridge too compromised for #Inauguration &amp; #WomensMarch. We must fix this. Improving crumbling infrastructure has R and D support"
2017-01-18 15:08:28;timkaine;#Price needs to lay out his plan for the 30 million Americans who stand to lose insurance if the ACA is repealed. https://t.co/uD4YkoVkz5
2017-01-18 15:05:44;timkaine;Trump promised not to cut #Medicare or #Medicaid on the campaign, but his pick for HHS Tom Price has other plans  https://t.co/tr7qEN2B5Q
2017-01-18 14:46:44;timkaine;RT @SenSchumer: Betsy DeVos fails @timkaine's test at Senate hearing: https://t.co/qnyFZgc52X
2017-01-17 23:16:25;timkaine;"RT @MarkWarner: Did you know #MemorialBridge is in such bad shape it wont be used for inauguration? Asked @Interior &amp; @USDOT nominees to fo…"
2017-01-17 21:36:52;timkaine;".@usedgov has an important role in supporting &amp; investing in all students—from our youngest learners, to those in higher education. #DeVos"
2017-01-17 21:36:01;timkaine;We must be committed to making sure that all students have access to a high quality public education that allows them to succeed. #DeVos
2017-01-17 21:35:31;timkaine;Today at 5pm: HELP Committee hearing on the nomination of Betsy DeVos to serve as Secretary of Education. Tune in → https://t.co/xMK3N5tutx
2017-01-17 20:00:35;timkaine;Nonpartisan report says #ACA repeal would leave 18 million uninsured in the first year. Premiums would double by 20… https://t.co/bbQQ701esr
2017-01-17 19:01:04;timkaine;This $2M in federal funding is a small step, but it represents the continued investment and commitment needed to ad… https://t.co/93JsyHsqcX
2017-01-16 15:55:27;timkaine;"""Life's most persistent and urgent question is, 'What are you doing for others?'"" - Martin Luther King, Jr. #MLKDay"
2017-01-15 22:28:52;timkaine;An incredible rally to #ProtectOurCare in Richmond today. Packed with Virginians who want to #SaveTheACA. I'm ready… https://t.co/agWYWeiOLc
2017-01-15 22:24:49;timkaine;This sign says it all #ProtectOurCare #SaveTheACA https://t.co/L8MnKbLka5
2017-01-15 17:21:15;timkaine;Great time last night on the harmonica with the Cary Street Ramblers at @PositiveVibeRVA. A clip of Josie-o! https://t.co/k6ODltmMyG
2017-01-14 02:03:44;timkaine;My jam sesh with the Cary Street Ramblers tonight. Looking forward to playing the harp with them tomorrow at… https://t.co/PG7Ed7HV7P
2017-01-13 18:56:01;timkaine;I'm working on how we can improve the #ACA and health care. Great forum with @UVA medical school students today! https://t.co/929xss4yDC
2017-01-13 15:11:46;timkaine;Read my statement on my decision to support the nomination of Gen Mattis and oppose the nomination of Rex Tillerson https://t.co/P8vjPRig26
2017-01-13 15:11:24;timkaine;The Sec State needs to put US interests above any other loyalty. Mr. Tillerson did not give me confidence in his ability to do that
2017-01-13 15:11:03;timkaine;Tillerson's answers on Russia and refusals to answer on ExxonMobil makes me question whether he could set aside the interests of ExxonMobil
2017-01-13 15:10:47;timkaine;Rex Tillerson, however, made many comments during his confirmation hearing that caused me concern
2017-01-13 15:10:34;timkaine;"Gen Mattis appreciates challenges facing servicemembers &amp; is committed to strong civilian/military understanding. I support his confirmation"
2017-01-13 15:10:03;timkaine;"The US needs military and diplomatic leadership that understands our national security threats &amp; is fully committed to the US above all else"
2017-01-13 00:07:41;timkaine;.@SECARMY Eric Fanning has been a superb Secretary of the @USArmy. I'm humbled to accept this civilian service awar… https://t.co/h3H5rrMtcv
2017-01-12 22:32:44;timkaine;"RT @PositiveVibeRVA: VIBEFROST'17 This Saturday-our 12th year anniversary! 5 bands &amp; starts at 5:30..expecting Richmonder of the year on ha…"
2017-01-12 18:17:52;timkaine;On Sunday I'll be in Richmond rallying to #SaveHealthCare. Join me to fight GOP efforts to repeal the #ACA https://t.co/HbvlTcCSzZ
2017-01-12 18:17:15;timkaine;Last night Senate Rs moved us one step closer to health care chaos. We should be working to find fixes to the system, not break it
2017-01-11 18:53:49;timkaine;Asked Tillerson about potential Trump financial conflicts of interest that could affect foreign policy. He's in the dark like the rest of us
2017-01-11 17:28:17;timkaine;It's shameful Tillerson refused to answer my questions on his company's role in funding phony climate science. Bottom line: #ExxonKnew
2017-01-11 02:56:18;timkaine;Inspiring message from President Obama. I'm thankful for his friendship, steady leadership, and the progress we've achieved #ObamaFarewell
2017-01-11 02:01:35;timkaine;Way to go @JennMcClellanVA! Proud to support VA's new State Senator!
2017-01-10 20:17:53;timkaine;.@SenateDems will hear testimony directly from Labor Sec nominee Andrew Puzder's employees soon. Watch it live here: https://t.co/2aXHcm3f8W
2017-01-10 00:21:01;timkaine;We can't let the GOP #MakeAmericaSickAgain. Shared #ACA stories w/@SenateDems alongside VA med school students on F… https://t.co/o4wHIUHxfC
2017-01-09 22:21:32;timkaine;Repealing the #ACA without a replacement is like jumping out of a plane and saying you'll figure out later how to land. #SaveHealthCare
2017-01-09 21:55:22;timkaine;"I stand w/ 2.5 million ppl who visit @PPFA each year &amp; I'm asking GOP to abandon partisan attacks on women's health… https://t.co/OLJf1kTVsp"
2017-01-08 16:09:55;timkaine;Congrats to James Madison University, #FCS champs for the second time in school history! GO DUKES!
2017-01-06 21:41:34;timkaine;You can RSVP for my rally in Richmond on Jan. 15th to #SaveHealthCare here: https://t.co/HbvlTcCSzZ Hope to see you there! #ProtectOurCare
2017-01-06 21:40:52;timkaine;Repeal of the #ACA would be a historic mistake. Join me in Richmond to #SaveHealthCare. Let's make our voices heard… https://t.co/E0M3m0Ffgq
2017-01-06 18:00:37;timkaine;Applaud this decision by @USarmy. Our military is strongest in defending our liberties when it embraces our country… https://t.co/4x3yvLnojP
2017-01-05 20:26:54;timkaine;...without any replacement injects tremendous uncertainty into one-sixth of the American economy. America can't afford this amateur mistake.
2017-01-05 20:26:19;timkaine;...Dems like myself who have supported reforms to the #ACA. Why are we rushing to repeal this law? A repeal...
2017-01-05 20:25:46;timkaine;GOP vote signals continued desire to fast-track a repeal of the #ACA - a law that has helped 30 million Americans - rather than work with...
2017-01-05 19:33:08;timkaine;My letter with other moderate Democrats asking GOP to abandon rush to repeal the #ACA and #MakeAmericaSickAgain https://t.co/1q7aKD14kK
2017-01-05 15:41:15;timkaine;Repeal of the #ACA would #MakeAmericaSickAgain. About to intro an amendment to prevent GOP from stripping health care from millions
2017-01-05 14:37:13;timkaine;Dems are ready to discuss improvements to the #ACA...why is the GOP rushing to repeal it outright? We should discus… https://t.co/ZJacFOitMz
2017-01-04 21:16:03;timkaine;GOP plan to #MakeAmericaSickAgain hurts millions of Americans, including seniors, women and the middle class https://t.co/YUvbcnducw
2017-01-04 18:02:40;timkaine;"Please thank Penelope for her drawing &amp; touching letter! I'll do everything I can to be her hero &amp; keep families to… https://t.co/LDev72jXG4"
2017-01-04 16:12:34;timkaine;Just wrapped meeting w/@POTUS on the ACA. Motivated to protect this landmark law for the millions who depend on it #SaveHealthCare
2017-01-03 23:35:52;timkaine;Thank you for this honor! This proud Richmonder is motivated to keep serving Virginians well in 2017 https://t.co/dmwS30fRv2
2017-01-03 19:58:30;timkaine;Welcome to Reps. Taylor, McEachin and Garrett -- new members of the VA delegation and 115th Congress. Looking forward to working together!
2017-01-03 16:34:49;timkaine;...That's right -- the total population of 19 states! Heartless! #SaveHealthCare
2017-01-03 16:34:09;timkaine;...New Hampshire, Hawaii, Idaho, West Virginia, Nebraska, New Mexico, Kansas, Nevada, Arkansas and Mississippi...
2017-01-03 16:33:08;timkaine;...Wyoming, Vermont, Alaska, North Dakota, South Dakota, Delaware, Montana, Rhode Island, Maine...
2017-01-03 16:32:28;timkaine;Urban Institute says Trump/GOP plan to repeal ACA will strip health care from 30 million Americans. That equals combined population of...
2017-01-01 23:25:52;timkaine;Anne, Annella and I hiking in Richmond on January 1. My resolution: More time outdoors this year! https://t.co/Z4pUysc3dc
2016-12-26 20:09:55;timkaine;What books did you get for Christmas? Here's the stack I'll be working through! https://t.co/pC9KqfKrv2
2016-12-25 15:03:11;timkaine;Christmas at our house. The big stocking belongs to our dog! https://t.co/dXChqfGVzR
2016-12-24 17:02:07;timkaine;https://t.co/2Xms4bcKXA
2016-12-21 17:49:59;timkaine;"Agree w/concerns from Hampton Roads residents &amp; DoD, combined w/trend of sea level rise driven by #climatechange. This is the right choice"
2016-12-21 17:49:02;timkaine;The risks of Atlantic offshore drilling outweigh the rewards. I support the President’s decision yesterday https://t.co/kZYIyCmEPz
2016-12-20 22:15:38;timkaine;"VA’s Peter F. Pontzer named #CarnegieHero; helped rescue 13yo boy from drowning in Atlantic Ocean https://t.co/QlsE9bjUBb via @carnegie_hero"
2016-12-20 21:26:44;timkaine;Opioid abuse affects every corner of VA. I was in Newport News today to focus on strategies to fight this epidemic… https://t.co/3xcKeFdfSZ
2016-12-19 22:22:33;timkaine;Thanks to our bill, Petersburg National Battlefield is now the nation's largest protected battlefield. Proud to see… https://t.co/Jkp0taEmil
2016-12-19 18:46:48;timkaine;"Ready to fight to protect the ACA &amp; advance smart education policies as a HELP Committee member next year… https://t.co/wbkm0YAGgS"
2016-12-16 17:12:52;timkaine;"Funding transportation &amp; infrastructure projects ought to be an area of bipartisan cooperation in 2017 https://t.co/CTCnMGSUFq"
2016-12-15 22:23:52;timkaine;"If I am held to just one....then ""I Will Dare"" https://t.co/xLANhjhzIj"
2016-12-15 18:09:07;timkaine;It's true, @jaymboller I love the Replacements. Hope those UMN students took me up on the tip to give them a listen! https://t.co/19OYE1I51w
2016-12-15 16:39:07;timkaine;Happy birthday @MarkWarner! Here's to plenty more thrilling rides ahead. #TBT to riding through the Hollywood Rapid… https://t.co/bbYcUnrE2w
2016-12-14 22:46:59;timkaine;"Saw I-95 corridor transportation improvements today. VRE in Fredericksburg &amp; #RVA Main Street Amtrak Station. Good… https://t.co/JsFYqz28PK"
2016-12-14 20:04:54;timkaine;We cannot turn a blind eye to besiegement and murder of civilians #Aleppo. How you can help: https://t.co/2stpuy7N7M
2016-12-14 20:04:06;timkaine;"Russia, Assad, Iran must be held to account for gross human rights violations &amp; indiscriminate killings #Aleppo https://t.co/vV4dxbI32b"
2016-12-14 19:44:05;timkaine;Glad to see @POTUS take another step to protect critical healthcare for millions of Americans! https://t.co/IHQyW2hUXa
2016-12-14 16:44:37;timkaine;"Captain Humayun Khan represented the best of America. Grateful @UVA will honor his life &amp; legacy https://t.co/LkiNQqQwmN"
2016-12-14 15:54:06;timkaine;"Virginia is home to so many brave veterans. Great to meet Falls Church resident &amp; WWII veteran John Alford today https://t.co/4nvsX5RNSq"
2016-12-13 18:44:29;timkaine;Special thanks to Vidal, @PWForestPark Superintendent, for letting me visit today. He's been with @NatlParkService… https://t.co/KYuGZQXKDU
2016-12-13 18:20:02;timkaine;Learned about the history of @PWForestPark during my visit today #VAisForNPSLovers #FindYourPark #NPS100 https://t.co/T54MDk8LGY
2016-12-13 16:41:21;timkaine;Riding the Silver Line this morning with GM Wiedefeld. I remember when this was just a model on a conference room t… https://t.co/6SUMgeXczQ
2016-12-13 15:32:03;timkaine;"Tillerson for Secretary of State! What's next -- climate change deniers for EPA &amp; Energy? Oh wait...."
2016-12-12 18:08:09;timkaine;"Our veterans deserve the best healthcare &amp; services for their sacrifices. Met w/ @PVA1946 members in Chesterfield t… https://t.co/Ml2PPSOSWo"
2016-12-09 17:10:56;timkaine;Call on Trump to protect and improve the ACA #CoverageMatters https://t.co/D9wDKBUSll
2016-12-09 16:18:49;timkaine;Advocated for this federal workforce pay raise with Senate colleagues. Glad @POTUS came through for hardworking Vir… https://t.co/lGNpKYSRsE
2016-12-09 15:11:22;timkaine;My father-in-law, Linwood Holton, inspired me to go into public service. Proud Roanoke is honoring his impact in VA https://t.co/wM315soE7j
2016-12-08 23:30:09;timkaine;Farewell to a great public servant. John Glenn, always a trailblazer, on Earth and in space. https://t.co/OeBtfcuuHx
2016-12-08 20:51:01;timkaine;The nomination of an EPA Administrator who does not accept basic climate science is deeply troubling https://t.co/Vvd1BZh004
2016-12-07 21:25:48;timkaine;America is a better place because of the public service of @VP Joe Biden. Proud to honor him with Senate colleagues today.
2016-12-07 19:01:09;timkaine;"Imperative that new Administration &amp; Congress move forward on healthcare &amp; not erase gains that have been made by the ACA #CoverageMatters"
2016-12-07 19:00:30;timkaine;It would be reckless to repeal the ACA. It would have a drastic impact on the American people and our economy #CoverageMatters
2016-12-07 19:00:07;timkaine;Since the passage of the Affordable Care Act in 2010, 20 million Americans have gained health insurance #CoverageMatters
2016-12-07 18:18:19;timkaine;Headed to the Senate floor now to discuss the importance of protecting these vital health programs. Tune to @CSPAN 2
2016-12-07 18:17:30;timkaine;"Families across Virginia rely on the Affordable Care Act, Medicare &amp; Medicaid. We can't undo the progress we've made on healthcare coverage"
2016-12-07 16:58:35;timkaine;Honored to have served with @SenatorBarb. May the force be with her, always
2016-12-07 16:03:25;timkaine;Discussing my priorities heading into the new Congress with Kojo at noon today. Tune in! @kojoshow https://t.co/XqrBs1I8n0
2016-12-07 15:16:47;timkaine;"A Suffolk resident, Navy veteran &amp; Pearl Harbor survivor shares his story @virginianpilot #PearlHarborRemembranceDay https://t.co/7wm9jmtoGr"
2016-12-07 14:47:39;timkaine;December 7th, 1941 is a day that will always live in infamy. Remembering the brave Americans we lost 75 years ago #PearlHarborRemembranceDay
2016-12-07 00:06:06;timkaine;RT @RepAdamSchiff: .@POTUS right to call out Congress on #AUMF. But Administration is also culpable in expansion of executive power with re…
2016-12-07 00:05:43;timkaine;".@POTUS is right, Congress must have courage to debate &amp; vote on mission vs ISIL. But admin has set dangerous precedent on decisions of war"
2016-12-05 23:17:27;timkaine;Community health centers, like the one I visited in Alexandria today, are critical to our nation's health care system #CoverageMatters
2016-12-02 18:42:56;timkaine;Too many families in Virginia are suffering from this tragic epidemic. Increasing access to naloxone is one way to… https://t.co/pzycqgBfYf
2016-12-02 17:58:25;timkaine;RT @OIA: Thank you @timkaine for meeting with with outdoor industry leaders and @OIA and for recognizing the outdoor recreation economy’s i…
2016-12-01 22:50:55;timkaine;"It's been a busy couple of weeks back in the Senate &amp; plenty more to do. Talked with @nbcwashington on what's ahead https://t.co/hCZzd9wWkQ"
2016-12-01 22:03:12;timkaine;61 years ago Rosa Parks took a stand for equality by sitting down. Thankful GRTC is honoring her today #RosaParksDay https://t.co/5Li9CspuVF
2016-12-01 21:35:48;timkaine;"Veterans in Virginia deserve the timely &amp; quality health care benefits they earned through their service: https://t.co/vCFjcDdr1i"
2016-12-01 21:03:17;timkaine;RT @WTOP: .@timkaine is healing the best way he knows how: Diving back into work. w/WTOP this morning https://t.co/wkIKmEkaR5 https://t.co/…
2016-12-01 20:44:45;timkaine;New poll finds 3 out of every 4 Americans oppose repeal of the Affordable Care Act #CoverageMatters https://t.co/u8Qguk14bi
2016-12-01 18:03:42;timkaine;"RT @MarkWarner: Expect our measure to expand @PetersburgNPS will become law. Will encourage tourism &amp; preserve Civil War history. https://t…"
2016-12-01 17:29:58;timkaine;Felicidades a #Colombia por el #nuevoacuerdo de paz. Momento histórico para el hemisferio. Mucha esperanza para una colaboración más fuerte.
2016-12-01 17:27:52;timkaine;Congrats to #Colombia on the new peace deal agreement. Historic moment for our hemisphere. Looking forward to an even stronger partnership.
2016-11-30 17:25:41;timkaine;Congress has set a dangerous precedent in avoiding a vote to authorize war against ISIL. Heading to Senate floor to renew my call for action
2016-11-30 01:05:50;timkaine;Honored to join @TenantsWorkers this evening to celebrate 30 years of empowering communities in Northern VA! #TWU30th
2016-11-29 21:47:00;timkaine;"Working w/@MarkWarner to protect funding for new aircraft carriers. Critical to Hampton Roads &amp; our nation's defense https://t.co/nKcyjZLRRq"
2016-11-29 18:35:31;timkaine;Sign your name if you think no president, including Trump, should be able to go to war without a vote in Congress https://t.co/rcrvmL53O4
2016-11-29 17:03:31;timkaine;"Rep. Tom Price could reverse ACA progress &amp; threaten reproductive care, Medicare &amp; Medicaid. Very discouraged by this pick #CoverageMatters"
2016-11-28 22:22:43;timkaine;"Trump's claim of voter fraud in VA is shameful. @hillaryclinton won VA by 5+ points &amp; popular vote by &gt;2 million. Don't insult our voters!"
2016-11-28 18:16:33;timkaine;"Updated reports say attacker used a vehicle &amp; knife. Horrifying &amp; senseless. Relieved the scene is secure &amp; praying… https://t.co/sDpEA9UUkh"
2016-11-28 16:52:31;timkaine;Deeply saddened by the senseless act of gun violence at Ohio State this morning. Praying for the injured and the entire Buckeye community
2016-11-26 18:27:04;timkaine;Working off Thanksgiving at James River State Park in Buckingham County! https://t.co/K4zazWEjvN
2016-11-25 19:26:41;timkaine;Pleased to see signing of revised deal in Colombia to end 52 years of war and bring peace to our hemisphere https://t.co/rEVUnHnv1g
2016-11-25 15:53:33;timkaine;Celebrated Thanksgiving and our 32nd anniversary yesterday by running the Irvington Turkey Trot. Our times? Strictl… https://t.co/odYZXlItdx
2016-11-24 15:59:22;timkaine;Happy Thanksgiving from my family to yours! https://t.co/g9sagxuFxH
2016-11-22 22:24:31;timkaine;A Muslim registry would be contrary to our values as Americans. Join me in defending our nation's core principles https://t.co/EbdK3vxpCI
2016-11-22 20:54:56;timkaine;"Our govt guaranteed lifetime health &amp; retirement benefits for our miners. Urging Congress to uphold that promise https://t.co/0Zqp3Uekbc"
2016-11-22 19:07:18;timkaine;Read our amicus brief urging #SCOTUS to safeguard rights of students with disabilities in Endrew v. Douglas County https://t.co/862xqsGgP1
2016-11-22 19:06:46;timkaine;"Proud to fight for Drew &amp; all students w/disabilities who could be denied an appropriate educational benefit. #SCOTUS must defend this right"
2016-11-18 19:41:05;timkaine;Just arrived in Halifax w/bipartisan delegation led by @SenJohnMcCain. Excited to talk global security issues facing the Americas #HISF2016
2016-11-16 19:53:20;timkaine;Great meeting with #vabiz leaders of @VAChamber. Working across the aisle on federal priorities will help grow VA's… https://t.co/EQm6u0T0j5
2016-11-16 18:59:53;timkaine;Very happy for my friend @MarkWarner on his new post as Vice Chairman of the Intelligence Committee - his leadership is an asset to VA
2016-11-16 15:48:49;timkaine;"Congrats to @SenSchumer @SenatorDurbin @PattyMurray &amp; the newly elected Democratic leadership team! Energized for our work ahead"
2016-11-15 18:26:57;timkaine;Just stepped into the office and I'm excited to get back to work in the Senate on behalf of my fellow Virginians!
2016-11-11 19:48:28;timkaine;On this #VeteransDay, proud to salute the service of those who fought for our country and their families.
2016-11-10 23:38:32;timkaine;Tuesday night was hard. But there is important work ahead. https://t.co/G06o9qQou5
2016-11-09 19:18:10;timkaine;Hillary Clinton held fast to dreams and made history. Thank you for including my family and me on this incredible j… https://t.co/VVS9Hf1BdP
2016-11-09 01:30:02;timkaine;Thinking about my daughter right now. No little girl will ever again have to wonder whether she, too, can be presid… https://t.co/kIneANsV9Q
2016-11-09 00:00:03;timkaine;Spread the word: If you're in line by the time polls close, you can vote. https://t.co/P9VTasrQIN
2016-11-08 23:10:01;timkaine;"Polls are closing soon! Go vote now: https://t.co/EdM1KCcP5l

If you've already voted, RT so your friends do, too. https://t.co/kOX00mYOsV"
2016-11-08 20:03:27;timkaine;If you've already voted, head to https://t.co/Q6ysvu6KjU to make sure you’re doing everything you can to help Hillary win today.
2016-11-08 16:21:43;timkaine;It’s your last chance to help Hillary win! We need all hands on deck. Head to https://t.co/KrLTPFSsTv to volunteer. https://t.co/RhYBJG5Gko
2016-11-08 14:00:02;timkaine;Millions of Americans have already voted—confirm where to go vote and join them: https://t.co/EdM1KCcP5l
2016-11-08 13:18:56;timkaine;I wanted to be first at my polling place, but 99-year-old Minerva Turpin beat me to it. Looks like I need to get us… https://t.co/kmpYAWZxEk
2016-11-08 11:30:02;timkaine;It's Election Day, and polls are open! Confirm where you'll cast your vote for Hillary: https://t.co/EdM1KBVdGL https://t.co/2oH5lalsP5
2016-11-08 06:14:19;timkaine;Tonight, my heart is full. I can’t wait for the next chapter. Let's win this thing and make some history:… https://t.co/e7CimdSn6k
2016-11-08 03:40:09;timkaine;"RT @Hillary_esp: ""Creo que el poder del voto latino en esta nación, en una manera bien histórica, va a hacer la diferencia""—@TimKaine https…"
2016-11-07 20:46:15;timkaine;Fueling up for the last day on the trail! https://t.co/EdM1KCcP5l https://t.co/jqV7J58EuR
2016-11-07 18:01:01;timkaine;Tomorrow's the big day! What's your plan to vote? Go to https://t.co/EdM1KCcP5l to confirm where you'll vote for Hillary.
2016-11-07 16:01:09;timkaine;Strong women have always been the hearts of our communities. It's time we put one in charge of our country.… https://t.co/x85gEomQiT
2016-11-07 00:02:33;timkaine;"RT @Hillary_esp: ""Los latinos en nuestro país son el 17% de la población, pero solo tienen el 2% de la riqueza, de los recursos. Eso es muy…"
2016-11-06 22:19:19;timkaine;When you go to your polling location and cast your ballot on Tuesday, who will you be voting with in mind?… https://t.co/qdrCqpUDDi
2016-11-06 21:19:55;timkaine;RT @TheManeater: Democratic vice-presidential nominee @timkaine graduated from MU in 1979. Get to know him:   https://t.co/rF9LMoXgtR https…
2016-11-06 20:20:10;timkaine;Make sure you know where to go vote: https://t.co/ZM82swzFMF https://t.co/BZHIB7GbM7
2016-11-06 18:13:18;timkaine;Millions of people across the country have already voted. Join them—and make your plan to vote on Tuesday:… https://t.co/lyBs9rhl3q
2016-11-06 13:59:06;timkaine;Make a plan to vote on Tuesday, then RT this to tell your friends: https://t.co/EdM1KCcP5l
2016-11-05 22:54:02;timkaine;Let's bring home this win. Make a plan to vote now: https://t.co/ZM82swzFMF https://t.co/TBC2X8h7aF
2016-11-05 20:35:30;timkaine;Make sure you're ready to make history on Tuesday. Confirm where you'll vote and make a plan today: https://t.co/ZM82swzFMF
2016-11-05 15:54:37;timkaine;3 days left to make history. Don't miss out: https://t.co/ZM82swzFMF https://t.co/2rfjtOEccN
2016-11-04 18:06:26;timkaine;You don’t want to be the only one staying home on November 8. Make a plan to vote today: https://t.co/LkbaNsBymQ
2016-11-04 14:41:58;timkaine;We need you to pitch in and help Hillary win: https://t.co/rJ6HSUorTl
2016-11-04 01:09:14;timkaine;"RT @HillaryforAZ: RT if you're as ready as Jordynn is to have @TimKaine as our next Vice President. #VotaArizona

Then volunteer: https://t…"
