timestamp;sn;text
2016-06-08 22:27:20;timkaine;RT @SenatorDurbin: I commend @OAS_official Secretary General Almagro's efforts to bring attention to the need for peaceful resolution to th…
2016-06-08 21:47:31;timkaine;"Shocked &amp; saddened by today's violent terror attack in Tel Aviv. The U.S. stands with Israel in mourning the loss of life &amp; seeking justice"
2016-06-08 21:00:20;timkaine;"New report &amp; mapping tool on health disparities in NoVa region. Despite high rankings, disparities still exist: https://t.co/amKJ0PFhJA"
2016-06-08 19:42:56;timkaine;Strategic importance of the US-India relationship is growing every year. My full statement here: https://t.co/KLPKHXK8jc
2016-06-08 19:42:23;timkaine;"Encouraged by increased cooperation b/t US-India on defense issues &amp; combatting #climatechange #ModiInUS"
2016-06-08 19:41:42;timkaine;Honored to hear Prime Minister Modi’s vision for India before a joint session of Congress in the U.S. Capitol today #ModiInUS
2016-06-08 17:27:36;timkaine;Felicidades a @USSoccer por su victoria decisiva anoche en #Copa100!! #OneNationOneTeam 🇺🇸
2016-06-08 17:26:54;timkaine;Congratulations to @USSoccer for a decisive win last night in #Copa100!! #OneNationOneTeam 🇺🇸
2016-06-08 16:24:53;timkaine;#TSCA reform was named after the late NJ Sen. Frank Lautenberg. His leadership on this bill will never be forgotten!
2016-06-08 16:24:12;timkaine;#TSCA clears away a bureaucratic obstacle that has prevented regulation of asbestos, a known carcinogen, for the past 25 years
2016-06-08 16:23:39;timkaine;Proud Senate sent #TSCA to @POTUS with unanimous support. The good faith shown in this process is a model for future legislative cooperation
2016-06-08 14:57:31;timkaine;"We must be more proactive responding to #Zika virus. Urging @StateDept to protect servicemembers &amp; Americans abroad https://t.co/pcph3DysG9"
2016-06-08 11:31:58;timkaine;Excited to join so many friends on a special edition of @jfradioshow! Tune in at 7:35AM https://t.co/TwqP1XpsQm
2016-06-08 11:10:18;timkaine;Joining @wmalnews at 7:15am to discuss @HillaryClinton's historic primary wins last night #ImWithHer https://t.co/YPKBhtyDWH
2016-06-08 02:49:18;timkaine;Now it's time for us to come together to ensure we send @HillaryClinton to the White House #LoveTrumpsHate
2016-06-08 02:49:06;timkaine;History made! So proud to call @HillaryClinton our presumptive nominee #ImWithHer
2016-06-07 21:42:22;timkaine;My full statement on the #AUMF amendments I introduced today on the #NDAA here: https://t.co/FXSaASIw9m
2016-06-07 21:41:59;timkaine;"Short of ISIL-specific #AUMF this year, it's my hope we can revise 2001 #AUMF to better tailor US fight against terrorism &amp; clarify mission"
2016-06-07 20:45:00;timkaine;RT @lizchar: Wild horse spotting on Assateague #VAisforNPSLovers https://t.co/eUG09xeQTH
2016-06-07 20:44:58;timkaine;RT @lizchar: Spent the weekend at my favorite park, Assateague Island #VAisforNPSLovers https://t.co/7nPF2uD5P4
2016-06-06 23:31:36;timkaine;Congrats to @NASA_Wallops on its groundbreaking last Friday for a new Mission Launch Command Center
2016-06-06 13:47:51;timkaine;Honored to be a part of today's #DDayRollCall ceremony at the @DDayMemorial. @WDBJ7 will cover it at 11am: https://t.co/QWTc72i5EB
2016-06-06 13:47:08;timkaine;Today, we remember the valor, devotion and sacrifice of the Allied Forces on #DDay
2016-06-06 13:15:04;timkaine;Ramadan Kareem to Muslims in Virginia and across the world during this holy month
2016-06-04 14:25:00;timkaine;Muhammad Ali was an inspiration worldwide. His contributions to sport and athletes were invaluable #TheGreatest
2016-06-03 23:41:06;timkaine;Rooting for the #USMNT tonight as they kick off #Copa100! RT to show your support! @ussoccer #OneNationOneTeam 🇺🇸
2016-06-03 18:16:36;timkaine;We know #safetrack will be inconvenient for commuters, but safety work is long overdue. WMATA is finally stepping up, which is a good sign
2016-06-03 18:15:49;timkaine;As #safetrack surge begins tomorrow, stay updated on impacts to OR/SV lines: https://t.co/cDbXbWyg8x
2016-06-02 21:53:35;timkaine;#tbt Productivity the public sees when the Senate works best. Today marks 30 yrs of @CSPAN broadcasting the floor https://t.co/aOfvQG1KOi
2016-06-02 21:00:10;timkaine;My take on why Donald Trump poses an unprecedented risk to our country in today's @Daily_Press: https://t.co/AwiXuOU4QB
2016-06-02 20:59:39;timkaine;Anyone who missed @HillaryClinton's speech today should go back and watch - she clearly laid out why Trump is unfit to be Commander in Chief
2016-06-02 20:11:08;timkaine;Saddened by the loss of Delegate Jackie Stump, a great public servant for our Commonwealth who served SW Virginia admirably.
2016-06-02 17:00:42;timkaine;"RT @POTUS: We cannot accept our level of gun violence as the new normal. We must take action to prevent this from happening again &amp; again.…"
2016-06-02 14:53:17;timkaine;"Learn more about the CDC Research on Firearms Safety or Gun Violence Prevention Act &amp; Fix Gun Checks Act https://t.co/jSXrxkNGkF"
2016-06-02 14:51:49;timkaine;"Announced my support for a bill that dramatically strengthens background record checks on all private &amp; online firearm sales #WearOrange"
2016-06-02 14:50:34;timkaine;"Proud to support a bill that would lift a de facto 20-year ban on firearms safety &amp; gun violence prevention research at @CDCgov #WearOrange"
2016-06-02 14:49:52;timkaine;Congress cannot be complacent when gun violence remains so prevalent in American society #WearOrange https://t.co/EM6pChuEpc
2016-05-31 15:12:20;timkaine;Unlike Trump, @HillaryClinton has a comprehensive plan to support our veterans, troops, and their families: https://t.co/dUQe7xZoQd
2016-05-31 13:39:16;timkaine;RT @NeffGould: Mt Rogers. Highest peak in VA! #VAisforNPSLovers #nature #vaoutdoors https://t.co/hyDtgj7jAY
2016-05-30 19:34:42;timkaine;RT @TimBialecki: .@timkaine Heard little devils stairs is a favorite hike of yours. Great call! #VAisforNPSlovers #FindYourPark #MDW https:…
2016-05-30 13:23:28;timkaine;Our fallen heroes will never be forgotten. Grateful to the servicemembers who have protected our nation #MemorialDay https://t.co/Ut45ywjUd4
2016-05-27 16:35:42;timkaine;Hey VA! Going to a national park on #MemorialDayWeekend? Send me your best photos using #VAisforNPSLovers. I'll RT my favs #FindYourPark
2016-05-27 16:18:30;timkaine;RT @WMLawSchool: The Education of Senator @TimKaine: @VALW story on remarks at @WMLawSchool  graduation  https://t.co/oU8oVWZbDd https://t.…
2016-05-26 22:11:45;timkaine;Laura Holgate confirmed as @iaeaorg ambassador. Important position, esp for #Iran oversight. Confident she has experience to do the job well
2016-05-26 19:31:02;timkaine;RT @HokiePedro: Fun day at wolf trap! #vaisfornpslovers https://t.co/Yg3obywICW
2016-05-26 17:19:22;timkaine;Congrats to Kyra, Tejas and Edwin on their great performances this week (h/t @philosophykat for catching my mistake earlier)
2016-05-26 14:35:53;timkaine;Good luck to Virginians Hannah, Tejas, and Edwin in the @ScrippsBee finals today! #Speller252 #Speller259 #Speller262 #spellingbee
2016-05-25 21:43:08;timkaine;May is #MilitarySpouseMonth. @BlueStarFamily study shows economic cost of employment challenges: https://t.co/YHfSYQDka8
2016-05-25 21:25:06;timkaine;Honored to speak to leaders in the Jewish American community today for Jewish American Heritage Month #JAHM https://t.co/hYDzbkmjnP
2016-05-25 20:38:18;timkaine;Congrats to @UVAMensTennis on back to back national championships! #GoHoos #NCAATennis
2016-05-24 17:21:01;timkaine;"Happy 75th birthday to legendary musician &amp; civil rights advocate Bob Dylan. Enjoying some Dylan classics in the office today"
2016-05-24 12:27:47;timkaine;"Discussing #cybersecurity &amp; elevating U.S. cyber posture at @CSIS. Watch live: https://t.co/6jVY8wxRMC"
2016-05-23 22:22:07;timkaine;Proud to be honored by the @CFTNI tonight with my colleague @SenPatRoberts!
2016-05-20 17:22:00;timkaine;Good luck to @DCCPR men's baseball as they take on Montgomery College for the District D Championship Series today #NJCAA #GoKnights!
2016-05-20 15:52:46;timkaine;RT @NARALVirginia: Thank you Virginia's Sen. @timkaine for introducing Access to Birth Control Act to protect access at pharmacies: https:/…
2016-05-20 15:48:35;timkaine;RT @CyberCSIS: Where do we stand on info sharing after the Cybersecurity Act? @timkaine et.al will discuss this topic @CSIS on 5/24 https:/…
2016-05-19 23:59:40;timkaine;No woman’s access to contraception should be denied at the pharmacy counter after she has made a decision with her doctor
2016-05-19 23:58:57;timkaine;Joining colleagues on a bill to defend the freedom of women's healthcare choices: https://t.co/vMX3wX6Thm
2016-05-19 22:42:04;timkaine;Bill also includes important emergency supplemental funding to prevent spread of #Zika virus. Important as we move into the summer months
2016-05-19 22:39:33;timkaine;Glad the Senate could pass a #THUD / MilCon / VetAffairs approps bill with solid provisions for Virginia: https://t.co/NxIgRC3hDi
2016-05-19 22:27:09;timkaine;"Intro'd bill to promote apprenticeships-goal is to help more students, workers &amp; employers compete in global economy https://t.co/2QMOzK452G"
2016-05-19 21:45:20;timkaine;"Saddened at the passing of @CBSnews &amp; @60Minutes legend Morley Safer. A master of his craft who will be dearly missed."
2016-05-19 21:10:51;timkaine;"Joined @maddow last night to discuss the obstruction of President's @SCOTUSnom &amp; how it's being perceived #DoYourJob https://t.co/9gW6WZ0zVS"
2016-05-19 20:49:04;timkaine;Congrats to @TCCva on the national designation for its #cybersecurity program!
2016-05-19 00:07:10;timkaine;"Joining @maddow tonight to discuss continued @SCOTUSnom obstruction &amp; how it's perceived. Tune in at 9:15"
2016-05-18 23:19:39;timkaine;Great meeting with Mayor Roger Vance today to discuss infrastructure and the latest in Hillsboro! https://t.co/RS9hvaAbZz
2016-05-18 22:48:56;timkaine;Protecting our airports, surface transportation, and travelers through substantial security measures is vital and paramount
2016-05-18 22:48:23;timkaine;"Joining colleagues in calling for increased TSA funding to help address long wait times &amp; ensure security https://t.co/6t2uhhrL2O"
2016-05-18 22:06:36;timkaine;We must help those fleeing the unspeakable violence in Syria. Refugees are the most carefully vetted of travelers to the US #RefugeesWelcome
2016-05-18 22:05:58;timkaine;Urging the Administration to fulfill commitment to resettle 10,000 Syrian refugees this fiscal year #RefugeesWelcome https://t.co/neGZYmuSRN
2016-05-18 16:00:04;timkaine;The obligation for communities to affirmatively further #FairHousing is not new. RT if you stand against attempts to weaken the AFFH rule
2016-05-18 15:59:21;timkaine;It is fiction to say AFFH mandates changes to zoning laws, requires people to move, or ends local control of community planning #FairHousing
2016-05-18 15:58:54;timkaine;"AFFH lets communities make informed planning &amp; investment decisions that break down barriers that stand in the way of #FairHousing choice"
2016-05-18 15:58:27;timkaine;AFFH rule is at the core of #FairHousing Act. It's about expanding opportunity, investing in communities, and giving people choice
2016-05-18 15:55:57;timkaine;Affirmatively Furthering #FairHousing (AFFH) rule protects people from housing discrimination, providing justice and equality for all
2016-05-18 15:13:08;timkaine;"We cannot blind ourselves to how our actions are perceived. It’s time for a hearing &amp; vote on Judge Garland’s nomination #DoYourJob"
2016-05-18 15:12:41;timkaine;"ICYMI: my speech on unprecedented obstruction of @SCOTUSnom &amp; the dangerous message it sends to the American public https://t.co/Gnu9duf7nk"
2016-05-17 21:57:06;timkaine;It was great to see members of the Danville Youth Council checking out the Capitol today! https://t.co/LJT5bhk70W
2016-05-17 21:40:15;timkaine;Congratulations to Eric Fanning, the new Secretary of the @USArmy
2016-05-17 20:32:59;timkaine;RT @ChrisCoons: #BrownVBoard reminds why a full, functioning #SCOTUS is so critical to addressing the most pressing challenges our country…
2016-05-17 18:28:43;timkaine;Refusal to consider this President's @SCOTUSnom - the first African American president - feeds a painful perception among many constituents
2016-05-17 18:26:31;timkaine;I don't know the majority's motivations, but I want to share how this obstruction appears to many in Virginia
2016-05-17 18:25:42;timkaine;In that spirit, heading to floor at 4pm w/@SenatorCardin @CoryBooker @SenBlumenthal re: unprecedented obstruction of @SCOTUSnom #DoYourJob
2016-05-17 18:24:54;timkaine;"Senate did its job by considering &amp; confirming a #SCOTUS nominee to ensure Brown v. Board had 9 justices to rule on this important matter"
2016-05-17 18:23:23;timkaine;#OTD in 1954, #SCOTUS ruled the promise of equality could not be denied to schoolchildren based on the color of their skin in Brown v. Board
2016-05-17 15:07:53;timkaine;"There shouldn't be a stigma surrounding #CareerTechEd programs in society. They are proven solutions for creating jobs &amp; retraining workers"
2016-05-17 15:05:45;timkaine;The acquisition of #CareerTechEd skills, whether it be welding, carpentry, or computer sciences, is a great path to success in life
2016-05-17 15:05:07;timkaine;In Senate, I have made #CareerTechEd my edu priority. I've intro'd bipartisan bills that promote integration of CTE into the academic track
2016-05-17 15:03:12;timkaine;"Just wrapped my testimony on #CareerTechEd for the House
@EdWorkforce Committee. Here are some highlights..."
2016-05-17 13:55:04;timkaine;"Watch the hearing live here #CareerTechEd @edworkforcedems 
https://t.co/jaEZxR4bDk"
2016-05-17 13:49:38;timkaine;On my way to testify on importance of passing Perkins CTE Act for future of #CareerTechEd cc: @edworkforcedems
2016-05-17 13:46:57;timkaine;"As a beneficiary of dual enrollment, I applaud @usedgov’s experimental
site program. Will benefit students &amp; help cut the cost of higher-ed"
2016-05-17 13:46:24;timkaine;"Fantastic news that Central VA CC and @germannacc were selected to
take part in experimental Pell Grant program for dual enrollment
students"
2016-05-16 20:20:23;timkaine;Honored to address @VMInews class of 2016 on #AUMF and U.S. global leadership in Lexington. Good luck and godspeed! https://t.co/UJKQbzUcQp
2016-05-16 14:48:12;timkaine;Excited to deliver the commencement address for @VMInews class of 2016. Watch live at 11:00am https://t.co/eMs3tcIipL
2016-05-14 15:09:21;timkaine;Co-prescribing naloxone with opioid medications can help save lives. Learn more about my bill here: https://t.co/jyNpkbceHV
2016-05-14 15:08:43;timkaine;"Hoping for more bipartisan work in Congress to address this epidemic. Families and communities across VA &amp; US depending on us to lead"
2016-05-14 15:08:05;timkaine;Opioid abuse doesn't discriminate, it can affect anyone. Proud to be working in the Senate to increase access to treatment resources
2016-05-14 15:07:35;timkaine;Important weekly address from @POTUS with @Macklemore on addressing opioid abuse: https://t.co/8uCJLe5DSC
2016-05-12 23:44:17;timkaine;Proud #NDAA includes many provisions that will benefit Virginia’s hardworking defense community. My full statement: https://t.co/iOSjvoklW7
2016-05-12 22:28:37;timkaine;Happy independence day to the State of Israel. The bond between our nations remains strong and vital to our mutual security and prosperity
2016-05-12 19:48:22;timkaine;"Energy &amp; Water Appropriations bill has passed the Senate with several VA priorities @MarkWarner and I fought for: https://t.co/QonJ6WMGTR"
2016-05-12 19:17:40;timkaine;Congrats to Bruce Smith! Hall of Fame defensive end from Norfolk and all-time @VT_Football and @NFL leader in sacks https://t.co/Ja85rGrgru
2016-05-12 17:00:54;timkaine;"Joined @MarkWarner to intro a resolution honoring the life &amp; legacy of General George Marshall through @GeoCMarshallFou’s museum and library"
2016-05-12 15:46:04;timkaine;These brave pilots served our nation admirably and deserve this special recognition. Glad Congress could right this wrong
2016-05-12 15:44:57;timkaine;Proud the bill I cosponsored to give Women @usairforce Service Pilots burial rights at @ArlingtonNatl will be law https://t.co/9JNKm8bmZv
2016-05-11 19:51:47;timkaine;"Thinking of Officers Dermyer &amp; Guindon during #NationalPoliceWeek. Let's honor them and all the officers who serve to protect us every day"
2016-05-10 22:31:50;timkaine;Applaud @USTradeRep in challenging China on fair trade @WTO. Poultry #1 ag commodity of #1 VA industry https://t.co/ELxz2L9QkH
2016-05-10 22:17:06;timkaine;Congrats to Jacqueline Firster of Abingdon E.S. in Arlington on being named #PBSDigitalInnovator for leading the classroom in #edtech
2016-05-10 20:36:21;timkaine;Spoke with students of the @ArmyWarCollege class of 2016 today. Congrats, and thank you for serving https://t.co/9SY4dJMZY9
2016-05-10 19:26:27;timkaine;"Watch @NOVA_Prez share his thoughts on #CareerPathways &amp; preparing students for college and beyond cc: @NovaAccess @All4Ed"
2016-05-10 19:21:49;timkaine;"Live now, Senate Career and Technical Education Caucus &amp; @All4Ed holding a briefing on #CareerPathways for students https://t.co/7rDJrEVj0f"
2016-05-10 16:24:17;timkaine;Joining @mitchellreports now on #AMR to discuss foreign policy and the important role it will play in #Election2016. Tune to @MSNBC
2016-05-10 15:38:46;timkaine;Thanks to all who participated! Virginia agencies and the @DEAHQ will look to organize another one in the fall
2016-05-10 15:35:06;timkaine;31,000 lbs of Rx drugs were collected in VA during last month's Take Back Day. A great success that will keep unused opioids off the streets
2016-05-08 14:14:45;timkaine;"Happy Mother's Day! Enjoying time with my parents &amp; Anne this weekend in #RVA"
2016-05-06 18:37:40;timkaine;"My prayers are with Johnny Joannou's family; an accomplished public servant who will be missed by his former colleagues &amp; those he served"
2016-05-06 17:43:39;timkaine;My full statement w/ @MarkWarner on the @wmata repair plan: https://t.co/8r8e3ELV2x
2016-05-06 17:43:17;timkaine;We’ve waited years to see a take-charge plan to deal w/ Metro’s safety issues. Plan announced today grasps the urgency of the situation. 2/3
2016-05-06 17:42:46;timkaine;"Metro riders deserve better than the new normal of near-daily smoke incidents, power outages, arcing insulators &amp; service disruptions. 1/3"
2016-05-05 18:44:01;timkaine;Abingdon has been nominated for @BudgetTravel’s coolest Small Town in America. Vote today! https://t.co/1G9RIUe7Rz https://t.co/g6eV2qdccs
2016-05-05 16:28:14;timkaine;Hoy reconocemos la valentía de los mexicanos en la Batalla de Puebla y la importancia de las contribuciones de Mex a EEUU que perduran
2016-05-05 16:15:17;timkaine;"Congrats to Caroline Taylor, RN &amp; President of Taylor Made Diagnostics, for winning the 2016 VA #SmallBiz POY! #SmallBizWeek #DreamSmallBiz"
2016-05-05 15:24:24;timkaine;"#SmallBiz keeps the Commonwealth's economy strong &amp; innovative. Best wishes on a good #b2g expo today to the @RestonChamber #SmallBizWeek"
2016-05-04 21:00:13;timkaine;I joined Senate colleagues last week to request more resources for testing drinking water in schools for contaminants
2016-05-04 20:59:37;timkaine;Lead contamination in Flint has highlighted the importance of investing in prevention and mitigation resources at the federal level
2016-05-03 19:29:45;timkaine;"RT @MarkWarner: .@TimKaine &amp; I urged @usedgov 4 comprehensive guidance on protections 4 transgender &amp; gender non-conforming students https:…"
2016-05-03 18:50:42;timkaine;"#AAPI Americans have fought for our country, served as leaders in our communities &amp; made an immeasurable impact on our history #AAPIHM2016"
2016-05-03 18:47:01;timkaine;"It's Asian American &amp; Pacific Islander Heritage Month, a time to celebrate the influence of the #AAPI community in VA and across the country"
2016-05-03 17:54:14;timkaine;As a parent I've seen the difference teachers can make in students' lives. RT to thank VA's hardworking teachers #TeacherAppreciationDay
2016-05-03 17:08:13;timkaine;RT @SenFranken: As states like NC try to limit rights of #LGBT people, I’m urging @usedgov to clarify Title IX protections. More: https://t…
2016-05-03 17:07:18;timkaine;Joining my colleagues in urging @usedgov to clarify legal protections for #LGBT students across the country https://t.co/mioNcYBbO1
2016-05-02 20:35:07;timkaine;Taking questions on education on @Quora. Send me your Qs, and I'll post my thoughts this Wednesday at 3:00pm ET https://t.co/2On35aK1zA
2016-04-29 17:34:50;timkaine;The drone that made the historic delivery of medical supplies to @ramusaorg in Wise is heading to @airandspace! https://t.co/qF0agOa2dd
2016-04-29 15:42:32;timkaine;El Senado aprobó una resolución que copatrociné respaldando los esfuerzos de Colombia en solucionar el conflicto armado pacificamente
2016-04-29 15:30:59;timkaine;Senate passed a resolution this week that I cosponsored to support Colombia's efforts to pursue peace and end the nation's armed conflict
2016-04-29 11:20:21;timkaine;"Joining the @Morning_Joe crew at 7:40am to talk foreign policy &amp; yesterday's hearing on the counter-ISIL operation."
2016-04-28 20:34:31;timkaine;RT @chefjoseandres: @timkaine @DogTagBakery proud that my @WCKitchen is a small partner in their amazing success!!!
2016-04-28 19:21:17;timkaine;"Learn how @DogTagBakery is helping veterans find jobs &amp; get the education they need to succeed in civilian life: https://t.co/Ydy6eB4Mg3"
2016-04-28 19:20:43;timkaine;"The folks at @DogTagBakery are helping empower our nation's veterans &amp; their families  #DTIstormthehill https://t.co/v6qtmFgrnv"
2016-04-28 18:30:48;timkaine;"Great seeing VA @steelworkers reps yesterday to talk workers' rights &amp; their important contributions to VA's economy https://t.co/CJcCTnoxb4"
2016-04-28 15:24:11;timkaine;With passage of a Senate resolution yesterday, we unanimously agreed the economic bonds between the U.S. and Israel must remain strong.
2016-04-28 13:22:33;timkaine;"Watch today's Armed Services Committee hearing on counter-ISIL operations &amp; Middle East strategy here at 9:30am: https://t.co/IrUWmuNSdT"
2016-04-27 18:54:13;timkaine;Berna couldn't afford a drug she needs b/c of #Valeant's sudden price hike business model. She tells her story today https://t.co/qJJdj56prY
2016-04-27 18:53:27;timkaine;At 3:30, I'll introduce Williamsburg's Berna Heyman who was a victim of #Valeant's drastic Rx price hikes: https://t.co/qJJdj56prY
2016-04-27 16:30:07;timkaine;RT @GovernorVA: .@GovernorVA encourages all Virginians to prepare for mosquito season by visiting @VDHgov Zika website https://t.co/lqYW78A…
2016-04-27 15:38:43;timkaine;The Southwest Virginia Medical Reserve Corps was awarded for their 2015 Rx drug take-back efforts. Congrats and thank you! @VDHgov
2016-04-27 15:34:21;timkaine;Saturday is National Rx Drug Take-Back Day. Disposing unused Rx drugs responsibly can help save lives: https://t.co/b2zjofDhd3 @VDHgov
2016-04-26 21:54:31;timkaine;Increasing access to K-12 computer science prepares students for in-demand, high-skill jobs #CSforAll https://t.co/3U71Ln8CrS
2016-04-22 20:27:53;timkaine;Hey Virginians! Headed to a national park this weekend? Send me your best photos using #VAisforNPSLovers. I'll RT my favorites #FindYourPark
2016-04-22 19:01:42;timkaine;Nice photo! As a reminder, here are tips to stay safe among the wildlife in @ShenandoahNPS https://t.co/xwguUKwQDN https://t.co/mrz1HJqe3L
2016-04-22 18:41:54;timkaine;Wishing for a joyous and reflective Passover to families celebrating in Virginia and across the world. Chag Sameach!
2016-04-22 18:24:27;timkaine;"RT @adamtlewis: Gaines Mill Battlefield, Hanover County VA 

@RichmondNPS @timkaine #vaisfornpslovers https://t.co/9Nba3ZL1Zk"
2016-04-22 17:18:42;timkaine;"On #EarthDay, let's recognize our planet's natural beauty &amp; help preserve it by combatting #climatechange https://t.co/jMnAowjALd"
2016-04-22 16:58:23;timkaine;The right to vote makes up the very fabric of our democracy and now 200,000 more Virginians can exercise this right thanks to @GovernorVA
2016-04-22 16:51:44;timkaine;"Signing the Paris Climate Agreement marks the start of a worldwide effort to reduce carbon pollution &amp; save our planet #ActOnClimate"
2016-04-21 22:26:58;timkaine;#HappyBirthdayYourMajesty! #TBT to Queen Elizabeth II's Virginia visit for the 400th birthday of Jamestown https://t.co/8uR8wg6evW
2016-04-21 21:35:50;timkaine;Honored to meet @SCOTUSnom Merrick Garland today. The Senate must consider such a highly qualified nominee https://t.co/7YeuadsFjC
2016-04-21 17:32:40;timkaine;Visiting a VA National Park during #NationalParkWeek? Send me photos using #VAisforNPSLovers and I'll RT my favorites! #NPS100 #FindYourPark
2016-04-21 17:32:08;timkaine;Celebrate #NationalParkWeek by helping get #everykidinapark. Free admission for 4th graders all year! #FindYourPark https://t.co/2nA6MVCfUm
2016-04-20 21:38:05;timkaine;"Proud to support the #LWCF &amp; this bipartisan effort on #energyefficiency  https://t.co/CuKQkpCw9C"
2016-04-20 21:24:33;timkaine;"Met GEN Lori Robinson who's been nominated to head @NoradNorthcom &amp; would be 1st female to lead a combatant command https://t.co/HgFsHR0ZuC"
2016-04-20 21:07:22;timkaine;"Positive relationships between faith groups &amp; law enforcement build more resilient communities https://t.co/6pfrSKVE72"
2016-04-20 19:35:12;timkaine;Excellent choice! #HarrietTubman fought tirelessly for freedom  https://t.co/2L0KJ76KaI
