timestamp;sn;text
2017-02-01 03:29:32;USNewsOpinion;Democrats are making a huge blunder opposing Trump #SCOTUS pick Neil Gorsuch, @PeterRoff writes https://t.co/peNmHa2RHm
2017-02-01 02:05:51;USNewsOpinion;Look back to history to resist Donald Trump. https://t.co/6V3730Wh9Q via @pastpunditry
2017-02-01 01:09:47;USNewsOpinion;Draw the line with Donald Trump. https://t.co/jWdteTwIMV via @simonwdc
2017-02-01 00:03:44;USNewsOpinion;The Democrats can and should obstruct Trump's #SCOTUS pick. https://t.co/46aDovRLYf via @Pat_Garofalo
2017-01-31 23:12:45;USNewsOpinion;.@realdonaldtrump's executive order on regulations is absurd. https://t.co/rfbFnVg68O
2017-01-31 22:29:44;USNewsOpinion;Donald Trump fired the acting attorney general. https://t.co/2MIhWioilR
2017-01-31 22:08:48;USNewsOpinion;Draw the line with Donald Trump, Democrats. https://t.co/SlrudRjQxj
2017-01-31 21:45:02;USNewsOpinion;The White House omitted Jews from its Holocaust statement. That matters. https://t.co/K6GrZocHgE
2017-01-31 21:20:39;USNewsOpinion;Trump's administration is moving fast – intentionally. https://t.co/pbyZo6D0hd
2017-01-31 20:57:28;USNewsOpinion;The Democrats have every right to hold up Trump's #SCOTUS pick. https://t.co/7YPXlZFXoz via @Pat_Garofalo
2017-01-31 20:35:34;USNewsOpinion;The Trump administration failed to truly confront the horrors of the Holocaust. https://t.co/kSHpjGmJwf
2017-01-31 20:03:20;USNewsOpinion;"Donald Trump fired Sally Yates, the acting attorney general. Here's what everyone';s saying. https://t.co/T0muDygIcx"
2017-01-31 19:34:35;USNewsOpinion;There is enough crazy happening. Why did the media drum up more over Trump and State? https://t.co/BwKyMEA5oU
2017-01-31 19:12:53;USNewsOpinion;Democrats should filibuster the heck out of Trump's #SCOTUS pick. https://t.co/dJ7iy6fenh via @Pat_Garofalo
2017-01-31 18:44:06;USNewsOpinion;Here's what everyone's saying about Donald Trump firing the acting attorney general. https://t.co/22KtAUkLeo
2017-01-31 17:29:02;USNewsOpinion;Stop the outcry over Betsy DeVos' approach to education. https://t.co/7eBOk856Ro
2017-01-31 17:05:39;USNewsOpinion;How to resist Donald Trump? Go to the history books. https://t.co/9o3PPI3dw3 via @pastpunditry
2017-01-31 15:28:27;USNewsOpinion;Donald Trump is intentionally making it hard for you to keep up. https://t.co/nnHBwqMZIT
2017-01-31 14:28:19;USNewsOpinion;Democrats, it's time to draw the line with Donald Trump. https://t.co/VoScYMdhSh via @simonwdc
2017-01-31 13:52:42;USNewsOpinion;The case against Betsy DeVos, in 5 points. https://t.co/hwfSMMhzfR
2017-01-31 12:29:27;USNewsOpinion;Donald Trump is wreaking so much havoc, it's hard to keep up. (And that's the point.) https://t.co/H9iORZZsdb
2017-01-31 02:37:31;USNewsOpinion;Trump won't create jobs by deregulating the economy. https://t.co/eEhrYDLFVA
2017-01-31 01:37:14;USNewsOpinion;Here are the 3 flawed assumptions underlying Trump's #MuslimBan https://t.co/4KEXU1ybKG
2017-01-31 00:35:34;USNewsOpinion;Trump has a chance to finish what Obama started in Cuba. https://t.co/XcOJdv3VyQ
2017-01-30 23:35:21;USNewsOpinion;Use Steve Bannon's and @realdonaldtrump's tactics against them. https://t.co/cMps8cbQxJ
2017-01-30 23:04:27;USNewsOpinion;This is what's wrong with @realdonaldtrump's immigration ban. https://t.co/C2YUOlw7aU
2017-01-30 22:41:00;USNewsOpinion;The regulations order is absurd and a total Trump gimmick. https://t.co/RKUYFjNzYe via @Pat_Garofalo
2017-01-30 22:07:24;USNewsOpinion;.@realdonaldtrump and Steve Bannon are flooding us. Flood them back. https://t.co/8kUT3j9q6k
2017-01-30 21:45:51;USNewsOpinion;Trump's immigration ban rollout was bad. The bottom line is right. https://t.co/kITPu1znEN
2017-01-30 20:05:25;USNewsOpinion;.@realdonaldtrump's executive order on regulations is absurd. https://t.co/QvwDaF1cnN via @Pat_Garofalo
2017-01-30 19:10:45;USNewsOpinion;Just say no to more federal spending on infrastructure. https://t.co/XgAGLQqI7Y
2017-01-30 18:19:30;USNewsOpinion;Trump's voter fraud claim is bogus. https://t.co/g9eVufLoqr
2017-01-30 17:57:19;USNewsOpinion;No, cutting regulations is bad for the economy. https://t.co/zZIKBuOziG
2017-01-30 17:37:06;USNewsOpinion;Here's what @POTUS' immigration ban gets wrong. https://t.co/DLiUBYb1mS
2017-01-30 16:33:49;USNewsOpinion;The government's plan to gut regulations will hurt the economy. https://t.co/wX78XRBwZE
2017-01-30 16:03:33;USNewsOpinion;Trump has a chance to finish what Obama started in Cuba. https://t.co/7mgMyKhG9d
2017-01-30 15:41:01;USNewsOpinion;3 things @realdonaldtrump's immigration ban gets wrong. https://t.co/kjuSf4bkYr
2017-01-30 03:03:47;USNewsOpinion;.@realdonaldtrump's conflicts of interest endanger us. https://t.co/AsimFv8rsP
2017-01-30 01:33:47;USNewsOpinion;Trump's voter fraud claim is bogus. https://t.co/8dSdasK3El
2017-01-30 00:03:42;USNewsOpinion;Obama set a dangerous precedent when it comes to press freedom. https://t.co/EvtsthdGXN
2017-01-29 22:34:55;USNewsOpinion;Barron Trump will be just fine when it comes to media kerfuffles. https://t.co/rxqKZURopl
2017-01-29 21:12:02;USNewsOpinion;Fentanyl is killing us. Here's what can be done. https://t.co/zfot8Te6Rh
2017-01-29 19:35:01;USNewsOpinion;Undercutting the @cfpb will only hurt America's working class. https://t.co/fSyJyDubTf
2017-01-29 18:19:04;USNewsOpinion;The case against Betsy DeVos, in 5 points. https://t.co/WURrT09K6T
2017-01-29 16:54:33;USNewsOpinion;Here are the 3 flawed assumptions underlying Trump's #MuslimBan https://t.co/5bWsOXlP5R
2017-01-29 16:34:21;USNewsOpinion;Trump won't create jobs by deregulating the economy. https://t.co/QgFx1wWHEy
2017-01-29 15:09:32;USNewsOpinion;Mary Tyler Moore was a trailblazer for feminist TV. https://t.co/21Ya9gy1iA
2017-01-29 13:48:47;USNewsOpinion;Who will pay for @realdonaldtrump's wall? Hint: Not Mexico. https://t.co/GwdaO90Qnp
2017-01-28 23:35:31;USNewsOpinion;Trump's unwillingness to work with the press is dangerous. https://t.co/cCJF6rdcFs
2017-01-28 22:11:57;USNewsOpinion;Think you know the Constitution? Think again. https://t.co/4PUXV9mZfW
2017-01-28 20:33:54;USNewsOpinion;Donald Trump is driving America off a moral cliff. https://t.co/LSjyPgqXtG
2017-01-28 19:08:55;USNewsOpinion;What Mary Tyler Moore did for women https://t.co/B4AnFeyKGK
2017-01-28 17:34:54;USNewsOpinion;Democrats can obstruct @realdonaldtrump. Here's how. https://t.co/TLBSPBLZOe
2017-01-28 16:04:19;USNewsOpinion;Mexico won't pay for @realdonaldtrump's wall. You will. https://t.co/L1tnVHVL0D
2017-01-28 14:35:42;USNewsOpinion;Trump's voter fraud claim is just wrong. https://t.co/lmiV4TXPkt
2017-01-28 13:05:46;USNewsOpinion;.@POTUS and Theresa May can't get much done in the short term. https://t.co/aOsF4j5xpH
2017-01-27 21:14:01;USNewsOpinion;Trump's disregard for the truth and his attacks on the media are dangerous to our very democracy. https://t.co/MA4OqrzU8N
2017-01-27 20:51:39;USNewsOpinion;What Theresa May and @POTUS can accomplish https://t.co/tIWjoU9Y90
2017-01-27 20:27:06;USNewsOpinion;RT @davidmfaris: In my new piece for @USNewsOpinion I propose 5 rules for how @SenateDems can justly obstruct Trump and the GOP. https://t.…
2017-01-27 20:07:01;USNewsOpinion;Remember this, @realdonaldtrump: No one wins trade wars. https://t.co/MG8m1ULftN
2017-01-27 18:59:05;USNewsOpinion;How Democrats can get in the way of @realdonaldtrump and the GOP https://t.co/ASk3J6gGey
2017-01-27 17:33:04;USNewsOpinion;Nationwide concealed carry is a bad idea. https://t.co/4SxSzV9ff6
2017-01-27 17:12:12;USNewsOpinion;.@POTUS is wooing business and union leaders. https://t.co/GFcFNNFNNu
2017-01-27 16:51:22;USNewsOpinion;The U.S. has a strong stake in the EU. Trump must remember that. https://t.co/NVCmvk3lSK
2017-01-27 16:31:05;USNewsOpinion;Democrats can obstruct @realdonaldtrump. Here's how. https://t.co/ypsoEEhAcW
2017-01-27 15:16:09;USNewsOpinion;Obama set a dangerous precedent when it comes to press freedom. https://t.co/36j4bLkETD
2017-01-27 14:53:03;USNewsOpinion;Theresa May and @POTUS could still strike a trade deal, despite their differences. https://t.co/j6HRnSy9Xi
2017-01-27 13:05:14;USNewsOpinion;.@POTUS and Theresa May can't get much done in the short term. https://t.co/OVvZFW8jM4
2017-01-27 03:08:50;USNewsOpinion;The NRA is pushing for concealed carry, nationwide. Here's why that's bad. https://t.co/VO8SfkuCPU
2017-01-27 02:15:11;USNewsOpinion;The free market won't solve the jobs problem. https://t.co/VAwUvgbD3Z
2017-01-27 01:13:17;USNewsOpinion;What Mary Tyler Moore did for women https://t.co/VlzrcCFLbe
2017-01-27 00:12:59;USNewsOpinion;Trump would be wise to remember America's stake in a strong EU. https://t.co/95e5mNJtYb
2017-01-26 23:35:31;USNewsOpinion;RT @Pat_Garofalo: So we will pay, not Mexico? Got it. https://t.co/RiA33gQv1t https://t.co/vm92OOnM7n
2017-01-26 23:11:05;USNewsOpinion;Is Trump the end of Pax Americana? https://t.co/wA21fpGlYq
2017-01-26 22:32:21;USNewsOpinion;RT @rweingarten: New 5 Questions for @BetsyDeVos: https://t.co/qnyOHrpGnB #DeVosFacts #DumpDeVos
2017-01-26 22:09:23;USNewsOpinion;Trump's voter fraud claim is just wrong. https://t.co/b0KasgQih3
2017-01-26 21:32:06;USNewsOpinion;RT @JeanCard: Piling on to @FredBarnes with more reasons why @realDonaldTrump should #pardonScooterLibby @USNewsOpinion https://t.co/p7rgkg…
2017-01-26 21:10:10;USNewsOpinion;Mexico won't pay for @realdonaldtrump's wall. https://t.co/jlhE4OJX4l
2017-01-26 20:47:45;USNewsOpinion;Mary Tyler Moore was a trailblazer for feminist TV. https://t.co/F1foAQXYNo
2017-01-26 19:47:47;USNewsOpinion;Is Trump the end of Pax Americana? https://t.co/o8NgLIAHEC
2017-01-26 19:24:21;USNewsOpinion;You're going to pay for the wall. Not Mexico. https://t.co/JQkrZTTxOi
2017-01-26 19:01:58;USNewsOpinion;"If @realdonaldtrump wants to be ""God's greatest jobs producer,"" he needs to shift his thinking. https://t.co/JmfOfuyDet"
2017-01-26 18:01:32;USNewsOpinion;Research shows Trump's voter fraud claim is bogus. https://t.co/adaL2ILcie
2017-01-26 17:35:01;USNewsOpinion;Why Trump's private investment bet is good for infrastructure. https://t.co/ZVRtQiaIop via @bpc_bipartisan
2017-01-26 17:02:41;USNewsOpinion;The data on education are complicated and require equally complicated conversations. https://t.co/vlWXnCpLvJ
2017-01-26 16:01:58;USNewsOpinion;President Trump should pardon Scooter Libby. https://t.co/me87LhWoI2
2017-01-26 15:22:34;USNewsOpinion;Trump would be wise to remember America's stake in a strong EU. https://t.co/XYPvunoMky
2017-01-26 13:15:37;USNewsOpinion;.@realdonaldtrump gets something right on infrastructure. https://t.co/0ID5YOeyCE via @bpc_bipartisan
2017-01-26 12:08:18;USNewsOpinion;"RT @AAPPres: Now is the time to recognize, maintain &amp; strengthen ACA's improvements to the health of women &amp; kids. #Docs4Coverage https://t…"
2017-01-26 01:01:26;USNewsOpinion;Barron Trump will be just fine when it comes to media kerfuffles. https://t.co/cHYyDLVxNr
2017-01-26 00:27:17;USNewsOpinion;A new gun law could made it harder for law enforcement to do their jobs. https://t.co/ivVFyFELrp
2017-01-25 23:45:40;USNewsOpinion;Fentanyl is killing us. Here's what can be done. https://t.co/PdJ0fPbaG7
2017-01-25 23:20:02;USNewsOpinion;The case against Betsy DeVos, in 5 points. https://t.co/PujjWhchqu
2017-01-25 22:52:46;USNewsOpinion;.@realdonaldtrump can't bring back the good old days. https://t.co/kBo3Lyjppj
2017-01-25 22:25:07;USNewsOpinion;RT @EdProgress: There is a valid case against Trump's nominee for secretary of education. Here's 5 reasons to oppose Betsy #DeVos: https://…
2017-01-25 20:39:59;USNewsOpinion;The @nra's nationwide concealed carry push is a very bad idea. https://t.co/rbTNgN8kCH
2017-01-25 19:49:27;USNewsOpinion;Barron Trump, like other White House kids, can weather the media storm. https://t.co/ZC20BOmtjE
2017-01-25 19:18:46;USNewsOpinion;5 reasons to oppose Trump's education pick Betsy DeVos. https://t.co/jSYILulghU
2017-01-25 18:57:29;USNewsOpinion;Donald Trump is in office, and the good old days are gone. https://t.co/I16SXpwvht
2017-01-25 18:35:23;USNewsOpinion;Barron Trump will weather the media storm just fine. https://t.co/6ckzOXo0dd
2017-01-25 15:17:19;USNewsOpinion;Donald Trump's attacks on the @cfpb will only hurt America's working class. https://t.co/cjyakQZu7o
2017-01-25 14:48:01;USNewsOpinion;.@sandrafluke: What comes after the @womensmarch will shock Donald Trump. https://t.co/xfh239xZr2
2017-01-25 14:18:31;USNewsOpinion;Undercutting the @cfpb will only hurt America's working class. https://t.co/i6XsiyyEpo
2017-01-25 13:17:32;USNewsOpinion;Cities are crucial in the battle against opioids. https://t.co/wxlEHUAf0h
2017-01-25 12:16:54;USNewsOpinion;Obama may have accidentally laid the groundwork for school choice. https://t.co/YkP1OONgmt
2017-01-25 03:22:05;USNewsOpinion;"""America First"" will hurt real Americans. https://t.co/u3huehwBZn"
2017-01-25 02:18:01;USNewsOpinion;.@realdonaldtrump is right: NATO is obsolete. https://t.co/Tn6WZDIsLx
2017-01-25 01:23:22;USNewsOpinion;For many, the peaceful @womensmarch was the exception, not the rule. https://t.co/EYfa5BRRvX
2017-01-25 00:12:41;USNewsOpinion;What is our moral obligation in the Donald Trump era? https://t.co/e8zI6vqvzr
2017-01-24 23:26:27;USNewsOpinion;.@realdonaldtrump is making false claims about voter fraud. Again. https://t.co/9TcTPdq7NM
2017-01-24 22:51:30;USNewsOpinion;Make no mistake – Betsy DeVos wants to help disabled students. https://t.co/ePKFP70hQn
2017-01-24 22:28:50;USNewsOpinion;Let Donald Trump's con commence. https://t.co/1nBPo3TiDc
2017-01-24 22:07:22;USNewsOpinion;How @realdonaldtrump is remaking Fox News in his vision. https://t.co/k1SfqQumEd
2017-01-24 21:44:10;USNewsOpinion;Donald Trump is lying again about voter fraud. https://t.co/2wcRW470S6
2017-01-24 21:23:47;USNewsOpinion;.@realdonaldtrump will be shocked by what comes after the @womensmarch. https://t.co/ecmEl3eJDP via @sandrafluke
2017-01-24 19:55:43;USNewsOpinion;Betsy DeVos isn't indifferent to students with disabilities. https://t.co/RV2HsJZJUp
2017-01-24 19:05:59;USNewsOpinion;"Why ""America First"" is problematic for, yes, America. https://t.co/OawA0gHX4z"
2017-01-24 18:45:12;USNewsOpinion;.@realdonaldtrump can't stop lying about voter fraud. https://t.co/UjjWF9lieF
2017-01-24 16:32:55;USNewsOpinion;Fox News = Trump News. https://t.co/0TdbqgBMu7
2017-01-24 16:12:51;USNewsOpinion;.@sandrafluke: The @womensmarch on Washington was just the beginning. https://t.co/Mldepf7LQw
2017-01-24 14:09:27;USNewsOpinion;How to justify repealing and replacing the ACA https://t.co/7CbVymDb30
2017-01-24 13:16:24;USNewsOpinion;Don't take the peaceful @womensmarch for granted. https://t.co/Hz3Dczs2ZV
2017-01-24 12:03:16;USNewsOpinion;.@realdonaldtrump is right: NATO is obsolete. https://t.co/Vz97yUxWVb
2017-01-24 03:10:37;USNewsOpinion;It's our job to fight inequality now. https://t.co/PcPoa1Zc7r
2017-01-24 02:02:28;USNewsOpinion;Be a beacon of hope in the @realdonaldtrump era. https://t.co/xVDGGXD537
2017-01-24 01:07:26;USNewsOpinion;Obamacare politics are risking health care for women and children. https://t.co/OeAXMVOSyM
2017-01-24 00:07:02;USNewsOpinion;Why we need elitism in the Trump age. https://t.co/4xxYjWRGSM
2017-01-23 23:06:56;USNewsOpinion;"Donald Trump and the ""American carnage"" speech https://t.co/clu7RBqzQH"
2017-01-23 22:46:20;USNewsOpinion;"Get used to the Trump team's world of ""alternative facts."" https://t.co/oifOdR77iN via @Pat_Garofalo"
2017-01-23 22:11:17;USNewsOpinion;For many, the peaceful @womensmarch was the exception, not the rule. https://t.co/BrdMwr22Os
2017-01-23 21:49:16;USNewsOpinion;The @womensmarch was the antithesis of what the Trump administration represents. https://t.co/DDbnqz5IAn
2017-01-23 21:29:07;USNewsOpinion;The left is wimping out on defense. https://t.co/JaLw4P7c1Q
2017-01-23 19:47:36;USNewsOpinion;Take the ACA away from women and children, and endanger the whole country's health. https://t.co/OzmJiSjMnL
2017-01-23 18:48:38;USNewsOpinion;We can't be paralyzed by rage in the @realdonaldtrump era. https://t.co/Ef0uuXAT8i
2017-01-23 18:28:13;USNewsOpinion;Welcome to @realdonaldtrump's big con. https://t.co/XdRsUS80T4 via @Pat_Garofalo
2017-01-23 18:06:29;USNewsOpinion;Donald Trump is a wolf in wolf's clothing. https://t.co/K2AsJd8D6t
2017-01-23 17:43:56;USNewsOpinion;We need intellectuals in the fight against @realdonaldtrump. https://t.co/dLOxiKcfxL
2017-01-23 17:23:05;USNewsOpinion;Fighting inequality is on us, now. https://t.co/L2F9LuTTsH
2017-01-23 00:38:18;USNewsOpinion;Washington has a new sheriff in Donald Trump. https://t.co/VvjyP3KfDU
2017-01-22 23:08:12;USNewsOpinion;Obama's legacy as president is not yet fully shaped. https://t.co/7cfZ1g4Qgw
2017-01-22 21:32:59;USNewsOpinion;Trump wants to run the country like a business. Here's how he can do it. https://t.co/5xaY18FhoP
2017-01-22 20:04:54;USNewsOpinion;Keep your chin up, Democrats. https://t.co/Ki4syid4kr
2017-01-22 18:34:15;USNewsOpinion;The 2008 inauguration wasn't that different. https://t.co/nxb1H4bzIO
2017-01-22 17:04:01;USNewsOpinion;Insist that Donald Trump divest. https://t.co/jmgw6oNF9F
2017-01-22 15:33:43;USNewsOpinion;"""Sister marches"" will only strengthen the Women's March on Washington. https://t.co/o1Z6fnX3L1"
2017-01-22 13:52:48;USNewsOpinion;"Donald Trump pledged ""America First"" in his inaugural address. https://t.co/PBBewancCp"
2017-01-21 23:35:18;USNewsOpinion;Trump's conflicts of interest endanger us. https://t.co/Tdi97gWmDX Via @jimarkedis #Inauguration
2017-01-21 22:05:40;USNewsOpinion;Democrats should be proud of their party's historic success. https://t.co/pdwJZD5rLL
2017-01-21 20:35:03;USNewsOpinion;.@realdonaldtrump's inaugural address was full of delusion and deceit. https://t.co/ac1SgjWRzR
2017-01-21 19:06:17;USNewsOpinion;This is why Wall Street loves Donald Trump. https://t.co/zKpMf7K72s via @Pat_Garofalo
2017-01-21 17:43:09;USNewsOpinion;Don't shield kids from talking about race. https://t.co/vdzJdgngjg
2017-01-21 16:05:47;USNewsOpinion;.@realdonaldtrump's transition is unlike any other. https://t.co/9uLGiGl8wL
2017-01-21 14:56:36;USNewsOpinion;Why I will march at the Women's March on Washington. https://t.co/jx0Nl9hg8s
2017-01-21 13:46:36;USNewsOpinion;Insist that Donald Trump divest. https://t.co/RB57ZHK3zd
2017-01-21 02:40:58;USNewsOpinion;Keep your chin up, Democrats. https://t.co/eMS6nNWNiL
2017-01-21 01:49:12;USNewsOpinion;Why big banks love @realdonaldtrump https://t.co/AKDbYDYRsU via @Pat_Garofalo
2017-01-21 00:45:47;USNewsOpinion;The @womensmarch errs in leaving pro-life supporters out. https://t.co/ZjH161K3Np
2017-01-21 00:04:40;USNewsOpinion;What was the message of Donald Trump's inaugural address? https://t.co/0Uy0zowDpN
2017-01-20 23:02:59;USNewsOpinion;Bush Sr. is everything @realdonaldtrump is not. https://t.co/unWbIFKmt3
2017-01-20 22:27:05;USNewsOpinion;Washington has a new sheriff in Donald Trump. https://t.co/wBgPCUQHLp
2017-01-20 22:00:04;USNewsOpinion;Donald Trump's inaugural address was full of deceit. https://t.co/Siroew0uXP via @rschles
2017-01-20 21:10:54;USNewsOpinion;Give @realdonaldtrump the benefit of the doubt. https://t.co/YFK5MsKeIY
2017-01-20 20:47:23;USNewsOpinion;Obama's legacy as president is not yet fully shaped. https://t.co/mDxplVsdcr
2017-01-20 20:23:50;USNewsOpinion;Trump wants to run the country like a business. Here's how he can do it. https://t.co/JvJOIBnN9E
2017-01-20 20:00:33;USNewsOpinion;.@realdonaldtrump is huckster-in-chief, says @rschles. https://t.co/gX2c77v8GR
2017-01-20 20:00:11;USNewsOpinion;Washington has a new sheriff in Donald Trump. https://t.co/OxBjrG4vSi
2017-01-20 19:14:07;USNewsOpinion;Democrats wondering how Trump is president should look back – to Obama. https://t.co/f5iCO0RJlQ
2017-01-20 17:59:13;USNewsOpinion;"""I am marching for women's rights."" https://t.co/oRS7Hm5ut6"
2017-01-20 17:37:04;USNewsOpinion;Insist that Donald Trump divest. https://t.co/zeyjtGZGgn
2017-01-20 17:09:52;USNewsOpinion;Keep your chin up, Democrats. https://t.co/MT7cJG3Bfb
2017-01-20 16:48:32;USNewsOpinion;Historian Robert Dallek took a look at Obama's legacy in the making: https://t.co/BDu9Yb5Mmd #Inauguration
2017-01-20 16:18:41;USNewsOpinion;Democrats should be proud of what they've accomplished, even on Trump's #Inauguration day. https://t.co/LYfwjWEPZ4
2017-01-20 15:55:04;USNewsOpinion;4 ways Trump's conflicts of interest threaten national security. https://t.co/78nSeiUYVq Via @jimarkedis #Inauguration
2017-01-20 15:39:32;USNewsOpinion;On #Inauguration Day, Trump gets the benefit of the doubt. https://t.co/GffsNPUawC
2017-01-20 03:13:52;USNewsOpinion;Why big banks love @realdonaldtrump https://t.co/jxEmjqTL4r via @Pat_Garofalo
2017-01-20 02:18:46;USNewsOpinion;.@realdonaldtrump's transition is unlike any other. https://t.co/psnFuDhwR9
2017-01-20 01:13:12;USNewsOpinion;.@realdonaldtrump is trying to discredit the mainstream media – but that's only the half of it. https://t.co/3tYZ4IQTVI
2017-01-20 00:02:40;USNewsOpinion;"Big banks and Wall Street &lt;3 Donald Trump. https://t.co/MVHSQILipj via @Pat_Garofalo"
2017-01-19 23:27:27;USNewsOpinion;We need the White House press corps. https://t.co/H9bPM6asWq
2017-01-19 22:55:18;USNewsOpinion;Bush Sr. is everything @realdonaldtrump is not. https://t.co/Xwj4ezCwJq
2017-01-19 22:34:48;USNewsOpinion;In the Trump era, talk about race with your kids. https://t.co/j2vtgBKYVM
2017-01-19 22:11:21;USNewsOpinion;Obama has a complicated environmental legacy. https://t.co/TCRmF5Oh3G
2017-01-19 21:34:03;USNewsOpinion;Trump can surprise his critics with one simple move. https://t.co/KnidMCdkJE
2017-01-19 21:02:57;USNewsOpinion;History will look kindly on Obama's response to the Great Recession. https://t.co/Ek0b1M2HPd
2017-01-19 20:40:14;USNewsOpinion;This is why Wall Street loves Donald Trump. https://t.co/tLIDttoCtV via @Pat_Garofalo
2017-01-19 20:11:36;USNewsOpinion;Don't dismiss Rick Perry as energy secretary just yet. https://t.co/ImTqSvR3U1
2017-01-19 19:36:14;USNewsOpinion;Trump doesn't get why the White House press corps matters. https://t.co/SAM9dlmEop
2017-01-19 19:06:09;USNewsOpinion;The @womensmarch errs in leaving pro-life supporters out. https://t.co/se0VFiVYFQ
2017-01-19 18:38:18;USNewsOpinion;Don't shield kids from talking about race. https://t.co/R6z6XHpz74
2017-01-19 18:16:07;USNewsOpinion;Betsy DeVos is a danger to students with disabilities. https://t.co/60wIeMT2dj
2017-01-19 15:40:15;USNewsOpinion;Obama's climate legacy is clouded by partisanship. https://t.co/QOBHdty2lm
2017-01-19 15:18:56;USNewsOpinion;The problem with Tom Price, Trump's pick for Health and Human Services. https://t.co/ykEV0N621G
2017-01-19 13:17:21;USNewsOpinion;Focus on the kids in the Trump era of education. https://t.co/xKkthSBVcL
2017-01-19 12:11:50;USNewsOpinion;Why big banks love @realdonaldtrump https://t.co/HSpO9vA1nh via @Pat_Garofalo
2017-01-19 01:17:28;USNewsOpinion;Trump is tearing down mainstream media and building up sympathetic alternatives. https://t.co/yftubD6KEK
2017-01-19 00:12:15;USNewsOpinion;Donald Trump doesn't need economists. https://t.co/z63sZVcRAD
2017-01-18 23:44:25;USNewsOpinion;Obama's health care legacy rests with Republicans now. https://t.co/uEjU91Oyxr
2017-01-18 23:18:34;USNewsOpinion;We're better because of Obamacare. https://t.co/gb2objmmqz
2017-01-18 22:32:14;USNewsOpinion;Scott Pruitt is a bad pick to lead the EPA. https://t.co/DeE2nP8jr7
2017-01-18 22:07:17;USNewsOpinion;If Donald Trump really wants a weaker dollar, he sure is confused. https://t.co/sD2koYIln8
2017-01-18 21:16:13;USNewsOpinion;Tom Price is making the same empty Obamacare promises as @realdonaldtrump. https://t.co/IwPWcr4Ma7
2017-01-18 19:40:03;USNewsOpinion;How will history remember Barack Obama? https://t.co/5uk07eI46x
2017-01-18 19:26:00;USNewsOpinion;America needs a civics lesson. https://t.co/gTZccqpUvm
2017-01-18 17:45:08;USNewsOpinion;Obama's health care legacy is in GOP hands. https://t.co/g4CO7OI8VA
2017-01-18 17:23:12;USNewsOpinion;Say no to Scott Pruitt, Trump's EPA pick. https://t.co/27K6JpC9s0
2017-01-18 16:50:56;USNewsOpinion;Obama's legacy is better because of the Affordable Care Act. https://t.co/SIN9S8WlBU
2017-01-18 14:02:30;USNewsOpinion;Diversity matters outside the boardroom. https://t.co/pW3Y31jyuq
2017-01-18 11:44:25;USNewsOpinion;Can economists prevent a trade war? https://t.co/WwMmWc9CtI
2017-01-18 03:59:09;USNewsOpinion;4 big questions for Ryan Zinke, Trump's secretary of the interior pick. https://t.co/b5h497t6Mt
2017-01-18 02:44:21;USNewsOpinion;Bashing mainstream news is only part of Trump's media plan of attack. https://t.co/LWVhovNbQo
2017-01-18 01:52:46;USNewsOpinion;What will Obama's legacy be? https://t.co/5xwU0iAu3P https://t.co/4iGlmWgobk
2017-01-18 00:50:07;USNewsOpinion;Attacking John Lewis is not a great idea. https://t.co/LaM4jHIZVw
2017-01-17 23:42:17;USNewsOpinion;This is what Obama's economy wrought. https://t.co/QJ6q1GkXlc
2017-01-17 23:08:17;USNewsOpinion;.@realdonaldtrump is trying to discredit the mainstream media – but that's only the half of it. https://t.co/kPUaLBZnQu
2017-01-17 22:26:44;USNewsOpinion;Expect Donald Trump to echo Ronald Reagan on foreign policy. https://t.co/pbtf94WrfS
2017-01-17 21:56:48;USNewsOpinion;Ask Betsy DeVos this education question during her confirmation hearing. https://t.co/bOSX7XejBA
2017-01-17 21:35:46;USNewsOpinion;North Korea hasn't gone away, and Trump needs to deal with it. https://t.co/cAftCcwceb
2017-01-17 19:57:59;USNewsOpinion;4 big questions for Ryan Zinke, Trump's secretary of the interior pick. https://t.co/rpRZMILhlG
2017-01-17 19:35:10;USNewsOpinion;Ask Betsy DeVos about Title I funding. https://t.co/tLkmdyrRlT
