timestamp;sn;text
2017-01-31 21:06:00;UAW;Today in 1938, the Pecan Shellers’ Strike started. It sparked the Hispanic workers movement: https://t.co/pboPBsFn8h #PROUAW #UNIONHISTORY
2017-01-31 19:22:00;UAW;“Aunt Ida” was the first SSI recipient. SSI today provides security for 60 million vulnerable Americans: https://t.co/LzTlS7WqGf #PROUAW
2017-01-31 16:44:00;UAW;Black Men In Unions brings activists nationwide together for classes in Dearborn, MI. Registration ends February 9: https://t.co/LcKK3ENWkC
2017-01-31 14:45:37;UAW;@MachinistsUnion @USATODAY thank you! #solidarity
2017-01-31 14:45:19;UAW;RT @MachinistsUnion: The IAM stands behind Mississippi Nissan workers @UAW #OrganizeTheSouth https://t.co/7IyiIstltn
2017-01-30 19:52:59;UAW;When bargaining broke down, the Cemetery Association of Greater Chicago locked out its workers: https://t.co/CYMJ5pbSdA #PROUAW
2017-01-30 18:36:00;UAW;More disturbing allegations abt CKE Restaurants, the company run by Andrew Puzder who wants to be Labor Secretary: https://t.co/F5usFqZZEk
2017-01-30 18:02:59;UAW;New post on https://t.co/Gt7c4AEmb0! Statement from UAW President Dennis Williams on Immigration https://t.co/gQovlBI02T
2017-01-30 17:01:18;UAW;Collective bargaining for Bohdan means he's secure in his work so that he can spend time on his passion: https://t.co/sd5LAtpsfS  #PROUAW
2017-01-30 15:32:00;UAW;In Jan. 1932, this state created the 1st unemployment insurance law which led to today's federal program: https://t.co/ReTRokpy6x #PROUAW
2017-01-30 14:25:05;UAW;Labor has long clashed with business over fair treatment. But in January 1834, things drastically changed: https://t.co/MAwQ2KHLGp #PROUAW
2017-01-28 20:02:58;UAW;RT @ben_zucker: Legendary Mississippi @UAW and @MSNAACP leaders Morris Mock and Frank Figgers visiting us in Louisiana. #1u #dobetter @DoBe…
2017-01-27 21:02:42;UAW;RT @MichiganDems: Thank you to MI Dem congressionals/@UAW for saving auto industry, paving way for profit-sharing workers have earned https…
2017-01-27 21:02:37;UAW;"RT @MIAFLCIO: Collective bargaining works &gt;&gt; $9,000 bonus checks for @UAWFORDDEPT  workers, 2nd-largest in history https://t.co/XPW1hZnkW7…"
2017-01-27 21:02:29;UAW;"RT @MIAFLCIO: Great news for @UAW members &amp; their families &gt;&gt; FCA union workers to get $5,000 profit sharing checks https://t.co/EVNiTfEhZj…"
2017-01-27 21:02:19;UAW;RT @CHCF_Inc: Julie Kushner @UAW awarded at #NYgamechangers for NY Paid Leave Coalition advocacy https://t.co/5d9g6VouXd
2017-01-27 21:00:41;UAW;RT @facingsouth: Nissan Workers in Mississippi build Southern support for union drive with Days of Action https://t.co/hOL6Wu6bbV @AFLCIO @…
2017-01-27 18:21:00;UAW;"Workers take their message to Nissan dealerships: ""Workers' rights are human rights!"" https://t.co/Ut6MNWYXyv @DoBetterNissan #Organize"
2017-01-27 17:01:15;UAW;.@DoBetterNissan! Your wrkrs, except in Canton, MS, are unionized. Give them a voice: https://t.co/NRH0yNN4Je #nothreats #nointimidation
2017-01-27 16:31:05;UAW;The nominee to head the U.S. budget office says Social Security retirement age is too low: https://t.co/RPxlG8wVvx #ElectionsMatter
2017-01-27 14:45:33;UAW;The first attempt to get corporate money out of elections was made 110 yrs ago: https://t.co/EJNaWlsbn4 #PROUAW #ELECTIONSMATTER
2017-01-26 22:24:01;UAW;Protestors today tell @Nissan to respect workers' right to form a union: https://t.co/IHszGAybwR via @Tennessean
2017-01-26 21:32:02;UAW;New post on https://t.co/Gt7c4AEmb0! Our Future, Our Jobs – January – February 2017 https://t.co/t1JYIKZnhi
2017-01-26 20:17:44;UAW;New post on https://t.co/Gt7c4AEmb0! Statement from UAW Vice President Norwood Jewell on FCA US Profit-Sharing An... https://t.co/bWpUeUXRUa
2017-01-26 19:02:42;UAW;New post on https://t.co/Gt7c4AEmb0! NISSAN CRITICIZED OVER CIVIL RIGHTS ABUSES AGAINST AFRICAN AMERICAN WORKERS https://t.co/onZVLBpNmM
2017-01-26 17:16:36;UAW;New post on https://t.co/Gt7c4AEmb0! Statement from UAW Vice President Jimmy Settles on Ford Profit-Sharing Annou... https://t.co/axOyESaCaC
2017-01-26 14:06:06;UAW;Privatization run amok has led to $2 million in penalties for a Michigan contractor: https://t.co/uHJZWpkNyE #ElectionsMatter
2017-01-26 02:44:45;UAW;"RT @RobDet: This year is the 80th anniversary of ""The Battle of the Overpass"". Remember, people bled for fair work/fair pay. .@UAW #Detroit…"
2017-01-25 15:01:05;UAW;On Wednesdays UAW members wear red to show solidarity. Check out how Local 163 does it! https://t.co/R2DovYvkmC #UnionsMatter
2017-01-25 14:31:05;UAW;New post on https://t.co/Gt7c4AEmb0! Labor will miss Obama’s idealism https://t.co/A53nSBdkoq
2017-01-25 14:15:50;UAW;.@UAW Pres Dennis Williams says Pres Obama's idealism that we can change our country for the better didn’t falter: https://t.co/Bj3UAWd9Hl
2017-01-24 17:47:56;UAW;Andrew Puzder wants to run the labor dept but doesn’t seem to think very highly of his employees: https://t.co/CxZbpf6VC7
2017-01-24 14:17:40;UAW;Did you know #UAW members can save on movie tickets, theme parks, theater tickets and more? Start here:… https://t.co/HiqvVLRzK8
2017-01-23 22:46:35;UAW;New post on https://t.co/Gt7c4AEmb0! Statement by UAW President Dennis Williams on President Trump’s Executive Or... https://t.co/6gB15LpSEO
2017-01-23 22:01:07;UAW;Kathy remembers how her deaf mother, who never wanted to be in a union, was fired without representation: https://t.co/WJV3qDavFu
2017-01-23 21:01:10;UAW;UAW Women are taking on 2017! Join them at https://t.co/U1roiIpYgZ and follow at UAW Women: https://t.co/7R38oTIoEL #UAWWomen #PROUAW
2017-01-23 20:31:01;UAW;Jimmy Carter has been called the most effective ex-president in American history: https://t.co/uKSWuoey3o #POTUSVALUES #PROUAW
2017-01-23 20:01:13;UAW;President Barack Obama was critical in helping guide the U.S. auto industry back to life: https://t.co/dNPh8X91vS  #PROUAW #POTUSVALUES
2017-01-23 19:32:04;UAW;New post on https://t.co/Gt7c4AEmb0! UAW Women are taking on 2017! https://t.co/jXeSltvGUE
2017-01-23 19:31:02;UAW;Truman won in 1948. Critics said he would lose because of anti-civil rights Southerners: https://t.co/lGNeAb9bWz #PROUAW #POTUSVALUES
2017-01-23 18:31:06;UAW;.@UAW President Dennis Williams says the Legal Services Plan is back: https://t.co/nWRa24agHp
2017-01-23 18:09:28;UAW;JFK motivated a generation to fight for justice and positive social change: https://t.co/FPMwYry9s7 #PROUAW #POTUSVALUES
2017-01-21 22:34:59;UAW;"Check out photos of #UAW members at today's #WomensMarch https://t.co/TEQMKmxsrz

Stay connected by signing up here:https://t.co/sxh24xUYzb"
2017-01-21 21:01:02;UAW;Union women know the power of coming together for a common cause. We’re excited to be part of the #WomensMarch! #1uWomen
2017-01-21 19:46:03;UAW;Sign up to stay committed to #1uWomen activism! #UAW VP @CindyEstrada174 says thanks to today's #WomensMarch partic… https://t.co/Y822Lg6j3H
2017-01-21 19:18:48;UAW;RT @CindyEstrada174: Women's marchers: now's the time for all progressive groups to come together and unify in solidarity.
2017-01-21 19:16:03;UAW;RT @KristenShamus: Lots of Detroiters today in Washington. Kelli Smith (left), Yvonne Cash and Tony Braggs are here on behalf of the UAW Re…
2017-01-21 19:15:43;UAW;RT @DrDarrylBaker: Women have made many gains and must demand that the gains not be removed, but improved. https://t.co/NhEGK4hR8W
2017-01-21 19:15:19;UAW;RT @scottwongDC: D.C. getting political whiplash: Historic Trump inauguration yesterday. Massive #WomensMarch today. Here is @UAW gathering…
2017-01-21 19:15:16;UAW;RT @MccarthChase: @UAW @AFLCIO @CindyEstrada174 at the march in London waiting for the rally to start. Respect to my American sisters and b…
2017-01-21 19:15:11;UAW;"RT @jb4demusa: @UAW thank you 4 providing us in WV &amp; Md w/a bus &amp; metro card 4 the women's march, you always come through when chips are do…"
2017-01-21 19:01:09;UAW;A woman’s place is leading in her union and joining the #WomensMarch in D.C.! #1uWomen
2017-01-21 18:16:02;UAW;.@UAW VP @CindyEstrada174 says thanks to #WomensMarch participants! Continue your #1uWomen activism by registering… https://t.co/32cF82swjj
2017-01-21 17:01:12;UAW;The union makes us strong! Proud to be union and marching with the #WomensMarch #1uWomen https://t.co/gQMtfQyTTy
2017-01-21 15:01:14;UAW;RT if you’re union proud and here in D.C. at the #WomensMarch! #1uWomen https://t.co/1hVH7afa8x
2017-01-21 14:47:09;UAW;New post on https://t.co/Gt7c4AEmb0! UAW Vice President Estrada Says Thank You to Women’s March Participants https://t.co/Re7PDhh5Dp
2017-01-21 14:31:03;UAW;Women united will never, ever be defeated. #WomensMarch on DC and around the country today! #1uWomen #chants… https://t.co/t9lysCQBU9
2017-01-21 13:31:03;UAW;Fired up and ready for today's #WomensMarch! #1uWomen #chants @CindyEstrada174 @AFLCIO https://t.co/HBYlIxJ1nK
2017-01-21 13:01:10;UAW;Women united will never be defeated! #womensmarch #1uWomen https://t.co/DzL7oHDJvX
2017-01-20 23:13:59;UAW;Pres. Harrison was one of the first to take on billionaires. Some want to turn the clock back to then: https://t.co/LGOi7gyY7Q #PROUAW
2017-01-20 23:03:01;UAW;New post on https://t.co/Gt7c4AEmb0! Betsy DeVos apparently ‘confused’ about federal law protecting students with... https://t.co/4tDNB8E9bq
2017-01-20 22:12:00;UAW;FDR's New Deal critics called it socialism: https://t.co/M8CGYm5PwB  #PROUAW #POTUSVALUES
2017-01-20 21:46:57;UAW;New post on https://t.co/Gt7c4AEmb0! New UAW Legal Services Plan to Begin Opening Cases https://t.co/3lLP13mpN0
2017-01-20 21:04:44;UAW;Pres Lincoln's first address to Congress was abt capital and wealth. https://t.co/eiDmtQEOSj #POTUSVALUES #PROUAW
2017-01-20 19:31:03;UAW;"In the 1950s, the GOP pushed for expanding SSI, unemployment insurance, health care &amp; min wage: https://t.co/HDe4cvd1nq #PROUAW #POTUSVALUES"
2017-01-20 18:31:04;UAW;"Jan. 1920, Filipino &amp; Japanese wrkers began one of the largest labor actions in Hawaii: https://t.co/t8fw24DNa6 #PROUAW #UNIONHISTORY #APALA"
2017-01-20 17:31:06;UAW;"Tom Price wants to oversee Medicare, the FDA, CDC &amp; 8 other agencies. He's accused of insider trading: https://t.co/LI50krCWd3"
2017-01-20 16:31:15;UAW;Betsy DeVos wants to be Secretary of Education, but she isn’t proving she’s qualified for the job: https://t.co/KoSMvKn5xh
2017-01-20 15:01:20;UAW;"Why are union women joining the @womensmarch? Gender pay gap: https://t.co/sxbvW4FVnb &amp; what @lizshuler says: https://t.co/jnN9P6E99K #1u"
2017-01-19 20:15:10;UAW;New post on https://t.co/Gt7c4AEmb0! Save Our Health Care Rally – Bernie Sanders, Chuck Schumer, Cindy Estrada https://t.co/bYJyTTgvdI
2017-01-19 20:01:44;UAW;Every day, union women stand up to bad bosses. We will bring our power to DC @lizshuler on #womensmarch: https://t.co/jnN9P6myic #1uWomen
2017-01-19 18:55:45;UAW;Columbia: Drop the objections and respect the democratic choice for a Union! Sign here: https://t.co/GaakuB96n5
2017-01-19 15:51:00;UAW;Collective bargaining changes lives, says Amanda: https://t.co/bZf7cV6pIP #PROUAW
2017-01-19 13:43:56;UAW;In Jan. 1912, workers took action that set the stage for unionism in Australia that lasts to this day: https://t.co/mCkGjneJD6  #PROUAW
2017-01-18 19:48:16;UAW;New post on https://t.co/Gt7c4AEmb0! Save Our Healthcare Rally – Bernie Sanders, Chuck Schumer, Cindy Estrada https://t.co/bYJyTTgvdI
2017-01-18 13:54:40;UAW;It’s got a bureaucratic name, but Presidential Exec Order 10988 was anything but ordinary in Jan 1962: https://t.co/UsvnwU4QSZ  #PROUAW
2017-01-17 19:45:50;UAW;New post on https://t.co/Gt7c4AEmb0! UAW Region 1A Distributes Sleeping Bags to Homeless on MLK Day https://t.co/6c3zfhwnKF
2017-01-17 19:37:00;UAW;What's in store for those w/pre-existing conditions in a post-Obamacare world: https://t.co/qSBpWnTM9G #PROUAW
2017-01-17 18:32:00;UAW;Happy 102nd birthday to the iconic song Solidarity Forever! Thanks for this, Local 933's Chuck Berndt: https://t.co/6acLK7z3bZ #PROUAW
2017-01-17 17:29:59;UAW;Gov't oversight of construction work saves lives. W/out it the Boston Molasses Flood occurred in Jan. 1919: https://t.co/sbIKjoIBJs #PROUAW
2017-01-17 17:02:03;UAW;New post on https://t.co/Gt7c4AEmb0! STATEMENT FROM UAW-GM VICE PRESIDENT CINDY ESTRADA ON GM INVESTMENT ANNOUNCE... https://t.co/PCiPwkznKv
2017-01-17 16:29:00;UAW;Shame on these senators for voting against protecting Medicare and Social Security for our seniors: https://t.co/56HFCMHXHn
2017-01-17 15:22:39;UAW;In January 1874, NYC workers demanded the city relieve their economic suffering. They were met w/violence: https://t.co/ZSMkjDFXH3 #PROUAW
2017-01-16 22:01:10;UAW;#1uMLK https://t.co/VHrmB8r8pf
2017-01-16 20:01:12;UAW;#1uMLK https://t.co/Xi5Bvx4Q1X
2017-01-16 18:01:14;UAW;#1uMLK https://t.co/83YU2LGCaJ
2017-01-16 16:01:07;UAW;#1uMLK https://t.co/pwjj1bfIAN
2017-01-16 14:01:14;UAW;#1uMLK https://t.co/ZTGHh5e4ld
2017-01-16 05:46:27;UAW;New post on https://t.co/Gt7c4AEmb0! UAW Remembers Martin Luther King Jr. https://t.co/pyuVXRvaL1
2017-01-13 15:30:26;UAW;New post on https://t.co/Gt7c4AEmb0! UAW regional director says Governor Cuomo’s “Buy American” plan is a boost f... https://t.co/J7O5j2dsOD
2017-01-13 14:31:04;UAW;15 yrs ago, Bill saw how much he gained as a union member and decided he wanted to give back: https://t.co/kCzgWAOsyv #UnionsMatter #PROUAW
2017-01-13 13:15:22;UAW;New post on https://t.co/Gt7c4AEmb0! Union Plus Scholarships provide the keys for immigrant families to unlock th... https://t.co/rC9LQa6Tad
2017-01-12 21:22:08;UAW;Last night, the Senate started the ball rolling to undo the Affordable Care Act: https://t.co/VgXqC8A21r #ElectionsMatter
2017-01-12 16:03:06;UAW;New post on https://t.co/Gt7c4AEmb0! UAW-Made Chevrolet Bolt named North American Car of the Year https://t.co/auZ21Lvbyu
2017-01-12 14:47:49;UAW;New post on https://t.co/Gt7c4AEmb0! UAW regional director praises Governor Cuomo’s “Buy American” plan announced... https://t.co/aikvN99SSx
2017-01-12 13:59:44;UAW;"""How To Kill A Union,"" written 80 years ago: https://t.co/C8R97Y9Cph #PROUAW #UNIONHISTORY"
2017-01-11 16:13:27;UAW;What may be the worst industrial accident in Mass. history happened on this date in 1860: https://t.co/sRVwsasOkO #PROUAW #OURHISTORY
2017-01-10 15:21:54;UAW;The 1930s were filled with important sit-down strikes, even from farmers at the close of the decade: https://t.co/7D4485r2H0 #PROUAW
2017-01-09 21:06:00;UAW;Union activist Mary O’Sullivan was born in Jan. 153 yrs ago. Read her inspiring story: https://t.co/PgQrlnONzE #SistersWhoChangedtheWorld
2017-01-09 20:16:02;UAW;Check out this Diary of a Sit Downer series on UAW GM Talks' FB page: https://t.co/wqJJkP9jtr #DiaryOfASitDowner #80Years
2017-01-09 19:06:00;UAW;In 2017, the UAW celebrates our Greater Calling: https://t.co/wyDtoow1hR #GREATERCALLING #PROUAW
2017-01-09 18:11:00;UAW;"After 10 yrs, Marvin knows the spirit of being UAW carries on for a 
lifetime: https://t.co/v41QobuWQR #UnionsMatter #PROUAW"
2017-01-09 17:05:00;UAW;KY is going after unions. All workers should be on alert: https://t.co/WDbnDCJApR
2017-01-09 16:32:41;UAW;The agreement reached with Ford on November 6, 2015 and ratified by our members included today's announced product… https://t.co/UBnz3oxfeE
2017-01-09 16:29:25;UAW;@aliemalie people like you who keep telling the truth are the REAL, real MVPs🥇🥇🥇
2017-01-09 16:27:32;UAW;RT @MsTiaHopkins: @realDonaldTrump don't thank Ford and Fiat. Thank the @UAW for their collective bargaining agreement to create the jobs.
2017-01-09 15:49:01;UAW;"""We are very happy with FCA's announcement"" about $1 bil in investment: #UAW President Dennis Williams https://t.co/hgLSIZ400L"
2017-01-09 15:46:06;UAW;New post on https://t.co/Gt7c4AEmb0! Statement from UAW Vice President Jimmy Settles on Ford Announcement https://t.co/B41NF4xfoa
2017-01-09 14:10:18;UAW;RT @Ford: We are bringing back the #Ford #Bronco! One of five all-new global utilities coming by 2020. #FordNAIAS #NAIAS https://t.co/ipndv…
2017-01-09 14:09:35;UAW;RT @Ford: #Ford #Ranger is coming back to North America. Production begins late next year at Michigan Assembly. #FordNAIAS #NAIAS https://t…
2017-01-09 02:16:19;UAW;New post on https://t.co/Gt7c4AEmb0! Statement from UAW President Dennis Williams on FCA Announcement https://t.co/ECfbOKuET6
2017-01-09 01:03:12;UAW;"New post on https://t.co/Gt7c4AEmb0! FCA US Expands Jeep Product Lineup; $1 Billion in New Investment and 2,000 N... https://t.co/hgLSIZ400L"
2017-01-08 23:46:05;UAW;New post on https://t.co/Gt7c4AEmb0! FCA US Expands Jeep Product Lineup, Adding Jeep Wagoneer, Grand Wagoneer, an... https://t.co/gPJLqD3lbI
2017-01-06 22:31:00;UAW;When RTW was on the table in Ohio, Ron joined others to talk about the importance of unions: https://t.co/9QxRdDACij #ElectionsMatter
2017-01-06 20:27:00;UAW;The assault against worker rights takes place at all levels: https://t.co/WDbnDCJApR
2017-01-06 18:21:19;UAW;This is why unions are more important than ever: https://t.co/ADJfJtKL4l @AFLCIO
2017-01-05 16:07:59;UAW;Take a look into how Mack Truck’s contract killed two tier and halted the company’s attempt to move work: https://t.co/itS9gzrk2T
2017-01-05 14:01:28;UAW;Mandate? Hardly. People reacted strongly to the Congressional GOP's moves to weaken ethics. https://t.co/WnD9SbyMQm #ElectionsMatter
2017-01-03 18:02:29;UAW;New post on https://t.co/Gt7c4AEmb0! UAW President’s Statement on Today’s Announcements https://t.co/8rGgJUlmIO
2017-01-03 16:20:10;UAW;RT @MBurden_DN: .@UAW VP Jimmy Settles thanks @Ford for putting people over profits, keeping and expanding jobs in U.S.
2017-01-03 16:18:34;UAW;RT @BrentSnavely: . @Ford CEO Fields says cancellation of new $1.6 B Mexico plant and $700M investment at Flat Rock will generate 700 new j…
2017-01-03 16:17:59;UAW;"RT @MikeMartinez_AN: .@UAW Ford VP Jimmy Settles: $700M investment in Flat Rock ""is the equivalent of a new assembly plant."""
2017-01-03 16:17:56;UAW;"RT @BrentSnavely: ""I am a very, very happy person,"" says @uaw vp Jimmy Settles. ""I remember back in 2009 when this very location was on the…"
2017-01-03 02:36:17;UAW;"RT @keithellison: Talking Proud history of @UAW &amp; Labor w/ Pres. Dennis Williams as Walter Reuther, Martin Luther King look on. https://t.c…"
2017-01-01 14:47:11;UAW;New post on https://t.co/Gt7c4AEmb0! Happy New Year from the UAW! https://t.co/HObrk5nFn7
2016-12-30 19:46:37;UAW;New post on https://t.co/Gt7c4AEmb0! Mississippi Today: Union’s complaints about Nissan’s Mississippi plant filed... https://t.co/gV2CdJjAF9
2016-12-30 18:31:28;UAW;New post on https://t.co/Gt7c4AEmb0! Labor Voices: Company offers a cautionary tale https://t.co/bi4hFSr1xt
2016-12-30 14:47:41;UAW;New post on https://t.co/Gt7c4AEmb0! What’s your New Year’s Resolution? https://t.co/BdazzIQBuq
2016-12-27 17:40:18;UAW;"RT @MSTODAYnews: .@UAW is taking its fight for a union at the Mississippi @nissan plant overseas w/ @OECD complaints in 3 countries.

https…"
2016-12-25 14:45:38;UAW;New post on https://t.co/Gt7c4AEmb0! Happy Holidays from the UAW! https://t.co/O2I0gCmFoq
2016-12-23 13:38:55;UAW;This time of year UAW standing committees are in full action. Local 2280's president knows why: https://t.co/SwUhUO88iL  #UnionsMatter
2016-12-22 17:53:01;UAW;In 24 hrs over 1,000 people have signed our @GWCUAW petition calling on Columbia to respect our vote! https://t.co/y5c76rZ2OS
2016-12-22 15:52:01;UAW;Trump’s nominee to head up Education is Betsy DeVos, a booster of charter schools at any cost: https://t.co/idAuuxsK7F #ElectionsMatter
2016-12-22 14:51:01;UAW;"""I was arrested many times. I never thought of fear...but of justice."" Emma Tenayuca, born this week in 1916: https://t.co/ihzJaiemdH"
2016-12-22 13:43:23;UAW;Great holiday package for UAW families to see the Quick Lane Bowl at Ford Field in Detroit Dec. 26: https://t.co/ZdpObZU6hL
2016-12-21 16:01:41;UAW;"New post on https://t.co/Gt7c4AEmb0! ICYMI: Members build Motor Trend Car &amp; Truck of the Year https://t.co/SAjcuYbTy8"
2016-12-20 21:05:52;UAW;Dec. 20, 1790, the first cotton mill opened in the U.S., opening wide the age of child labor: https://t.co/zE3yrmBfRO #UnionHistory #PROUAW
2016-12-20 16:02:30;UAW;New post on https://t.co/Gt7c4AEmb0! Detroit Lions Holiday 4 Pack offer for the Quick Lane Bowl https://t.co/ZdpObZU6hL
2016-12-20 15:44:01;UAW;The new issue of Solidarity magazine is now available online: https://t.co/hANnaA8nhL
2016-12-20 13:38:24;UAW;When Melva's supervisor said she was just a $10/hr worker, Melva got fired up abt her union job: https://t.co/Us1Y1CDQRt #PROUAW
2016-12-20 02:00:25;UAW;New post on https://t.co/Gt7c4AEmb0! Union Front: Our Quality Shines Through https://t.co/VxRTr3yN0A
2016-12-20 00:47:33;UAW;New post on https://t.co/Gt7c4AEmb0! Union Front: Generous Jeep Workers https://t.co/cFSRifw8r3
2016-12-19 23:30:47;UAW;New post on https://t.co/Gt7c4AEmb0! Cover Story: Before Flint, The Winning Momentum Created by Sit-Down Strikes ... https://t.co/ycZhz6ri76
2016-12-19 22:17:43;UAW;New post on https://t.co/Gt7c4AEmb0! Cover Story: Before Flint, The Winning Momentum Created by Sit-Down Strikes ... https://t.co/O5jzvNxsLx
2016-12-19 21:02:59;UAW;New post on https://t.co/Gt7c4AEmb0! Trump’s pick for budget chief could signal major shift on Medicare, Social S... https://t.co/dG8UxHNoUm
2016-12-19 20:39:01;UAW;This is scary. Nominated Labor Secretary Puzder seems to like machines over workers: https://t.co/kdlSn0GuRg #ElectionsMatter
2016-12-19 19:37:01;UAW;The Great Bagel Strike of 1951 started 66 years ago this month:  https://t.co/p4Q4HkOLRT #UnionHistory #PROUAW
2016-12-19 18:36:00;UAW;Still shopping? Use this handy union-made holiday shopping guide. When you buy union, everybody wins: https://t.co/YYLjr3cQdy #UnionLabel
2016-12-19 17:35:02;UAW;Jamie says with the support of union brothers and sisters she is free to be who she is: https://t.co/AoNWW8vBUB #UnionsMatter #PROUAW
2016-12-19 16:34:00;UAW;When your child is seriously ill you can't afford to worry about medical bills: https://t.co/YBb52ernfD #CollectiveBargainingMatters #PROUAW
2016-12-19 15:32:00;UAW;Trump said he won't touch Social Security, but his new team includes big champions of cutting it: https://t.co/KBQyCms6hn #ElectionsMatter
2016-12-19 13:25:21;UAW;Just days before the 1936 Flint Sit-Down strike started, workers at 2 other plants did the same thing: https://t.co/qnZeCR1QzM #PROUAW
2016-12-17 04:31:45;UAW;New post on https://t.co/Gt7c4AEmb0! Union Front: ’Tis the Season to Support American Workers https://t.co/3ekAHBURUN
2016-12-17 03:15:25;UAW;New post on https://t.co/Gt7c4AEmb0! Together We Win: Auto Organizing Update https://t.co/nME7ZVDGL1
2016-12-17 01:46:00;UAW;New post on https://t.co/Gt7c4AEmb0! Legislative Update: 2016 Elections https://t.co/UaUZhcvGLm
2016-12-17 00:32:57;UAW;New post on https://t.co/Gt7c4AEmb0! Health and Safety: Workers Shed Light on Serious Problems https://t.co/vW9zP5UcPU
2016-12-16 23:15:43;UAW;New post on https://t.co/Gt7c4AEmb0! Together We Win: State of Michigan Workers Win Wage Increases, Protect Healt... https://t.co/PcTwHvKnDA
2016-12-16 22:56:00;UAW;Just days before the Flint Sit-Down strike, GM workers in Kansas City did the same thing: https://t.co/qnZeCR1QzM  #UnionHistory #PROUAW
2016-12-16 22:02:48;UAW;New post on https://t.co/Gt7c4AEmb0! Together We Win: The Devil in the Details https://t.co/FmuvBqqWgL
2016-12-16 21:54:01;UAW;This is scary. Nominated Labor Secretary Puzder seems to like machines over workers:  https://t.co/kdlSn0GuRg  #ElectionsMatter
2016-12-16 20:47:08;UAW;New post on https://t.co/Gt7c4AEmb0! PRO-Member: An Emotional Election https://t.co/kPcnZqKONX
2016-12-16 15:29:00;UAW;Big 3 Legal Services announcement: https://t.co/VqeNc6ydKK
2016-12-16 14:28:01;UAW;Great news! @GM is investing $552 million in key #UAW plants: https://t.co/Y7ulAdwz4u @CindyEstrada174
2016-12-16 13:19:23;UAW;Assumptions about others are easy to make. Seeing them as individuals, not so easy: https://t.co/wd34cf4oZQ #UnionsMatter #PROUAW
2016-12-15 21:01:31;UAW;New post on https://t.co/Gt7c4AEmb0! UAW Members at Local 5960 to Build Autonomous Vehicles https://t.co/pMRckohGpb
2016-12-15 19:46:31;UAW;New post on https://t.co/Gt7c4AEmb0! Statement on Big 3 Legal Services Plan from UAW President Dennis Williams https://t.co/zbNGJeYHpy
2016-12-15 14:14:04;UAW;Richard is a proud UAW member who values that he gets the boss' promise in writing: https://t.co/3VuglMt1hS #UnionsMatter #PROUAW
2016-12-15 00:01:44;UAW;New post on https://t.co/Gt7c4AEmb0! Veterans Day: Veterans Day Isn’t Just a One Day Event https://t.co/WB6rDOW2qn
2016-12-14 22:45:23;UAW;New post on https://t.co/Gt7c4AEmb0! From the President: Thank You for Your Hard Work on the Election https://t.co/sLPcp4ZESA
2016-12-14 21:32:37;UAW;New post on https://t.co/Gt7c4AEmb0! Before Flint – November – December 2016 https://t.co/hANnaA8nhL
2016-12-14 18:10:47;UAW;Congratulations UAW Local 5960, home of the Bolt! https://t.co/IRJN8DclL9
2016-12-14 18:01:51;UAW;New post on https://t.co/Gt7c4AEmb0! GM annouces $552 million investment for key UAW plants https://t.co/88IijAuams
2016-12-14 14:01:19;UAW;Chuck grew his hair long enough to donate to children with hair loss. Here he is on donation day: https://t.co/4I8St9i5Wv #UnionsMatter
2016-12-13 19:11:01;UAW;Roderick felt the union difference as soon as he got a union card. It was more than a card to him: https://t.co/Ylka9rlJxy #UnionsMatter
2016-12-13 17:05:13;UAW;Check out these great tips on giving this holiday season: https://t.co/MRkQfja7eH #PROUAW
